adult,backdrop_path,genre_ids,id,original_language,original_title,overview,popularity,poster_path,release_date,title,video,vote_average,vote_count,genre_names
False,/6yeVcxFR0j08vlv2OlL6zbewm4D.jpg,"28, 878, 53",1265609,en,War Machine,"On one last grueling mission during Army Ranger training, a combat engineer must lead his unit in a fight against a giant otherworldly killing machine.",698.3936,/rFhKkXhk7ClU03jQ5rHIApJDwev.jpg,2026-02-12,War Machine,False,7.183,466,"Action, Science Fiction, Thriller"
False,/nHxWyy18SvAZ8jJeemtS8k1UNjM.jpg,"28, 80, 53",1290821,en,Shelter,"A man living in self-imposed exile on a remote island rescues a young girl from a violent storm, setting off a chain of events that forces him out of seclusion to protect her from enemies tied to his past.",326.8723,/buPFnHZ3xQy6vZEHxbHgL1Pc6CR.jpg,2026-01-28,Shelter,False,6.719,262,"Action, Crime, Thriller"
False,/hYgUkH7TusddHRtelj53I6gFOWR.jpg,"28, 53",799882,en,The Bluff,"When her tranquil life on a remote island is shattered by the return of her vengeful former captain, a skilled ex-pirate must confront her bloody past and unleash her deadly talents to save her family from a ruthless siege.",238.5567,/w0jwjFmRu2or7LQqh1tSMFjq0At.jpg,2026-02-17,The Bluff,False,6.253,229,"Action, Thriller"
False,/finq0JnC6tIMkKczzyxLJjgWFfT.jpg,"27, 9648",1193501,en,Whistle,"A misfit group of unwitting high school students stumble upon a cursed object, an ancient Aztec Death Whistle. They discover that blowing the whistle and the terrifying sound it emits will summon their future deaths to hunt them down.",152.8173,/84vAcFwxoObBuMWANWQXCg0Umg8.jpg,2026-01-20,Whistle,False,6.052,116,"Horror, Mystery"
False,/2RrLuIfIzGWWIH8IAEo6o0IYHmx.jpg,"16, 10751, 878, 12, 35",1327819,en,Hoppers,"Scientists have discovered how to 'hop' human consciousness into lifelike robotic animals, allowing people to communicate with animals as animals. Animal lover Mabel seizes an opportunity to use the technology, uncovering mysteries within the animal world beyond anything she could have imagined.",142.8862,/xjtWQ2CL1mpmMNwuU5HeS4Iuwuu.jpg,2026-03-04,Hoppers,False,7.677,127,"Animation, Family, Science Fiction, Adventure, Comedy"
False,/nTbO6UF944b0VZrgypMK5rFYRSW.jpg,"9648, 18, 27",680493,en,Return to Silent Hill,"When James receives a mysterious letter from his lost love Mary, he is drawn to Silent Hill—a once-familiar town now consumed by darkness. As he searches for her, James faces monstrous creatures and unravels a terrifying truth that will push him to the edge of his sanity.",126.9053,/fqAGFN2K2kDL0EHxvJaXzaMUkkt.jpg,2026-01-21,Return to Silent Hill,False,5.037,256,"Mystery, Drama, Horror"
False,/7HKpc11uQfxnw0Y8tRUYn1fsKqE.jpg,"878, 28, 53",1236153,en,Mercy,"In the near future, a detective stands on trial accused of murdering his wife. He has ninety minutes to prove his innocence to the advanced AI Judge he once championed, before it determines his fate.",140.1336,/pyok1kZJCfyuFapYXzHcy7BLlQa.jpg,2026-01-20,Mercy,False,7.059,683,"Science Fiction, Action, Thriller"
False,/u9jE0R1nvkmdWu3bt7Op8joPywa.jpg,"12, 53, 878",840464,en,Greenland 2: Migration,"Having found the safety of the Greenland bunker after the comet Clarke decimated the Earth, the Garrity family must now risk everything to embark on a perilous journey across the wasteland of Europe to find a new home.",134.7811,/z2tqCJLsw6uEJ8nJV8BsQXGa3dr.jpg,2026-01-07,Greenland 2: Migration,False,6.49,570,"Adventure, Thriller, Science Fiction"
False,/1gLFGrxHqQebqLWpISmoFR6XWtJ.jpg,"28, 53",1088434,en,Hellfire,A drifter with a mysterious past arrives in a small town and finds the residents in the grip of a ruthless crime boss and realizes he has to help them.,126.2264,/tQti9QTf13MfzNpXguijgNh7ojE.jpg,2026-02-05,Hellfire,False,6.89,50,"Action, Thriller"
False,/lmns2jlRmATs8OGWKcCkgrbHLM4.jpg,"28, 18",1634301,te,Vanaveera,A descendant of the Vanara clan is pushed into conflict when a modern-day Ravana seizes his only bike for an election rally. What starts as a petty injustice soon erupts into a fierce fight for self-respect and dignity.,119.2844,/oBYExKI8E3bTzQjPkofhpV2EJon.jpg,2026-02-13,Vanaveera,False,7.0,3,"Action, Drama"
False,/hz7TdCrpLLt2Dz7S3PS2HG9rpAO.jpg,"27, 9648, 80",1159559,en,Scream 7,"When a new Ghostface killer emerges in the quiet town where Sidney Prescott has built a new life, her darkest fears are realized as her daughter becomes the next target. Determined to protect her family, Sidney must face the horrors of her past to put an end to the bloodshed once and for all.",109.997,/jjyuk0edLiW8vOSnlfwWCCLpbh5.jpg,2026-02-25,Scream 7,False,5.969,276,"Horror, Mystery, Crime"
False,/lgotja3xMoJZbynwHfcQcJAEMWH.jpg,"16, 35, 12, 10751, 9648",1084242,en,Zootopia 2,"After cracking the biggest case in Zootopia's history, rookie cops Judy Hopps and Nick Wilde find themselves on the twisting trail of a great mystery when Gary De'Snake arrives and turns the animal metropolis upside down. To crack the case, Judy and Nick must go undercover to unexpected new parts of town, where their growing partnership is tested like never before.",116.1516,/oJ7g2CifqpStmoYQyaLQgEU32qO.jpg,2025-11-26,Zootopia 2,False,7.619,1994,"Animation, Comedy, Adventure, Family, Mystery"
False,/cz4vLJrmaV1zJlRYbxqtvLzeLWB.jpg,"28, 35, 80, 9648",1168190,en,The Wrecking Crew,"Estranged half-brothers Jonny and James reunite after their father's mysterious death. As they search for the truth, buried secrets reveal a conspiracy threatening to tear their family apart.",113.6499,/gbVwHl4YPSq6BcC92TQpe7qUTh6.jpg,2026-01-28,The Wrecking Crew,False,6.892,758,"Action, Comedy, Crime, Mystery"
False,/sdZSjtGUTSN8B3al5o0f2WoQfQQ.jpg,"878, 12, 14",83533,en,Avatar: Fire and Ash,"In the wake of the devastating war against the RDA and the loss of their eldest son, Jake Sully and Neytiri face a new threat on Pandora: the Ash People, a violent and power-hungry Na'vi tribe led by the ruthless Varang. Jake's family must fight for their survival and the future of Pandora in a conflict that pushes them to their emotional and physical limits.",105.7912,/bRBeSHfGHwkEpImlhxPmOcUsaeg.jpg,2025-12-17,Avatar: Fire and Ash,False,7.267,1873,"Science Fiction, Adventure, Fantasy"
False,/tn95fumbkVAgXjOuw9CQOg0aYQz.jpg,"28, 80, 18, 53",1419406,zh,The Shadow's Edge,Macau Police brings the tracking expert police officer out of retirement to help catch a dangerous group of professional thieves.,106.7239,/e0RU6KpdnrqFxDKlI3NOqN8nHL6.jpg,2025-08-16,The Shadow's Edge,False,7.211,481,"Action, Crime, Drama, Thriller"
False,/jtUHnlGbcq70uHLJ36ZnkF5MJdc.jpg,"27, 878, 35",696393,en,Cold Storage,"When a mutating, highly contagious fungus escapes a sealed facility, two employees – joined by a grizzled bioterror operative – must survive the wildest night shift ever to save humanity from extinction.",110.7146,/gZgWy4SDBDr5qmn2ql6H0uO7hMY.jpg,2026-01-22,Cold Storage,False,6.5,114,"Horror, Science Fiction, Comedy"
False,,"10749, 18",1523145,ru,Tvoe serdtse budet razbito,"High school student Polina is saved from bullying at her new school and makes a deal with the main bully Bars: he must pretend to be her boyfriend and protect her, and she must do everything he says. During this game, the couple develops real feelings, but her family and classmates have reasons to separate the lovers.",108.1875,/iGpMm603GUKH2SiXB2S5m4sZ17t.jpg,2026-03-26,Your Heart Will Be Broken,False,0.0,0,"Romance, Drama"
False,/lNYympQM5O6QSInusbyG9eJDIe4.jpg,"16, 28, 14",1311031,ja,劇場版「鬼滅の刃」無限城編 第一章 猗窩座再来,"The Demon Slayer Corps are drawn into the Infinity Castle, where Tanjiro, Nezuko, and the Hashira face terrifying Upper Rank demons in a desperate fight as the final battle against Muzan Kibutsuji begins.",101.9872,/fWVSwgjpT2D78VUh6X8UBd2rorW.jpg,2025-07-18,Demon Slayer: Kimetsu no Yaiba Infinity Castle,False,7.659,756,"Animation, Action, Fantasy"
False,/5hH7QiEPOiz7aGa4eJce74kZkO1.jpg,"878, 27, 35",1159831,en,The Bride!,A lonely Frankenstein travels to 1930s Chicago to ask groundbreaking scientist Dr. Euphronious to create a companion for him. The two revive a murdered young woman and The Bride is born. But what ensues is beyond what either of them imagined.,94.7987,/lV8YHwGkYZsm6EfIqnhaSz2avKt.jpg,2026-03-04,The Bride!,False,6.4,125,"Science Fiction, Horror, Comedy"
False,/zTnAnYIn0Iv3cn0ZHlzLhou3ybm.jpg,"18, 9648, 53",1368166,en,The Housemaid,"Trying to escape her past, Millie Calloway accepts a job as a live-in housemaid for the wealthy Nina and Andrew Winchester. But what begins as a dream job quickly unravels into something far more dangerous—a sexy, seductive game of secrets, scandal, and power.",92.164,/cWsBscZzwu5brg9YjNkGewRUvJX.jpg,2025-12-18,The Housemaid,False,7.259,1451,"Drama, Mystery, Thriller"
False,/iZLqwEwUViJdSkGVjePGhxYzbDb.jpg,"878, 53",755898,en,War of the Worlds,"Will Radford is a top analyst for Homeland Security who tracks potential threats through a mass surveillance program, until one day an attack by an unknown entity leads him to question whether the government is hiding something from him... and from the rest of the world.",92.9105,/yvirUYrva23IudARHn3mMGVxWqM.jpg,2025-07-29,War of the Worlds,False,4.162,915,"Science Fiction, Thriller"
False,/gaKFXcB5J1gz0QqYj8bWIfrPc04.jpg,"28, 878, 12",1242898,en,Predator: Badlands,"Cast out from his clan, a young Predator finds an unlikely ally in a damaged android and embarks on a treacherous journey in search of the ultimate adversary.",80.8125,/erTRAi241eYF4K8KoGGOI8kFPox.jpg,2025-11-05,Predator: Badlands,False,7.712,2312,"Action, Science Fiction, Adventure"
False,/bAFnjhweXxHUWjmFzMTuX12Ud3b.jpg,53,1199193,en,Pose,"Isolated in a grand country manor, a reclusive artist spends a passionate and paranoid weekend with his ex-lover, an obsessive fan, and a potential muse. Hoping to spark a new wave of artistic brilliance over the course of a few tumultuous days, filled with chaos and revelation not all of them will make it out alive.",74.6458,/qhyyyWrHUbl6QG4udAJj17CBa5.jpg,2026-02-25,Pose,False,7.0,21,Thriller
False,/O50sdY6JEwpU7cQRaFtTO9eSAk.jpg,28,1499984,en,Gladiator Underground,"Two brothers compete in the world's deadliest underground fighting tournament, where they must decide whether to play by the rules or to cast their honor aside and team up to bring down the dark syndicate running the tournament.",73.5531,/qLN16AeIjS5P5Kk5B6pBi1Mh1mi.jpg,2025-08-22,Gladiator Underground,False,6.981,26,Action
False,/1Xdsq7U7bvJJd2X7Jg4qNaKVkYO.jpg,"28, 53, 80, 18",1426964,pt,Salve Geral: Irmandade,"As São Paulo erupts in an unprecedented wave of violence, a lawyer with underworld ties must strike a deal with the police to rescue her kidnapped niece.",69.7644,/3Eaqedg8MAlnP51GYY8MCSIdTnV.jpg,2026-02-10,State of Fear,False,5.402,56,"Action, Thriller, Crime, Drama"
False,/hHDNOlATHhre4eZ7aYz5cdyJLik.jpg,"27, 53, 878",1272837,en,28 Years Later: The Bone Temple,Dr. Kelson finds himself in a shocking new relationship - with consequences that could change the world as they know it - and Spike's encounter with Jimmy Crystal becomes a nightmare he can't escape.,69.5689,/kK1BGkG3KAvWB0WMV1DfOx9yTMZ.jpg,2026-01-14,28 Years Later: The Bone Temple,False,7.193,781,"Horror, Thriller, Science Fiction"
False,/3F2EXWF1thX0BdrVaKvnm6mAhqh.jpg,"28, 53, 80",1306368,en,The Rip,"Trust frays when a team of Miami cops discovers millions in cash inside a run-down stash house, calling everyone — and everything — into question.",65.3043,/4wsYWH73Hb1B6noGIFaRQSAkuXj.jpg,2026-01-13,The Rip,False,7.066,1343,"Action, Thriller, Crime"
False,/eJ0HooOOD1uzI39CfOQNWIiWKlJ.jpg,"28, 18, 53",1387382,en,Hunting Season,"When a reclusive survivalist and his daughter rescue a mysterious, wounded woman from a river, they become entangled in a deadly web of violence and revenge, forcing them to confront a brutal criminal to survive.",64.8942,/cbryTyaWdqrKpQCw6K7zm2jrB5v.jpg,2025-12-05,Hunting Season,False,6.972,145,"Action, Drama, Thriller"
False,/vOV4Qy3g791OTzEndiSGoJwuI2M.jpg,"53, 28, 12, 18, 14",1401778,en,Turbulence,"Young married couple Zach and Emmy decide to take a hot air balloon trip across the Italian Dolomites to rekindle their relationship. When they and pilot Harry are joined by a third passenger, Julia, events unfold in ways they could never imagine five thousand meters in the air.",64.6123,/jRuiKL4S9UpLma2ZlM47xIu2gbe.jpg,2025-11-26,Turbulence,False,5.759,58,"Thriller, Action, Adventure, Drama, Fantasy"
False,/eUERZRVjCTNdgnESlQxyaOJ2d4K.jpg,28,1584215,en,The Internship,"A CIA-trained assassin recruits other graduates from her secret childhood program, The Internship, to violently destroy the organization. The CIA fights back with deadly force.",63.6137,/fYqSOkix4rbDiZW0ACNnvZCpT6X.jpg,2026-01-13,The Internship,False,6.2,52,Action
False,/oN4TQ1TxchynXlFiXFBL3NHLT54.jpg,"16, 10751, 18",1167307,en,David,"From the songs of his mother’s heart to the whispers of a faithful God, David’s story begins in quiet devotion. When the giant Goliath rises to terrorize a nation, a young shepherd armed with only a sling, a few stones, and unshakable faith steps forward. Pursued by power and driven by purpose, his journey tests the limits of loyalty, love, and courage—culminating in a battle not just for a crown, but for the soul of a kingdom.",61.8109,/7lFG1WrCwAxBfyGK8ahlBVzXno7.jpg,2025-12-14,David,False,8.1,101,"Animation, Family, Drama"
False,/vSQSYd2zZTqc0zmHImwWEGGluMI.jpg,"10749, 18",1316092,en,"""Wuthering Heights""","Tragedy strikes when Heathcliff falls in love with Catherine Earnshaw, a woman from a wealthy family in 18th-century England.",60.1738,/3YBce6dTh1D5oCMITXk2S5QhPt.jpg,2026-02-11,"""Wuthering Heights""",False,6.403,478,"Romance, Drama"
False,/gre7gyocZSuwd7M51CGlqsJqBmB.jpg,"53, 80, 28",1054867,en,One Battle After Another,"Washed-up revolutionary Bob exists in a state of stoned paranoia, surviving off-grid with his spirited, self-reliant daughter, Willa. When his evil nemesis resurfaces after 16 years and she goes missing, the former radical scrambles to find her, father and daughter both battling the consequences of his past.",59.8839,/lbBWwxBht4JFP5PsuJ5onpMqugW.jpg,2025-09-23,One Battle After Another,False,7.409,3022,"Thriller, Crime, Action"
False,/dbvUYL1dN75xFH1QqQWQi4xYCuJ.jpg,53,1555951,tl,Salikmata,"In a remote town full of secrets and mysteries, a young man faces controversy after his secret relationship with a politician’s daughter is exposed. He must confront harsh consequences filled with deception, revenge, and unexplained events.",58.4413,/yE87eY4g9K8Z4qSNPvpvxWZRwQG.jpg,2025-10-22,Salikmata,False,4.5,2,Thriller
False,/gtKglOSEq3d4MgQE4VsrT1sRkd0.jpg,"16, 28, 14",1539104,ja,劇場版 呪術廻戦「渋谷事変 特別編集版」×「死滅回游 先行上映」,"A veil abruptly descends over the busy Shibuya area amid the bustling Halloween crowds, trapping countless civilians inside. Satoru Gojo, the strongest jujutsu sorcerer, steps into the chaos. But lying in wait are curse users and spirits scheming to seal him away. Yuji Itadori, accompanied by his classmates and other top-tier jujutsu sorcerers, enters the fray in an unprecedented clash of curses — the Shibuya Incident. In the aftermath, ten colonies across Japan are transformed into dens of curses in a plan orchestrated by Noritoshi Kamo. As the deadly Culling Game starts, Special Grade sorcerer Yuta Okkotsu is assigned to carry out Yuji's execution for his perceived crimes. A compilation movie of Shibuya Incident including the first two episodes of the Culling Games arc.",58.0499,/v0s3dx6am0RzfsuK3KdEy8ZoCDs.jpg,2025-11-07,JUJUTSU KAISEN: Execution,False,5.786,84,"Animation, Action, Fantasy"
False,/pAyImoslSnpMgjRwhaS5ZEdl8UI.jpg,"28, 53",1448560,en,Wildcat,An ex-black ops team reunite to pull off a desperate heist in order to save the life of their leader’s eight-year-old daughter.,57.7607,/h893ImjM6Fsv5DFhKJdlZFZIJno.jpg,2025-11-19,Wildcat,False,6.191,128,"Action, Thriller"
False,/wCwZ4ljSsWyZyTiyk1tGQtBHTDx.jpg,"28, 18",1511417,te,Bāhubali: The Epic,"When a mysterious child is found by a tribal couple near a roaring waterfall, they raise him as their own. As he grows, Sivudu is drawn to the world beyond the cliffs, where he discovers the ancient kingdom of Mahishmati, ruled by a cruel tyrant, haunted by rebellion, and bound to his past. What begins as a quest for love soon unravels a legacy of betrayal, sacrifice, and a forgotten prince.",57.2721,/z9YIo2qscyaXYgRqIdRJtND3bw8.jpg,2025-10-29,Bāhubali: The Epic,False,6.0,32,"Action, Drama"
False,/6D6M5z4reppUxo2cnBEKI02Csp1.jpg,"28, 80, 53, 37",1601243,en,Oscar Shaw,"After retiring from the police force, a relentless detective haunted by the tragic loss of his closest friend sets out on a perilous quest for vengeance, seeking redemption and fighting to restore justice to the streets he once swore to protect.",57.2696,/tsE3nySukwrfUjouz8vzvKTcXNC.jpg,2026-01-09,Oscar Shaw,False,6.6,25,"Action, Crime, Thriller, Western"
False,/3iMoYSbI72Nwsvi7uSpqReLJVa6.jpg,18,1317288,en,Marty Supreme,"Marty Mauser, a young man with a dream no one respects, goes to hell and back in pursuit of greatness.",56.3315,/lYWEXbQgRTR4ZQleSXAgRbxAjvq.jpg,2025-12-19,Marty Supreme,False,7.5,1220,Drama
False,/wt0gb7ISUf8IyaJ4tnZVltvWoo7.jpg,27,1353333,en,Mouseboat Massacre,The story follows a young woman battling a drug addiction who suddenly begins to see a mutated mouse human hybrid who infests her life. Those around her begin to drop like flies.,56.2465,/ctKqevqOwbeVg5GLQLu5VvnCjan.jpg,2025-05-09,Mouseboat Massacre,False,5.446,28,Horror
False,/wt0gb7ISUf8IyaJ4tnZVltvWoo7.jpg,27,1353333,en,Mouseboat Massacre,The story follows a young woman battling a drug addiction who suddenly begins to see a mutated mouse human hybrid who infests her life. Those around her begin to drop like flies.,49.1182,/ctKqevqOwbeVg5GLQLu5VvnCjan.jpg,2025-05-09,Mouseboat Massacre,False,5.446,28,Horror
False,/pGFQCp12a8andfPlpnmXz44IIvY.jpg,"878, 28, 12",24428,en,The Avengers,"When an unexpected enemy emerges and threatens global safety and security, Nick Fury, director of the international peacekeeping agency known as S.H.I.E.L.D., finds himself in need of a team to pull the world back from the brink of disaster. Spanning the globe, a daring recruitment effort begins!",50.9077,/RYMX2wcKCBAr24UyPD7xwmjaTn.jpg,2012-04-25,The Avengers,False,7.962,36364,"Science Fiction, Action, Adventure"
False,/swxhEJsAWms6X1fDZ4HdbvYBSf9.jpg,"12, 35, 27, 28",1234731,en,Anaconda,"A group of friends facing mid-life crises head to the rainforest with the intention of remaking their favorite movie from their youth, only to find themselves in a fight for their lives against natural disasters, giant snakes and violent criminals.",56.652,/qxMv3HwAB3XPuwNLMhVRg795Ktp.jpg,2025-12-24,Anaconda,False,5.849,745,"Adventure, Comedy, Horror, Action"
False,/dHSz0tSFuO2CsXJ1CApSauP9Ncl.jpg,"53, 80",425274,en,Now You See Me: Now You Don't,"The original Four Horsemen reunite with a new generation of illusionists to take on powerful diamond heiress Veronika Vanderberg, who leads a criminal empire built on money laundering and trafficking. The new and old magicians must overcome their differences to work together on their most ambitious heist yet.",53.9452,/oD3Eey4e4Z259XLm3eD3WGcoJAh.jpg,2025-11-12,Now You See Me: Now You Don't,False,6.53,1193,"Thriller, Crime"
False,/2OHa6ukEq3Hce7Pc2kvu8wkmMFY.jpg,"28, 12, 53, 80, 18",7451,en,xXx,"Xander Cage is your standard adrenaline junkie with no fear and a lousy attitude. When the US Government ""recruits"" him to go on a mission, he's not exactly thrilled. His mission: to gather information on an organization that may just be planning the destruction of the world, led by the nihilistic Yorgi.",53.8283,/xeEw3eLeSFmJgXZzmF2Efww0q3s.jpg,2002-08-09,xXx,False,5.979,4816,"Action, Adventure, Thriller, Crime, Drama"
False,/huW5dZywslw6muqmpDtMl6Ywl3m.jpg,35,10156,en,History of the World: Part I,"An uproarious version of history that proves nothing is sacred – not even the Roman Empire, the French Revolution and the Spanish Inquisition.",30.0341,/6iAl78qZHT65erPXr2YW6Y54wlY.jpg,1981-06-12,History of the World: Part I,False,6.759,898,Comedy
False,/2ssWTSVklAEc98frZUQhgtGHx7s.jpg,"12, 18, 878",157336,en,Interstellar,The adventures of a group of explorers who make use of a newly discovered wormhole to surpass the limitations on human space travel and conquer the vast distances involved in an interstellar voyage.,59.3667,/gEU2QniE6E77NI6lCU6MxlNBvIx.jpg,2014-11-05,Interstellar,False,8.468,39079,"Adventure, Drama, Science Fiction"
False,/daVBzTiyRs4a7vf4SnBoeqJtwRy.jpg,"16, 35, 10751, 14, 12",1497970,zh,猫和老鼠：星盘奇缘,"The iconic cat-and-mouse duo accidentally travel through time in a museum. Along their journey, they meet a group of intriguing new companions and become involved in a final showdown with mysterious forces.",42.381,/5qttWFjsO62k88civZaDMHiBTvy.jpg,2025-08-02,Tom and Jerry: Forbidden Compass,False,5.763,19,"Animation, Comedy, Family, Fantasy, Adventure"
False,/73BClq9FOcrWrutnpiqhCNEWEwJ.jpg,"18, 10749, 36",858024,en,Hamnet,"The powerful story of love and loss that inspired the creation of Shakespeare's timeless masterpiece, Hamlet.",51.6784,/vbeyOZm2bvBXcbgPD3v6o94epPX.jpg,2025-11-26,Hamnet,False,7.73,937,"Drama, Romance, History"
False,/jhfJZ82qzcMV4Kr7G0uczdU4n2v.jpg,18,1629382,fr,Banlieusards 3,"Grieving and facing the consequences of their crimes, the Traoré brothers get one last chance to forge a new path.",49.3118,/vl50ruzFWxrbK4zFz0ySjC3TdyK.jpg,2026-03-04,Street Flow 3,False,5.172,29,Drama
False,/1qwhYqg7YEZajh3Q4biqbuQoDq8.jpg,"16, 35, 10751",1297842,en,GOAT,"A small goat with big dreams gets a once-in-a-lifetime shot to join the pros and play roarball, a high-intensity, co-ed, full-contact sport dominated by the fastest, fiercest animals in the world.",53.7828,/wfuqMlaExcoYiUEvKfVpUTt1v4u.jpg,2026-02-11,GOAT,False,7.5,98,"Animation, Comedy, Family"
False,/filZFYKr17wIJ4j1Cz115DOdegh.jpg,"80, 18, 10752",875828,en,Peaky Blinders: The Immortal Man,"After his estranged son gets embroiled in a Nazi plot, self-exiled gangster Tommy Shelby must return to Birmingham to save his family — and his nation.",52.2717,/gRMalasZEzsZi4w2VFuYusfSfqf.jpg,2026-03-05,Peaky Blinders: The Immortal Man,False,8.7,6,"Crime, Drama, War"
False,/ru0r5MYhIwcU0IddhRLqJpIPkiV.jpg,18,1191876,en,From the Ashes,"Jailed for her husband's crime, a woman discovers that her only way out is to solve riddles from her mysterious past.",48.3179,/aEUH2ECoZHvSmoMzJpca0STF2CZ.jpg,2027-06-01,From the Ashes,False,0.0,0,Drama
False,/cYyNJzwhaj7aC4uTlUctrfaERbf.jpg,"28, 18, 36",1305781,zh,镖人：风起大漠,"Dao Ma, the ""second most wanted fugitive,"" is entrusted by his benefactor, the chief of Mo family clan, to take on a mysterious escort mission-escorting the ""most wanted fugitive"" to Chang'an.",44.4658,/AbunjMKX4P1sDNlKfhYrWkIoRD9.jpg,2026-02-17,Blades of the Guardians: Wind Rises in the Desert,False,7.5,26,"Action, Drama, History"
False,/gmu4liRCTk5nKSiGL6XHFbsJvD8.jpg,27,1451398,ja,カラダ探し THE LAST NIGHT,"Three years after completing a deadly game, high schoolers trapped in a looping nightmare must survive brutal encounters and unravel a terrifying curse.",79.7177,/5MEzNrfvfpSajhSRSA7Jtybu3Jr.jpg,2025-09-05,Re/Member: The Last Night,False,4.571,7,Horror
False,/8QRMlkCMFNKZM2ApnIaut5t4snf.jpg,"53, 9648, 18",1389149,hi,अक्यूज़्ड,"When a celebrated queer doctor in London is accused of sexual misconduct, her life unravels. Now under a storm of suspicion and scrutiny, her marriage fractures and the truth blurs. Her wife must decide whether to walk away, or fight for the woman the world is turning against.",41.4487,/eeP55mdqj4KpWtEPBvZJoxmnkXI.jpg,2026-02-27,Accused,False,5.0,49,"Thriller, Mystery, Drama"
False,/i275mAQP4KhPtYUpMUgBGMmK4WN.jpg,"27, 53, 18",1249508,en,Grizzly Night,"On August 12, 1967, in Montana's Glacier National Park, the unthinkable happened: that same night, nine miles apart, there were not one—but two—fatal grizzly bear attacks.",41.5841,/d3UMQAw5EGRsLEnMfpxorHvbzHg.jpg,2026-01-30,Grizzly Night,False,6.11,41,"Horror, Thriller, Drama"
False,/8h3Ev1xf3WBrzHD4fNOGs790GWZ.jpg,"28, 53",891644,en,Zero,"Two Americans wake up in Dakar, Senegal, with bombs strapped to their chests ticking down from ten hours. Guided by a threatening voice on the phone, these men complete a series of violent tasks that spark widespread protest against Western influence in the city.",33.7737,/5bo30pUJGUpvNP8XS75T3Al8V1R.jpg,2025-04-11,Zero,False,5.967,30,"Action, Thriller"
False,/w3Bi0wygeFQctn6AqFTwhGNXRwL.jpg,"14, 10402, 35, 16",803796,en,KPop Demon Hunters,"When K-pop superstars Rumi, Mira and Zoey aren't selling out stadiums, they're using their secret powers to protect their fans from supernatural threats.",45.8825,/zT7Lhw3BhJbMkRqm9Zlx2YGMsY0.jpg,2025-06-20,KPop Demon Hunters,False,8.066,2485,"Fantasy, Music, Comedy, Animation"
False,/lZYMXx74pWmbj5Q5jp1QaMvmuuR.jpg,"28, 14, 53",1180831,no,Troll 2,"When a dangerous new troll unleashes devastation across their homeland, Nora, Andreas and Major Kris embark on their most perilous mission yet.",45.2978,/p6xAExLNFbHcLfvSuvLPoM8aqZU.jpg,2025-11-30,Troll 2,False,6.5,427,"Action, Fantasy, Thriller"
False,/m5dA4JZsj78EBTa2D6imWOAebwB.jpg,35,4247,en,Scary Movie,"A familiar-looking group of teenagers find themselves being stalked by a more-than-vaguely recognizable masked killer! As the victims begin to pile up and the laughs pile on, none of your favorite scary movies escape the razor-sharp satire of this outrageously funny parody!",40.5005,/fVQFPRuw3yWXojYDJvA5EoFjUOY.jpg,2000-07-07,Scary Movie,False,6.385,7586,Comedy
