adult,backdrop_path,genre_ids,id,original_language,original_title,overview,popularity,poster_path,release_date,title,video,vote_average,vote_count,genre_names
False,/gMItMzDOyrfQGZsMWRM9tdxq5cV.jpg,"878, 28, 27",1196067,en,Worldbreaker,"Five years ago, a tear in the fabric of reality brought creatures to our world from an alternate dimension bent on our destruction. A father hides his daughter on an island to keep her safe while he prepares her for survival and the battles to come. But when the world is about to break, no place is safe.",42.005,/7K8w6mdrJp0oaSoKWGyjSZ4Zv2z.jpg,2025-10-30,Worldbreaker,False,6.033,90,"Science Fiction, Action, Horror"
False,/nAxGnGHOsfzufThz20zgmRwKur3.jpg,"27, 28, 53",1233413,en,Sinners,"Trying to leave their troubled lives behind, twin brothers return to their hometown to start again, only to discover that an even greater evil is waiting to welcome them back.",44.7496,/qTvFWCGeGXgBRaINLY1zqgTPSpn.jpg,2025-04-16,Sinners,False,7.483,3909,"Horror, Action, Thriller"
False,/efcAOJ9Thm0NHzMk16Bpo4m550G.jpg,"28, 53",1319280,en,Run Baby Run,A young woman has to run for her life.,31.3874,/p9e7gGdYfdRauIbh9dBu6PgzVGP.jpg,2024-08-30,Run Baby Run,False,6.3,7,"Action, Thriller"
False,/hpXBJxLD2SEf8l2CspmSeiHrBKX.jpg,"18, 14, 27",1062722,en,Frankenstein,"Dr. Victor Frankenstein, a brilliant but egotistical scientist, brings a creature to life in a monstrous experiment that ultimately leads to the undoing of both the creator and his tragic creation.",41.6556,/g4JtvGlQO7DByTI6frUobqvSL3R.jpg,2025-10-17,Frankenstein,False,7.66,3079,"Drama, Fantasy, Horror"
False,/aHj7d7wSLqrg5cjAcgHhiGr97Ih.jpg,"28, 53, 878",798645,en,The Running Man,"Desperate to save his sick daughter, working-class Ben Richards is convinced by The Running Man's charming but ruthless producer to enter the deadly competition game as a last resort. But Ben's defiance, instincts, and grit turn him into an unexpected fan favorite — and a threat to the entire system. As ratings skyrocket, so does the danger, and Ben must outwit not just the Hunters, but a nation addicted to watching him fall.",42.9942,/dKL78O9zxczVgjtNcQ9UkbYLzqX.jpg,2025-11-11,The Running Man,False,6.785,1247,"Action, Thriller, Science Fiction"
False,/uM5i623wwNfoGD97iwwQWQ7GlZL.jpg,"18, 878",1032892,en,In the Blink of an Eye,"Three storylines, spanning thousands of years, intersect and reflect on hope, connection, and the circle of life.",37.2773,/4vWqIdoBavo1htxmxlScDniOS9C.jpg,2026-01-26,In the Blink of an Eye,False,4.938,64,"Drama, Science Fiction"
False,/dqK9Hag1054tghRQSqLSfrkvQnA.jpg,"28, 80, 53",155,en,The Dark Knight,"Batman raises the stakes in his war on crime. With the help of Lt. Jim Gordon and District Attorney Harvey Dent, Batman sets out to dismantle the remaining criminal organizations that plague the streets. The partnership proves to be effective, but they soon find themselves prey to a reign of chaos unleashed by a rising criminal mastermind known to the terrified citizens of Gotham as the Joker.",36.2248,/qJ2tW6WMUDux911r6m7haRef0WH.jpg,2008-07-16,The Dark Knight,False,8.527,35309,"Action, Crime, Thriller"
False,/rZWkXnIyTLzUJpHSUpOb7vgB0BL.jpg,"28, 18",911430,en,F1,Racing legend Sonny Hayes is coaxed out of retirement to lead a struggling Formula 1 team—and mentor a young hotshot driver—while chasing one more chance at glory.,40.354,/vqBmyAj0Xm9LnS1xe1MSlMAJyHq.jpg,2025-06-25,F1,False,7.765,3511,"Action, Drama"
False,/6xVAbjvUWKJlPSVYduQgkRzEQNy.jpg,"18, 53",1424965,en,Ice Skater,"A survival drama about an ice skater stranded on an ice floe at the Arctic Sea. When the ice floe starts to float towards south and melt, the ice skater must use all means necessary to survive.",36.3073,/3GdF5fublhF1w0suCpsj1zExzPl.jpg,2026-02-24,Ice Skater,False,5.667,9,"Drama, Thriller"
False,/oz4U9eA6ilYf1tyiVuGmkftdLac.jpg,"18, 10749, 53",1010581,es,Culpa mía,"Noah must leave her city, boyfriend, and friends to move into William Leister's mansion, the flashy and wealthy husband of her mother Rafaela. As a proud and independent 17 year old, Noah resists living in a mansion surrounded by luxury. However, it is there where she meets Nick, her new stepbrother, and the clash of their strong personalities becomes evident from the very beginning.",37.8585,/w46Vw536HwNnEzOa7J24YH9DPRS.jpg,2023-06-08,My Fault,False,7.754,4012,"Drama, Romance, Thriller"
False,/zNriRTr0kWwyaXPzdg1EIxf0BWk.jpg,"878, 12, 28",1234821,en,Jurassic World Rebirth,"Five years after the events of Jurassic World Dominion, covert operations expert Zora Bennett is contracted to lead a skilled team on a top-secret mission to secure genetic material from the world's three most massive dinosaurs. When Zora's operation intersects with a civilian family whose boating expedition was capsized, they all find themselves stranded on an island where they come face-to-face with a sinister, shocking discovery that's been hidden from the world for decades.",36.1126,/1RICxzeoNCAO5NpcRMIgg1XT6fm.jpg,2025-07-01,Jurassic World Rebirth,False,6.303,3091,"Science Fiction, Adventure, Action"
False,/xGPb3wI8lhBxAvUbIM2hRtm8S6b.jpg,"80, 53",1171145,en,Crime 101,"When an elusive thief whose high-stakes heists unfold along the iconic 101 freeway in Los Angeles eyes the score of a lifetime, with hopes of this being his final job, his path collides with a disillusioned insurance broker who is facing her own crossroads. Determined to crack the case, a relentless detective closes in on the operation, raising the stakes even higher.",45.4528,/2HoR2x23bqKpopluoBD1FH3tBi7.jpg,2026-02-11,Crime 101,False,7.0,134,"Crime, Thriller"
False,/zfbjgQE1uSd9wiPTX4VzsLi0rGG.jpg,"18, 80",278,en,The Shawshank Redemption,"Imprisoned in the 1940s for the double murder of his wife and her lover, upstanding banker Andy Dufresne begins a new life at the Shawshank prison, where he puts his accounting skills to work for an amoral warden. During his long stretch in prison, Dufresne comes to be admired by the other inmates -- including an older prisoner named Red -- for his integrity and unquenchable sense of hope.",47.7967,/9cqNxx0GxF0bflZmeSMuL5tnGzr.jpg,1994-09-23,The Shawshank Redemption,False,8.716,29890,"Drama, Crime"
False,/yRBc6WY3r1Fz5Cjd6DhSvzqunED.jpg,"878, 12, 28",1061474,en,Superman,"Superman, a journalist in Metropolis, embarks on a journey to reconcile his Kryptonian heritage with his human upbringing as Clark Kent.",36.4877,/ldyfo0BKmz5rWtJJKCvwaNS4cJT.jpg,2025-07-09,Superman,False,7.35,4437,"Science Fiction, Adventure, Action"
False,/kfXgo2rMF1A19celCwLyQ4Xwpf8.jpg,"16, 28, 10749, 14",1218925,ja,劇場版 チェンソーマン レゼ篇,"In a brutal war between devils, hunters, and secret enemies, a mysterious girl named Reze has stepped into Denji's world, and he faces his deadliest battle yet, fueled by love in a world where survival knows no rules.",39.3202,/pHyxb2RV5wLlboAwm9ZJ9qTVEDw.jpg,2025-09-19,Chainsaw Man - The Movie: Reze Arc,False,8.3,745,"Animation, Action, Romance, Fantasy"
False,/6AYl4PU29o2WXUPZzAo56GVQs5r.jpg,"53, 18, 9648, 27",1381027,en,The Good Boy,"Tommy, a volatile 19-year-old, revels in drugs, parties and violence. After getting separated from his friends on a drunken bender, he is abducted by a shadowy figure. He wakes to find himself imprisoned in the basement of a remote Yorkshire house, inhabited by a very strange family. But what unfolds is not what he could possibly expect.",39.5575,/cEXT4bXOrM0pqrK714NP3M69cWW.jpg,2026-03-06,The Good Boy,False,8.179,14,"Thriller, Drama, Mystery, Horror"
False,/w57nxiBIODAYHLRs1xmrCY9zEFe.jpg,"28, 18, 14",1083637,kn,ಕಾಂತಾರ: ಅಧ್ಯಾಯ - ೧,"During the Kadamba reign, King Vijayendra, the ruler of the fictional feudatory land of Bangra, meets his final fate while venturing into the mystical forest of Kantara. Witnessing this, his son Rajashekara seals the borders of their realm. Later, Prince Kulashekara reopens them through a brutal massacre. The protagonist, Berme, in search of prosperity, crosses the divide and ignites a conflict of faith, power, and destiny between the Kingdom and Nature.",35.4781,/ehQPboTPaIMkMUOoNOh8e7pZ5Rp.jpg,2025-10-01,Kantara - A Legend: Chapter 1,False,7.0,63,"Action, Drama, Fantasy"
False,/oIJjO1CvEdTMFNkWfHaV0RB584G.jpg,"28, 80, 53",628847,en,Trap House,"An undercover DEA agent and his partner embark on a game of cat and mouse with an audacious, and surprising group of thieves – their own rebellious teenagers, who have begun robbing from a dangerous cartel, using their parents' tactics and top-secret intel to do it.",35.023,/6tpAPeuuqbVnYWWPoOLEDLSBU7a.jpg,2025-11-14,Trap House,False,6.52,229,"Action, Crime, Thriller"
False,/ImIRPOvlxKC1jsKld5ZEpxmvmV.jpg,"28, 80, 53",1461181,en,Hierarchy,"In an undisclosed area of Texas after two adoptive brothers become entangled in criminal activity, forced to evade law enforcement and the greedy Russian mafia.",24.9503,/3KVq24NkOn98nrSEAFphnRWVWNd.jpg,2025-08-15,Hierarchy,False,5.658,19,"Action, Crime, Thriller"
False,/be5SIsRGMckO8tU9lrLcIik70Dy.jpg,"27, 14, 10749",1246049,fr,Dracula,"In late 15th-century Eastern Europe, Prince Vlad II’s bride is brutally murdered. As a result, he renounces God and damns Heaven itself. Cursed with eternal life, Vlad is reborn as Dracula, an immortal warlord who defies fate in a blood-soaked crusade to wrench his lost love back from death.",34.1263,/libhghrUSBSEdHgF9uP1SQES0nQ.jpg,2025-07-30,Dracula,False,7.126,933,"Horror, Fantasy, Romance"
False,/tSPT36ZKlP2WVHJLM4cQPLSzv3b.jpg,"18, 80",238,en,The Godfather,"Spanning the years 1945 to 1955, a chronicle of the fictional Italian-American Corleone crime family. When organized crime family patriarch, Vito Corleone barely survives an attempt on his life, his youngest son, Michael steps in to take care of the would-be killers, launching a campaign of bloody revenge.",37.6783,/3bhkrj58Vtu7enYsRolD1fZdja1.jpg,1972-03-14,The Godfather,False,8.688,22569,"Drama, Crime"
False,/pUNfHmVqfwRdILhCkU8TdysVOXo.jpg,"878, 12, 28",533533,en,TRON: Ares,"A highly sophisticated Program called Ares is sent from the digital world into the real world on a dangerous mission, marking humankind's first encounter with A.I. beings.",34.9137,/chpWmskl3aKm1aTZqUHRCtviwPy.jpg,2025-10-08,TRON: Ares,False,6.475,1248,"Science Fiction, Adventure, Action"
False,/493MuzSs6iLyKM7aqsA30eODfsV.jpg,"27, 53, 35",1198994,en,Send Help,"Two colleagues become stranded on a deserted island, the only survivors of a plane crash. On the island, they must overcome past grievances and work together to survive, but ultimately, it's a battle of wills and wits to make it out alive.",35.8255,/kL4MgAIZIYX3sCeG34N0XfVhCtt.jpg,2026-01-22,Send Help,False,7.075,355,"Horror, Thriller, Comedy"
False,/8ZTVqvKDQ8emSGUEMjsS4yHAwrp.jpg,"28, 878, 12",27205,en,Inception,"Cobb, a skilled thief who commits corporate espionage by infiltrating the subconscious of his targets is offered a chance to regain his old life as payment for a task considered to be impossible: ""inception"", the implantation of another person's idea into a target's subconscious.",34.526,/xlaY2zyzMfkhk0HSC5VUwzoZPU1.jpg,2010-07-15,Inception,False,8.37,38822,"Action, Science Fiction, Adventure"
False,/5arE7ysejlE2byGyakuUrR5TmUt.jpg,"27, 53, 28",1205225,en,Gates of Flesh,"A group of friends attempt to escape the city after an outbreak of demon-possessions. The friends seek shelter in an abandoned church, but their plans for escape are ruined when one of them becomes possessed.",30.6064,/cOiuCeECSRqzpwuY6wYKQzvPcXm.jpg,2025-04-08,Gates of Flesh,False,5.694,36,"Horror, Thriller, Action"
False,/3I2RO8UuAliSuX25jK59stqFZW1.jpg,"16, 878, 35",1600672,ja,エヴァンゲリオン放送30周年記念特別興行,A short film celebrating the 30th anniversary of Neon Genesis Evangelion starring both the classic and Rebuild iterations of Asuka. The short comedically explores alternate timelines.,38.1183,/yNgDrl4WX2kMDjYMXIp7PbSt8nU.jpg,2026-02-21,EVANGELION 30th Anniversary Special Screening,False,8.0,1,"Animation, Science Fiction, Comedy"
False,/fPfDB0IHOqvmKIzFP9CA51OOS1N.jpg,"27, 53",1010755,en,The Strangers: Chapter 3,"Tethered by a frightening conclusion, Maya and the Strangers are locked on an unavoidable, unforgiving collision course — a showdown that proves they’re far from strangers now.",33.6755,/yPHwX78mcwJw3I6YOJ9qh2wQBFr.jpg,2026-02-05,The Strangers: Chapter 3,False,5.7,38,"Horror, Thriller"
False,/ncI1PlBcANixIkgQSnjsSRz4OyT.jpg,"28, 53, 9648",1439112,en,Muzzle: City of Wolves,"LAPD officer Jake Rosser endeavors to lead a peaceful life with his family and retired K-9 officer, Socks. However, tranquility dissolves into chaos when a gang targets them in a brutal attack. Alongside his new K-9 partner Argos, Jake launches into a relentless pursuit of justice, determined to protect his loved ones.",33.9507,/8qTMRmC07XCGidnKQFLbRM3FoDU.jpg,2025-11-13,Muzzle: City of Wolves,False,6.7,111,"Action, Thriller, Mystery"
False,/kVSUUWiXoNwq2wVCZ4Mcqkniqvr.jpg,"16, 10751, 35, 12, 14",991494,en,The SpongeBob Movie: Search for SquarePants,"Desperate to be a big guy, SpongeBob sets out to prove his bravery to Mr. Krabs by following The Flying Dutchman – a mysterious swashbuckling ghost pirate – on a seafaring adventure that takes him to the deepest depths of the deep sea, where no Sponge has gone before.",31.3776,/xJnOMMsFASxNiFnG7v3TNIQ3ife.jpg,2025-12-16,The SpongeBob Movie: Search for SquarePants,False,6.8,225,"Animation, Family, Comedy, Adventure, Fantasy"
False,/5lQ4euO30sDin5nCifvi0vURFNd.jpg,"28, 35, 10751",1248226,en,Playdate,"When out-of-work accountant Brian joins stay-at-home dad Jeff for a playdate with their sons, he expects a laid-back afternoon. Instead, they're chased by mercenaries, and Brian—totally unprepared—must survive one absurd obstacle after another.",34.6704,/fGodXWqJkkkbSebPIlxLSygV8GY.jpg,2025-11-04,Playdate,False,6.029,539,"Action, Comedy, Family"
False,/ohUhHOqW8cM59Ay5UjqplLzJbH3.jpg,"10749, 18",1317672,en,Love Me Love Me,"After her brother's death, June moves to Milan for a fresh start, finding comfort in Will, the perfect honor student at her new international school. But when his troubled best friend James—hiding a dangerous life in clandestine MMA fights—sparks a rivalry that quickly turns into irresistible attraction, June must choose between safety and a love that upends everything she thought she wanted.",33.1046,/xmoO861IKm1ycJ52mLGc3nwINKV.jpg,2026-02-12,Love Me Love Me,False,5.528,161,"Romance, Drama"
False,/xcBlMEvzuaHoWANKYn5PGvcW4OC.jpg,"27, 28, 53",1110034,no,Kraken,"Marine biologist Johanne is doing research on a fish farm in Vangsnes, a rural community located by the fjord, when she encounters several strange occurrences. Along with the brutal deaths of two local teenagers, all signs point to the deep fjord; can there be more to the depths than the eye can see? At the bottom of the deepest fjord rests a mythical monster as large as a mountain, with a myriad of arms ready to crush and devour anything they can grab.",29.8163,/jVsflOu9WpMqUJ3WwVX2mITi86S.jpg,2026-02-06,Kraken,False,6.7,7,"Horror, Action, Thriller"
False,/7nAVXGHHtaNcdsqvDXmY6R9N0fG.jpg,"28, 35",1363123,en,The Family Plan 2,"Now that Dan's assassin days are behind him, all he wants for Christmas is quality time with his kids. But when he learns his daughter has her own plans, he books a family trip to London—putting them all in the crosshairs of an unexpected enemy.",35.8074,/semFxuYx6HcrkZzslgAkBqfJvZk.jpg,2025-11-11,The Family Plan 2,False,6.53,514,"Action, Comedy"
False,/gLXibzLQ4qegvjdqDC0f8yTij2P.jpg,"9648, 53, 28",1310568,en,Murder at the Embassy,"1934. Private detective Miranda Green investigates a murder perpetrated in the British Embassy in Cairo, where a top secret document was stolen, risking to jeopardize both Buckingham Palace and the peace of the world. All those present in this closed place are suspected: the American photographer, the English student, the American actress, the Egyptian security guard, the ambassador interpreter, the Egyptian gardener and - why not? — the Ambassador himself. But who would have expected that a small group of Nazis would be behind a plot, risking to jeopardize both Buckingham Palace and the peace of the world?",32.4039,/3DBmBItPdy0A2ol59jgHhS54Lua.jpg,2025-11-14,Murder at the Embassy,False,5.8,37,"Mystery, Thriller, Action"
False,/9Z2uDYXqJrlmePznQQJhL6d92Rq.jpg,"10751, 14, 35, 12, 16",1226863,en,The Super Mario Galaxy Movie,"Having thwarted Bowser's previous plot to marry Princess Peach, Mario and Luigi now face a fresh threat in Bowser Jr., who is determined to liberate his father from captivity and restore the family legacy. Alongside companions new and old, the brothers travel across the stars to stop the young heir's crusade.",49.8245,/eJGWx219ZcEMVQJhAgMiqo8tYY.jpg,2026-04-01,The Super Mario Galaxy Movie,False,0.0,0,"Family, Fantasy, Comedy, Adventure, Animation"
False,/vL5LR6WdxWPjLPFRLe133jXWsh5.jpg,"28, 12, 878",19995,en,Avatar,"In the 22nd century, a paraplegic Marine is dispatched to the moon Pandora on a unique mission, but becomes torn between following orders and protecting an alien civilization.",30.5561,/gKY6q7SjCkAU6FqvqWybDYgUKIF.jpg,2009-12-16,Avatar,False,7.6,33584,"Action, Adventure, Science Fiction"
False,/cGbPBHKSFO7hSIjxkb3KOaGdOep.jpg,"14, 12, 10749",967941,en,Wicked: For Good,"As an angry mob rises against the Wicked Witch, Glinda and Elphaba will need to come together one final time. With their singular friendship now the fulcrum of their futures, they will need to truly see each other, with honesty and empathy, if they are to change themselves, and all of Oz, for good.",34.057,/si9tolnefLSUKaqQEGz1bWArOaL.jpg,2025-11-19,Wicked: For Good,False,6.646,859,"Fantasy, Adventure, Romance"
False,/o2xLxY1LdwBMsrGD9hjIaOrIQm6.jpg,"878, 12, 9648",687163,en,Project Hail Mary,"Science teacher Ryland Grace wakes up on a spaceship light years from home with no recollection of who he is or how he got there. As his memory returns, he begins to uncover his mission: solve the riddle of the mysterious substance causing the sun to die out. He must call on his scientific knowledge and unorthodox ideas to save everything on Earth from extinction… but an unexpected friendship means he may not have to do it alone.",56.3524,/vOhW7Lbt4kZAqe0vJhVC4Ced9x2.jpg,2026-03-13,Project Hail Mary,False,10.0,2,"Science Fiction, Adventure, Mystery"
False,/9uakM2woks0JV8HKIc4oatIVS88.jpg,"27, 53",1315303,en,Primate,"Lucy, a college student, along with her friends, spend their vacation at her family's home in Hawaii, which includes her pet chimpanzee, Ben. However, when Ben contracts rabies after being bitten by a rabid animal, the group must fight for their lives in order to avoid the now-violent chimp.",30.193,/z97hrgI5wbGbZvSVkBfAeBnFKAg.jpg,2026-01-01,Primate,False,6.6,456,"Horror, Thriller"
False,/reQELo8rDiLIOoYIA7M6q7KGRW0.jpg,"16, 12, 14, 10751, 18, 878",804370,fr,Arco,"10-year-old Arco lives in a far future. During his first flight in his rainbow suit, he loses control and falls into the past. Iris, a girl his age from 2075, comes to his rescue and tries by all means to help send him back to his era.",25.7555,/ipE3XiHqbSQm3HS0tJ09CDaJ2Fs.jpg,2025-10-22,Arco,False,7.526,114,"Animation, Adventure, Fantasy, Family, Drama, Science Fiction"
False,/54BOXpX2ieTXMDzHymdDMnUIzYG.jpg,"27, 53",1228246,en,Five Nights at Freddy's 2,"One year since the supernatural nightmare at Freddy Fazbear's Pizza, the stories about what transpired there have been twisted into a campy local legend, inspiring the town's first ever Fazfest. With the truth kept from her, Abby sneaks out to reconnect with Freddy, Bonnie, Chica, and Foxy, setting into motion a terrifying series of events that will reveal dark secrets about the real origin of Freddy's, and unleash a decades-hidden horror.",29.6541,/udAxQEORq2I5wxI97N2TEqdhzBE.jpg,2025-12-03,Five Nights at Freddy's 2,False,6.686,800,"Horror, Thriller"
False,/ySHUoK4utUOiSfCinw81H1TsV0E.jpg,"878, 28, 27",1241470,en,Osiris,"Special Forces commandos on a mission are abducted mid-operation by a mysterious spacecraft. Upon waking aboard, they find themselves prey to a relentless alien race in a fight for survival.",31.3141,/3YtZHtXPNG5AleisgEatEfZOT2w.jpg,2025-07-25,Osiris,False,5.957,199,"Science Fiction, Action, Horror"
False,/82C04rTiXYZ7c8XZv91Nu53w82Y.jpg,"28, 53",1007734,en,Nobody 2,"Former assassin Hutch Mansell takes his family on a nostalgic vacation to a small-town theme park, only to be pulled back into violence when they clash with a corrupt operator, a crooked sheriff, and a ruthless crime boss.",30.7057,/iyxwxDZCpIm0vIORaHpmgJv2BGF.jpg,2025-08-13,Nobody 2,False,6.978,1319,"Action, Thriller"
False,/yCatt8lmp3oRFEcOZF8KHhsiASQ.jpg,"28, 10752",1223601,fi,Sisu 2,"Returning to the house where his family was brutally murdered during the war, ""the man who refuses to die"" dismantles it, loads it on a truck, and is determined to rebuild it somewhere safe in their honor. When the commander who killed his family comes back hellbent on finishing the job, a relentless, eye-popping cross-country chase ensues.",28.5996,/jNsttCWZyPtW66MjhUozBzVsRb7.jpg,2025-10-21,Sisu: Road to Revenge,False,7.316,594,"Action, War"
False,/fAF3VGFBpItWNROmiGob60n0y5.jpg,27,1242937,en,The Dreadful,"In medieval England, Anne and her domineering mother-in-law Morwen struggle to survive on the outskirts of society. But when a man from Anne's past returns from war, a curse begins to take shape through a mysterious knight and threatens to destroy them all.",29.5967,/nhhJkYau8nQMFgauvOudDjwj9vA.jpg,2026-02-20,The Dreadful,False,6.55,50,Horror
False,/jwRbJMGO3OZCwFLoJXn8tEbatJ2.jpg,27,1375831,en,Diabolic,"A woman's hope for a miracle cure turns into a nightmare when she confronts the vengeful spirit of a cursed witch, determined to claim her as a vessel for her evil power.",26.7198,/3qikoc12LQH6upkLZZlJY8wEZvN.jpg,2025-11-20,Diabolic,False,7.154,26,Horror
False,/ehumsuIBbgAe1hg343oszCLrAfI.jpg,"16, 10751, 14, 12",1022796,en,Wish,"Asha, a sharp-witted idealist, makes a wish so powerful that it is answered by a cosmic force – a little ball of boundless energy called Star. Together, Asha and Star confront a most formidable foe - the ruler of Rosas, King Magnifico - to save her community and prove that when the will of one courageous human connects with the magic of the stars, wondrous things can happen.",27.8698,/nesuSdJakNkf0zs7OfoasB6Clxf.jpg,2023-11-13,Wish,False,6.224,1747,"Animation, Family, Fantasy, Adventure"
False,/zFIdOkN4ULw6K6HBpMUMn6njMnK.jpg,"35, 18",1631485,es,Parque Lezama,"A former communist militant and a ""live and let live"" man form an unlikely friendship on a park bench, sharing their life stories with humor and heart.",30.8639,/s97TitarxPtIdIsU7u1BSnf0FW5.jpg,2026-02-19,Strangers in the Park,False,6.8,5,"Comedy, Drama"
False,/xM2dUqkpaSHOR87ojZ538DGQqcD.jpg,"27, 878, 53, 18",1289893,en,Somnium,"Gemma moves to LA, hoping to become an actress. She takes an overnight gig at a sleep clinic that promises to make their clients’ dreams come true. But the longer she spends there, the more it becomes clear that something sinister is going on.",26.2845,/cPUeMJkPLDWSOA6OU862EdZhylS.jpg,2025-08-28,Somnium,False,5.6,25,"Horror, Science Fiction, Thriller, Drama"
False,/qth56RA3rkUlhbDRDKGeMJEssdi.jpg,"10749, 35, 18",1034716,en,People We Meet on Vacation,"Poppy's a free spirit. Alex loves a plan. After years of summer vacations, these polar-opposite pals wonder if they could be a perfect romantic match.",29.7976,/peG6482ALJQ9Tbvv2P38BquVk0f.jpg,2026-01-06,People We Meet on Vacation,False,7.0,494,"Romance, Comedy, Drama"
False,/4w6nQYAY0eb7B0VVRDXilXcgAUV.jpg,"80, 27, 9648",4232,en,Scream,"A year after the murder of her mother, a teenage girl is terrorized by a masked killer who targets her and her friends by using scary movies as part of a deadly game.",26.936,/lr9ZIrmuwVmZhpZuTCW8D9g0ZJe.jpg,1996-12-20,Scream,False,7.427,7755,"Crime, Horror, Mystery"
False,/ufpeVEM64uZHPpzzeiDNIAdaeOD.jpg,"28, 35, 878",533535,en,Deadpool & Wolverine,"A listless Wade Wilson toils away in civilian life with his days as the morally flexible mercenary, Deadpool, behind him. But when his homeworld faces an existential threat, Wade must reluctantly suit-up again with an even more reluctant Wolverine.",27.0871,/8cdWjvZQUExUUTzyp4t6EDMubfO.jpg,2024-07-24,Deadpool & Wolverine,False,7.556,8348,"Action, Comedy, Science Fiction"
False,/k8NQUrnUtX20bCreOKyEv9J7U3S.jpg,"878, 12, 18",1258151,ru,Кракен,"A Russian missile submarine disappears without trace during a secret mission in the Greenland Sea. A vessel is deployed to search for it, captained by the brother of the missing submarine’s commander. The search crew is tasked with locating the submarine and preventing a top-secret weapon from falling into enemy hands. Meanwhile, a geological research operation at the North Pole awakens the Kraken, a giant deep-water monster with an incredible ability to camouflage and an uncanny intelligence. As the search party narrows in on the missing submarine, they will encounter the legendary creature of the deep.",27.8192,/c97Xlokfn4M6ZOQmt7OfXfLDwd5.jpg,2025-04-17,Kraken,False,6.3,43,"Science Fiction, Adventure, Drama"
False,/xnHVX37XZEp33hhCbYlQFq7ux1J.jpg,"18, 10749",597,en,Titanic,"101-year-old Rose DeWitt Bukater tells the story of her life aboard the Titanic, 84 years later. A young Rose boards the ship with her mother and fiancé. Meanwhile, Jack Dawson and Fabrizio De Rossi win third-class tickets aboard the ship. Rose tells the whole story from Titanic's departure through to its death—on its first and last voyage—on April 15, 1912.",28.9221,/9xjZS2rlVxm8SFx8kPC3aIGCOYQ.jpg,1997-12-18,Titanic,False,7.903,26871,"Drama, Romance"
