adult,backdrop_path,genre_ids,id,original_language,original_title,overview,popularity,poster_path,release_date,title,video,vote_average,vote_count,genre_names
False,/yOFqBpJ0PEkBdQqalDEaeOiaKbz.jpg,"28, 80, 53",1267319,ko,사마귀,"The secret society of contract killers falls into chaos, unleashing a new breed of assassins. With old rules in ruins, who dares claim the shadows?",26.7553,/pzsXKLJsZ26HUV1oCMa7WiFFQbW.jpg,2025-09-25,Mantis,False,6.282,149,"Action, Crime, Thriller"
False,/mDfJG3LC3Dqb67AZ52x3Z0jU0uB.jpg,"12, 28, 878",299536,en,Avengers: Infinity War,"As the Avengers and their allies have continued to protect the world from threats too large for any one hero to handle, a new danger has emerged from the cosmic shadows: Thanos. A despot of intergalactic infamy, his goal is to collect all six Infinity Stones, artifacts of unimaginable power, and use them to inflict his twisted will on all of reality. Everything the Avengers have fought for has led up to this moment - the fate of Earth and existence itself has never been more uncertain.",29.149,/7WsyChQLEftFiDOVTGkv3hFpyyt.jpg,2018-04-25,Avengers: Infinity War,False,8.234,31582,"Adventure, Action, Science Fiction"
False,/40Wtp7kMG6mZ4d5T1jfrd8qrvD4.jpg,"16, 35, 14, 12, 10751",808,en,Shrek,"It ain't easy bein' green -- especially if you're a likable (albeit smelly) ogre named Shrek. On a mission to retrieve a gorgeous princess from the clutches of a fire-breathing dragon, Shrek teams up with an unlikely compatriot -- a wisecracking donkey.",27.8454,/iB64vpL3dIObOtMZgX3RqdVdQDc.jpg,2001-05-18,Shrek,False,7.757,18481,"Animation, Comedy, Fantasy, Adventure, Family"
False,/ukfI9QkU1aIhOhKXYWE9n3z1mFR.jpg,"16, 10751, 14",129,ja,千と千尋の神隠し,"A young girl, Chihiro, becomes trapped in a strange new world of spirits. When her parents undergo a mysterious transformation, she must call upon the courage she never knew she had to free her family.",29.3079,/39wmItIWsg5sZMyRUHLkWBcuVCM.jpg,2001-07-20,Spirited Away,False,8.534,18047,"Animation, Family, Fantasy"
False,/s94NjfKkcSczZ1FembwmQZwsuwY.jpg,"878, 12, 28",617126,en,The Fantastic 4: First Steps,"Against the vibrant backdrop of a 1960s-inspired, retro-futuristic world, Marvel's First Family is forced to balance their roles as heroes with the strength of their family bond, while defending Earth from a ravenous space god called Galactus and his enigmatic Herald, Silver Surfer.",28.436,/nf5qaSEvyYSNeFH0YhSs5EsBLX9.jpg,2025-07-23,The Fantastic 4: First Steps,False,6.969,3065,"Science Fiction, Adventure, Action"
False,/s94NjfKkcSczZ1FembwmQZwsuwY.jpg,"878, 12, 28",617126,en,The Fantastic 4: First Steps,"Against the vibrant backdrop of a 1960s-inspired, retro-futuristic world, Marvel's First Family is forced to balance their roles as heroes with the strength of their family bond, while defending Earth from a ravenous space god called Galactus and his enigmatic Herald, Silver Surfer.",28.436,/nf5qaSEvyYSNeFH0YhSs5EsBLX9.jpg,2025-07-23,The Fantastic 4: First Steps,False,6.969,3065,"Science Fiction, Adventure, Action"
False,/tlm8UkiQsitc8rSuIAscQDCnP8d.jpg,"28, 878",603,en,The Matrix,"Set in the 22nd century, The Matrix tells the story of a computer hacker who joins a group of underground insurgents fighting the vast and powerful computers who now rule the earth.",28.4378,/p96dm7sCMn4VYAStA6siNz30G1r.jpg,1999-03-31,The Matrix,False,8.239,27492,"Action, Science Fiction"
False,/7Zx3wDG5bBtcfk8lcnCWDOLM4Y4.jpg,"10751, 878, 35",552524,en,Lilo & Stitch,The wildly funny and touching story of a lonely Hawaiian girl and the fugitive alien who helps to mend her broken family.,24.7377,/ckQzKpQJO4ZQDCN5evdpKcfm7Ys.jpg,2025-05-17,Lilo & Stitch,False,7.205,2059,"Family, Science Fiction, Comedy"
False,/7uXzE0ZBkbAeKylOz7cUQF4Yw75.jpg,18,879945,nl,L'homme inconnu,"Louis, a Flemish writer, decides to isolate himself at the Côte d’Azur, hoping this place will bring him inspiration.",28.8951,/4TpBhdaSl5ALHbgeaYOLF8Q3haz.jpg,2021-10-16,The Unknown Man,False,8.5,2,Drama
False,/cd8YDn7M0lfaHhZdU6MvCDxPalP.jpg,"28, 12, 878",76600,en,Avatar: The Way of Water,"Set more than a decade after the events of the first film, learn the story of the Sully family (Jake, Neytiri, and their kids), the trouble that follows them, the lengths they go to keep each other safe, the battles they fight to stay alive, and the tragedies they endure.",26.9092,/t6HIqrRAclMCA60NsSmeqe9RmNV.jpg,2022-12-14,Avatar: The Way of Water,False,7.6,13813,"Action, Adventure, Science Fiction"
False,/9tOkjBEiiGcaClgJFtwocStZvIT.jpg,"16, 12, 10751, 35",269149,en,Zootopia,"Determined to prove herself, Officer Judy Hopps, the first bunny on Zootopia's police force, jumps at the chance to crack her first case - even if it means partnering with scam-artist fox Nick Wilde to solve the mystery.",29.8934,/hlK0e0wAQ3VLuJcsfIYPvb4JVud.jpg,2016-02-11,Zootopia,False,7.759,17784,"Animation, Adventure, Family, Comedy"
False,/91kH9D1cr8GF7jgvUXiirAw3EK3.jpg,"27, 53",18278,en,Perkins' 14,"Ronald Perkins builds an army of 14 people brainwashed through cult-like methods to protect him from his parents' killers. When Perkins is imprisoned, the police unwittingly unleash his followers on a small town and they've only got one thing on their mind: ""Kill for Mr. Perkins.""",21.6745,/m20PFFDOp6KWtpqzhsrp67aa4Wc.jpg,2009-01-09,Perkins' 14,False,4.673,49,"Horror, Thriller"
False,/yKWZIDo4ixcDUeelk2QGVA1EVmC.jpg,"27, 9648",1078605,en,Weapons,"When all but one child from the same class mysteriously vanish on the same night at exactly the same time, a community is left questioning who or what is behind their disappearance.",25.0143,/cpf7vsRZ0MYRQcnLWteD5jK9ymT.jpg,2025-08-04,Weapons,False,7.273,3009,"Horror, Mystery"
False,/OO75q1cTWWXDmy52bB79yzpxBt.jpg,"53, 878, 80, 28",1266798,fr,Chien 51,"In the near future, Paris is divided into three zones that separate social classes, and no one can escape ALMA, a predictive AI that has revolutionized law enforcement. When ALMA’s creator is assassinated, Salia, a top agent, and Zem, a jaded cop, are forced to work together to solve a murder that may expose the dark secrets of the system they serve.",17.5923,/olMvhbCRuhTbf6EMKxKGHi2on3L.jpg,2025-10-15,Dog 51,False,6.2,220,"Thriller, Science Fiction, Crime, Action"
False,/qDyFe7gMnom72qfUEYzWrgwB4ss.jpg,28,62201,hi,शहँशाह,"Inspector Srivastav is framed by a wily and cunning gangster, J.K., and unable to prove his innocence, hangs himself, leaving behind his wife, and son, Vijay. Years later, Vijay has grown up and has joined the police force as an Inspector. Unlike his dad, he is corrupt and does accept bribes to turn a nelson's eye to crime. The City Police are assigned the task of apprehending a customed man called ""Shahenshah"", who operates at night and targets, tries and kills gangsters in a ""Judge and Executioner ""style. No one knows the real identity of Shahenshah, as he is feared by the police department, and respected by the poor and middle-class.",26.5264,/2ZUpj73MzEh2YwVzJNVUqBSu2LZ.jpg,1988-01-29,Shahenshah,False,6.3,25,Action
False,/lj6AaDqDUbzm2XJltFNHeAm2uXN.jpg,"35, 27",1273221,en,Scary Movie,"Twenty-six years after outrunning a suspiciously familiar masked killer, the Core Four are back in the killer's crosshairs and no horror movie IP is safe.",26.7633,/opJeybZ5EL4zObkgFPFkke0KnIq.jpg,2026-06-04,Scary Movie,False,0.0,0,"Comedy, Horror"
False,/zFpaNGxW0FzRFKBOyCFVeYlCdI9.jpg,"10749, 35",1429605,en,F Valentine's Day,"Gina hates her Valentine's Day birthday and travels to Greece to prevent her boyfriend's proposal. With help from vacationers Johnny and his sister Mickey, she schemes to delay it – while questioning her relationship.",25.0894,/8zPExowfpfZOTpS1W4J7G27lH4H.jpg,2026-02-12,F Valentine's Day,False,6.3,56,"Romance, Comedy"
False,,99,1290552,en,Lost to Time: Unearthing the Primevals,Documentary about the 30-year long process of David Allen's The Primevals.,23.6025,/6CWBd5hg0QZEVezTjghATYqXEOJ.jpg,2024-05-31,Lost to Time: Unearthing the Primevals,False,0.0,0,Documentary
False,/arNhhBd88bP3Bjoe4HT8MFE1JQA.jpg,"28, 35, 10751",1029575,en,The Family Plan,"Dan Morgan is many things: a devoted husband, a loving father, a celebrated car salesman. He's also a former assassin. And when his past catches up to his present, he's forced to take his unsuspecting family on a road trip unlike any other.",31.4032,/jLLtx3nTRSLGPAKl4RoIv1FbEBr.jpg,2023-12-14,The Family Plan,False,7.23,1814,"Action, Comedy, Family"
False,/z51Wzj94hvAIsWfknifKTqKJRwp.jpg,"12, 14, 28",120,en,The Lord of the Rings: The Fellowship of the Ring,"Young hobbit Frodo Baggins, after inheriting a mysterious ring from his uncle Bilbo, must leave his home in order to keep it from falling into the hands of its evil creator. Along the way, a fellowship is formed to protect the ringbearer and make sure that the ring arrives at its final destination: Mt. Doom, the only place where it can be destroyed.",26.8878,/6oom5QYQ2yQTMJIbnvbkBL9cHo6.jpg,2001-12-18,The Lord of the Rings: The Fellowship of the Ring,False,8.428,27129,"Adventure, Fantasy, Action"
False,/2u7zbn8EudG6kLlBzUYqP8RyFU4.jpg,"12, 14, 28",122,en,The Lord of the Rings: The Return of the King,"As armies mass for a final battle that will decide the fate of the world--and powerful, ancient forces of Light and Dark compete to determine the outcome--one member of the Fellowship of the Ring is revealed as the noble heir to the throne of the Kings of Men. Yet, the sole hope for triumph over evil lies with a brave hobbit, Frodo, who, accompanied by his loyal friend Sam and the hideous, wretched Gollum, ventures deep into the very dark heart of Mordor on his seemingly impossible quest to destroy the Ring of Power.​",27.675,/rCzpDGLbOoPwLjy3OAm5NUPOTrC.jpg,2003-12-17,The Lord of the Rings: The Return of the King,False,8.494,26145,"Adventure, Fantasy, Action"
False,/ifUfE79O1raUwbaQRIB7XnFz5ZC.jpg,"27, 9648",646385,en,Scream,"Twenty-five years after a streak of brutal murders shocked the quiet town of Woodsboro, a new killer has donned the Ghostface mask and begins targeting a group of teenagers to resurrect secrets from the town’s deadly past.",23.2156,/1m3W6cpgwuIyjtg5nSnPx7yFkXW.jpg,2022-01-12,Scream,False,6.7,3758,"Horror, Mystery"
False,/thgemkoLauZxcqe6KX8wxqEc70z.jpg,"53, 18",1428862,es,Cortafuego,"Little Lide disappears in the forest while her family packs up their home. As a fire breaks out, her mother must race to reach her before the flames do.",25.1,/knh3c8LzL9fMhjc5SZPAOotXyiy.jpg,2026-02-19,Firebreak,False,6.199,78,"Thriller, Drama"
False,/dbr3eceKuGnKc9v5GaVTVtegZNK.jpg,35,1243460,en,Joe's College Road Trip,"To teach his sheltered grandson about the real world, Madea's foul-mouthed brother Joe takes the college-bound teen on a raucous cross-country road trip.",25.5356,/jWGOCUlzF4aCVLwHoiuqWWfhcrA.jpg,2026-02-12,Joe's College Road Trip,False,5.76,50,Comedy
False,/44immBwzhDVyjn87b3x3l9mlhAD.jpg,"27, 53, 80",934433,en,Scream VI,"Following the latest Ghostface killings, the four survivors leave Woodsboro behind and start a fresh chapter.",22.7834,/wDWwtvkRRlgTiUr6TyLSMX8FCuZ.jpg,2023-03-08,Scream VI,False,6.962,3078,"Horror, Thriller, Crime"
False,/QEbt6liCqDcJkmfgIUBoEGlhLC.jpg,"27, 878",223319,ja,LSD -ラッキースカイダイアモンド-,"At the clinic where her boyfriend Katayama, a young genius doctor, is the director, Yoko, a young girl who continues to suffer from eerie nightmares every day, is not getting better despite the care of her sister Sakurako and Katayama's treatment. Sakurako, the sister, is suspicious of Yoko's condition and confronts Katayama, who tells her that she suffers from a serious mental disorder and that the only way to cure it is to have brain surgery. Yoko, despite being persuaded by her sister and Katayama, agrees to the surgery, although she is skeptical...",29.3625,/kYTHzZpgnzhea5Trp3evcxSEdTG.jpg,1989-03-11,Lucky Sky Diamond,False,3.6,9,"Horror, Science Fiction"
False,/zMhfjTmdZblh37fyVHkwv6DuGGv.jpg,"99, 10402",404141,en,Nick Cave & The Bad Seeds: One More Time with Feeling,"Andrew Dominik's One More Time With Feeling is a remarkable black and white documentary which chronicles the creation of Nick Cave & The Bad Seeds' album Skeleton Tree. Originally a performance based concept, the film evolved into something much more significant as Dominik delved into the tragic backdrop of the writing and recording of the album. The result is stark, fragile and raw, and a true testament to an artist trying to find his way through the darkness. It documents the writing, recording and performing of Nick Cave & the Bad Seeds’ sixteenth studio album, Skeleton Tree.",22.5729,/opORnjagpi1KKfGVNX2NuNECdzE.jpg,2016-09-02,Nick Cave & The Bad Seeds: One More Time with Feeling,False,7.9,103,"Documentary, Music"
False,/wYMbnrdRCREjNLwFlG5SLWzBjui.jpg,"878, 12",438631,en,Dune,"Paul Atreides, a brilliant and gifted young man born into a great destiny beyond his understanding, must travel to the most dangerous planet in the universe to ensure the future of his family and his people. As malevolent forces explode into conflict over the planet's exclusive supply of the most precious resource in existence-a commodity capable of unlocking humanity's greatest potential-only those who can conquer their fear will survive.",25.7486,/d5NXSklXo0qyIYkgV94XAgMIckC.jpg,2021-09-15,Dune,False,7.778,14540,"Science Fiction, Adventure"
False,/8btfz81bOJ2lC7cujYBTw03wzg3.jpg,"16, 14, 12, 28",980477,zh,哪吒之魔童闹海,"After a catastrophic event leaves their bodies destroyed, Ne Zha and Ao Bing are granted a fragile second chance at life. As tensions rise between the dragon clans and celestial forces, the two must undergo a series of perilous trials that will test their bond, challenge their identities, and decide the fate of both mortals and immortals.",25.7307,/cb5NyNrqiCNNoDkA8FfxHAtypdG.jpg,2025-01-29,Ne Zha 2,False,8.107,611,"Animation, Fantasy, Adventure, Action"
False,/hiKmpZMGZsrkA3cdce8a7Dpos1j.jpg,"35, 53, 18",496243,ko,기생충,"All unemployed, Ki-taek's family takes peculiar interest in the wealthy and glamorous Parks for their livelihood until they get entangled in an unexpected incident.",28.9129,/7IiTTgloJzvGI1TAYymCfbfl3vT.jpg,2019-05-30,Parasite,False,8.493,20248,"Comedy, Thriller, Drama"
False,/lQUsfSUcai6ZOHQHgobSlF0IDUV.jpg,"10402, 35",1422562,en,The Moment,"A rising pop sensation navigates fame and industry pressures while preparing for her arena tour debut, revealing the transformation of underground culture into mainstream success.",25.5666,/dYgCgTqqMnWdsnP2XirdcFB28ch.jpg,2026-01-30,The Moment,False,5.911,28,"Music, Comedy"
False,/1yktYsxkmUtUFTUnCAUaqG6FEiz.jpg,"28, 53, 80",541671,en,Ballerina,"Taking place during the events of John Wick: Chapter 3 – Parabellum, Eve Macarro begins her training in the assassin traditions of the Ruska Roma.",25.4378,/2VUmvqsHb6cEtdfscEA6fqqVzLg.jpg,2025-06-04,Ballerina,False,7.253,2395,"Action, Thriller, Crime"
False,/538U9snNc2fpnOmYXAPUh3zn31H.jpg,"28, 53, 12",575265,en,Mission: Impossible - The Final Reckoning,"Ethan Hunt and team continue their search for the terrifying AI known as the Entity — which has infiltrated intelligence networks all over the globe — with the world's governments and a mysterious ghost from Hunt's past on their trail. Joined by new allies and armed with the means to shut the Entity down for good, Hunt is in a race against time to prevent the world as we know it from changing forever.",25.3784,/z53D72EAOxGRqdr7KXXWp9dJiDe.jpg,2025-05-17,Mission: Impossible - The Final Reckoning,False,7.179,2624,"Action, Thriller, Adventure"
False,/zQ8AxTPiCiS5nnwXpwTBPBHSaa5.jpg,"28, 878",557,en,Spider-Man,"After being bitten by a genetically altered spider at Oscorp, nerdy but endearing high school student Peter Parker is endowed with amazing powers to become the superhero known as Spider-Man.",24.9919,/kjdJntyBeEvqm9w97QGBdxPptzj.jpg,2002-05-01,Spider-Man,False,7.323,20377,"Action, Science Fiction"
False,/3Rfvhy1Nl6sSGJwyjb0QiZzZYlB.jpg,"10751, 35, 16, 12",862,en,Toy Story,"Led by Woody, Andy's toys live happily in his room until Andy's birthday brings Buzz Lightyear onto the scene. Afraid of losing his place in Andy's heart, Woody plots against Buzz. But when circumstances separate Buzz and Woody from their owner, the duo eventually learns to put aside their differences.",24.1075,/uXDfjJbdP4ijW5hWSBrPrlKpxab.jpg,1995-11-22,Toy Story,False,7.971,19630,"Family, Comedy, Animation, Adventure"
False,/v92h7ys8fRuG5pFny7rE24meLLI.jpg,"27, 878",9599,en,The Blob,"In Arborville, California, three high school students try to protect their hometown from a gelatinous alien life form that engulfs everything it touches.",24.0812,/zXXDmz5cPuSo9LveCNjZ1j16szC.jpg,1988-08-05,The Blob,False,6.838,1016,"Horror, Science Fiction"
False,/79PNOxNXSe5e0bhEj11QJPlsdCN.jpg,"14, 10751, 28, 12",1087192,en,How to Train Your Dragon,"On the rugged isle of Berk, where Vikings and dragons have been bitter enemies for generations, Hiccup stands apart, defying centuries of tradition when he befriends Toothless, a feared Night Fury dragon. Their unlikely bond reveals the true nature of dragons, challenging the very foundations of Viking society.",21.9305,/53dsJ3oEnBhTBVMigWJ9tkA5bzJ.jpg,2025-06-06,How to Train Your Dragon,False,7.929,2653,"Fantasy, Family, Action, Adventure"
False,/9n2tJBplPbgR2ca05hS5CKXwP2c.jpg,"10751, 35, 12, 16, 14",502356,en,The Super Mario Bros. Movie,"While working underground to fix a water main, Brooklyn plumbers—and brothers—Mario and Luigi are transported down a mysterious pipe and wander into a magical new world. But when the brothers are separated, Mario embarks on an epic quest to find Luigi.",28.739,/qNBAXBIQlnOThrVvA6mA2B5ggV6.jpg,2023-04-05,The Super Mario Bros. Movie,False,7.59,10327,"Family, Comedy, Adventure, Animation, Fantasy"
False,/n8BYpslKnXDScx4WTWejLel3qZ1.jpg,35,4248,en,Scary Movie 2,"While the original parodied slasher flicks like Scream, Keenen Ivory Wayans's sequel to Scary Movie takes comedic aim at haunted house movies. A group of students visit a mansion called ""Hell House,"" and murderous high jinks ensue.",23.6784,/7Eb1JWK0Cb0rbfsYjwfc9g0PbQH.jpg,2001-07-04,Scary Movie 2,False,5.811,5038,Comedy
False,/jRJrQ72VLyEnVsvwfep8Xjlvu8c.jpg,"80, 18, 28",101,fr,Léon,"Léon, the top hit man in New York, has earned a rep as an effective ""cleaner"". But when his next-door neighbors are wiped out by a loose-cannon DEA agent, he becomes the unwilling custodian of 12-year-old Mathilda. Before long, Mathilda's thoughts turn to revenge, and she considers following in Léon's footsteps.",22.325,/bxB2q91nKYp8JNzqE7t7TWBVupB.jpg,1994-09-14,Léon: The Professional,False,8.295,15858,"Crime, Drama, Action"
False,/fTrQsdMS2MUw00RnzH0r3JWHhts.jpg,"28, 80, 53",1197306,en,A Working Man,"Levon Cade left behind a decorated military career in the black ops to live a simple life working construction. But when his boss's daughter, who is like family to him, is taken by human traffickers, his search to bring her home uncovers a world of corruption far greater than he ever could have imagined.",24.9104,/6FRFIogh3zFnVWn7Z6zcYnIbRcX.jpg,2025-03-26,A Working Man,False,6.683,1805,"Action, Crime, Thriller"
False,/geQgwdQBNYOVoUKK2oBB0ILilIa.jpg,"878, 53",475961,en,Curvature,"Helen tries to cope with the recent death of her husband, a scientist who killed himself right when he was on the verge of successfully completing the invention of a time machine. One day, she receives a phone call, and a voice suspiciously resembling her own voice warns her that she’s in danger. Is it possible Helen has time travelled? And what could have led her to do something like that?",24.6819,/wQ1CwqwGCNZHAkMC0HyEoWYJwzI.jpg,2017-10-08,Curvature,False,4.938,80,"Science Fiction, Thriller"
False,/iwgl8zlrrfvfWp9k9Paj8lvFEvS.jpg,"80, 9648, 53",807,en,Se7en,"Two homicide detectives are on a desperate hunt for a serial killer whose crimes are based on the ""seven deadly sins"" in this dark and haunting film that takes viewers from the tortured remains of one victim to the next. The seasoned Det. Somerset researches each sin in an effort to get inside the killer's mind, while his novice partner, Mills, scoffs at his efforts to unravel the case.",23.4317,/191nKfP0ehp3uIvWqgPbFmI4lv9.jpg,1995-09-22,Se7en,False,8.379,22740,"Crime, Mystery, Thriller"
False,,18,1021635,ja,ザ・レイプ　肉刑,"This unique work depicts in a thrilling way the fear of being isolated in a locked room in the urban jungle, through a man's abnormal sexual urges and a woman who is his target.",26.1754,/e2UNUamYoulTxmIXjbOxvl0Oyaj.jpg,1982-07-09,Za reipu: Niku-kei,False,2.0,2,Drama
False,/srk5NlOnpEsd0hxVFiHfhtQtfDe.jpg,"10749, 18",1156594,es,Culpa nuestra,"Jenna and Lion's wedding brings about the long-awaited reunion between Noah and Nick after their breakup. Nick's inability to forgive Noah stands as an insurmountable barrier. He, heir to his grandfather's businesses, and she, starting her professional life, resist fueling a flame that's still alive. But now that their paths have crossed again, will love be stronger than resentment?",23.797,/yzqHt4m1SeY9FbPrfZ0C2Hi9x1s.jpg,2025-10-15,Our Fault,False,7.365,625,"Romance, Drama"
False,/iwgl8zlrrfvfWp9k9Paj8lvFEvS.jpg,"80, 9648, 53",807,en,Se7en,"Two homicide detectives are on a desperate hunt for a serial killer whose crimes are based on the ""seven deadly sins"" in this dark and haunting film that takes viewers from the tortured remains of one victim to the next. The seasoned Det. Somerset researches each sin in an effort to get inside the killer's mind, while his novice partner, Mills, scoffs at his efforts to unravel the case.",23.4317,/191nKfP0ehp3uIvWqgPbFmI4lv9.jpg,1995-09-22,Se7en,False,8.379,22741,"Crime, Mystery, Thriller"
False,,18,1021635,ja,ザ・レイプ　肉刑,"This unique work depicts in a thrilling way the fear of being isolated in a locked room in the urban jungle, through a man's abnormal sexual urges and a woman who is his target.",26.1754,/e2UNUamYoulTxmIXjbOxvl0Oyaj.jpg,1982-07-09,Za reipu: Niku-kei,False,2.0,2,Drama
False,/srk5NlOnpEsd0hxVFiHfhtQtfDe.jpg,"10749, 18",1156594,es,Culpa nuestra,"Jenna and Lion's wedding brings about the long-awaited reunion between Noah and Nick after their breakup. Nick's inability to forgive Noah stands as an insurmountable barrier. He, heir to his grandfather's businesses, and she, starting her professional life, resist fueling a flame that's still alive. But now that their paths have crossed again, will love be stronger than resentment?",23.797,/yzqHt4m1SeY9FbPrfZ0C2Hi9x1s.jpg,2025-10-15,Our Fault,False,7.365,625,"Romance, Drama"
False,/mXlDBIHh9hBkDCMNazGV2fEPr5J.jpg,18,1124566,no,Affeksjonsverdi,"Sisters Nora and Agnes reunite with their estranged father, the charismatic Gustav, a once-renowned director who offers stage actress Nora a role in what he hopes will be his comeback film. When Nora turns it down, she soon discovers he has given her part to an eager young Hollywood star.",23.9429,/pz9NCWxxOk3o0W3v1Zkhawrwb4i.jpg,2025-08-20,Sentimental Value,False,7.6,657,Drama
False,/AmN8ozRE0AbMGgZhqBu4fUjZkRt.jpg,"12, 18, 36, 28, 53",11362,en,The Count of Monte Cristo,"Edmond Dantés's life and plans to marry the beautiful Mercedes are shattered when his best friend, Fernand, deceives him. After spending 13 miserable years in prison, Dantés escapes with the help of a fellow inmate and plots his revenge, cleverly insinuating himself into the French nobility.",22.6937,/ifMgDAUXVQLY4DeOu3VTTi55jSP.jpg,2002-01-23,The Count of Monte Cristo,False,7.675,1972,"Adventure, Drama, History, Action, Thriller"
False,/qxBgqQpfkcusqEBeaITpQQO3vJs.jpg,"27, 53, 9648",69872,it,Il tuo vizio è una stanza chiusa e solo io ne ho la chiave,"Oliviero is a drunk, burned-out writer who amuses himself by hosting orgies at his grand country manor and humiliating his wife Irina. When a number of women are murdered in grisly fashion, Oliviero becomes a prime suspect.",20.8303,/3CAdlrJ6mOq1BgOJRLuNbNS5Lwa.jpg,1972-08-04,Your Vice Is a Locked Room and Only I Have the Key,False,6.478,136,"Horror, Thriller, Mystery"
False,/kM2l7BoPrlP7hx6bSKrp6MHZ1Aa.jpg,"35, 10749, 14",1489187,ru,Сводишь с ума,"Alisa moves into a spacious apartment in St. Petersburg, where the mirror starts to malfunction, showing the young lodger a parallel reality of the same apartment. Only it is not Alisa who lives in this parallel reality, but the party animal Ivan. Will the young people be able to recognize true love and will they be able to unite their worlds in order to meet in reality and simply touch each other?",20.238,/uk20xvDxx36RAOnYCy86yiUGFP8.jpg,2025-10-09,You Drive Me Crazy,False,8.0,7,"Comedy, Romance, Fantasy"
False,/xRyINp9KfMLVjRiO5nCsoRDdvvF.jpg,"18, 53",550,en,Fight Club,"A ticking-time-bomb insomniac and a slippery soap salesman channel primal male aggression into a shocking new form of therapy. Their concept catches on, with underground ""fight clubs"" forming in every town, until an eccentric gets in the way and ignites an out-of-control spiral toward oblivion.",23.8426,/pB8BM7pdSp6B6Ih7QZ4DrQ3PmJK.jpg,1999-10-15,Fight Club,False,8.438,31576,"Drama, Thriller"
False,/qr7dUqleMRd0VgollazbmyP9XjI.jpg,"878, 18, 53",78,en,Blade Runner,"In the smog-choked dystopian Los Angeles of 2019, blade runner Rick Deckard is called out of retirement to terminate a quartet of replicants who have escaped to Earth seeking their creator for a way to extend their short life spans.",22.7286,/63N9uy8nd9j7Eog2axPQ8lbr3Wj.jpg,1982-06-25,Blade Runner,False,7.94,14770,"Science Fiction, Drama, Thriller"
