adult,backdrop_path,genre_ids,id,title,original_language,original_title,overview,popularity,poster_path,release_date,softcore,video,vote_average,vote_count,genre_names
False,/gdQk5g4TC95957Xs4xGbcOBnG56.jpg,"35, 12, 14, 878, 28",11551,Small Soldiers,en,Small Soldiers,"When missile technology is used to enhance toy action figures, the toys soon begin to take their battle programming too seriously.",9.7505,/2nuUjSzHsoYlRvTPmLo7m7gCQry.jpg,1998-07-10,False,False,6.558,2346,"Comedy, Adventure, Fantasy, Science Fiction, Action"
False,/mPgI6ipyNGfxlQjVkV0MkjDtHjW.jpg,18,348084,Beasts Cage,ja,団鬼六 白獣の槛,"A young bar waitress, Natsuko has accepted to many Mr. Uehara, a rich art teacher. It’s because Uehara could pay the debt for Natsuko’s ex-husband. Mr. Uchara agreed with the terms but suspected that Natsuko betrayed him for money and continued to meet Seiji. Mr. Uehara determined to punish his young wife in his “artistic” way. He tied her up and locked her in the basement of his house, or better described as “the beasts’ cage”, a place where a “bitch” was tortured and sexually abused in various SM ways",11.3599,/apuIoAFqgwc0ZZmpgjtIGcCMtKJ.jpg,2008-02-29,False,False,3.0,2,Drama
False,/mHm73HhpvGWfRkXNErcwc15Czrv.jpg,"80, 18, 53",1628367,Kartavya,hi,कर्त्तव्य,"With his family's safety at stake and menacing threats closing in, a police officer must decide how far he'll go to uphold his duty.",12.0899,/2I689w0K02r5oXawo08W8yNYIzx.jpg,2026-05-15,False,False,6.583,24,"Crime, Drama, Thriller"
False,/mIpCxBWNz6SHCQBe2K2PFr5MB7f.jpg,"16, 10751, 35, 14",62211,Monsters University,en,Monsters University,A look at the relationship between Mike and Sulley during their days at Monsters University — when they weren't necessarily the best of friends.,10.8374,/y7thwJ7z5Bplv6vwl6RI0yteaDD.jpg,2013-06-19,False,False,7.053,11386,"Animation, Family, Comedy, Fantasy"
False,/qe4Tp0hURXqiih5AV1kHimXIt3u.jpg,"28, 80",414419,Kill Bill: The Whole Bloody Affair,en,Kill Bill: The Whole Bloody Affair,"A former assassin, known simply as The Bride, wakes from a coma four years after her jealous ex-lover Bill attempts to murder her on her wedding day. Fueled by an insatiable desire for revenge, she vows to get even with every person who contributed to the loss of her unborn child, her entire wedding party, and four years of her life.  After devising a hit list, The Bride sets off on her quest, enduring unspeakable injury and unscrupulous enemies.",10.0293,/nSOJfWJCdVFZQwXQA7RXn7FIIiY.jpg,2011-03-27,False,False,8.1,1334,"Action, Crime"
False,/iBmIjZ8r0xcUKEhOS9rnEnHeP5I.jpg,"27, 35",1715180,Project Bundy,pt,Projeto Bundy,"Inspired by real and fictional killers, two teenagers initiate a wave of murders in their friend group, creating their own horror movie.",9.0944,/yHuwayPcD9c2jDlELfbgUMYaWE4.jpg,2025-10-22,False,False,0.0,0,"Horror, Comedy"
False,/mQOUyqDybTqxl73hO5LujCZsM1o.jpg,"28, 53, 878",577922,Tenet,en,Tenet,"Armed with only one word - Tenet - and fighting for the survival of the entire world, the Protagonist journeys through a twilight world of international espionage on a mission that will unfold in something beyond real time.",11.0616,/aCIFMriQh8rvhxpN1IWGgvH0Tlg.jpg,2020-08-22,False,False,7.176,11195,"Action, Thriller, Science Fiction"
False,/9udCLTxTFl28RxnK8Q05E154ZGa.jpg,"35, 18",120467,The Grand Budapest Hotel,en,The Grand Budapest Hotel,"The Grand Budapest Hotel tells of a legendary concierge at a famous European hotel between the wars and his friendship with a young employee who becomes his trusted protégé. The story involves the theft and recovery of a priceless Renaissance painting, the battle for an enormous family fortune and the slow and then sudden upheavals that transformed Europe during the first half of the 20th century.",11.1515,/zOVCqKUzjFKqa1eDMcOzvXwthY4.jpg,2014-02-26,False,False,8.027,16192,"Comedy, Drama"
False,/u1HfYLIzWZWpeTJENxWao69DUiz.jpg,18,1398655,Blue Film,en,Blue Film,"Drawn by the promise of easy money and anonymous sex, queer camboy Aaron Eagle is shocked to discover a personal connection with the mysterious stranger who has paid for his company. Over the course of one night, the two men engage in a war of words and emotions as they wrestle with the impact of a tainted and shared past.",11.9852,/7wECL45CnlFWsiadBHwArgVJ1nL.jpg,2026-05-08,False,False,7.2,6,Drama
False,/8KooLwHzZ4oGXiesTxqXMKJby09.jpg,"18, 35",4370,The Lady Banker,fr,La Banquière,"Ambitious Emma Eckhert successfully makes her way into a world previously reserved for men: that of high finance. She quickly becomes popular with small savers, but leads a scandalous life that will cost her.",13.0643,/scH4ltzCx8DqqB5AXERbQdq22Ou.jpg,1980-08-27,False,False,5.3,42,"Drama, Comedy"
False,/9PRKAdrDvAdCfg3EcApLTfzGsEt.jpg,"878, 35, 12",696506,Mickey 17,en,Mickey 17,"Unlikely hero Mickey Barnes finds himself in the extraordinary circumstance of working for an employer who demands the ultimate commitment to the job… to die, for a living.",11.4625,/edKpE9B5qN3e559OuMCLZdW1iBZ.jpg,2025-02-28,False,False,6.84,3664,"Science Fiction, Comedy, Adventure"
False,/vh7np635kDIcfO6x2Y9ElgLJsuI.jpg,"80, 27, 9648",4232,Scream,en,Scream,"A year after the murder of her mother, a teenage girl is terrorized by a masked killer who targets her and her friends by using scary movies as part of a deadly game.",11.3574,/lr9ZIrmuwVmZhpZuTCW8D9g0ZJe.jpg,1996-12-20,False,False,7.432,8044,"Crime, Horror, Mystery"
False,/uvitbjFU4JqvMwIkMWHp69bmUzG.jpg,"18, 80",598,City of God,pt,Cidade de Deus,"In the poverty-stricken favelas of Rio de Janeiro in the 1970s, two young men choose different paths. Rocket is a budding photographer who documents the increasing drug-related violence of his neighborhood, while José “Zé” Pequeno is an ambitious drug dealer diving into a dangerous life of crime.",11.3884,/k7eYdWvhYQyRQoU2TB2A2Xu2TfD.jpg,2002-08-30,False,False,8.428,8254,"Drama, Crime"
False,/flxZrYmIxBZur2K8JBoFmtQdNEv.jpg,18,526024,Boy Undone,es,Memorias de lo que no fue,"Two young men spend the night together after meeting the previous evening in a notorious gay club. The next day, however, the host wakes to find the boy he picked up bewildered and confused, unable remember his name or anything about his past. Lacking any type of identification or obvious clues, the boys begin to search for the truth among fragments of memories that may or may not prove reliable.",8.5944,/eOBsUuK4qoW4S8Qm5hNZpno9mVi.jpg,2017-05-31,False,False,4.8,20,Drama
False,/qGZXYHvWR1TYOU9raCaEABrj9m7.jpg,"16, 10751, 14",10144,The Little Mermaid,en,The Little Mermaid,This colorful adventure tells the story of an impetuous mermaid princess named Ariel who falls in love with the very human Prince Eric and puts everything on the line for the chance to be with him. Memorable songs and characters -- including the villainous sea witch Ursula.,11.5211,/plcZXvI310FkbwIptvd6rqk63LP.jpg,1989-11-17,False,False,7.4,8441,"Animation, Family, Fantasy"
False,/m2QvGozzKz5ux74gKocn4kFTGz1.jpg,"18, 10749",796,Cruel Intentions,en,Cruel Intentions,"Slaking a thirst for dangerous games, Kathryn challenges her stepbrother, Sebastian, to deflower their headmaster's daughter before the summer ends. If he succeeds, the prize is the chance to bed Kathryn. But if he loses, Kathryn will claim his most prized possession.",10.2642,/76cCsRtQ5MJBAqoigojXsLXLJwh.jpg,1999-03-05,False,False,6.819,3612,"Drama, Romance"
False,/AfyuI3glMCBDFmNPj9PY6DwbgGp.jpg,"16, 878, 18, 14",18491,Neon Genesis Evangelion: The End of Evangelion,ja,新世紀エヴァンゲリオン劇場版 Air／まごころを、君に,"SEELE orders an all-out attack on NERV, aiming to destroy the Evas before Gendo can advance his own plans for the Human Instrumentality Project. Shinji is pushed to the limits of his sanity as he is forced to decide the fate of humanity.",11.1379,/j6G24dqI4WgUtChhWjfnI4lnmiK.jpg,1997-07-19,False,False,8.258,1878,"Animation, Science Fiction, Drama, Fantasy"
False,/ffQFnAUm2Uu4RU0nijpjPRf9TBT.jpg,"18, 10749",843,In the Mood for Love,cn,花樣年華,"In 1960s Hong Kong, two neighbors form an intimate bond after making a discovery about their spouses in this visually stunning tale of unrequited love.",10.3887,/iYypPT4bhqXfq1b6EnmxvRt6b2Y.jpg,2000-09-29,False,False,8.087,3288,"Drama, Romance"
False,/mZj8EUr6F1x2PWZjKPxaeYd5WRw.jpg,"12, 16, 35, 10751, 14",11688,The Emperor's New Groove,en,The Emperor's New Groove,"When the self‑absorbed Emperor Kuzco is accidentally transformed into a llama, he must rely on a humble villager to survive the jungle and reclaim his throne.",12.0378,/isA0acj3ONKBLp1pKadUNzxEPFv.jpg,2000-12-15,False,False,7.563,7345,"Adventure, Animation, Comedy, Family, Fantasy"
False,,"878, 18, 9648",1660305,Arkfall,en,Arkfall,Arkfall is an upcoming movie being directed by Randy Smith and is in the announcement phase.,10.6043,/w0W4IjWs2xYZba7wjHaoCcGtISd.jpg,,False,False,0.0,0,"Science Fiction, Drama, Mystery"
False,/cKZTdEyaU74CbuhdlnkV681DGHk.jpg,"18, 53",52462,The Pet,en,The Pet,"A young woman in dire financial straights accepts an offer to be a wealthy aristocrat's human ""pet"" for six months. Then ruthless modern ""pet-nappers"" kidnap the woman to sell her on the GSM (Global Slave Market).",9.7194,/k6UZzTszSpIysEt3mk47U93iS0v.jpg,2006-05-17,False,False,4.5,31,"Drama, Thriller"
False,/ok4ot3YbfDYZcINXf91JUfq3maB.jpg,"27, 9648, 80",176,Saw,en,Saw,"Two men wake up to find themselves shackled in a grimy, abandoned bathroom. As they struggle to comprehend their predicament, they discover a disturbing tape left behind by the sadistic mastermind known as Jigsaw. With a chilling voice and cryptic instructions, Jigsaw informs them that they must partake in a gruesome game in order to secure their freedom.",10.1801,/rLNSOudrayDBo1uqXjrhxcjODIC.jpg,2004-10-01,False,False,7.423,10138,"Horror, Mystery, Crime"
False,/zu09Mwoo69qwHpcj3gNtKntgUB7.jpg,"18, 53",867,Sliver,en,Sliver,"A woman moves into a Manhattan apartment, where she learns that the previous tenant's life ended under mysterious circumstances.",11.9579,/g7PC2e2KqDkIfOoJx9iXJJez99d.jpg,1993-05-21,False,False,5.574,814,"Drama, Thriller"
False,/tH2SoOS2HqOJCOImbeGkmKSdCMz.jpg,"12, 18, 10751",1265,Bridge to Terabithia,en,Bridge to Terabithia,"Jesse Aarons trained all summer to become the fastest runner in school. So he's very upset when newcomer Leslie Burke outruns him and everyone else. Despite this and other differences including that she's rich, he's poor, she's a city girl, and he's a country boy the two become fast friends. Together they create Terabithia, a land of monsters, trolls, ogres, and giants where they rule as king and queen.",11.5259,/3xFxGodKPMFLheS8rujFSmLfcq4.jpg,2007-02-15,False,False,7.343,5325,"Adventure, Drama, Family"
False,,"18, 35",1692461,Marriage Story,ta,Marriage Story,"The film delves into the depths of friendship, love, relationships, and the journey of marriage.",11.3435,/mm9oKhCR58y3NiKYach1lP1o5MI.jpg,,False,False,0.0,0,"Drama, Comedy"
False,/zgQQF04u3OgNBJqClRNby1FPz9s.jpg,"12, 16, 35, 10751, 878",893723,PAW Patrol: The Mighty Movie,en,PAW Patrol: The Mighty Movie,"A magical meteor crash lands in Adventure City and gives the PAW Patrol pups superpowers, transforming them into The Mighty Pups.",11.3431,/aTvePCU7exLepwg5hWySjwxojQK.jpg,2023-09-21,False,False,6.938,569,"Adventure, Animation, Comedy, Family, Science Fiction"
False,/evUB9YKE5IPPtQOchcEF6hS90BO.jpg,"18, 9648, 80",37257,Witness for the Prosecution,en,Witness for the Prosecution,An ailing barrister is thrust back into the courtroom in what becomes one of the most unusual and eventful murder cases of the lawyer's career when he finds himself defending a man being tried for the murder of a socialite.,13.4612,/bCj4EfuehAlgBwVd3diyWyhuuau.jpg,1957-12-17,False,False,8.204,1715,"Drama, Mystery, Crime"
False,/yBDvgpyynDsbMyK21FoQu1c2wYR.jpg,"9648, 80, 53",870028,The Accountant²,en,The Accountant²,"When an old acquaintance is murdered, Wolff is compelled to solve the case. Realizing more extreme measures are necessary, Wolff recruits his estranged and highly lethal brother, Brax, to help. In partnership with Marybeth Medina, they uncover a deadly conspiracy, becoming targets of a ruthless network of killers who will stop at nothing to keep their secrets buried.",10.1947,/lUvfTcOZiK0sdcX0WNLPbMyKjGm.jpg,2025-04-23,False,False,7.086,1822,"Mystery, Crime, Thriller"
False,/ff2ti5DkA9UYLzyqhQfI2kZqEuh.jpg,"28, 53",245891,John Wick,en,John Wick,Ex-hitman John Wick comes out of retirement to track down the gangsters that took everything from him.,11.3261,/wXqWR7dHncNRbxoEGybEy7QTe9h.jpg,2014-10-16,False,False,7.46,20969,"Action, Thriller"
False,,10402,1721391,Come Down,en,Come Down,"Music video by Asha Banks performing Come Down.© 2026 Asha Banks, under exclusive license to Island Records, a division of UMG Recordings, Inc.",11.3183,/UCPxFHgt8Z7OI8eljUq5GVYts4.jpg,,False,False,10.0,1,Music
False,/rOJb0yQOCny0bPjg8bCLw8DyAD7.jpg,"35, 12, 878",550988,Free Guy,en,Free Guy,"A bank teller discovers he is actually a background player in an open-world video game, and decides to become the hero of his own story. Now, in a world where there are no limits, he is determined to be the guy who saves his world his way before it's too late.",11.3129,/dxraF0qPr1OEgJk17ltQTO84kQF.jpg,2021-08-11,False,False,7.451,9913,"Comedy, Adventure, Science Fiction"
False,/7JhsJxNmdW0y4IyNrHy10cECrAz.jpg,35,109418,Grown Ups 2,en,Grown Ups 2,"Lenny has relocated his family back to the small town where he and his friends grew up. This time around, the grown ups are the ones learning lessons from their kids on a day notoriously full of surprises—the last day of school.",11.2844,/hT6ijOtjtYrnyDhN7VA2QWyGFAm.jpg,2013-07-11,False,False,6.181,4733,Comedy
False,/sTQNRqLbfCXolrb5CizAW1dj528.jpg,"878, 14, 28",246655,X-Men: Apocalypse,en,X-Men: Apocalypse,"After the re-emergence of the world's first mutant, world-destroyer Apocalypse, the X-Men must unite to defeat his extinction level plan.",11.2831,/ikA8UhYdTGpqbatFa93nIf6noSr.jpg,2016-05-18,False,False,6.526,13844,"Science Fiction, Fantasy, Action"
False,/teCZlGivejMw4rVzyxBSYQNr6XI.jpg,"28, 53, 18",1368,First Blood,en,First Blood,"When former Green Beret John Rambo is harassed by local law enforcement and arrested for vagrancy, he is forced to flee into the mountains and wage an escalating one-man war against his pursuers.",11.2628,/a9sa6ERZCpplbPEO7OMWE763CLD.jpg,1982-10-22,False,False,7.511,6940,"Action, Thriller, Drama"
False,/bfAC5CnieQljyWp9664zHzvDGIP.jpg,"10749, 35, 18",1363903,True Beauty: The Movie - Part 2,ja,女神降臨 After,"Reina's beauty and dreams dazzle, but her bare face exposes hidden truths as Shun and Yu vie for her heart, stirring tension and racing emotions.",11.2625,/rd6oiZV1VlVXvvGlQ9CYhnjLR8J.jpg,2025-05-01,False,False,10.0,1,"Romance, Comedy, Drama"
False,/vaRCS4CCFXcWz1j9GKd6rGLsQQ2.jpg,"18, 10749",1278,The Dreamers,en,The Dreamers,"When Isabelle and Theo invite Matthew to stay with them, what begins as a casual friendship ripens into a sensual voyage of discovery and desire in which nothing is off limits and everything is possible.",11.2614,/gBb7GGaFYPu7nEUYvC8G4LaJJN1.jpg,2003-10-10,False,False,7.2,3106,"Drama, Romance"
False,/7VSh4KRB38gs4t4Dlub8GwXNUub.jpg,"18, 12, 10749, 10770",115290,Blue Lagoon: The Awakening,en,Blue Lagoon: The Awakening,Two high school students become stranded on a tropical island and must rely on each other for survival. They learn more about themselves and each other while falling in love.,11.2564,/ptsBY9Aqo4Mn0V1krI5s8WfFxzW.jpg,2012-06-16,False,False,6.459,1511,"Drama, Adventure, Romance, TV Movie"
False,/eDLp4uFdqP1gpy9oMrutwH6Q64I.jpg,"18, 53, 27",44214,Black Swan,en,Black Swan,"A committed dancer struggles to maintain her sanity after winning the lead role in a production of Tchaikovsky's ""Swan Lake.""",11.2529,/viWheBd44bouiLCHgNMvahLThqx.jpg,2010-12-03,False,False,7.7,15636,"Drama, Thriller, Horror"
False,/nGpFBxoPZ8pDaQNNL4KwW1YRfz.jpg,"18, 10749",1663123,Lily,id,Lily,A girl finds comfort in someone she believes is her home; until love slowly turns into something that takes more than it gives.,11.2508,/o1ugpMA44YZS4cEEzvqiVYVBMPQ.jpg,2026-04-09,False,False,0.0,0,"Drama, Romance"
False,/3czpqXzFy5UcNuD1AubecRLWkwD.jpg,"28, 12, 878",127585,X-Men: Days of Future Past,en,X-Men: Days of Future Past,The ultimate X-Men ensemble fights a war for the survival of the species across two time periods as they join forces with their younger selves in an epic battle that must change the past – to save our future.,11.2507,/tYfijzolzgoMOtegh1Y7j2Enorg.jpg,2014-05-15,False,False,7.533,16347,"Action, Adventure, Science Fiction"
False,/23AdQ9YGEtx8EbkS0WJPpnP5YWa.jpg,"10751, 35",1497882,TATTERS,en,TATTERS,Meet Marvin: A silly puppet who learns a big lesson after he is diagnosed with a terminal illness.,11.2356,/17MJwVH1X5aUhy0YSHskuSUWIIb.jpg,2025-06-11,False,False,0.0,0,"Family, Comedy"
False,/2Fk3AB8E9dYIBc2ywJkxk8BTyhc.jpg,"53, 28, 878",524047,Greenland,en,Greenland,"John Garrity, his estranged wife and their young son embark on a perilous journey to find sanctuary as a planet-killing comet hurtles toward Earth. Amid terrifying accounts of cities getting levelled, the Garritys experience the best and worst in humanity. As the countdown to the global apocalypse approaches zero, their incredible trek culminates in a desperate and last-minute flight to a possible safe haven.",11.2314,/bNo2mcvSwIvnx8K6y1euAc1TLVq.jpg,2020-07-29,False,False,7.13,5378,"Thriller, Action, Science Fiction"
False,/vlmiJOeDMbiyaJCAjFPtlkDcOEv.jpg,"878, 27, 28",940721,Godzilla Minus One,ja,ゴジラ-1.0,"In postwar Japan, Godzilla brings new devastation to an already scorched landscape. With no military intervention or government help in sight, the survivors must join together in the face of despair and fight back against an unrelenting horror.",11.2058,/2E2WTX0TJEflAged6kzErwqX1kt.jpg,2023-11-03,False,False,7.579,3235,"Science Fiction, Horror, Action"
False,/uzzTystB8lL0mRDII5Sfs5HxgkI.jpg,"35, 12, 14, 16, 10751",10192,Shrek Forever After,en,Shrek Forever After,"A midlife-crisis burdened Shrek, longing for the days when he felt like a real ogre, makes a pact with magic deal-maker Rumpelstiltskin. But when he's duped and sent to a twisted version of Far Far Away—where Rumpelstiltskin is king, ogres are hunted, and he and Fiona have never met—he sets out to restore his world and reclaim his true love.",11.1974,/6HrfPZtKcGmX2tUWW3cnciZTaSD.jpg,2010-05-20,False,False,6.406,8001,"Comedy, Adventure, Fantasy, Animation, Family"
False,/1Ds7xy7ILo8u2WWxdnkJth1jQVT.jpg,"28, 12, 35",752623,The Lost City,en,The Lost City,"Reclusive author Loretta Sage writes about exotic places in her popular adventure novels that feature a handsome cover model named Alan. While on tour promoting her new book with Alan, Loretta gets kidnapped by an eccentric billionaire who hopes she can lead him to the ancient city's lost treasure that featured in her latest story. Alan, determined to prove he can be a hero in real life and not just on the pages of her books, sets off to rescue her.",11.1944,/rnheO8cFvCYcmZsDrBoabJbKLFE.jpg,2022-03-23,False,False,6.455,4027,"Action, Adventure, Comedy"
False,/7yYR8ulZdXBXFKmxGw1Uk28jnyH.jpg,"18, 10749",741110,Dreamchild,fr,L'Enfant rêvé,"François and Noémie run a sawmill in the mountains not far from the Swiss border. François has taken over his family's business, making him the fourth generation. He dreams of having a child. After years of failed fertility assistance, they give up on having a baby of their own and turn to adoption. But then François meets Patricia, new to the neighborhood. They begin a passionate affair. Soon after, Patricia gets pregnant.",11.1916,/mdLNmqIehGximKCHZre65hCcYxb.jpg,2020-10-07,False,False,5.6,28,"Drama, Romance"
False,/bRFg7VZ2GKTW09Ak15hfdVGuto3.jpg,"18, 27",185673,Bridal Doll,ja,団鬼六　花嫁人形,At a park a listless young man becomes intrigued by a wandering woman in white as she exits an exhibit of torture at a wax museum. He is slowly drawn into her forbidden world of pain and discipline.,11.1863,/7jB335pxwGc1eX5yB9X9EULHkj6.jpg,1979-10-06,False,False,4.667,3,"Drama, Horror"
False,/yir5430WblZSZuIMd9C6pIZerfA.jpg,"28, 80",339403,Baby Driver,en,Baby Driver,"After being coerced into working for a crime boss, a young getaway driver finds himself taking part in a heist doomed to fail.",11.1699,/tYzFuYXmT8LOYASlFCkaPiAFAl0.jpg,2017-06-28,False,False,7.444,16917,"Action, Crime"
False,/uUa6jgSr5BQpcBhhaz1PV1JhSa4.jpg,"12, 28, 878",20526,TRON: Legacy,en,TRON: Legacy,"Sam Flynn, the tech-savvy and daring son of Kevin Flynn, investigates his father's disappearance and is pulled into The Grid. With the help of a mysterious program named Quorra, Sam quests to stop evil dictator Clu from crossing into the real world.",11.1503,/8Nc6R8k7bG8frSiDJo0oLucF7dN.jpg,2010-12-14,False,False,6.545,7993,"Adventure, Action, Science Fiction"
False,/qvZ91FwMq6O47VViAr8vZNQz3WI.jpg,"28, 18",346,Seven Samurai,ja,七人の侍,"A samurai answers a village's request for protection after he falls on hard times. The town needs protection from bandits, so the samurai gathers six others to help him teach the people how to defend themselves, and the villagers provide the soldiers with food.",11.1498,/lOMGc8bnSwQhS4XyE1S99uH8NXf.jpg,1954-04-26,False,False,8.4,4267,"Action, Drama"
False,/iryef4LKiPQkvhNJS1EtLlay3br.jpg,"28, 9648, 53, 878",615173,The Witch: Part 2. The Other One,ko,마녀 2,"A girl wakes up in a huge secret laboratory, then accidentally meets another girl who is trying to protect her house from a gang. The mystery girl overthrows the gang with her unexpected powers, and laboratory staff set out to find her.",11.1481,/9YTuscJXmr9Iua62amCgGSU8PDW.jpg,2022-06-15,False,False,7.417,456,"Action, Mystery, Thriller, Science Fiction"
False,/82C04rTiXYZ7c8XZv91Nu53w82Y.jpg,"28, 53, 35",1007734,Nobody 2,en,Nobody 2,"Former assassin Hutch Mansell takes his family on a nostalgic vacation to a small-town theme park, only to be pulled back into violence when they clash with a corrupt operator, a crooked sheriff, and a ruthless crime boss.",11.1441,/svXVRoRSu6zzFtCzkRsjZS7Lqpd.jpg,2025-08-13,False,False,6.923,1662,"Action, Thriller, Comedy"
False,/ibKeXahq4JD63z6uWQphqoJLvNw.jpg,"28, 878, 27",345940,The Meg,en,The Meg,"A deep sea submersible pilot revisits his past fears in the Mariana Trench, and accidentally unleashes the seventy foot ancestor of the Great White Shark believed to be extinct.",11.1275,/eyWICPcxOuTcDDDbTMOZawoOn8d.jpg,2018-08-09,False,False,6.249,8236,"Action, Science Fiction, Horror"
False,/nVodCGKYLpqNC8YwQAbivKlWCgZ.jpg,"28, 12, 14",293167,Kong: Skull Island,en,Kong: Skull Island,"Explore the mysterious and dangerous home of the king of the apes as a team of explorers ventures deep inside the treacherous, primordial island.",11.1231,/r2517Vz9EhDhj88qwbDVj8DCRZN.jpg,2017-03-08,False,False,6.555,11193,"Action, Adventure, Fantasy"
False,/clFFCapyGpE7KD4Jsu5pUbFBZF4.jpg,"28, 53, 18",359410,Road House,en,Road House,"Ex-UFC fighter Dalton takes a job as a bouncer at a Florida Keys roadhouse, only to discover that this paradise is not all it seems.",11.1116,/fDEdtS4P0gJsxHDIt8dG8TR5dx1.jpg,2024-03-08,False,False,6.944,3099,"Action, Thriller, Drama"
False,/cRXcuLS1z0820eZ4mOXF08VEdZR.jpg,"12, 28, 35, 10749",14324,Virgin Territory,en,Virgin Territory,"In Black Death era Tuscany, as in the Decameron, ten young Florentines take refuge from the plague. But instead of telling stories, they have lusty adventures, bawdy exchanges, romance, swordplay, randy nuns, Saracen pirates, and a sexy cow.",11.1079,/zofWP7ZKhoVTh2VUltaDo4LRQXc.jpg,2007-12-17,False,False,4.976,375,"Adventure, Action, Comedy, Romance"
False,/7C921eWK06n12c1miRXnYoEu5Yv.jpg,"12, 28, 14",166426,Pirates of the Caribbean: Dead Men Tell No Tales,en,Pirates of the Caribbean: Dead Men Tell No Tales,"Thrust into an all-new adventure, a down-on-his-luck Capt. Jack Sparrow feels the winds of ill-fortune blowing even more strongly when deadly ghost sailors led by his old nemesis, the evil Capt. Salazar, escape from the Devil's Triangle. Jack's only hope of survival lies in seeking out the legendary Trident of Poseidon, but to find it, he must forge an uneasy alliance with a brilliant and beautiful astronomer and a headstrong young man in the British navy.",11.0978,/6lAPOAFYFWIO3SQRemEY2wInQMC.jpg,2017-05-23,False,False,6.66,12881,"Adventure, Action, Fantasy"
False,/oAGVaGiS6yJtNYBFN9kPe40ISCv.jpg,"53, 27",1428990,This Is Not a Test,en,This Is Not a Test,"Sloane and four classmates take cover in Cortege High to escape a world plagued by the infected. As danger relentlessly pounds on the doors, Sloane begins to see the world through the eyes of those who actually want to live and takes matters into her own hands.",11.0856,/oZqxDDByIei1UVDgw7ZBXJCHHtI.jpg,2026-02-20,False,False,5.5,68,"Thriller, Horror"
False,/l7HHv83hYQlnlt9hChBzTN76typ.jpg,35,1662893,Beautiful Fish,en,Kaunis Kala,This film is not art... it is something much.. much... much... More.,11.083,/rrwfDvGb97woRzy7OjRO6dwdGDX.jpg,2026-03-29,False,False,10.0,2,Comedy
False,/y2Ca1neKke2mGPMaHzlCNDVZqsK.jpg,"28, 35, 53",718930,Bullet Train,en,Bullet Train,"Unlucky assassin Ladybug is determined to do his job peacefully after one too many gigs gone off the rails. Fate, however, may have other plans, as Ladybug's latest mission puts him on a collision course with lethal adversaries from around the globe—all with connected, yet conflicting, objectives—on the world's fastest train.",11.0788,/j8szC8OgrejDQjjMKSVXyaAjw3V.jpg,2022-08-03,False,False,7.413,7630,"Action, Comedy, Thriller"
