adult,backdrop_path,genre_ids,id,title,original_language,original_title,overview,popularity,poster_path,release_date,softcore,video,vote_average,vote_count,genre_names
False,/13Nz8EchKRdCgJcKdEoJAnpiVn2.jpg,"28, 12, 14",791373,Zack Snyder's Justice League,en,Zack Snyder's Justice League,"Determined to ensure Superman's ultimate sacrifice was not in vain, Bruce Wayne aligns forces with Diana Prince with plans to recruit a team of metahumans to protect the world from an approaching threat of catastrophic proportions.",14.8629,/tnAuB8q5vv7Ax9UAEje5Xi4BXik.jpg,2021-03-18,False,False,8.09,10818,"Action, Adventure, Fantasy"
False,/vgGcmZWWjxYanOrPxxIoijZqCtQ.jpg,"35, 53",467905,How to Make a Killing,en,How to Make a Killing,"Disowned at birth by his obscenely wealthy family, blue-collar Becket Redfellow will stop at nothing to reclaim his inheritance, no matter how many relatives stand in his way.",14.8273,/vxMeKC7o5Gi8IHMi6lUgsdprTqv.jpg,2026-02-16,False,False,7.07,408,"Comedy, Thriller"
False,/4DZxWNSAyksN6N3JkvpJ53Yq6zU.jpg,"28, 18, 878",263115,Logan,en,Logan,"In the near future, a weary Logan cares for an ailing Professor X in a hideout on the Mexican border. But Logan's attempts to hide from the world and his legacy are upended when a young mutant arrives, pursued by dark forces.",14.8007,/fnbjcRDYn6YviCcePDnGdyAkYsB.jpg,2017-02-28,False,False,7.82,20395,"Action, Drama, Science Fiction"
False,/3TeGmKJfkik1D1rIoqGb1aR4k9c.jpg,"12, 28, 878",1893,Star Wars: Episode I - The Phantom Menace,en,Star Wars: Episode I - The Phantom Menace,"Anakin Skywalker, a young slave strong with the Force, is discovered on Tatooine. Meanwhile, the evil Sith have returned, enacting their plot for revenge against the Jedi.",14.7893,/6wkfovpn7Eq8dYNKaG5PY3q2oq6.jpg,1999-05-19,False,False,6.577,15826,"Adventure, Action, Science Fiction"
False,/wbDkvShcrveXNFsgyujY4kdurVa.jpg,"35, 10749",957119,Sidelined: The QB and Me,en,Sidelined: The QB and Me,"Dallas, a burdened but headstrong dancer, is determined to get into the best dance school in the country—her late mother’s alma mater. However, that dream is suddenly derailed when the cheeky yet secretly grieving football star, Drayton, crashes into her life with a unique story of his own. Will the two of them be able to grow into their dreams together, or will their dreams be sidelined?",14.7724,/mSL6truNrWP1Bn9ng1rN0SkMI4f.jpg,2025-02-06,False,False,6.21,229,"Comedy, Romance"
False,/hT3OqvzMqCQuJsUjZnQwA5NuxgK.jpg,"53, 28",985939,Fall,en,Fall,"For best friends Becky and Hunter, life is all about conquering fears and pushing limits. But after they climb 2,000 feet to the top of a remote, abandoned radio tower, they find themselves stranded with no way down. Now Becky and Hunter's expert climbing skills will be put to the ultimate test as they desperately fight to survive the elements, a lack of supplies, and vertigo-inducing heights.",16.2204,/spCAxD99U1A6jsiePFoqdEcY0dG.jpg,2022-08-11,False,False,7.134,4589,"Thriller, Action"
False,/y3zUOMWRoI2vC4ck2GBJyFWhzyA.jpg,"35, 10751, 10749",9820,The Parent Trap,en,The Parent Trap,"Hallie Parker and Annie James are identical twins who were separated at a young age due to their parents' divorce. Unbeknownst to their parents, the girls are sent to the same summer camp, where they meet, discover the truth about their relationship, and come up with a plan to switch places in an effort to reunite their mother and father.",14.386,/p4dGmi8u9W0HHyVXcgWPoiFfKTF.jpg,1998-07-28,False,False,7.2,4519,"Comedy, Family, Romance"
False,/cT6xO3YjzfZKYGhZ8S7plNlA27F.jpg,"18, 36",9453,Caligula,it,Caligola,"After the death of the paranoid emperor Tiberius, Caligula, his heir, seizes power and plunges the empire into a bloody spiral of madness and depravity.",12.8224,/vNXAY6r9Pb6WkMCGmNeW2PlznLQ.jpg,1979-08-14,False,False,5.978,982,"Drama, History"
False,/8BTsTfln4jlQrLXUBquXJ0ASQy9.jpg,"12, 28, 878",140607,Star Wars: The Force Awakens,en,Star Wars: The Force Awakens,"Thirty years after defeating the Galactic Empire, Han Solo and his allies face a new threat from the evil Kylo Ren and his army of Stormtroopers.",15.5076,/wqnLdwVXoBjKibFRR5U3y0aDUhs.jpg,2015-12-15,False,False,7.249,20536,"Adventure, Action, Science Fiction"
False,/5oaMV2q0qzxkIW2ukU3lldLu5q2.jpg,"53, 18, 80",1359,American Psycho,en,American Psycho,"A wealthy New York investment banking executive hides his alternate psychopathic ego from his co-workers and friends as he escalates deeper into his illogical, gratuitous fantasies.",16.3164,/9uGHEgsiUXjCNq8wdq4r49YL8A1.jpg,2000-04-13,False,False,7.403,12284,"Thriller, Drama, Crime"
False,/x6zvXGaI67NJehFHorTRSxEasMe.jpg,18,1688163,Hayok,tl,Hayok,"A feisty thriller about a fiercely independent woman who becomes the obsession of a contractor desperate to possess her. But when betrayal turns violent, she strikes back with a revenge that destroys his pride and control.",14.8204,/i4FFY9mskUpJLnLXQwZSTn3f1Ek.jpg,2026-05-15,False,False,7.0,1,Drama
False,/jsoz1HlxczSuTx0mDl2h0lxy36l.jpg,"14, 28, 35",616037,Thor: Love and Thunder,en,Thor: Love and Thunder,"After his retirement is interrupted by Gorr the God Butcher, a galactic killer who seeks the extinction of the gods, Thor Odinson enlists the help of King Valkyrie, Korg, and ex-girlfriend Jane Foster, who now wields Mjolnir as the Mighty Thor. Together they embark upon a harrowing cosmic adventure to uncover the mystery of the God Butcher’s vengeance and stop him before it’s too late.",14.6085,/pIkRyD18kl4FhoCNQuWxWu5cBLM.jpg,2022-07-06,False,False,6.369,8557,"Fantasy, Action, Comedy"
False,/mOtKQlXdL5J4lwqcSFlkZmgmFeZ.jpg,"16, 35, 10751, 37, 12",44896,Rango,en,Rango,"When Rango, a lost family pet, accidentally winds up in the gritty, gun-slinging Western town of Dirt, the theater-loving lizard suddenly finds himself the newly appointed sheriff. Welcomed as the last hope the town has been waiting for, Rango is forced to play his new role to the hilt and uncover the truth behind a looming water crisis—before his act catches up with him.",15.5544,/A5MP1guV8pbruieG0tnpPIbaJtt.jpg,2011-03-02,False,False,6.897,7097,"Animation, Comedy, Family, Western, Adventure"
False,/lprsAHkwMxk2iC6VZxNmV0H7g1t.jpg,"28, 80, 18",781732,Animal,hi,Animal,The hardened son of a powerful industrialist returns home after years abroad and vows to take bloody revenge on those threatening his father's life.,15.6152,/hr9rjR3J0xBBKmlJ4n3gHId9ccx.jpg,2023-12-01,False,False,6.119,189,"Action, Crime, Drama"
False,/9XhZhoSnFJ3AjpfzdIiZVHLQIS4.jpg,"28, 35, 80, 14",9470,Kung Fu Hustle,cn,功夫,"It's the 1940s, and the notorious Axe Gang terrorizes Shanghai. Small-time criminals Sing and Bone hope to join, but they only manage to make lots of very dangerous enemies. Fortunately for them, kung fu masters and hidden strength can be found in unlikely places. Now they just have to take on the entire Axe Gang.",15.6194,/exbyTbrvRUDKN2mcNEuVor4VFQW.jpg,2004-02-10,False,False,7.496,3182,"Action, Comedy, Crime, Fantasy"
False,/AaABt75ZzfMGrscUR2seabz4PEX.jpg,"28, 12, 14",297762,Wonder Woman,en,Wonder Woman,An Amazon princess comes to the world of Man in the grips of the First World War to confront the forces of evil and bring an end to human conflict.,14.0874,/v4ncgZjG2Zu8ZW5al1vIZTsSjqX.jpg,2017-05-30,False,False,7.209,20899,"Action, Adventure, Fantasy"
False,/w5IDXtifKntw0ajv2co7jFlTQDM.jpg,"878, 9648, 12",62,2001: A Space Odyssey,en,2001: A Space Odyssey,"Humanity finds a mysterious object buried beneath the lunar surface and sets off to find its origins with the help of HAL 9000, the world's most advanced super computer.",14.3057,/ve72VxNqjGM69Uky4WTo2bK6rfq.jpg,1968-04-02,False,False,8.0,12584,"Science Fiction, Mystery, Adventure"
False,/2QMgoiDlTmrO9FngZft8GgZ2SbX.jpg,"10751, 16, 12, 35",270946,Penguins of Madagascar,en,Penguins of Madagascar,"Skipper, Kowalski, Rico and Private join forces with undercover organization The North Wind to stop the villainous Dr. Octavius Brine from destroying the world as we know it.",13.8433,/dXbpNrPDZDMEbujFoOxmMNQVMHa.jpg,2014-11-22,False,False,6.534,4471,"Family, Animation, Adventure, Comedy"
False,/hBwDYiOPwXHuwiYGP82ekFNSeBr.jpg,"12, 14, 10749",50619,The Twilight Saga: Breaking Dawn - Part 1,en,The Twilight Saga: Breaking Dawn - Part 1,Bella Swan and Edward Cullen's honeymoon phase is abruptly disrupted by betrayals and unforeseen tragedies that endanger their world.,14.5806,/qs8LsHKYlVRmJbFUiSUhhRAygwj.jpg,2011-11-16,False,False,6.189,9264,"Adventure, Fantasy, Romance"
False,/698FjyzLdpgXmUSr63LaRwblTmx.jpg,"12, 878, 53",507086,Jurassic World Dominion,en,Jurassic World Dominion,"Four years after Isla Nublar was destroyed, dinosaurs now live—and hunt—alongside humans all over the world. This fragile balance will reshape the future and determine, once and for all, whether human beings are to remain the apex predators on a planet they now share with history's most fearsome creatures.",13.9665,/jbAvCACjLf1ZG0unB2tdmx5HAf1.jpg,2022-06-01,False,False,6.598,7048,"Adventure, Science Fiction, Thriller"
False,/5KGrBXvE0cYDwqfEaymvNBVspkJ.jpg,53,645710,The Voyeurs,en,The Voyeurs,"When Pippa and Thomas move into their dream apartment, they notice that their windows look directly into the apartment opposite – inviting them to witness the volatile relationship of the attractive couple across the street. But what starts as a simple curiosity turns into full-blown obsession with increasingly dangerous consequences.",15.1529,/8Y4XOIWhpOvSOEn8XrxbkH9yAXO.jpg,2021-08-25,False,False,6.526,1179,Thriller
False,/wxr4Z6E83h14CogsZOzDm1vuDX3.jpg,"878, 28, 12",91314,Transformers: Age of Extinction,en,Transformers: Age of Extinction,"As humanity picks up the pieces after the battle of Chicago, a shadowy group reveals itself in an attempt to control the direction of history…while an ancient, powerful new menace sets Earth in its crosshairs. With help from Cade Yeager, Optimus Prime and the Autobots rise to meet their most fearsome challenge yet.",13.7376,/jyzrfx2WaeY60kYZpPYepSjGz4S.jpg,2014-06-25,False,False,5.963,8742,"Science Fiction, Action, Adventure"
False,/kJaRWmy1BGq3pHyE94LOTteiHer.jpg,"28, 18, 9648, 53",2501,The Bourne Identity,en,The Bourne Identity,"Wounded to the brink of death and suffering from amnesia, Jason Bourne is rescued at sea by a fisherman. With nothing to go on but a Swiss bank account number, he starts to reconstruct his life, but finds that many people he encounters want him dead. However, Bourne realizes that he has the combat and mental skills of a world-class spy—but who does he work for?",14.1936,/aP8swke3gmowbkfZ6lmNidu0y9p.jpg,2002-06-14,False,False,7.478,10091,"Action, Drama, Mystery, Thriller"
False,/fypydCipcWDKDTTCoPucBsdGYXW.jpg,"878, 12, 28",653346,Kingdom of the Planet of the Apes,en,Kingdom of the Planet of the Apes,"Several generations following Caesar's reign, apes – now the dominant species – live harmoniously while humans have been reduced to living in the shadows. As a new tyrannical ape leader builds his empire, one young ape undertakes a harrowing journey that will cause him to question all he's known about the past and to make choices that will define a future for apes and humans alike.",14.4029,/gKkl37BQuKTanygYQG1pyYgLVgf.jpg,2024-05-08,False,False,7.055,4251,"Science Fiction, Adventure, Action"
False,/r17jFHAemzcWPPtoO0UxjIX0xas.jpg,"28, 53, 80",324552,John Wick: Chapter 2,en,John Wick: Chapter 2,"John Wick is forced out of retirement by a former associate looking to seize control of a shadowy international assassins’ guild. Bound by a blood oath to aid him, Wick travels to Rome and does battle against some of the world’s most dangerous killers.",14.5335,/hXWBc0ioZP3cN4zCu6SN3YHXZVO.jpg,2017-02-08,False,False,7.337,14244,"Action, Thriller, Crime"
False,/49fzLedFVKgGgFChLMuulDJBY1c.jpg,"18, 10752",28,Apocalypse Now,en,Apocalypse Now,"At the height of the Vietnam war, Captain Benjamin Willard is sent on a dangerous mission that, officially, ""does not exist, nor will it ever exist."" His goal is to locate - and eliminate - a mysterious Green Beret Colonel named Walter Kurtz, who has been leading his personal army on illegal guerrilla missions into enemy territory.",14.4102,/gQB8Y5RCMkv2zwzFHbUJX3kAhvA.jpg,1979-05-19,False,False,8.268,9089,"Drama, War"
False,/5lQ4euO30sDin5nCifvi0vURFNd.jpg,"28, 35, 10751",1248226,Playdate,en,Playdate,"When out-of-work accountant Brian joins stay-at-home dad Jeff for a playdate with their sons, he expects a laid-back afternoon. Instead, they're chased by mercenaries, and Brian—totally unprepared—must survive one absurd obstacle after another.",14.3993,/fGodXWqJkkkbSebPIlxLSygV8GY.jpg,2025-11-04,False,False,6.078,594,"Action, Comedy, Family"
False,/5a7lMDn3nAj2ByO0X1fg6BhUphR.jpg,"12, 28, 878",333339,Ready Player One,en,Ready Player One,"When the creator of a popular video game system dies, a virtual contest is created to compete for his fortune.",14.3803,/pU1ULUq8D3iRxl1fdX2lZIzdHuI.jpg,2018-03-28,False,False,7.587,16918,"Adventure, Action, Science Fiction"
False,/4HWAQu28e2yaWrtupFPGFkdNU7V.jpg,"35, 80, 9648",546554,Knives Out,en,Knives Out,"When renowned crime novelist Harlan Thrombey is found dead at his estate just after his 85th birthday, the inquisitive and debonair Detective Benoit Blanc is mysteriously enlisted to investigate. From Harlan's dysfunctional family to his devoted staff, Blanc sifts through a web of red herrings and self-serving lies to uncover the truth behind Harlan's untimely death.",14.3793,/pThyQovXQrw2m0s9x82twj48Jq4.jpg,2019-11-27,False,False,7.841,14013,"Comedy, Crime, Mystery"
False,/vVpEOvdxVBP2aV166j5Xlvb5Cdc.jpg,"28, 53, 80",458156,John Wick: Chapter 3 - Parabellum,en,John Wick: Chapter 3 - Parabellum,"Super-assassin John Wick returns with a $14 million price tag on his head and an army of bounty-hunting killers on his trail. After killing a member of the shadowy international assassin’s guild, the High Table, John Wick is excommunicado, but the world’s most ruthless hit men and women await his every turn.",14.3487,/ziEuG1essDuWuC5lpWUaw1uXY2O.jpg,2019-05-15,False,False,7.437,11721,"Action, Thriller, Crime"
False,/vbkW4KerpshPZnP84w9qwSfYrhu.jpg,"27, 53",1198984,We Bury the Dead,en,We Bury the Dead,"After a catastrophic military disaster, the dead don't just rise - they hunt. Ava searches for her missing husband, but what she finds is far more terrifying.",14.2855,/xZqo0yPARmyF8TACVNyaOACkYWG.jpg,2026-01-01,False,False,5.993,229,"Horror, Thriller"
False,/fiRDzpcJe7qz3yIR43hdXIE3NHv.jpg,"53, 9648, 35",812583,Wake Up Dead Man: A Knives Out Mystery,en,Wake Up Dead Man: A Knives Out Mystery,"When young priest Jud Duplenticy is sent to assist charismatic firebrand Monsignor Jefferson Wicks, it’s clear that all is not well in the pews. After a sudden and seemingly impossible murder rocks the town, the lack of an obvious suspect prompts local police chief Geraldine Scott to join forces with renowned detective Benoit Blanc to unravel a mystery that defies all logic.",14.2815,/qCOGGi8JBVEZMc3DVby8rUivyXz.jpg,2025-11-26,False,False,7.202,2477,"Thriller, Mystery, Comedy"
False,/2oZklIzUbvZXXzIFzv7Hi68d6xf.jpg,"18, 37",68718,Django Unchained,en,Django Unchained,"With the help of a German bounty hunter, a freed slave sets out to rescue his wife from a brutal Mississippi plantation owner.",14.2807,/mhf63wOnaLCnzxeHgngTH98WaVh.jpg,2012-12-25,False,False,8.191,28023,"Drama, Western"
False,/3G1Q5xF40HkUBJXxt2DQgQzKTp5.jpg,"16, 35, 10751, 14",568124,Encanto,en,Encanto,"The tale of an extraordinary family, the Madrigals, who live hidden in the mountains of Colombia, in a magical house, in a vibrant town, in a wondrous, charmed place called an Encanto. The magic of the Encanto has blessed every child in the family—every child except one, Mirabel. But when she discovers that the magic surrounding the Encanto is in danger, Mirabel decides that she, the only ordinary Madrigal, might just be her exceptional family's last hope.",14.2789,/4j0PNHkMr5ax3IA8tjtxcmPU3QT.jpg,2021-10-13,False,False,7.569,10200,"Animation, Comedy, Family, Fantasy"
False,/5Q2CWHZTk48lb8QOMninYmzUfvc.jpg,"18, 27, 9648",1497348,Alas Roban,id,Alas Roban,"The lives of Sita and her daughter, Gendis, change after a terrifying night. Their journey through Alas Roban is filled with fear and relentless terror. Can they uncover what's happening there?",14.2647,/84Az3SHKRJDg971KQ0j9nZWYTcf.jpg,2026-01-15,False,False,4.6,5,"Drama, Horror, Mystery"
False,/69EFgWWPFWbRNHmQgYdSnyJ94Ge.jpg,"28, 12, 878",49521,Man of Steel,en,Man of Steel,"A young boy learns that he has extraordinary powers and is not of this earth. As a young man, he journeys to discover where he came from and what he was sent here to do. But the hero in him must emerge if he is to save the world from annihilation and become the symbol of hope for all mankind.",14.2415,/cB46TSg3kGjq2eVy5kVUhlpUa1H.jpg,2013-06-12,False,False,6.648,16185,"Action, Adventure, Science Fiction"
False,/gl0jzn4BupSbL2qMVeqrjKkF9Js.jpg,"12, 14, 16",128,Princess Mononoke,ja,もののけ姫,"Ashitaka, a prince of the disappearing Emishi people, is cursed by a demonized boar god and must journey to the west to find a cure. Along the way, he encounters San, a young human woman fighting to protect the forest, and Lady Eboshi, who is trying to destroy it. Ashitaka must find a way to bring balance to this conflict.",14.2264,/cMYCDADoLKLbB83g4WnJegaZimC.jpg,1997-07-12,False,False,8.322,8973,"Adventure, Fantasy, Animation"
False,/jlGmlFOcfo8n5tURmhC7YVd4Iyy.jpg,"28, 35, 12",436969,The Suicide Squad,en,The Suicide Squad,"Supervillains Harley Quinn, Bloodsport, Peacemaker and a collection of nutty cons at Belle Reve prison join the super-secret, super-shady Task Force X as they are dropped off at the remote, enemy-infused island of Corto Maltese.",14.2255,/q61qEyssk2ku3okWICKArlAdhBn.jpg,2021-07-28,False,False,7.459,9574,"Action, Comedy, Adventure"
False,/cFcXilLbI7yjPIYB58AZiOyUnoh.jpg,"28, 12, 80",47971,xXx: Return of Xander Cage,en,xXx: Return of Xander Cage,"Xander Cage is left for dead after an incident, though he secretly returns to action for a new, tough assignment with his handler Augustus Gibbons.",14.206,/hba8zREJpP1AYhaXgb2oJLQeO0K.jpg,2017-01-13,False,False,6.133,9223,"Action, Adventure, Crime"
False,/d3hiSKKyIjvB3Lv577vHh0TxbFM.jpg,10749,1650558,Abot Langit,tl,Abot Langit,"The relationship of a couple is tested when the girl’s first official flight pairs her with a confident senior pilot, jealousy and power dynamics surface in the training ground. The girl is now torn between her present relationship and new temptation she can’t resist.",14.1955,/5lVYe4aSimWdxJINKwq9s68TZ2G.jpg,2026-03-13,False,False,5.0,1,Romance
False,/rNvn89IcEJPqRKxIgwTAPXl9qjJ.jpg,"27, 35",19994,Jennifer's Body,en,Jennifer's Body,"Jennifer, a gorgeous, seductive cheerleader takes evil to a whole new level after she's possessed by a sinister demon. Now it's up to her best friend to stop Jennifer's reign of terror before it's too late.",14.195,/wrkjsGcFJxcQqR56kJUYAEKKg2T.jpg,2009-09-18,False,False,6.0,4239,"Horror, Comedy"
False,/edVIvTc8RofOTxoAZN7a5kxIAay.jpg,"27, 53",1461254,Salmokji: Whispering Water,ko,살목지,"An incident unfolds when a film crew goes to a reservoir to update the road view where an unidentified figure was filmed, and they encounter something in the dark, deep waters.",14.1854,/bOl0rJ86WWxVYlQlGttHhHuYiPQ.jpg,2026-04-08,False,False,6.6,5,"Horror, Thriller"
False,/e9UvRjJAqn2hLXDfMHU1LFMEKGv.jpg,27,1430077,Hokum,en,Hokum,"When novelist Ohm Bauman retreats to a remote inn to scatter his parents' ashes, he is consumed by tales of a witch haunting the honeymoon suite. Disturbing visions and a shocking disappearance forces him to confront dark corners of his past.",14.1773,/jKPWwsbAM6HKURPYQ1eG8DmKMKn.jpg,2026-04-29,False,False,7.0,56,Horror
False,/4fza1QWpGAoxReiEsnvdFBeMyfX.jpg,"10749, 18, 35",286687,Love Lesson,ko,화려한 외출,"Korea's most popular song writer Hee-soo runs into a nineteen-year-old boy in the elevator. Hee-soo is inspired by a new song watching him shake at her figure. She starts to tell him about women under the excuse that she's teaching him music. They fall for each other but things get complicated when her life teacher, Joon-ho who taught her about life and music comes back.",14.1757,/yUQg6yvZIRQUSyQ36TQo0Tp1gzr.jpg,2013-12-05,False,False,6.8,42,"Romance, Drama, Comedy"
False,/rLa4cmfIiX5V3i9FDjDUVbzgvl0.jpg,"35, 18",1630661,Gaayapadda Simham,te,గాయపడ్డ సింహం,Follows Indians facing challenges while trying to travel to the USA and the struggles they encounter after reaching there.,10.401,/dx40U1uLHwBpdbVxIMC57jyIAaf.jpg,2026-05-01,False,False,0.0,0,"Comedy, Drama"
False,/atoIgfAk2Ig2HFJLD0VUnjiPWEz.jpg,"12, 35, 10751, 14",118,Charlie and the Chocolate Factory,en,Charlie and the Chocolate Factory,"A young boy wins a tour through the most magnificent chocolate factory in the world, led by the world's most unusual candy maker.",15.0677,/iKP6wg3c6COUe8gYutoGG7qcPnO.jpg,2005-07-13,False,False,7.039,16116,"Adventure, Comedy, Family, Fantasy"
False,/9UAcMhSCDJ2OCo5QdPpSERjhMA1.jpg,"18, 36",1396,Mirror,ru,Зеркало,"A dying man in his forties recalls his childhood, his mother, the war and personal moments that tell of and juxtapose pivotal moments in Soviet history with daily life.",10.1921,/AttDP5OEsMxtHPPN7Z92p2Ntnmd.jpg,1975-03-07,False,False,7.952,1090,"Drama, History"
False,/ztiFxuG0gC6wQ8y7JZFYbCQyN4Y.jpg,"16, 35, 10751, 10402",438695,Sing 2,en,Sing 2,"Buster and his new cast now have their sights set on debuting a new show at the Crystal Tower Theater in glamorous Redshore City. But with no connections, he and his singers must sneak into the Crystal Entertainment offices, run by the ruthless wolf mogul Jimmy Crystal, where the gang pitches the ridiculous idea of casting the lion rock legend Clay Calloway in their show. Buster must embark on a quest to find the now-isolated Clay and persuade him to return to the stage.",13.2074,/aWeKITRFbbwY8txG5uCj4rMCfSP.jpg,2021-12-01,False,False,7.835,4771,"Animation, Comedy, Family, Music"
False,/qvcOovScPoRalRxDy50rYSYFree.jpg,"35, 10749",10591,The Girl Next Door,en,The Girl Next Door,"Exceptionally ambitious high schooler Matthew has aspirations for a career in politics when he falls in love with his gorgeous 19-year-old neighbor, Danielle. But Matthew's bright future is jeopardized when he finds Danielle was once a porn star. As Danielle's past catches up with her, Matthew's love for her forces him to re-evaluate his goals.",15.0833,/5mVyFHSY2rSsNgD4NfEwV82HigU.jpg,2004-04-09,False,False,6.743,4009,"Comedy, Romance"
False,/8Sh04np6IA2shSycI9uy5xrjC6I.jpg,"53, 10770",375846,Bad Sister,en,Bad Sister,"As a top student at St. Adeline's Catholic Boarding School, Zoe senses that something is not quite right about the school's new nun-- a sense proven to be true when it is revealed the ""good' nun is an imposter with a fatal attraction to Zoe's brother.",14.5888,/jKrIlgfJPIWNeowaOZPBZuOPmq0.jpg,2015-08-24,False,False,6.597,247,"Thriller, TV Movie"
False,/3kb5b8IQCX4vd3baNBoZqAboP41.jpg,18,499546,We,nl,Wij,"During a scorching summer in a Belgian-Dutch border village, eight teenagers play games of discovery to break the listless monotony. They challenge each other and themselves and pretty soon, their sexual curiosity starts to blur the lines between right and wrong. As innocence is crushed in depraved games and sexual exploitation, the teenagers soon turn into ruthless predators.",13.8998,/gwTKiJF57VknDuNCWgoHaJamm82.jpg,2018-07-12,False,False,5.44,116,Drama
False,/8Qsr8pvDL3s1jNZQ4HK1d1Xlvnh.jpg,"14, 12",259316,Fantastic Beasts and Where to Find Them,en,Fantastic Beasts and Where to Find Them,"In 1926, Newt Scamander arrives at the Magical Congress of the United States of America with a magically expanded briefcase, which houses a number of dangerous creatures and their habitats. When the creatures escape from the briefcase, it sends the American wizarding authorities after Newt, and threatens to strain even further the state of magical and non-magical relations.",15.0414,/fLsaFKExQt05yqjoAvKsmOMYvJR.jpg,2016-11-16,False,False,7.309,19695,"Fantasy, Adventure"
False,/3WK7p9EdZmmvB1IbB2Vw9Rf4lXH.jpg,"18, 10749",296096,Me Before You,en,Me Before You,"Lou Clark, a directionless 26-year-old from the English countryside, takes a job at the local castle as a caregiver and companion to a wealthy young banker, Will Traynor. Wheelchair-bound from an accident two years prior, the once adventurous Will has all but given up — that is until Lou determines to show him that life is worth living.",13.3687,/Ia3dzj5LnCj1ZBdlVeJrbKJQxG.jpg,2016-06-01,False,False,7.919,13227,"Drama, Romance"
False,/83H0C66AcvkwpG2738VCTHMY9uv.jpg,"28, 12, 878",505642,Black Panther: Wakanda Forever,en,Black Panther: Wakanda Forever,"Queen Ramonda, Shuri, M’Baku, Okoye and the Dora Milaje fight to protect their nation from intervening world powers in the wake of King T’Challa’s death.  As the Wakandans strive to embrace their next chapter, the heroes must band together with the help of War Dog Nakia and Everett Ross and forge a new path for the kingdom of Wakanda.",14.0809,/sv1xJUazXeYqALzczSZ3O6nkH75.jpg,2022-11-09,False,False,7.005,7462,"Action, Adventure, Science Fiction"
False,/hO7KbdvGOtDdeg0W4Y5nKEHeDDh.jpg,"80, 53, 18",475557,Joker,en,Joker,"During the 1980s, a failed stand-up comedian is driven insane and turns to a life of crime and chaos in Gotham City while becoming an infamous psychopathic crime figure.",18.9761,/udDclJoHjfjb8Ekgsd4FDteOkCU.jpg,2019-10-01,False,False,8.125,27724,"Crime, Thriller, Drama"
