adult,backdrop_path,genre_ids,id,title,original_language,original_title,overview,popularity,poster_path,release_date,softcore,video,vote_average,vote_count,genre_names
False,/5rxEnsgriw8z065q51lrvPKYmCL.jpg,"10749, 18",1367642,Reminders of Him,en,Reminders of Him,"When Diem's custodial grandparents adamantly refuse Kenna's attempts to see her daughter, Kenna discovers unexpected compassion, and then something truer and deeper, with former NFL player and local bar owner Ledger. As their secret romance develops, so do the dangers for both of them, leading Kenna toward heartbreak and, ultimately, the hope for a second chance.",24.2341,/7L6rceYgzQ0NeHD7PRDNrRoQ291.jpg,2026-03-11,False,False,7.61,263,"Romance, Drama"
False,/w4bTBXcqXc2TUyS5Fc4h67uWbPn.jpg,18,389,12 Angry Men,en,12 Angry Men,"The defense and the prosecution have rested and the jury is filing into the jury room to decide if a young Spanish-American is guilty or innocent of murdering his father. What begins as an open and shut case soon becomes a mini-drama of each of the jurors' prejudices and preconceptions about the trial, the accused, and each other.",24.1574,/zhG3vKWyDRaZYoaww1UVAi29T9h.jpg,1957-04-10,False,False,8.561,10000,Drama
False,/m5dA4JZsj78EBTa2D6imWOAebwB.jpg,35,4247,Scary Movie,en,Scary Movie,"A familiar-looking group of teenagers find themselves being stalked by a more-than-vaguely recognizable masked killer! As the victims begin to pile up and the laughs pile on, none of your favorite scary movies escape the razor-sharp satire of this outrageously funny parody!",23.9707,/fVQFPRuw3yWXojYDJvA5EoFjUOY.jpg,2000-07-07,False,False,6.395,7766,Comedy
False,/5Sfl1SdrCWNHuRcPcqJP6Vcx8I8.jpg,35,1370123,"Aida, the Movie",es,Aída y vuelta,"The film deals with the filming of an episode of the series with storylines that take place both within the fiction with the characters of 'Aída' and outside of it with the actors themselves and their relationships, which reflects on topics such as the limits of comedy, the work of a comedian and fame.",23.9118,/h4QnoqmMPS50U7m1XByw29CJ1ws.jpg,2026-01-30,False,False,7.061,49,Comedy
False,/cBRDacpg1Q6ZOKSxrOhhgkKx9NI.jpg,"99, 18",1426306,Titan: The OceanGate Submersible Disaster,en,Titan: The OceanGate Submersible Disaster,OceanGate's Titan tourist submersible imploded in 2023 on a deep-sea dive to the Titanic. This documentary details how a bold vision ended in tragedy.,23.8427,/mSVJI9P5UmvOLZVTH8sAtlgxsgy.jpg,2025-06-06,False,False,7.049,175,"Documentary, Drama"
False,/ecKQlAEG95k62SMGhvX83oEqANK.jpg,"27, 53",138843,The Conjuring,en,The Conjuring,"Paranormal investigators Ed and Lorraine Warren work to help a family terrorized by a dark presence in their farmhouse. Forced to confront a powerful entity, the Warrens find themselves caught in the most terrifying case of their lives.",23.8092,/wVYREutTvI2tmxr6ujrHT704wGF.jpg,2013-07-18,False,False,7.5,12716,"Horror, Thriller"
False,/q8Qlpmp2my1IZV9EVebzvhhJPmy.jpg,"28, 10749, 53",1220522,Dacoit,te,డెకాయిట్,"Betrayed by his better half, a man is convicted for a crime he didn't commit. Once free, he hunts her down in pursuit of vengeance, as their stories intertwine with a series of robberies.",23.7471,/lbrnJY7E0a9xxgj2cotNp6YI4dz.jpg,2026-04-10,False,False,6.25,4,"Action, Romance, Thriller"
False,/ofxq93dSF85goDtNfQoquo8LTWS.jpg,"18, 10751",63964,Deiva Thirumagal,ta,தெய்வத்திருமகள்,"An intellectually disabled man fights for custody of his 7-year-old daughter, and in the process teaches his opponent lawyer the value of love and family.",23.7206,/ovfLSxsgLFYm2ISjfH1Te0lNyEr.jpg,2011-06-03,False,False,7.3,31,"Drama, Family"
False,/lzrFleYAVX0x6qLKOwGl16slqD9.jpg,"36, 10752, 28, 18",898704,Desert Warrior,en,Desert Warrior,"In 7th-century Arabia, Princess Hind becomes a warrior to defy the ruthless Emperor Kisra. Forged into a warrior and aided by legendary bandit Hanzala, Hind unites warring tribes for a last stand—the historic Battle of Dhi Qar—that will change history.",23.7051,/waxnw1NpzTPY5JkqWvu0muSopRJ.jpg,2026-04-23,False,False,6.2,14,"History, War, Action, Drama"
False,/fPfDB0IHOqvmKIzFP9CA51OOS1N.jpg,"27, 53",1010755,The Strangers: Chapter 3,en,The Strangers: Chapter 3,"Tethered by a frightening conclusion, Maya and the Strangers are locked on an unavoidable, unforgiving collision course — a showdown that proves they’re far from strangers now.",23.691,/yPHwX78mcwJw3I6YOJ9qh2wQBFr.jpg,2026-02-05,False,False,5.713,181,"Horror, Thriller"
False,/iWak7wT0j6ycCc8lKr4NBz9c7n5.jpg,"9648, 53, 18",210577,Gone Girl,en,Gone Girl,"With his wife's disappearance having become the focus of an intense media circus, a man sees the spotlight turned on him when it's suspected that he may not be innocent.",23.647,/ts996lKsxvjkO2yiYG0ht4qAicO.jpg,2014-10-01,False,False,7.89,19961,"Mystery, Thriller, Drama"
False,/zIOBTZAqGwdKnOb5c6SvzxP7x86.jpg,"53, 10749",1446616,Tu Yaa Main,hi,तू या मैं,"A wannabe rapper from the outskirts of Mumbai and an affluent influencer elope to a coastal town, only to find themselves trapped in the pool of a derelict resort fighting for survival against the wrath of a ferocious crocodile.",23.6183,/nUPnA0I1MTaZRVCsUQc5DS5JA8W.jpg,2026-02-11,False,False,6.298,42,"Thriller, Romance"
False,/y04gpYp8rJoUud6vf8okqHIdP4V.jpg,"80, 53",1340206,Tuner,en,Tuner,A talented piano tuner's life is turned upside down when he discovers that his meticulous skills for tuning pianos can equally be applied to cracking safes.,23.4994,/kyM60vcgf7lfofmZB4F5Rj7OrHW.jpg,2026-05-11,False,False,6.661,31,"Crime, Thriller"
False,/8UfYtyCeWGbhfyyq0u0xYwEYaZb.jpg,"28, 12, 35, 14",285213,The Pirates,ko,해적: 바다로 간 산적,"At the cusp of the founding of Joseon Dynasty, an envoy from China is delivering Emperor’s Ming’s Royal Seal. But nature in the form of a giant whale intervenes and swallows the royal seal.  When a generous reward is offered to whomever can retrieve the royal seal from the belly of the whale, the race is on. A group of mountain bandits led by Jang Sa Jung and a group of pirates led by Yeo Wol  go after the lost treasure, but who will get to to it first?",23.464,/4qU1SW1b2Txf3Ge9rGlddDthSgx.jpg,2014-08-06,False,False,7.027,240,"Action, Adventure, Comedy, Fantasy"
False,/aHj7d7wSLqrg5cjAcgHhiGr97Ih.jpg,"28, 53, 878",798645,The Running Man,en,The Running Man,"Desperate to save his sick daughter, working-class Ben Richards is convinced by The Running Man's charming but ruthless producer to enter the deadly competition game as a last resort. But Ben's defiance, instincts, and grit turn him into an unexpected fan favorite — and a threat to the entire system. As ratings skyrocket, so does the danger, and Ben must outwit not just the Hunters, but a nation addicted to watching him fall.",23.299,/dKL78O9zxczVgjtNcQ9UkbYLzqX.jpg,2025-11-11,False,False,6.786,1577,"Action, Thriller, Science Fiction"
False,/9tOkjBEiiGcaClgJFtwocStZvIT.jpg,"16, 12, 10751, 35",269149,Zootopia,en,Zootopia,"Determined to prove herself, Officer Judy Hopps, the first bunny on Zootopia's police force, jumps at the chance to crack her first case - even if it means partnering with scam-artist fox Nick Wilde to solve the mystery.",23.2033,/hlK0e0wAQ3VLuJcsfIYPvb4JVud.jpg,2016-02-11,False,False,7.761,18092,"Animation, Adventure, Family, Comedy"
False,/4MCKNAc6AbWjEsM2h9Xc29owo4z.jpg,"28, 80, 53",866398,The Beekeeper,en,The Beekeeper,One man's campaign for vengeance takes on national stakes after he is revealed to be a former operative of a powerful and clandestine organization known as Beekeepers.,23.1736,/A7EByudX0eOzlkQ2FIbogzyazm2.jpg,2024-01-08,False,False,7.259,4239,"Action, Crime, Thriller"
False,/bf5TG9RODkPXmtJSgf8Iymof1wl.jpg,"36, 18",1214931,Nuremberg,en,Nuremberg,"In postwar Germany, an American psychiatrist must determine whether Nazi prisoners are fit to go on trial for war crimes, and finds himself in a complex battle of intellect and ethics with Hermann Göring, Hitler's right-hand man.",23.0893,/xthXNYltOOm80vW5Kxjzxx5gvQ6.jpg,2025-11-06,False,False,7.552,1048,"History, Drama"
False,/1yktYsxkmUtUFTUnCAUaqG6FEiz.jpg,"28, 53, 80",541671,Ballerina,en,Ballerina,"Taking place during the events of John Wick: Chapter 3 – Parabellum, Eve Macarro begins her training in the assassin traditions of the Ruska Roma.",23.0153,/2VUmvqsHb6cEtdfscEA6fqqVzLg.jpg,2025-06-04,False,False,7.239,2613,"Action, Thriller, Crime"
False,/4s2d3xdyqotiVNHTlTlJjrr3q0H.jpg,"12, 10751, 16, 28, 35",177572,Big Hero 6,en,Big Hero 6,"A special bond develops between plus-sized inflatable robot Baymax, and prodigy Hiro Hamada, who team up with a group of friends to form a band of high-tech heroes.",22.9748,/2mxS4wUimwlLmI1xp6QW6NSU361.jpg,2014-10-24,False,False,7.725,16583,"Adventure, Family, Animation, Action, Comedy"
False,/s94NjfKkcSczZ1FembwmQZwsuwY.jpg,"878, 12, 28",617126,The Fantastic 4: First Steps,en,The Fantastic 4: First Steps,"Against the vibrant backdrop of a 1960s-inspired, retro-futuristic world, Marvel's First Family is forced to balance their roles as heroes with the strength of their family bond, while defending Earth from a ravenous space god called Galactus and his enigmatic Herald, Silver Surfer.",22.884,/abqOz6EL3yXyOOafCPZxjL1M5bQ.jpg,2025-07-23,False,False,6.966,3358,"Science Fiction, Adventure, Action"
False,/o3i6AfTcWAuNvzAUV3q5lOmi6Gx.jpg,"16, 10751, 12, 18, 35",150540,Inside Out,en,Inside Out,"When 11-year-old Riley moves to a new city, her Emotions team up to help her through the transition. Joy, Fear, Anger, Disgust and Sadness work together, but when Joy and Sadness get lost, they must journey through unfamiliar places to get back home.",22.8836,/2H1TmgdfNtsKlU9jKdeNyYL5y8T.jpg,2015-06-17,False,False,7.91,23450,"Animation, Family, Adventure, Drama, Comedy"
False,/Aueidj1cfpZBOW5KbyVCyKMSZE1.jpg,"18, 10749, 36",585032,Sa Bang-ji,ko,사방지,"Sa Bangji was an intersex person who according to historical records lived during Korea’s Joseon Dynasty. Taken in by a kindly benefactor, Sa Bangji lives in a monastery that is one day visited by a young widow, Lee So-sa, who is in mourning following the death of her husband. The pair’s meeting seems predestined, with the erotic attraction between Sa Bangji and Lee So-sa soon evolving into something far more transcendent – and dangerous.  While aspects of the film – its stylised depiction of female actors and sex – identify it as a product of its time, Sa Bangji is undeniably a milestone in screen representations of intersex people, a film that refuses to shy away from the horrendous stigmatization faced by its titular character.",22.7546,/uFsTrW5qzU2l3YE0ataLoUgfsjJ.jpg,1988-10-29,False,False,6.6,5,"Drama, Romance, History"
False,/19EpgKZDkLIwY1TI1pjBJtQ5qdr.jpg,"28, 14, 878",9823,Mortal Kombat: Annihilation,en,Mortal Kombat: Annihilation,"A group of heroic warriors has only six days to save the planet in ""Mortal Kombat Annihilation."" To succeed they must survive the most spectacular series of challenges any human, or god, has ever encountered as they battle an evil warlord bent on taking control of Earth.",22.7259,/ttryglcY2osWZE3sRYBf3ewTZsW.jpg,1997-11-11,False,False,4.6,1342,"Action, Fantasy, Science Fiction"
False,/sDTnMOJ3H5wI38OxObmCtK7wfd5.jpg,"16, 35, 10751, 14",585,"Monsters, Inc.",en,"Monsters, Inc.","Lovable Sulley and his wisecracking sidekick Mike Wazowski are the top scare team at Monsters, Inc., the scream-processing factory in Monstropolis. When a little girl named Boo wanders into their world, it's the monsters who are scared silly, and it's up to Sulley and Mike to keep her out of sight and get her back home.",22.71,/wFSpyMsp7H0ttERbxY7Trlv8xry.jpg,2001-11-01,False,False,7.85,19764,"Animation, Comedy, Family, Fantasy"
False,/uorMP2U1F0AfogYMz4lYu2EbgYo.jpg,"53, 12, 28, 878",524047,Greenland,en,Greenland,"John Garrity, his estranged wife and their young son embark on a perilous journey to find sanctuary as a planet-killing comet hurtles toward Earth. Amid terrifying accounts of cities getting levelled, the Garritys experience the best and worst in humanity. As the countdown to the global apocalypse approaches zero, their incredible trek culminates in a desperate and last-minute flight to a possible safe haven.",22.5941,/bNo2mcvSwIvnx8K6y1euAc1TLVq.jpg,2020-07-29,False,False,7.128,5307,"Thriller, Adventure, Action, Science Fiction"
False,/vgwmwigN5jrtYVTewRX4rLd5geg.jpg,"10751, 35, 18",1561144,Madhuvidhu,ml,മധുവിധു,"When Amrutharaj, a groom from an all-male household repeatedly rejected by brides' families, falls in love with Sneha Marcose, their journey toward marriage ignites a chain of hilarious chaos inside his unruly home.",22.5917,/jVSnpXklfxi3FchGqweRMvrC8Gd.jpg,2026-04-23,False,False,6.333,3,"Family, Comedy, Drama"
False,/6zKjoOOb3OZnZuiHtQZn4Kd69Gq.jpg,"27, 53",1197137,Black Phone 2,en,Black Phone 2,"Four years after defeating The Grabber, Finney Blake is struggling with life after captivity. When his younger sister Gwen begins receiving calls in her dreams from the Black Phone and seeing disturbing visions of three boys being stalked at a winter camp, the siblings become determined to solve the mystery and confront a killer who has grown more powerful in death and more significant to them than either could imagine.",22.5167,/gFddBLQ8wj9M9O82iPzgX5KVNHz.jpg,2025-10-15,False,False,6.692,1120,"Horror, Thriller"
False,/Adrip2Jqzw56KeuV2nAxucKMNXA.jpg,37,429,"The Good, the Bad and the Ugly",it,"Il buono, il brutto, il cattivo","While the Civil War rages on between the Union and the Confederacy, three men – a quiet loner, a ruthless hitman, and a Mexican bandit – comb the American Southwest in search of a strongbox containing $200,000 in stolen gold.",22.4756,/bX2xnavhMYjWDoZp1VM6VnU1xwe.jpg,1966-12-23,False,False,8.468,9649,Western
False,/xOMo8BRK7PfcJv9JCnx7s5hj0PX.jpg,"878, 12",693134,Dune: Part Two,en,Dune: Part Two,"Follow the mythic journey of Paul Atreides as he unites with Chani and the Fremen while on a path of revenge against the conspirators who destroyed his family. Facing a choice between the love of his life and the fate of the known universe, Paul endeavors to prevent a terrible future only he can foresee.",22.4127,/1pdfLvkbY9ohJlCjQH2CZjjYVvJ.jpg,2024-02-27,False,False,8.128,7975,"Science Fiction, Adventure"
False,/jhk6D8pim3yaByu1801kMoxXFaX.jpg,"28, 18, 12",98,Gladiator,en,Gladiator,"After the death of Emperor Marcus Aurelius, his devious son takes power and demotes Maximus, one of Rome's most capable generals who Marcus preferred. Eventually, Maximus is forced to become a gladiator and battle to the death against other men for the amusement of paying audiences.",22.4004,/wN2xWp1eIwCKOD0BHTcErTBv1Uq.jpg,2000-05-04,False,False,8.227,20894,"Action, Drama, Adventure"
False,/iuRVt8tFiXDPGgzavhuSa3QHRxD.jpg,35,18785,The Hangover,en,The Hangover,"When three friends finally come to after a raucous night of bachelor-party revelry, they find a baby in the closet and a tiger in the bathroom. But they can't seem to locate their best friend, Doug – who's supposed to be tying the knot. Launching a frantic search for Doug, the trio perseveres through a nasty hangover to try to make it to the church on time.",22.3962,/A0uS9rHR56FeBtpjVki16M5xxSW.jpg,2009-06-02,False,False,7.332,18094,Comedy
False,/iVped1djsF0tvGkvnHbzsE3ZPTF.jpg,"28, 12, 878",68721,Iron Man 3,en,Iron Man 3,"When Tony Stark's world is torn apart by a formidable terrorist called the Mandarin, he starts an odyssey of rebuilding and retribution.",22.3412,/qhPtAc1TKbMPqNvcdXSOn9Bn7hZ.jpg,2013-04-18,False,False,6.933,23423,"Action, Adventure, Science Fiction"
False,/mBc6RB7VajfykLqGx0ue7qatXky.jpg,18,1266990,Kulong,tl,Kulong,"Three friends retreat to a resort to collaborate on a daring screenplay for a contest. Faced with the challenge of writing about passion despite their own dry spells, their journey soon blurs the line between imagination and experience.",22.3121,/AnzrE2WHg3DtZrtmB9AnEbAh17m.jpg,2024-05-24,False,False,6.417,18,Drama
False,/ss0Os3uWJfQAENILHZUdX8Tt1OC.jpg,"28, 12, 878",545611,Everything Everywhere All at Once,en,Everything Everywhere All at Once,"An aging Chinese immigrant is swept up in an insane adventure, where she alone can save what's important to her by connecting with the lives she could have led in other universes.",22.0012,/u68AjlvlutfEIcpmbYpKcdi09ut.jpg,2022-03-24,False,False,7.72,7949,"Action, Adventure, Science Fiction"
False,/jr8tSoJGj33XLgFBy6lmZhpGQNu.jpg,"16, 12, 14, 35, 10751",315162,Puss in Boots: The Last Wish,en,Puss in Boots: The Last Wish,"Puss in Boots discovers that his passion for adventure has taken its toll: He has burned through eight of his nine lives, leaving him with only one life left. Puss sets out on an epic journey to find the mythical Last Wish and restore his nine lives.",21.9699,/kuf6dutpsT0vSVehic3EZIqkOBt.jpg,2022-12-07,False,False,8.205,8827,"Animation, Adventure, Fantasy, Comedy, Family"
False,/5jhG1lTgV0MS6tDkBMQSSitttTT.jpg,18,1402,The Pursuit of Happyness,en,The Pursuit of Happyness,A struggling salesman takes custody of his son as he's poised to begin a life-changing professional career.,21.8567,/lBYOKAMcxIvuk9s9hMuecB9dPBV.jpg,2006-12-14,False,False,7.886,10591,Drama
False,/kIBK5SKwgqIIuRKhhWrJn3XkbPq.jpg,"28, 12, 878",99861,Avengers: Age of Ultron,en,Avengers: Age of Ultron,"When Tony Stark tries to jumpstart a dormant peacekeeping program, things go awry and Earth’s Mightiest Heroes are put to the ultimate test as the fate of the planet hangs in the balance. As the villainous Ultron emerges, it is up to The Avengers to stop him from enacting his terrible plans, and soon uneasy alliances and unexpected action pave the way for an epic and unique global adventure.",21.8053,/4ssDuvEDkSArWEdyBl2X5EHvYKU.jpg,2015-04-22,False,False,7.272,24432,"Action, Adventure, Science Fiction"
False,/3upEZ0ltY7WwOSFVXrtiP34D48p.jpg,"53, 18, 10749",290098,The Handmaiden,ko,아가씨,"1930s Korea, in the period of Japanese occupation, a new girl, Sook-hee, is hired as a handmaiden to a Japanese heiress, Hideko, who lives a secluded life on a large countryside estate with her domineering Uncle Kouzuki. But the maid has a secret. She is a pickpocket recruited by a swindler posing as a Japanese Count to help him seduce the Lady to steal her fortune.",21.753,/dLlH4aNHdnmf62umnInL8xPlPzw.jpg,2016-06-01,False,False,8.2,4321,"Thriller, Drama, Romance"
False,/uNexK3QOe1mbAmVlFs7PqTCCBUG.jpg,"28, 53",1088434,Hellfire,en,Hellfire,A drifter with a mysterious past arrives in a small town and finds the residents in the grip of a ruthless crime boss and realizes he has to help them.,21.7477,/tQti9QTf13MfzNpXguijgNh7ojE.jpg,2026-05-14,False,False,4.7,3,"Action, Thriller"
False,/qdthf9WrRDSaIkGVQGhhJ9pz1hn.jpg,"28, 16, 35, 10751",9502,Kung Fu Panda,en,Kung Fu Panda,"Chosen by prophecy but doubted by all, Po is an unlikely choice for the mystical title of the Dragon Warrior—a clumsy panda thrust into the world of kung fu as a deadly enemy threatens the Valley of Peace. Under reluctant guidance by Master Shifu and the Furious Five, Po must embrace who he is to unlock the power that no scroll can teach.",21.7365,/wWt4JYXTg5Wr3xBW2phBrMKgp3x.jpg,2008-06-04,False,False,7.3,12632,"Action, Animation, Comedy, Family"
False,/mZ6J2g6HCV2gj3iuCdSxcyBXq9c.jpg,"16, 18, 10751, 36",1167307,David,en,David,"From the songs of his mother’s heart to the whispers of a faithful God, David’s story begins in quiet devotion. When the giant Goliath rises to terrorize a nation, a young shepherd armed with only a sling, a few stones, and unshakable faith steps forward. Pursued by power and driven by purpose, his journey tests the limits of loyalty, love, and courage—culminating in a battle not just for a crown, but for the soul of a kingdom.",21.727,/bESlrLOrsQ9gKzaGQGHXKOyIUtX.jpg,2025-12-14,False,False,8.063,144,"Animation, Drama, Family, History"
False,/70AV2Xx5FQYj20labp0EGdbjI6E.jpg,"53, 80, 18",637649,Wrath of Man,en,Wrath of Man,"A cold and mysterious new security guard for a Los Angeles cash truck company surprises his co-workers when he unleashes precision skills during a heist. The crew is left wondering who he is and where he came from. Soon, the marksman's ultimate motive becomes clear as he takes dramatic and irrevocable steps to settle a score.",21.7029,/M7SUK85sKjaStg4TKhlAVyGlz3.jpg,2021-04-22,False,False,7.576,6098,"Thriller, Crime, Drama"
False,/wTipCPwvGfm3IJXBRojmuj97GIN.jpg,"18, 10749, 10752",27098,All Things Fair,sv,Lust och fägring stor,"In 1943 Malmö, 15-year-old Stig is attracted to his teacher Viola, 22 years his senior, who, drawn to his youth and innocence, believes the lad is a God-sent relief from her miserable marriage to a drunken, unfaithful lout.",21.6931,/y1oFNynXrIzlPUe4CXKMR2dpNep.jpg,1995-03-08,False,False,6.428,173,"Drama, Romance, War"
False,/cbcpDn6XJaIGoOil1bKuskU8ds4.jpg,"12, 14",12445,Harry Potter and the Deathly Hallows: Part 2,en,Harry Potter and the Deathly Hallows: Part 2,"Harry, Ron and Hermione continue their quest to vanquish the evil Voldemort once and for all. Just as things begin to look hopeless for the young wizards, Harry discovers a trio of magical objects that endow him with powers to rival Voldemort's formidable skills.",21.689,/c54HpQmuwXjHq2C9wmoACjxoom3.jpg,2011-07-12,False,False,8.08,21979,"Adventure, Fantasy"
False,/8HbNKB2pMiD3mfLgbxe7DgAKjdS.jpg,27,1173559,Insidious Inferno,en,Insidious Inferno,A secluded cottage is plagued by gruesome murders and unbeknownst to the inhabitants something other worldly lurks within the halls. Can the couple solve the mystery of the cursed grounds in time or will they open the door to the inferno?,21.5668,/8kljUAovBatZRYp2ye2RZr239hU.jpg,2024-11-29,False,False,5.6,19,Horror
False,/hpXBJxLD2SEf8l2CspmSeiHrBKX.jpg,"18, 14, 27",1062722,Frankenstein,en,Frankenstein,"Dr. Victor Frankenstein, a brilliant but egotistical scientist, brings a creature to life in a monstrous experiment that ultimately leads to the undoing of both the creator and his tragic creation.",21.5097,/g4JtvGlQO7DByTI6frUobqvSL3R.jpg,2025-10-17,False,False,7.639,3465,"Drama, Fantasy, Horror"
False,/cK070s3Qdn1Ib7Gq8RgIyJKgvu3.jpg,"18, 35",77338,The Intouchables,fr,Intouchables,A true story of two men who should never have met – a quadriplegic aristocrat who was injured in a paragliding accident and a young man from the projects.,21.4904,/1QU7HKgsQbGpzsJbJK4pAVQV9F5.jpg,2011-11-02,False,False,8.27,18427,"Drama, Comedy"
False,/kHJlXiwxcMAf9R934f0ncEBAMXg.jpg,"10749, 18",1252309,Tell Me What You Want,es,Pídeme lo que quieras,"After his father's death, Eric Zimmerman travels to Spain to oversee his company's branches. In Madrid, he falls for Judith and engage in an intense, erotic relationship full of exploration. However, Eric fears his secret may end their affair.",21.4825,/yZXYCiZQPB7Ui6D5206W1zDKv8P.jpg,2024-11-29,False,False,6.2,290,"Romance, Drama"
False,/5bzPWQ2dFUl2aZKkp7ILJVVkRed.jpg,"12, 35, 878",105,Back to the Future,en,Back to the Future,"Eighties teenager Marty McFly is accidentally sent back in time to 1955, inadvertently disrupting his parents' first meeting and attracting his mother's romantic interest. Marty must repair the damage to history by rekindling his parents' romance and - with the help of his eccentric inventor friend Doc Brown - return to 1985.",21.4716,/vN5B5WgYscRGcQpVhHl6p9DDTP0.jpg,1985-07-03,False,False,8.326,21816,"Adventure, Comedy, Science Fiction"
False,/eTlcNXGv32zkVI7ZDHhfeaKHXKQ.jpg,"28, 9648, 878, 53",198663,The Maze Runner,en,The Maze Runner,"A teenager with no memory of his past finds himself among a group of boys living in a walled enclosure surrounded by a massive, ever-changing maze. As he struggles to adapt to their rules and society, he begins to uncover clues that may lead to escape and the truth behind their confinement.",21.446,/ode14q7WtDugFDp78fo9lCsmay9.jpg,2014-09-10,False,False,7.188,18098,"Action, Mystery, Science Fiction, Thriller"
False,/pRrH098VPYiUtDwKOm2mVXVQZdf.jpg,"10402, 18, 53",1102883,Mother Mary,en,Mother Mary,Long-buried wounds rise to the surface when iconic pop star Mother Mary reunites with her estranged best friend and former costume designer Sam Anselm on the eve of her comeback performance.,21.4211,/qMgUI6pxkPtIuoXX4DcJ6X7bdt2.jpg,2026-04-16,False,False,5.737,76,"Music, Drama, Thriller"
False,/xgDj56UWyeWQcxQ44f5A3RTWuSs.jpg,"16, 35, 10751, 14",2062,Ratatouille,en,Ratatouille,"Remy, a rat, possesses a palate far more refined than that of his fellow comrades. He dreams of becoming a chef, one who creates rather than scavenges. When fate deposits him in the sewers beneath one of Paris’s most famous restaurants, he finds himself ideally placed to fulfill his dream. Forming an unusual alliance with a hapless young kitchen worker, Remy begins a daring culinary double life.  As Remy pursues his vision, he must navigate the suspicions of the calculating Head Chef Skinner, the disapproval of Remy’s own colony, and the foreboding presence of renowned food critic Anton Ego, who strikes fear in the hearts of chefs all throughout France.",21.3501,/t3vaWRPSf6WjDSamIkKDs1iQWna.jpg,2007-06-28,False,False,7.841,18469,"Animation, Comedy, Family, Fantasy"
