adult,backdrop_path,genre_ids,id,title,original_language,original_title,overview,popularity,poster_path,release_date,softcore,video,vote_average,vote_count,genre_names
False,/xugEpZk9YQ0DIz1aFvH5HGkqpZK.jpg,"27, 9648",1304313,Lee Cronin's The Mummy,en,Lee Cronin's The Mummy,"The young daughter of a journalist disappears into the desert without a trace—eight years later, the broken family is shocked when she is returned to them, as what should be a joyful reunion turns into a living nightmare.",583.1981,/uIb9Tvae5haF0XcQBaPyufmxbb0.jpg,2026-04-15,False,False,8.075,1483,"Horror, Mystery"
False,/rZfmzpixLKLR3Hg2u0WgC7XLFl8.jpg,27,1339713,Obsession,en,Obsession,"After breaking the mysterious ""One Wish Willow"" to win his crush's heart, a hopeless romantic finds himself getting exactly what he asked for but soon discovers that some desires come at a dark, sinister price.",501.5672,/6X4qFYBsG3bpWDG2XIKqr04kFJa.jpg,2026-05-13,False,False,8.0,422,Horror
False,/dd31qJxOarrHyGZwYsCzOjobQzP.jpg,"28, 53",1380291,Tom Clancy's Jack Ryan: Ghost War,en,Tom Clancy's Jack Ryan: Ghost War,"Jack Ryan is reluctantly pulled back into espionage when an international covert mission unravels a deadly conspiracy. Racing against time, he joins CIA allies Mike November & James Greer and sharp MI6 officer Emma Marlowe to battle a rogue black-ops unit in a high-stakes, deeply personal fight.",368.4056,/8ehYxUh5MWE41AeE9gkHE8DKzvB.jpg,2026-05-20,False,False,7.142,429,"Action, Thriller"
False,/jatqtz0VlQRiugmHktbKQpuf5EV.jpg,"80, 18, 53",1433117,Kara,ta,கர,"A thief tries to go straight, but when predatory banks trap his father in debt, he returns to crime — with a determined cop closing in on his trail.",328.9697,/uIrFdMWlJFdc1jPBP9bxeaISCDj.jpg,2026-04-30,False,False,6.5,8,"Crime, Drama, Thriller"
False,/qO55CD8tgVL1T4WKn6zYFFiD6lL.jpg,"28, 18, 80",1439930,The Punisher: One Last Kill,en,The Punisher: One Last Kill,"As Frank Castle searches for meaning beyond revenge, an unexpected force pulls him back into the fight.",314.4766,/qQclTgLMDvGBuUBFGHRipxkEwWR.jpg,2026-05-12,False,False,8.396,1364,"Action, Drama, Crime"
False,/2I1OFQJ0L9T0dpU6FobKFWV2PxX.jpg,"878, 12",687163,Project Hail Mary,en,Project Hail Mary,"Science teacher Ryland Grace wakes up on a spaceship light years from home with no recollection of who he is or how he got there. As his memory returns, he begins to uncover his mission: solve the riddle of the mysterious substance causing the sun to die out. He must call on his scientific knowledge and unorthodox ideas to save everything on Earth from extinction.",302.0827,/yihdXomYb5kTeSivtFndMy5iDmf.jpg,2026-03-15,False,False,8.645,4468,"Science Fiction, Adventure"
False,/9Z2uDYXqJrlmePznQQJhL6d92Rq.jpg,"10751, 35, 12, 14, 16",1226863,The Super Mario Galaxy Movie,en,The Super Mario Galaxy Movie,"Having thwarted Bowser's previous plot to marry Princess Peach, Mario and Luigi now face a fresh threat in Bowser Jr., who is determined to liberate his father from captivity and restore the family legacy. Alongside companions new and old, the brothers travel across the stars to stop the young heir's crusade.",289.9814,/eJGWx219ZcEMVQJhAgMiqo8tYY.jpg,2026-04-01,False,False,8.097,2209,"Family, Comedy, Adventure, Fantasy, Animation"
False,/mCpwRayjXMFzKHbjbzc5JRKfq1O.jpg,"27, 9648, 878",1083381,Backrooms,en,Backrooms,A strange doorway appears in the basement of a furniture showroom.,273.5711,/rhGx6E3qRNMgj3i5su2oukNHwIQ.jpg,2026-05-27,False,False,6.8,193,"Horror, Mystery, Science Fiction"
False,/gRoZG3Z0zJxgElmTsVHOl2dNYXe.jpg,"28, 80, 53",1582770,Dhurandhar: The Revenge,hi,धुरंधर: द रिवेंज,"As rival gangs, corrupt officials and a ruthless Major Iqbal close in, Hamza's mission for his country spirals into a bloody personal war where the line between patriot and monster disappears in the streets of Lyari.",268.0668,/ov8vrRLZGoXHpYjSY9Vpv1tHJX7.jpg,2026-03-18,False,False,7.257,103,"Action, Crime, Thriller"
False,/zMwhWailP1WY7sb6AoE6b8ugoy.jpg,"12, 16, 10751, 14",1007757,Swapped,en,Swapped,"A small woodland creature and a majestic bird, two natural sworn enemies of the Valley, magically trade places and set off on an adventure of a lifetime to switch back. Their journey soon uncovers a greater threat—one that could endanger not only their species, but the entire valley they call home.",265.3704,/tHhxWxge06goXU6ZQH1hj7vK8Hd.jpg,2026-05-01,False,False,8.976,1515,"Adventure, Animation, Family, Fantasy"
False,/tlm8UkiQsitc8rSuIAscQDCnP8d.jpg,"28, 878",603,The Matrix,en,The Matrix,"Set in the 22nd century, The Matrix tells the story of a computer hacker who joins a group of underground insurgents fighting the vast and powerful computers who now rule the earth.",257.5238,/aOIuZAjPaRIE6CMzbazvcHuHXDc.jpg,1999-03-31,False,False,8.247,27917,"Action, Science Fiction"
False,/1x9e0qWonw634NhIsRdvnneeqvN.jpg,"10749, 18",1523145,Your Heart Will Be Broken,ru,Твоё сердце будет разбито,"High school student Polina is saved from bullying at her new school and makes a deal with the main bully Bars: he must pretend to be her boyfriend and protect her, and she must do everything he says. During this game, the couple develops real feelings, but her family and classmates have reasons to separate the lovers.",255.3572,/7wIBfBl2gejt6xHxNSK0reVIm7E.jpg,2026-03-26,False,False,6.762,82,"Romance, Drama"
False,/kkRpcauZoBFKnH0Qsy7J5qtwBF5.jpg,"10749, 18",1371023,Chand Mera Dil,hi,चाँद मेरा दिल,"Aarav and Chandni's passionate college romance is struck by adulthood far too soon, forcing the two young lovers to balance their ambitions with responsibility and realize the evolved meaning of love.",175.793,/9LPkXJustudEBgPZEm9tgDx5KtC.jpg,2026-05-22,False,False,5.5,2,"Romance, Drama"
False,/4BtL2vvEufDXDP4u6xQjjQ1Y2aT.jpg,"28, 80, 18, 53",1419406,The Shadow's Edge,zh,捕风追影,Macau Police brings the tracking expert police officer out of retirement to help catch a dangerous group of professional thieves.,168.7615,/cHKo3m8N1fwvEy2ZEr0xGmmMODV.jpg,2025-08-16,False,False,7.425,703,"Action, Crime, Drama, Thriller"
False,/4EAAwpylq313qrDqpCxulUrXBNF.jpg,"28, 14, 12",931285,Mortal Kombat II,en,Mortal Kombat II,"The fan favorite champions—now joined by Johnny Cage himself—are pitted against one another in the ultimate, no-holds barred, gory battle to defeat the dark rule of Shao Kahn that threatens the very existence of the Earthrealm and its defenders.",167.7321,/lIsMeDbwntNXSUVHmWMMRXEZOVc.jpg,2026-05-06,False,False,6.8,353,"Action, Fantasy, Adventure"
False,/eNAFLrd1XAAD4hgdTPjewpzYU4W.jpg,35,1320660,Pati Patni Aur Woh Do,hi,पति पत्नी और वो दो,"A seemingly perfect marriage in Prayagraj takes an unexpected turn when one decision leads to a chain of misunderstandings, suspicion, and comedic chaos.",167.4581,/x0RUPvba4JlCCkyyEZGlQFIFVuF.jpg,2026-05-15,False,False,7.5,4,Comedy
False,/6zg7A9ICOthNR2TSXlT51KvXrsA.jpg,"28, 12, 878",1228710,The Mandalorian and Grogu,en,The Mandalorian and Grogu,"The evil Empire has fallen, and Imperial warlords remain scattered throughout the galaxy. As the fledgling New Republic works to protect everything the Rebellion fought for, they have enlisted the help of legendary Mandalorian bounty hunter Din Djarin and his young apprentice Grogu.",162.5472,/5Vi8dSauVwH1HOsiZceDMbRr1Ca.jpg,2026-05-20,False,False,6.882,353,"Action, Adventure, Science Fiction"
False,/sb76azrAXr9U13uEQxNP5e3fujY.jpg,"28, 35, 53",1390300,Over Your Dead Body,en,Over Your Dead Body,"A dysfunctional couple head to a remote cabin to ""reconnect"", but each has secret intentions to kill the other.",160.3583,/fqXIk1BY0tJvlqwiTw2HL9gegqE.jpg,2026-04-24,False,False,6.88,71,"Action, Comedy, Thriller"
False,/rHnANzYUmV3WZw3n0yWOLiR3pen.jpg,"53, 80",976912,Graphic Desires,en,Graphic Desires,"When reclusive Franklin cheats on his partner with a mysterious girl he meets on a dating app, it becomes the start of a deadly obsession.",158.2495,/3BjLdTWRiHc1ISIZMFvToOmghOM.jpg,2023-08-31,False,False,6.975,79,"Thriller, Crime"
False,/gkh6Nt8DtY1XT4gQsyFq9XAVJlJ.jpg,"18, 35",350,The Devil Wears Prada,en,The Devil Wears Prada,"A young woman from the Midwest gets more than she bargained for when she moves to New York to become a writer and ends up as the assistant to the tyrannical, larger-than-life editor-in-chief of a major fashion magazine.",155.4556,/8912AsVuS7Sj915apArUFbv6F9L.jpg,2006-06-29,False,False,7.427,13626,"Drama, Comedy"
False,/iN41Ccw4DctL8npfmYg1j5Tr1eb.jpg,"878, 12, 14",83533,Avatar: Fire and Ash,en,Avatar: Fire and Ash,"In the wake of the devastating war against the RDA and the loss of their eldest son, Jake Sully and Neytiri face a new threat on Pandora: the Ash People, a violent and power-hungry Na'vi tribe led by the ruthless Varang. Jake's family must fight for their survival and the future of Pandora in a conflict that pushes them to their emotional and physical limits.",154.2828,/aabwWZWx6z1aYP4PX2ADvbDKktd.jpg,2025-12-17,False,False,7.531,3271,"Science Fiction, Adventure, Fantasy"
False,/oQEAWIr3thvSICvoQnFEqyuf0Oz.jpg,"18, 9648",249397,Nymphomaniac: Vol. II,en,Nymphomaniac: Vol. II,The continuation of Joe's sexually dictated life delves into the darker aspects of her adult life and what led to her being in Seligman's care.,152.8571,/iLUNqgNKuWn667kXCKztSxYbT3k.jpg,2013-12-25,False,False,6.711,3168,"Drama, Mystery"
False,/wvmfToHjflWab2PHKG1vCqg2Asx.jpg,"28, 53",1065834,Kattalan,ml,കാട്ടാളൻ,"Power-hungry forces clash in the Ivory cartel war-a fierce story of control, vengeance, and survival where compassion vanishes and only the ruthless endure.",151.4169,/53FATyQirV8BuBcrsQMGPvGKgCu.jpg,2026-05-14,False,False,6.0,1,"Action, Thriller"
False,/6ELCZlTA5lGUops70hKdB83WJxH.jpg,"28, 14, 12",460465,Mortal Kombat,en,Mortal Kombat,"Washed-up MMA fighter Cole Young, unaware of his heritage, and hunted by Emperor Shang Tsung's best warrior, Sub-Zero, seeks out and trains with Earth's greatest champions as he prepares to stand against the enemies of Outworld in a high stakes battle for the universe.",151.1462,/ybrX94xQm8lXYpZAPRmwD9iIbWP.jpg,2021-04-07,False,False,7.036,6675,"Action, Fantasy, Adventure"
False,/u53UYu5XG2hNgWGvs3xGhAVzypl.jpg,"12, 16, 35, 10751, 878",1327819,Hoppers,en,Hoppers,"Scientists have discovered how to 'hop' human consciousness into lifelike robotic animals, allowing people to communicate with animals as animals. Animal lover Mabel seizes an opportunity to use the technology, uncovering mysteries within the animal world beyond anything she could have imagined.",145.8289,/xjtWQ2CL1mpmMNwuU5HeS4Iuwuu.jpg,2026-03-04,False,False,8.164,1320,"Adventure, Animation, Comedy, Family, Science Fiction"
False,/gqGQ0zADV5FIcgMWtWX8FcGQjFp.jpg,"27, 9648, 878",1116201,Iron Lung,en,Iron Lung,"In a post-apocalyptic future where an event known as ""The Quiet Rapture"" caused all known stars and habitable planets in the universe to disappear, a convict is sent to search an ocean of blood discovered on a desolate moon, using a small submarine nicknamed the ""Iron Lung"".",145.7933,/sIwakdbMGS1krtgendTWpxTY9Hw.jpg,2026-01-30,False,False,7.2,174,"Horror, Mystery, Science Fiction"
False,/dMX6RR0SHgI43r2CsDkF5wzozOw.jpg,53,758308,Red Latex,es,Red Latex,"Eric lives with his pregnant wife in his in-laws' house because they have no money to become independent. Eric is very docile and the people around him: his wife, his father, his father-in-law, and his boss have always told him what he has to do with his life. But everything has a limit. Fed of with this situation, Eric leaves his family and escapes to the mansion of the dominatrix Mistress Gise to become her slave. Eric hopes to achieve liberation by submitting to Mistress Gise. When his family finds out, they do what they can to get him back. Meanwhile, Mistress Gise is a twisted Domina who takes Eric's slavery beyond any expected limit.",129.4559,/hP1o5waM6ohMTKr4QcOtyOP1oiu.jpg,2020-02-22,False,False,5.1,37,Thriller
False,/1eAuwNBy34kkM3xkl202z4f1NiI.jpg,"28, 14",1367220,Karuppu,ta,கருப்பு,"In a world where justice falters, guardian deity Vettai Karuppu takes the guise of a lawyer to battle a corrupt legal system preying on the powerless.",128.292,/4KZXlZ5tTT6ghbW77gS4hSLkCd7.jpg,2026-05-14,False,False,7.5,10,"Action, Fantasy"
False,/krhj4Fhb0G3QCmyBtEADxgFFmRX.jpg,"18, 10749",11012,Damage,en,Damage,The life of a respected British politician at the height of his career crumbles when he becomes obsessed with his son's lover.,125.3256,/alf3JOPP7EYP0iO24gwe5YfRnqo.jpg,1992-12-02,False,False,6.6,680,"Drama, Romance"
False,/gQq1r3H0QgM9h72o2OpOV5kTOpG.jpg,"53, 18",405818,Door II: Tokyo Diary,ja,Door II: Tokyo Diary,Ai is a call girl that makes good money for what she does but there’s always at risk no matter how good the money is.,123.9785,/lskJ34j4VKwbMwcvFSQeNYEdt8g.jpg,1991-04-25,False,False,6.071,14,"Thriller, Drama"
False,/oTE4lNs4PSG5iIWjqaTdCIFJ4Bs.jpg,"28, 53",1318447,Apex,en,Apex,A grieving woman pushing her limits on a solo adventure in the Australian wild is ensnared in a twisted game with a cunning killer who thinks she's prey.,122.1691,/eTp7gSPkSF3Aw79mNx1NkBP1PZT.jpg,2026-04-24,False,False,6.7,1328,"Action, Thriller"
False,/1RgPyOhN4DRs225BGTlHJqCudII.jpg,"16, 28, 14",1311031,Demon Slayer: Kimetsu no Yaiba Infinity Castle,ja,劇場版「鬼滅の刃」無限城編 第一章 猗窩座再来,"The Demon Slayer Corps are drawn into the Infinity Castle, where Tanjiro, Nezuko, and the Hashira face terrifying Upper Rank demons in a desperate fight as the final battle against Muzan Kibutsuji begins.",119.9525,/fWVSwgjpT2D78VUh6X8UBd2rorW.jpg,2025-07-18,False,False,7.728,846,"Animation, Action, Fantasy"
False,/tq3h43fZy0H80vzf47MAY7R9Mxo.jpg,"16, 35, 10751",1297842,GOAT,en,GOAT,"A small goat with big dreams gets a once-in-a-lifetime shot to join the pros and play roarball, a high-intensity, co-ed, full-contact sport dominated by the fastest, fiercest animals in the world.",116.6577,/wfuqMlaExcoYiUEvKfVpUTt1v4u.jpg,2026-02-11,False,False,8.1,712,"Animation, Comedy, Family"
False,/xBT0oNq6rsTFv4SxG5uGRIEOrq6.jpg,"10402, 18",936075,Michael,en,Michael,"The story of Michael Jackson, one of the most influential artists the world has ever known, and his life beyond the music. His journey from the discovery of his extraordinary talent as the lead of the Jackson Five, to the visionary artist whose creative ambition fueled a relentless pursuit to become the biggest entertainer in the world, highlighting both his life off-stage and some of the most iconic performances from his early solo career.",112.6836,/3Qud19bBUrrJAzy0Ilm8gRJlJXP.jpg,2026-04-22,False,False,7.573,887,"Music, Drama"
False,/cfDHxkco8RrslL0Vk2XPTwTVFCe.jpg,"28, 53",1472951,Infiltrate,en,Infiltrate,"In a city overrun by crime, government Agent Lily Chen is forced to choose between her duty and her family when her husband is kidnapped, and she’s blackmailed into assassinating high-level criminals to save him. As she delves deeper into the criminal underworld, Lily’s relentless pursuit of justice unravels a web of corruption, leading to a final, life-altering decision that will change her world forever.",111.6802,/8Cw8GF9wG63kF8pRRXwOx2kXGt.jpg,2026-04-10,False,False,5.2,15,"Action, Thriller"
False,/6DfHl4CE88x7Rt9oyARQQm6bHXD.jpg,"28, 53",1510339,Mark,kn,ಮಾರ್ಕ್,"Mark is suspended from his police duties for his unruly yet effective ways of operating, but when 18 children are abducted and found dead, races to catch the criminals. With only 18 hours left, he must confront powerful foes and use unconventional tactics to succeed.",109.2945,/6LTDv6XHiHN0N77QIFg2tidVvhh.jpg,2025-12-25,False,False,4.0,1,"Action, Thriller"
False,/gYumbUCWyUI6Mutgd7oILOCunk8.jpg,"27, 53",1252051,Disforia,es,Disforia,"Set in the near future against the backdrop of widespread looting and societal collapse, the couple formed by Esther and Tomás and their daughter Say move to their summer house so they can promptly sell it and then flee from their country to France, drawing attention from a ring of voyeurs of real-life torture streamed on the dark web.",108.0813,/49pzxbf1Eftz7wQZdVDVl8OM9bg.jpg,2025-09-20,False,False,4.833,6,"Horror, Thriller"
False,/7f9ZaTwyqQOJtNWUS7xZgWQOzSt.jpg,53,1431071,System,hi,सिस्टम,"When Neha Rajvansh, a privileged public prosecutor, meets Sarika Rawat, a courtroom stenographer from a humble background, their lives are thrown into upheaval where power defines truth, blurring the system and raising a question of what justice truly means to them.",105.014,/8qrddM5BRcTuqjc9crJY6e3gyE6.jpg,2026-05-22,False,False,7.5,2,Thriller
False,/hdLsZ3dCjKt5A6xDpoo3UFgcTSm.jpg,"27, 28",1426822,Mortal Game,en,Mortal Game,"A group of hunters travel to a mysterious island to track down a legendary forest creature. They soon realize their guide has set them up as bait, forcing them to confront a highly intelligent predator that terrorizes them one by one.",97.6395,/iCvucorbs3hFqWshDbLe0fHzB71.jpg,2025-02-03,False,False,4.917,12,"Horror, Action"
False,/hlZGaey4lR9hc4rGxZRAmIEsZOc.jpg,"28, 18",1292415,Beast,en,Beast,"MMA legend Patton James, now a commercial fisherman, is pulled back into the cage when his brother is in danger. Reuniting with his old coach Sammy, he commits to one final fight in one championship against the brutal champion Xavier Grau.",95.786,/7NrvUI3vnW8H3rD7ExKcTL7KRcQ.jpg,2026-04-10,False,False,6.3,45,"Action, Drama"
False,/xGJT18qN8lzELAnHRyfoe1vLTiI.jpg,18,186745,Rape of Love,fr,L'Amour violé,"Nicole, nurse in Grenoble, is raped one night by four men. Deeply scarred, emotionally and physically, she thinks she will never recover from the trauma. Following a friend's advice, she decides to file a lawsuit.",108.2565,/qVGL9xgGCzXtRwexUTmpz7z1MVg.jpg,1978-01-10,False,False,5.6,24,Drama
False,/4DfxcN4w0FuYZHQ3JAHzpHWia1U.jpg,"28, 80, 53",1291608,Dhurandhar,hi,धुरंधर,"A mysterious traveler slips into the heart of Karachi's underbelly and rises through its ranks with lethal precision, only to tear the notorious ISI-Underworld nexus apart from within.",87.6481,/8FHOtUpNIk5ZPEay2N2EY5lrxkv.jpg,2025-12-05,False,False,7.138,289,"Action, Crime, Thriller"
False,/7TJjD2X9GTEqyLVIJKLS85J2V47.jpg,"53, 28, 80",28322,Madness,it,Vacanze per un massacro,"An escaped convicted murderer invades the cottage of a man, his wife and the wife's sister, whereupon he proceeds to torment this already dysfunctional trio with rape and violence.",82.6356,/gV0J0Fqw2mYMtQbzb0ruxv9MAeZ.jpg,1980-03-20,False,False,4.969,32,"Thriller, Action, Crime"
False,/lgotja3xMoJZbynwHfcQcJAEMWH.jpg,"12, 16, 35, 10751, 9648",1084242,Zootopia 2,en,Zootopia 2,"After cracking the biggest case in Zootopia's history, rookie cops Judy Hopps and Nick Wilde find themselves on the twisting trail of a great mystery when Gary De'Snake arrives and turns the animal metropolis upside down. To crack the case, Judy and Nick must go undercover to unexpected new parts of town, where their growing partnership is tested like never before.",84.135,/oJ7g2CifqpStmoYQyaLQgEU32qO.jpg,2025-11-26,False,False,7.648,2853,"Adventure, Animation, Comedy, Family, Mystery"
False,/aJxmgoNtP2BH7mRYvuf7AHB0VC3.jpg,18,1302007,Kaulayaw,tl,Kaulayaw,"Two college schoolmates venture into the world of cybersex to support their needs. They fulfill their fans' sexual fantasy only to realized that they too, are falling for each other.",95.4883,/qifjfp5a2gHQ0WsGhTvlamPshnH.jpg,2024-07-18,False,False,5.8,6,Drama
False,/mxdiaM2tsx8M6W3zLgiPwAkhQfq.jpg,"18, 10749",744275,After We Fell,en,After We Fell,"Just as Tessa's life begins to become unglued, nothing is what she thought it would be. Not her friends nor her family. The only person that she should be able to rely on is Hardin, who is furious when he discovers the massive secret that she's been keeping. Before Tessa makes the biggest decision of her life, everything changes because of revelations about her family.",79.6626,/dU4HfnTEJDf9KvxGS9hgO7BVeju.jpg,2021-09-01,False,False,7.005,2742,"Drama, Romance"
False,/vP7YFt9pP8NPCg4PMBAHO5ILdrQ.jpg,"28, 53",44980,Zero Woman 2,ja,Zero WOMAN ＩＩ　警視庁０課の女,"When a valuable suitcase is stolen, the mob, petty criminals, and a beautiful agent from the Elite Zero division are pulled into a battle to settle the score.",123.9359,/sQHeDjwmBQba8E51Mkp5dvgkzeZ.jpg,1995-09-05,False,False,5.0,8,"Action, Thriller"
False,/bOy625BjpCskOWnx3tD09MsKVCb.jpg,"35, 14",1368881,Ladies First,en,Ladies First,"An arrogant but charismatic ladies' man finds his life of money, power and casual flings upended when he wakes up in a parallel world dominated by women.",71.7287,/kjR56Yv17pbjTVBTMjqepvcus4f.jpg,2026-05-21,False,False,6.045,224,"Comedy, Fantasy"
False,/A2tzVTVtnTvpji96IZmleN78KKv.jpg,"27, 35",1239134,Bhooth Bangla,hi,भूत बंगला,"A man inherits a palace in rural Mangalpur and plans his sister's wedding there, but strange supernatural events and panicked locals force him to investigate the property's mysterious past.",87.2818,/79RBp8afL4u4z3nVGR78z6eIvBB.jpg,2026-04-16,False,False,6.5,10,"Horror, Comedy"
False,/9qYPmrdpGT58hd3wSam82pmPIoW.jpg,"27, 53",1571594,La fotógrafa,es,La fotógrafa,"Inna, a young post-mortem photographer, arrives at a remote orphanage in northern Spain to capture the final image of Alejandra, a girl found dead under mysterious circumstances. But as her lens lingers on the tragedy, Inna begins to sense a dark presence within the orphanage's walls-an evil that refuses to remain hidden and threatens to make her its next subject.",79.7093,/95pZ9yB5SABddzaINITvZd7SvER.jpg,2025-10-30,False,False,4.0,1,"Horror, Thriller"
False,/zfbjgQE1uSd9wiPTX4VzsLi0rGG.jpg,"18, 80",278,The Shawshank Redemption,en,The Shawshank Redemption,"Imprisoned in the 1940s for the double murder of his wife and her lover, upstanding banker Andy Dufresne begins a new life at the Shawshank prison, where he puts his accounting skills to work for an amoral warden. During his long stretch in prison, Dufresne comes to be admired by the other inmates -- including an older prisoner named Red -- for his integrity and unquenchable sense of hope.",80.3109,/9cqNxx0GxF0bflZmeSMuL5tnGzr.jpg,1994-09-23,False,False,8.721,30454,"Drama, Crime"
False,/61RYedFgX1K07xgVIvdJzukSR4g.jpg,"35, 18, 10751, 10749",848116,Rocky Aur Rani Kii Prem Kahaani,hi,रॉकी और रानी की प्रेम कहानी,"Gym-freak brat Rocky falls in love with Rani, who comes from a well-educated Bengali family. Being from polar opposite worlds, the two decide to switch their families to adjust to each other's cultures and backgrounds and to know if their marriage will survive. Rocky and Rani are trapped in a world where they are united by love but divided by families and the ultimate question is will they fit in?",85.0773,/vTQIqlxUkOuyf2UKhlM2OUaFGKz.jpg,2023-07-28,False,False,6.201,87,"Comedy, Drama, Family, Romance"
False,/aqqoDJs8vYp2EZ74aQ1UMY0sjM7.jpg,"18, 53",235271,Addicted,en,Addicted,A gallerist risks her family and flourishing career when she enters into an affair with a talented painter and slowly loses control of her life.,77.9406,/fAERrD6vvmznDoL99wlgjhSfPcH.jpg,2014-10-10,False,False,5.9,444,"Drama, Thriller"
False,/2ssWTSVklAEc98frZUQhgtGHx7s.jpg,"12, 18, 878",157336,Interstellar,en,Interstellar,The adventures of a group of explorers who make use of a newly discovered wormhole to surpass the limitations on human space travel and conquer the vast distances involved in an interstellar voyage.,74.4364,/yQvGrMoipbRoddT0ZR8tPoR7NfX.jpg,2014-11-05,False,False,8.5,39876,"Adventure, Drama, Science Fiction"
False,/nHxWyy18SvAZ8jJeemtS8k1UNjM.jpg,"28, 80, 53",1290821,Shelter,en,Shelter,"A man living in self-imposed exile on a remote island rescues a young girl from a violent storm, setting off a chain of events that forces him out of seclusion to protect her from enemies tied to his past.",65.8241,/buPFnHZ3xQy6vZEHxbHgL1Pc6CR.jpg,2026-01-28,False,False,7.626,1089,"Action, Crime, Thriller"
False,/82hjEm0x5Val6nCwExwlawdfwLJ.jpg,"53, 27",1639398,Mexican Psycho,es,Psicópata: El Asesino del Conejo Blanco,"Follows an ""ultra-violent and intelligent"" psychopath who challenges the police by leaving a white paper rabbit at each crime scene, connecting them all.",63.2198,/7tIgfsTWuzXKR2kLRUPrLRTbcuo.jpg,2026-03-19,False,False,7.368,76,"Thriller, Horror"
False,/sS3zGYFPcfM5pArVNWl6qLyaSmU.jpg,"16, 28, 12, 14",980431,Avatar Aang: The Last Airbender,en,Avatar Aang: The Last Airbender,"Avatar Aang, the world's last Airbender, learns of an ancient power that could save his culture from extinction. With the help of his friends, he embarks on a global quest to find it before it falls into the wrong hands and threatens to upend the peace they sacrificed everything to achieve.",69.3414,/29Jdsak3SrwGds5k1t43kH6Khed.jpg,2026-10-09,False,False,0.0,0,"Animation, Action, Adventure, Fantasy"
False,/gMItMzDOyrfQGZsMWRM9tdxq5cV.jpg,"878, 28, 27",1196067,Worldbreaker,en,Worldbreaker,"Five years ago, a tear in the fabric of reality brought creatures to our world from an alternate dimension bent on our destruction. A father hides his daughter on an island to keep her safe while he prepares her for survival and the battles to come. But when the world is about to break, no place is safe.",62.0077,/ahj1JU8r0uJv7QII5Uj7tKzbEsC.jpg,2025-10-30,False,False,6.033,195,"Science Fiction, Action, Horror"
False,/mHm73HhpvGWfRkXNErcwc15Czrv.jpg,"80, 18, 53",1628367,Kartavya,hi,कर्त्तव्य,"With his family's safety at stake and menacing threats closing in, a police officer must decide how far he'll go to uphold his duty.",62.5214,/doTwMyAphlDL5Z8WqE3elWWvj8M.jpg,2026-05-15,False,False,6.471,17,"Crime, Drama, Thriller"
