adult,backdrop_path,genre_ids,id,title,original_language,original_title,overview,popularity,poster_path,release_date,softcore,video,vote_average,vote_count,genre_names
False,/a2PyqyjREwjnrjdJyJtHfSQOxyf.jpg,18,1669051,Kesong Puti,tl,Kesong Puti,"Have a taste of VMX Newest Temptation Apphle Celso. Lena, a Kesong Puti vendor, meets a charming dairy supplier Manny. Their chemistry sparks a daring secret that transforms her humble cheese into their town’s obsession.",14.4228,/8zYU8hlKR5111IToxXvv5575tZG.jpg,2026-04-24,False,False,3.75,4,Drama
False,/ru0r5MYhIwcU0IddhRLqJpIPkiV.jpg,"18, 80, 9648",1191876,From the Ashes,en,From the Ashes,"Jailed for her husband's crime, a woman discovers that her only way out is to solve riddles from her mysterious past.",14.4194,/aEUH2ECoZHvSmoMzJpca0STF2CZ.jpg,2027-06-01,False,False,0.0,0,"Drama, Crime, Mystery"
False,/YL3GPOiDcNraIJOVDCZsoOBoDy.jpg,"878, 28, 12, 53",106,Predator,en,Predator,A team of elite commandos on a secret mission in a Central American jungle come to find themselves hunted by an extraterrestrial warrior.,14.414,/aN3cdjIK70KGmD84et8MMblU87Q.jpg,1987-06-12,False,False,7.57,9238,"Science Fiction, Action, Adventure, Thriller"
False,/9vAoubhoZE8aSkUZoSfxs3UWZhO.jpg,"53, 28, 80",156022,The Equalizer,en,The Equalizer,"McCall believes he has put his mysterious past behind him and dedicated himself to beginning a new, quiet life. But when he meets Teri, a young girl under the control of ultra-violent Russian gangsters, he can’t stand idly by – he has to help her. Armed with hidden skills that allow him to serve vengeance against anyone who would brutalize the helpless, McCall comes out of his self-imposed retirement and finds his desire for justice reawakened. If someone has a problem, if the odds are stacked against them, if they have nowhere else to turn, McCall will help. He is The Equalizer.",14.4075,/9u4yW7yPA0BQ2pv9XwiNzItwvp8.jpg,2014-09-24,False,False,7.291,10003,"Thriller, Action, Crime"
False,/y5tad0a4yRbxYgOHGllEIEeCCKt.jpg,"16, 10749, 14, 10751",10198,The Princess and the Frog,en,The Princess and the Frog,"A waitress, desperate to fulfill her dreams as a restaurant owner, is set on a journey to turn a frog prince back into a human being, but she has to face the same problem after she kisses him.",14.3881,/yprv5PbnEksoVj2v6XEnDBg9joR.jpg,2009-12-08,False,False,7.227,6164,"Animation, Romance, Fantasy, Family"
False,/dF6FjTZzRTENfB4R17HDN20jLT2.jpg,"12, 878, 53",135397,Jurassic World,en,Jurassic World,"Twenty-two years after the events of Jurassic Park, Isla Nublar now features a fully functioning dinosaur theme park, Jurassic World, as originally envisioned by John Hammond.",14.387,/rhr4y79GpxQF9IsfJItRXVaoGs4.jpg,2015-06-06,False,False,6.702,21663,"Adventure, Science Fiction, Thriller"
False,/kkRpcauZoBFKnH0Qsy7J5qtwBF5.jpg,"10749, 18",1371023,Chand Mera Dil,hi,चाँद मेरा दिल,"Aarav and Chandni's passionate college romance is struck by adulthood far too soon, forcing the two young lovers to balance their ambitions with responsibility and realize the evolved meaning of love.",14.3847,/9LPkXJustudEBgPZEm9tgDx5KtC.jpg,2026-05-22,False,False,5.75,6,"Romance, Drama"
False,/cPkt7WE6c1CnU8UklHfrOEz1oEC.jpg,35,91884,Self Service Girls,de,"Mädchen, die sich selbst bedienen",A series of vignettes depict different sexual fantasies.,14.3633,/qo8Ry3nr3bNYAgMJa6B5JZETQ5r.jpg,1975-01-01,False,False,5.7,11,Comedy
False,/d5C5Wsx4fnMRA0tj9BK1kTPcgQe.jpg,"27, 53",1315303,Primate,en,Primate,"College student Lucy and her friends spend their vacation at her family's home in Hawaii, which includes her pet chimpanzee, Ben. However, when Ben contracts rabies after being bitten by a rabid animal, the group must fight for their lives in order to avoid the now-violent chimp.",14.3348,/rKleYiEj4pFqxedTRWfujLooi84.jpg,2026-01-01,False,False,6.536,717,"Horror, Thriller"
False,/nLlvuGgR8LtHO7Q1OVgmFQq2dMR.jpg,"27, 28, 18",210911,Rigor Mortis,cn,殭屍,"When a former actor moves into an apartment building with the intention of commiting suicide, he is saved by a Taoist priest who used to specialize in hunting Chinese hopping vampires: or Jiāngshī. Elsewhere in the building, a woman turns to a specialist in black magic to bring her husband back to life.",14.3136,/13XrW84O4HBagKQ3mvJTQcVjCVu.jpg,2013-10-23,False,False,6.065,201,"Horror, Action, Drama"
False,/iffzIhuLAO38Po6sh1s6ZEVwlNL.jpg,"28, 80",24,Kill Bill: Vol. 1,en,Kill Bill: Vol. 1,"An assassin is shot by her ruthless employer, Bill, and other members of their assassination circle – but she lives to plot her vengeance.",14.3117,/v7TaX8kXMXs5yFFGR41guUDNcnB.jpg,2003-10-10,False,False,7.973,19067,"Action, Crime"
False,/6Ybbh8TrO8bkEfQXDedekLwVDfA.jpg,"16, 35, 10751, 12",8355,Ice Age: Dawn of the Dinosaurs,en,Ice Age: Dawn of the Dinosaurs,"Times are changing for Manny the moody mammoth, Sid the motor mouthed sloth and Diego the crafty saber-toothed tiger. Life heats up for our heroes when they meet some new and none-too-friendly neighbors – the mighty dinosaurs.",14.3024,/cXOLaxcNjNAYmEx1trZxOTKhK3Q.jpg,2009-06-26,False,False,6.771,8922,"Animation, Comedy, Family, Adventure"
False,/5mzr6JZbrqnqD8rCEvPhuCE5Fw2.jpg,"28, 878, 27",615656,Meg 2: The Trench,en,Meg 2: The Trench,An exploratory dive into the deepest depths of the ocean of a daring research team spirals into chaos when a malevolent mining operation threatens their mission and forces them into a high-stakes battle for survival.,14.2926,/4m1Au3YkjqsxF8iwQy0fPYSxE0h.jpg,2023-08-02,False,False,6.374,4018,"Action, Science Fiction, Horror"
False,/8itHQecANtOevcCdr3AhVxFCYkw.jpg,"18, 28, 12, 36, 10752",1495,Kingdom of Heaven,en,Kingdom of Heaven,"After his wife dies, a blacksmith named Balian is thrust into royalty, political intrigue and bloody holy wars during the Crusades.",14.2897,/rNaBe4TwbMef71sgscqabpGKsxh.jpg,2005-05-03,False,False,7.06,5037,"Drama, Action, Adventure, History, War"
False,/1fkuBPid72KGS6WmtkEXMftZtkE.jpg,"80, 18",875828,Peaky Blinders: The Immortal Man,en,Peaky Blinders: The Immortal Man,"After his estranged son gets embroiled in a Nazi plot, self-exiled gangster Tommy Shelby must return to Birmingham to save his family — and his nation.",14.2812,/gRMalasZEzsZi4w2VFuYusfSfqf.jpg,2026-03-05,False,False,7.245,1061,"Crime, Drama"
False,/seuG9UslSFybML8C4enbrE6Hsyz.jpg,"27, 9648, 878",1116201,Iron Lung,en,Iron Lung,"In a post-apocalyptic future where an event known as ""The Quiet Rapture"" caused all known stars and habitable planets in the universe to disappear, a convict is sent to search an ocean of blood discovered on a desolate moon, using a small submarine nicknamed the ""Iron Lung"".",14.268,/sIwakdbMGS1krtgendTWpxTY9Hw.jpg,2026-01-30,False,False,6.992,327,"Horror, Mystery, Science Fiction"
False,/akflpqPH6yQoEnxlk6H8FyoFSsI.jpg,"27, 9648",1193501,Whistle,en,Whistle,"A misfit group of unwitting high school students stumble upon a cursed object, an ancient Aztec Death Whistle. They discover that blowing the whistle and the terrifying sound it emits will summon their future deaths to hunt them down.",14.2568,/vgonf5kGsiijUBjzxKTvechhT28.jpg,2026-01-20,False,False,6.3,514,"Horror, Mystery"
False,/6RDgtEBzjuF7W25DVziXRABchpX.jpg,27,109428,Evil Dead,en,Evil Dead,"Mia, a drug addict, is determined to kick the habit. To that end, she asks her brother, David, his girlfriend, Natalie and their friends Olivia and Eric to accompany her to their family's remote forest cabin to help her through withdrawal. Eric finds a mysterious Book of the Dead at the cabin and reads aloud from it, awakening an ancient demon. All hell breaks loose when the malevolent entity possesses Mia.",14.2563,/1gDV0Lm9y8ufIKzyf0h0GBgb9Zj.jpg,2013-04-05,False,False,6.613,5092,Horror
False,/nR3HoUX6zvO6PigYAFOBWjQoYUD.jpg,"10402, 35, 18",1391239,The Debut,en,The Debut,"When Mona Friedman is cast in a bit part at a small community theater, she transforms from a shy, unassuming housewife into a zealous method actor willing to do anything to protect the artistic integrity of her marginal role—even if it means waging war against the show’s domineering director.",14.2438,/5CZdxLiBpYMBXwo0rur6YzZTVP4.jpg,2026-12-11,False,False,0.0,0,"Music, Comedy, Drama"
False,/fPfDB0IHOqvmKIzFP9CA51OOS1N.jpg,"27, 53",1010755,The Strangers: Chapter 3,en,The Strangers: Chapter 3,"Tethered by a frightening conclusion, Maya and the Strangers are locked on an unavoidable, unforgiving collision course — a showdown that proves they’re far from strangers now.",14.2415,/dWi4D1rUX1Pg4MaafpwwssqJ9lv.jpg,2026-02-05,False,False,5.966,238,"Horror, Thriller"
False,/ocOWbTzHcJVTw9Tz173KPeskDOP.jpg,"10751, 14, 12",12155,Alice in Wonderland,en,Alice in Wonderland,"Alice, now 19 years old, returns to the whimsical world she first entered as a child and embarks on a journey to discover her true destiny.",14.2149,/o0kre9wRCZz3jjSjaru7QU0UtFz.jpg,2010-03-03,False,False,6.644,14878,"Family, Fantasy, Adventure"
False,/7uyKHL9wDWGaq3ql8QO93ownxaN.jpg,"28, 12, 18, 53",1279264,LAJJPAL -  The Endless Journey,pa,Lajj Pal,"""Lajjpal"" is a compelling narrative following the journey of an ordinary individual seeking divine empowerment to combat the malevolence of evil forces. Fueled by a deep sense of purpose, our protagonist embarks on a transformative quest, delving into the realms of spirituality and courage. As he navigates through trials and tribulations, he discovers the latent strength within himself, bestowed by the benevolence of the divine. With newfound powers, he confronts the darkness that threatens to engulf humanity, embodying the timeless struggle between good and evil. ""Lajjpal"" is a poignant tale of resilience, faith, and the triumph of righteousness over adversity.",14.1474,/z4vATprs4F19iajvRqgK58Q8JQb.jpg,2025-08-15,False,False,0.0,0,"Action, Adventure, Drama, Thriller"
False,/3q01ACG0MWm0DekhvkPFCXyPZSu.jpg,"28, 35, 80",573435,Bad Boys: Ride or Die,en,Bad Boys: Ride or Die,"After their late former Captain is framed, Lowrey and Burnett try to clear his name, only to end up on the run themselves.",14.1435,/oGythE98MYleE6mZlGs5oBGkux1.jpg,2024-06-05,False,False,7.321,3372,"Action, Comedy, Crime"
False,/5Dkv39CuytJDnJeZjkepFtOWqBr.jpg,"35, 36, 18",1530510,Mexico 86,es,México 86,"When a last-minute chance to host the 1986 World Cup appears, a cunning Mexican bureaucrat, armed with nothing but guts and audacity, cons his way through FIFA to beat the United States, but in a country of power games, every victory has a price.",14.142,/dj4MbmBrZXzNQpxsLBIxKohRp9b.jpg,2026-05-21,False,False,7.732,97,"Comedy, History, Drama"
False,/lU1fQews2gye23PocVE48CsTmOQ.jpg,"28, 18, 10749, 53",4588,"Lust, Caution",zh,色‧戒,"During World War II, a secret agent must seduce, then assassinate an official  who works for the Japanese puppet government in Shanghai. Her mission becomes clouded when she finds herself falling in love with the man she is assigned to kill.",14.1359,/6c1tqfJEBuIyhQC19SLlLQAUAvJ.jpg,2007-09-24,False,False,7.3,813,"Action, Drama, Romance, Thriller"
False,/8BTsTfln4jlQrLXUBquXJ0ASQy9.jpg,"12, 28, 878",140607,Star Wars: The Force Awakens,en,Star Wars: The Force Awakens,"Thirty years after defeating the Galactic Empire, Han Solo and his allies face a new threat from the evil Kylo Ren and his army of Stormtroopers.",14.131,/wqnLdwVXoBjKibFRR5U3y0aDUhs.jpg,2015-12-15,False,False,7.248,20632,"Adventure, Action, Science Fiction"
False,/o8dPH0ZSIyyViP6rjRX1djwCUwI.jpg,"9648, 53, 27",419430,Get Out,en,Get Out,"Chris and his girlfriend Rose go upstate to visit her parents for the weekend. At first, Chris reads the family's overly accommodating behavior as nervous attempts to deal with their daughter's interracial relationship, but as the weekend progresses, a series of increasingly disturbing discoveries lead him to a truth that he never could have imagined.",14.1035,/tFXcEccSQMf3lfhfXKSU9iRBpa3.jpg,2017-02-24,False,False,7.624,19008,"Mystery, Thriller, Horror"
False,/zcySy6dnSmyqiichtDgO7AEeZoq.jpg,"28, 18, 53",254128,San Andreas,en,San Andreas,"In the aftermath of a massive earthquake in California, a rescue-chopper pilot makes a dangerous journey across the state in order to rescue his estranged daughter.",14.0771,/2Gfjn962aaFSD6eST6QU3oLDZTo.jpg,2015-05-27,False,False,6.247,9067,"Action, Drama, Thriller"
False,/z9DFGaWj4G4kZUWLZ6ESs1NP1Fp.jpg,"35, 10749",2105,American Pie,en,American Pie,"At a high-school party, four friends find that losing their collective virginity isn't as easy as they had thought. But they still believe that they need to do so before college. To motivate themselves, they enter a pact to all ""score"" by their senior prom.",14.0522,/5P68by2Thn8wHAziyWGEw2O7hco.jpg,1999-07-09,False,False,6.611,8367,"Comedy, Romance"
False,/2AI3pSt5sbAEav6isVDIeCuiZql.jpg,18,46853,Playing with Love,it,Maladolescenza,"Laura and Fabrizio have been meeting every summer in the forest by her parent's summer home. Fabrizio is a solitary boy with only his dog for company; Laura a sweet but unconfident child. This summer new aspects enter into their story as both are growing up. Laura is falling in love with Fabrizio, while he displays a new sexual awareness of her masked by his malice. Things develop further when they meet Sylvia who, unlike the innocent Laura, is confident and assertive. Fabrizio develops a fascination with her, eventually bribing Laura to fetch her to the forest to join them in play.",14.0391,/nu5uj47KSF73VPEiIRYdPLJ96j7.jpg,1977-05-06,False,False,5.3,87,Drama
False,/hJ5R9d6QuH3tzr8L8neZZTuzNXm.jpg,"878, 18, 53",78,Blade Runner,en,Blade Runner,"In the smog-choked dystopian Los Angeles of 2019, blade runner Rick Deckard is called out of retirement to terminate a quartet of replicants who have escaped to Earth seeking their creator for a way to extend their short life spans.",14.0168,/63N9uy8nd9j7Eog2axPQ8lbr3Wj.jpg,1982-06-25,False,False,7.936,15087,"Science Fiction, Drama, Thriller"
False,/5RPXDu7FLHSmUQDt319t7qsk186.jpg,18,615228,Vou Nadar Até Você,pt,Vou Nadar Até Você,"Ophelia is a 20-year-old girl who lives with her mother and grew up without a father. She suspects that he is Tedesco, a German artist who has just returned to Brazil. Determined to find him, she sends a letter notifying him of her arrival and that she will swim to him from the Santos bridge. Upon learning of the imminent arrival, Tedesco asks Smutter, his great friend, to start following her closely.",14.0094,/aNbcim9eQqi6oRXotRKTlT9ofXF.jpg,2020-03-05,False,False,2.2,4,Drama
False,/8eifdha9GQeZAkexgtD45546XKx.jpg,"28, 53, 878",822119,Captain America: Brave New World,en,Captain America: Brave New World,"After meeting with newly elected U.S. President Thaddeus Ross, Sam finds himself in the middle of an international incident. He must discover the reason behind a nefarious global plot before the true mastermind has the entire world seeing red.",14.0076,/pzIddUEMWhWzfvLI3TwxUG2wGoi.jpg,2025-02-12,False,False,5.961,3162,"Action, Thriller, Science Fiction"
False,/tN3pTxkQoP96wtaEahYuRVdUWb2.jpg,"878, 53, 35",701387,Bugonia,en,Bugonia,"Two conspiracy obsessed young men kidnap the high-powered CEO of a major company, convinced that she is an alien intent on destroying planet Earth.",13.9977,/oxgsAQDAAxA92mFGYCZllgWkH9J.jpg,2025-10-23,False,False,7.312,2083,"Science Fiction, Thriller, Comedy"
False,/sJg9L89XDKxLLg2iHeUoWZ0we0h.jpg,"35, 80",1457884,The Heist,en,The Heist,"One cold and fateful schoolnight, friends Kasey, Lyn, Ry, Zane, & AJ attempt to steal Kasey’s stuff back from her ex, Kyle. What could possibly go wrong?",13.9926,/s9dHmbmx0z0ceQVSPN3tbCyfHJr.jpg,2025-02-28,False,False,0.0,0,"Comedy, Crime"
False,/j5L5e211nYRd8DiLNDXbeGUsx7D.jpg,"28, 80, 53",1421155,Ikatan Darah,id,Ikatan Darah,"A former martial arts athlete must face a network of loan sharks to save her younger brother, who is trapped in online gambling debt and risking their family’s safety.",13.9465,/lF9amilOGIudUIq6NgDnz2YrPPa.jpg,2026-04-30,False,False,7.0,7,"Action, Crime, Thriller"
False,/3P52oz9HPQWxcwHOwxtyrVV1LKi.jpg,"28, 35, 12",383498,Deadpool 2,en,Deadpool 2,Wisecracking mercenary Deadpool battles the evil and powerful Cable and other bad guys to save a boy's life.,13.9398,/to0spRl1CMDvyUbOnbb4fTk3VAd.jpg,2018-05-15,False,False,7.49,19333,"Action, Comedy, Adventure"
False,/tntH2nSeaGTOXV6CITPSvczSiXw.jpg,"16, 12, 35, 10751",454640,The Angry Birds Movie 2,en,The Angry Birds Movie 2,"Red, Chuck, Bomb and the rest of their feathered friends are surprised when a green pig suggests that they put aside their differences and unite to fight a common threat. Aggressive birds from an island covered in ice are planning to use an elaborate weapon to destroy the fowl and swine.",13.9375,/ebe8hJRCwdflNQbUjRrfmqtUiNi.jpg,2019-08-02,False,False,7.1,1904,"Animation, Adventure, Comedy, Family"
False,/iiPBXynI88EgnpunHoUlBCnLpSE.jpg,"9648, 53",2832,Identity,en,Identity,"Complete strangers stranded at a remote desert motel during a raging storm soon find themselves the target of a deranged murderer. As their numbers thin out, the travelers begin to turn on each other, as each tries to figure out who the killer is.",13.9283,/sYgimsiBywqVwJI8H4sETke8m7v.jpg,2003-04-25,False,False,7.187,4401,"Mystery, Thriller"
False,/d3hiSKKyIjvB3Lv577vHh0TxbFM.jpg,10749,1650558,Abot Langit,tl,Abot Langit,"The relationship of a couple is tested when the girl’s first official flight pairs her with a confident senior pilot, jealousy and power dynamics surface in the training ground. The girl is now torn between her present relationship and new temptation she can’t resist.",13.9246,/5lVYe4aSimWdxJINKwq9s68TZ2G.jpg,2026-03-13,False,False,5.0,1,Romance
False,/nTK2dJX4IJfpMVAYDKrKaUl0q9k.jpg,35,1567856,Unreliable Witness,en,Unreliable Witness,"An exhausted detective interrogates three suspects after an altercation gone awry. As these mischievous suspects delve into their stories, will Detective Finch squeeze the truth out of them?",13.8811,/yNh2PONRjZ8RiWHHAROYKs7PKwm.jpg,2025-10-26,False,False,0.0,0,Comedy
False,/pu9qQUWDfWdp50Cy6sz9Apd9K7P.jpg,"16, 10751, 878, 35, 10749",1718699,Not Alone,en,Not Alone,"While preparing for a revolutionary space launch, an introverted rocket mechanic and a brilliant astro-botanist spark an unexpected romance—only for three runaway aliens to crash-land in his home, looking for a ride back to the stars.",13.8699,/9HqA8Hxwd7KNs6ttYqRbXtYHLpv.jpg,2027-03-18,False,False,0.0,0,"Animation, Family, Science Fiction, Comedy, Romance"
False,/onq6lsJLX8ay5iwxEbKX3qJKeO9.jpg,27,764,The Evil Dead,en,The Evil Dead,"In 1979, a group of college students find a Sumerian Book of the Dead in an old wilderness cabin they've rented for a weekend getaway.",13.8593,/54C1qdaiSijIU5NeNb4WsPJdNkG.jpg,1981-10-15,False,False,7.276,4525,Horror
False,/59vDC1BuEQvti24OMr0ZvtAK6R1.jpg,"14, 12, 16, 10751",10191,How to Train Your Dragon,en,How to Train Your Dragon,"As the son of a Viking leader on the cusp of manhood, shy Hiccup Horrendous Haddock III faces a rite of passage: he must kill a dragon to prove his warrior mettle. But after downing a feared dragon, he realizes that he no longer wants to destroy it, and instead befriends the beast – which he names Toothless – much to the chagrin of his warrior father.",13.8587,/ygGmAO60t8GyqUo9xYeYxSZAR3b.jpg,2010-03-18,False,False,7.863,14463,"Fantasy, Adventure, Animation, Family"
False,/pYgj8e2Y6RufnSyOA6OnzmxFXxZ.jpg,"27, 18, 9648",530385,Midsommar,en,Midsommar,"Several friends travel to Sweden to study as anthropologists a summer festival that is held every ninety years in the remote hometown of one of them. What begins as a dream vacation in a place where the sun never sets, gradually turns into a dark nightmare as the mysterious inhabitants invite them to participate in their disturbing festive activities.",13.8531,/7LEI8ulZzO5gy9Ww2NVCrKmHeDZ.jpg,2019-07-03,False,False,7.147,8167,"Horror, Drama, Mystery"
False,/o5bRLCNBmWBCBluFlOLUgivdONs.jpg,"18, 10749",47612,Au Bonheur des Dames,fr,Au Bonheur des Dames,"Denise, an orphaned girl, moves to Paris where she hopes to find work at her uncle's store. But the glamorous department store 'Aux Bonheur des Dames' across the street crushes all the little businesses around. She finds a position there.",13.8197,/lcshMRxDFWDtT2W9ImBeyuYnbg4.jpg,1930-07-03,False,False,6.257,35,"Drama, Romance"
False,/1GsZnO4RfUItKgnOqR3KUfKxpbX.jpg,"14, 35",1662960,Sick City,xx,Sick City,A sickly tourist visits Berlin sights quickly with an angelic teleport guide.,13.8155,/dMRqNWwkqafmICnjCFdGyuJk16t.jpg,2012-01-01,False,False,10.0,1,"Fantasy, Comedy"
False,/kHJlXiwxcMAf9R934f0ncEBAMXg.jpg,"10749, 18",1252309,Tell Me What You Want,es,Pídeme lo que quieras,"After his father's death, Eric Zimmerman travels to Spain to oversee his company's branches. In Madrid, he falls for Judith and engage in an intense, erotic relationship full of exploration. However, Eric fears his secret may end their affair.",13.8088,/yZXYCiZQPB7Ui6D5206W1zDKv8P.jpg,2024-11-29,False,False,6.135,299,"Romance, Drama"
False,/yF1eOkaYvwiORauRCPWznV9xVvi.jpg,"28, 878, 12",298618,The Flash,en,The Flash,"When his attempt to save his family inadvertently alters the future, Barry Allen becomes trapped in a reality in which General Zod has returned and there are no Super Heroes to turn to. In order to save the world that he is in and return to the future that he knows, Barry's only hope is to race for his life. But will making the ultimate sacrifice be enough to reset the universe?",13.8001,/rktDFPbfHfUbArZ6OOOKsXcv0Bm.jpg,2023-06-13,False,False,6.6,5064,"Action, Science Fiction, Adventure"
False,/bQXAqRx2Fgc46uCVWgoPz5L5Dtr.jpg,"28, 12, 878",436270,Black Adam,en,Black Adam,"Nearly 5,000 years after he was bestowed with the almighty powers of the Egyptian gods—and imprisoned just as quickly—Black Adam is freed from his earthly tomb, ready to unleash his unique form of justice on the modern world.",13.798,/rCtreCr4xiYEWDQTebybolIh6Xe.jpg,2022-10-19,False,False,6.795,7081,"Action, Adventure, Science Fiction"
False,/sI6uCeF8mUlZx22mFfHSi9W3XQ9.jpg,"10402, 35, 10749, 18",843527,The Idea of You,en,The Idea of You,"40-year-old single mom Solène begins an unexpected romance with 24-year-old Hayes Campbell, the lead singer of August Moon, the hottest boy band on the planet. As they begin a whirlwind romance, it isn't long before Hayes' superstar status poses unavoidable challenges to their relationship, and Solène soon discovers that life in the glare of his spotlight might be more than she bargained for.",13.7976,/Y5P4Q3q8nrruZ9aD3wXeJS2Plg.jpg,2024-05-02,False,False,7.278,1972,"Music, Comedy, Romance, Drama"
False,/2fgcRuaseQ9RIiTAUDbLtymnj2z.jpg,"53, 80",1274706,The Marked Woman,es,La desconocida,"When a woman is found in a shipping container with no memory of who she is, two detectives race to figure out her identity — and who wants her dead.",13.7951,/dyUZ6IKbzmgtdshHevJahpH51Eq.jpg,2026-06-05,False,False,5.527,93,"Thriller, Crime"
False,,"27, 35",1696598,S4E9,en,S4E9,Characters in a children's horror TV show realize that their reality is not what it seems.,13.772,/zraujByHuQ6Sw1fGZF1hiZIXq7.jpg,2026-04-30,False,False,0.0,0,"Horror, Comedy"
False,/viU23X3BIycUFf6TOlm9c7TxLgM.jpg,35,8835,Legally Blonde,en,Legally Blonde,"Fashionable sorority queen Elle Woods has it all, but, she wants nothing more than to be Mrs. Warner Huntington III. But he dumps her before heading to Harvard Law School. Elle rallies all of her resources and gets into Harvard, determined to win him back. While there, she figures out that there is more to herself than just good looks.",13.7561,/9ohlMrJHQqKhfUKh7Zr3JQqHNLZ.jpg,2001-07-13,False,False,6.819,4592,Comedy
False,/84beTJf26mfhoasUlKSOiNSutyS.jpg,"35, 18, 10749",19404,Dilwale Dulhania Le Jayenge,hi,दिलवाले दुल्हनिया ले जायेंगे,"Raj is a rich, carefree, happy-go-lucky second generation NRI. Simran is the daughter of Chaudhary Baldev Singh, who in spite of being an NRI is very strict about adherence to Indian values. Simran has left for India to be married to her childhood fiancé. Raj leaves for India with a mission at his hands, to claim his lady love under the noses of her whole family. Thus begins a saga.",13.7415,/tFbfCkS7q6g96wVoAu8kyr93iPm.jpg,1995-10-20,False,False,8.51,4600,"Comedy, Drama, Romance"
False,/3FO1kbQmRlU1H6Kmn7sTfmd7mw9.jpg,35,1621,Trading Places,en,Trading Places,A snobbish investor and a wily street con-artist find their positions reversed as part of a bet by two callous millionaires.,13.7276,/8mBuLCOcpWnmYtZc4aqtvDXslv6.jpg,1983-06-07,False,False,7.23,3690,Comedy
False,/5t2nuh147ycOKCHEF7RZi9pjtUG.jpg,10749,1231940,Nice Sister-in-law 6,ko,착한 형수 6,"Min-joon and Eun-seo are newlyweds who have been married for a month. Min-joon's younger brother suddenly returns from the United States and comes to live with the couple. Eun-seo falls in love with her handsome, muscular brother-in-law, so much so that she secretly masturbates and cannot sleep at night because of her desire to have her brother-in-law.",13.7156,/hrfpuqj6ZT8vVbuscamrU5C1bsM.jpg,2023-12-19,False,False,4.0,1,Romance
False,/tyfO9jHgkhypUFizRVYD0bytPjP.jpg,"10751, 14",447273,Snow White,en,Snow White,"Following the benevolent King's disappearance, the Evil Queen dominated the once fair land with a cruel streak. Princess Snow White flees the castle when the Queen, in her jealousy over Snow White's inner beauty, tries to kill her. Deep into the dark woods, she stumbles upon seven magical dwarves and a young bandit named Jonathan. Together, they strive to survive the Queen's relentless pursuit and aspire to take back the kingdom.",13.6857,/oLxWocqheC8XbXbxqJ3x422j9PW.jpg,2025-03-19,False,False,4.3,1670,"Family, Fantasy"
