adult,backdrop_path,genre_ids,id,original_language,original_title,overview,popularity,poster_path,release_date,title,video,vote_average,vote_count,genre_names
False,/q62bpQ67qaXY0u6b2wFEnQYIbPd.jpg,"10751, 35, 16, 12",301528,en,Toy Story 4,"Woody has always been confident about his place in the world, devoted to taking care of his kid—whether that's Andy or Bonnie. But after Bonnie creates a reluctant new toy called ""Forky"", a road trip adventure alongside old and new friends challenges everything Woody believes about loyalty, purpose, and what it truly means to be a toy.",13.5853,/w9kR8qbmQ01HwnvK4alvnQ2ca0L.jpg,2019-06-19,Toy Story 4,False,7.466,10449,"Family, Comedy, Animation, Adventure"
False,/6qHI1IYj7QlLSCwHRzkL62X175s.jpg,18,73,en,American History X,"Derek Vineyard is paroled after serving 3 years in prison for killing two African-American men. Through his brother, Danny Vineyard's narration, we learn that before going to prison, Derek was a skinhead and the leader of a violent white supremacist gang that committed acts of racial crime throughout L.A. and his actions greatly influenced Danny. Reformed and fresh out of prison, Derek severs contact with the gang and becomes determined to keep Danny from going down the same violent path as he did.",12.968,/x2drgoXYZ8484lqyDj7L1CEVR4T.jpg,1998-07-01,American History X,False,8.328,12479,Drama
False,/2vFuG6bWGyQUzYS9d69E5l85nIz.jpg,"878, 12, 28",667538,en,Transformers: Rise of the Beasts,"When a new threat capable of destroying the entire planet emerges, Optimus Prime and the Autobots must team up with a powerful faction known as the Maximals. With the fate of humanity hanging in the balance, humans Noah and Elena will do whatever it takes to help the Transformers as they engage in the ultimate battle to save Earth.",14.2422,/gPbM0MK8CP8A174rmUwGsADNYKD.jpg,2023-06-06,Transformers: Rise of the Beasts,False,7.173,5228,"Science Fiction, Adventure, Action"
False,/sd4xN5xi8tKRPrJOWwNiZEile7f.jpg,"16, 12, 35, 10751",920,en,Cars,"Lightning McQueen, a hotshot rookie race car driven to succeed, discovers that life is about the journey, not the finish line, when he finds himself unexpectedly detoured in the sleepy Route 66 town of Radiator Springs. On route across the country to the big Piston Cup Championship in California to compete against two seasoned pros, McQueen gets to know the town's offbeat characters.",14.0134,/2Touk3m5gzsqr1VsvxypdyHY5ci.jpg,2006-06-08,Cars,False,7.024,15021,"Animation, Adventure, Comedy, Family"
False,/wvlIoof1FnKPLv9jAYanuP31V0C.jpg,"878, 28, 53",87101,en,Terminator Genisys,"The year is 2029. John Connor, leader of the resistance continues the war against the machines. At the Los Angeles offensive, John's fears of the unknown future begin to emerge when TECOM spies reveal a new plot by SkyNet that will attack him from both fronts; past and future, and will ultimately change warfare forever.",12.7006,/oZRVDpNtmHk8M1VYy1aeOWUXgbC.jpg,2015-06-23,Terminator Genisys,False,5.952,8919,"Science Fiction, Action, Thriller"
False,/ksqaGSybKVyzkRmLFBgefMSa45a.jpg,"53, 18, 9648",1381027,en,Good Boy,"Tommy, a volatile 19-year-old, revels in drugs, parties and violence. After getting separated from his friends on a drunken bender, he is abducted by a shadowy figure. He wakes to find himself imprisoned in the basement of a remote Yorkshire house, inhabited by a very strange family. But what unfolds is not what he could possibly expect.",13.9446,/x0wD4Qxe0wulV0bxarsQ05PqDNF.jpg,2026-03-06,Good Boy,False,7.3,74,"Thriller, Drama, Mystery"
False,/rQaHA74pevnGsxcKGaoZVGWe9TC.jpg,"16, 10751, 18, 10402, 14",508442,en,Soul,"Joe Gardner is a middle school teacher with a love for jazz music. After a successful audition at the Half Note Club, he suddenly gets into an accident that separates his soul from his body and is transported to the You Seminar, a center in which souls develop and gain passions before being transported to a newborn child. Joe must enlist help from the other souls-in-training, like 22, a soul who has spent eons in the You Seminar, in order to get back to Earth.",13.2143,/6jmppcaubzLF8wkXM36ganVISCo.jpg,2020-12-25,Soul,False,8.093,11326,"Animation, Family, Drama, Music, Fantasy"
False,/sra8XnL96OyLHENcglmZJg6HA8z.jpg,"12, 28, 53",954,en,Mission: Impossible,"When Ethan Hunt, the leader of a crack espionage team whose perilous operation has gone awry with no explanation, discovers that a mole has penetrated the CIA, he's surprised to learn that he's the prime suspect. To clear his name, Hunt now must ferret out the real double agent and, in the process, even the score.",12.7241,/l5uxY5m5OInWpcExIpKG6AR3rgL.jpg,1996-05-22,Mission: Impossible,False,7.0,9902,"Adventure, Action, Thriller"
False,/2Y6Q7eYDXoolcHjYCAyJQlE2CVT.jpg,"27, 18, 9648",1813,en,The Devil's Advocate,"Aspiring Florida defense lawyer Kevin Lomax accepts a job at a New York law firm. With the stakes getting higher every case, Kevin quickly learns that his boss has something far more evil planned.",13.0006,/5ZzBGpxy55OQzHxKVY11IpY6a0o.jpg,1997-10-17,The Devil's Advocate,False,7.469,6710,"Horror, Drama, Mystery"
False,/cJvUJEEQ86LSjl4gFLkYpdCJC96.jpg,"10752, 28",1241436,en,Warfare,"A platoon of Navy SEALs embarks on a dangerous mission in Ramadi, Iraq, with the chaos and brotherhood of war retold through their memories of the event.",11.1805,/l39TlELomwysfsr37vrvCV6rmaQ.jpg,2025-04-09,Warfare,False,7.1,1395,"War, Action"
False,/pe3cTrUeAHHLycZVEmFjT9kEV7a.jpg,28,646315,ko,전설의 라이타,A man who used to be called Lighter cleans up his act from his days as a gangster and struggles to start over.,12.932,/h5fCwKCnKAKxdX6onTnrU6MeYe8.jpg,2019-10-29,The Legendary Lighter,False,4.8,4,Action
False,/jwRbJMGO3OZCwFLoJXn8tEbatJ2.jpg,27,1375831,en,Diabolic,"A woman's hope for a miracle cure turns into a nightmare when she confronts the vengeful spirit of a cursed witch, determined to claim her as a vessel for her evil power.",11.5342,/3qikoc12LQH6upkLZZlJY8wEZvN.jpg,2025-11-20,Diabolic,False,6.279,43,Horror
False,/4DZxWNSAyksN6N3JkvpJ53Yq6zU.jpg,"28, 18, 878",263115,en,Logan,"In the near future, a weary Logan cares for an ailing Professor X in a hideout on the Mexican border. But Logan's attempts to hide from the world and his legacy are upended when a young mutant arrives, pursued by dark forces.",12.8055,/fnbjcRDYn6YviCcePDnGdyAkYsB.jpg,2017-02-28,Logan,False,7.819,20290,"Action, Drama, Science Fiction"
False,/83H0C66AcvkwpG2738VCTHMY9uv.jpg,"28, 12, 878",505642,en,Black Panther: Wakanda Forever,"Queen Ramonda, Shuri, M’Baku, Okoye and the Dora Milaje fight to protect their nation from intervening world powers in the wake of King T’Challa’s death.  As the Wakandans strive to embrace their next chapter, the heroes must band together with the help of War Dog Nakia and Everett Ross and forge a new path for the kingdom of Wakanda.",14.4555,/sv1xJUazXeYqALzczSZ3O6nkH75.jpg,2022-11-09,Black Panther: Wakanda Forever,False,7.008,7388,"Action, Adventure, Science Fiction"
False,/u3MWQCdHyCK7IADtat4sVmBXd9U.jpg,"99, 10402",1022256,en,Selena Gomez: My Mind & Me,"After years in the limelight, Selena Gomez achieves unimaginable stardom. But just as she reaches a new peak, an unexpected turn pulls her into darkness. This uniquely raw and intimate documentary spans her six-year journey into a new light.",14.4541,/oMpsswJv8x4vnOnIKqs4xJs2Kn3.jpg,2022-11-04,Selena Gomez: My Mind & Me,False,8.532,584,"Documentary, Music"
False,/yZP6GyrgzdpjH1AxPHlb8ACLkiA.jpg,"27, 53",49018,en,Insidious,"A family discovers that dark spirits have invaded their home after their son inexplicably falls into an endless sleep. When they reach out to a professional for help, they learn things are a lot more personal than they thought.",14.4516,/1egpmVXuXed58TH2UOnX1nATTrf.jpg,2011-03-31,Insidious,False,6.941,7264,"Horror, Thriller"
False,/nG5zmbVeYlcDhckrPAe06fArywn.jpg,"10749, 878, 18",152601,en,Her,"In the not so distant future, Theodore, a lonely writer, purchases a newly developed operating system designed to meet the user's every need. To Theodore's surprise, a romantic relationship develops between him and his operating system. This unconventional love story blends science fiction and romance in a sweet tale that explores the nature of love and the ways that technology isolates and connects us all.",14.4014,/eCOtqtfvn7mxGl6nfmq4b1exJRc.jpg,2013-12-18,Her,False,7.841,15213,"Romance, Science Fiction, Drama"
False,/6N5d02quKqMKqvTpOdFmBDy9scY.jpg,"35, 18, 10749",19404,hi,दिलवाले दुल्हनिया ले जायेंगे,"Raj is a rich, carefree, happy-go-lucky second generation NRI. Simran is the daughter of Chaudhary Baldev Singh, who in spite of being an NRI is very strict about adherence to Indian values. Simran has left for India to be married to her childhood fiancé. Raj leaves for India with a mission at his hands, to claim his lady love under the noses of her whole family. Thus begins a saga.",14.4012,/2CAL2433ZeIihfX1Hb2139CX0pW.jpg,1995-10-20,Dilwale Dulhania Le Jayenge,False,8.515,4573,"Comedy, Drama, Romance"
False,/qvcOovScPoRalRxDy50rYSYFree.jpg,"35, 10749",10591,en,The Girl Next Door,"Exceptionally ambitious high schooler Matthew has aspirations for a career in politics when he falls in love with his gorgeous 19-year-old neighbor, Danielle. But Matthew's bright future is jeopardized when he finds Danielle was once a porn star. As Danielle's past catches up with her, Matthew's love for her forces him to re-evaluate his goals.",14.3978,/5mVyFHSY2rSsNgD4NfEwV82HigU.jpg,2004-04-09,The Girl Next Door,False,6.733,3961,"Comedy, Romance"
False,/sJpbDELfC8VjlRBOOkMJxxWpUg7.jpg,"53, 12, 28",27578,en,The Expendables,"Barney Ross leads a band of highly skilled mercenaries including knife enthusiast Lee Christmas, a martial arts expert Yin Yang, heavy weapons specialist Hale Caesar, demolitionist Toll Road, and a loose-cannon sniper Gunner Jensen. When the group is commissioned by the mysterious Mr. Church to assassinate the dictator of a small South American island, Barney and Lee visit the remote locale to scout out their opposition and discover the true nature of the conflict engulfing the city.",14.3905,/j09ZkH6R4JWVylBcDai1laCmGw7.jpg,2010-08-07,The Expendables,False,6.252,8235,"Thriller, Adventure, Action"
False,/9caD0fGCrp96JTFFeGyI0CGNj7.jpg,"36, 10752, 18, 12",967,en,Spartacus,"The rebellious Thracian Spartacus, born and raised a slave, is sold to Gladiator trainer Batiatus. After weeks of being trained to kill for the arena, Spartacus turns on his owners and leads the other slaves in rebellion. As the rebels move from town to town, their numbers swell as escaped slaves join their ranks. Under the leadership of Spartacus, they make their way to southern Italy, where they will cross the sea and return to their homes.",14.3839,/r0Fgg1GyZgzokaiw2HFQv3oPaL2.jpg,1960-10-13,Spartacus,False,7.537,2366,"History, War, Drama, Adventure"
False,/aTLq0TMKdsmIy1ZyFM1LfPs326d.jpg,"18, 878, 53",6479,en,I Am Legend,"Robert Neville is a scientist who was unable to stop the spread of the terrible virus that was incurable and man-made. Immune, Neville is now the last human survivor in what is left of New York City and perhaps the world. For three years, Neville has faithfully sent out daily radio messages, desperate to find any other survivors who might be out there. But he is not alone.",14.3805,/iPDkaSdKk2jRLTM65UOEoKtsIZ8.jpg,2007-12-12,I Am Legend,False,7.21,16722,"Drama, Science Fiction, Thriller"
False,/xcjJ5khg2yzOa282mza39Lbrm7j.jpg,"27, 18",9552,en,The Exorcist,"When a mysterious entity possesses a young girl, her mother seeks the help of two Catholic priests to save her life.",14.3764,/5x0CeVHJI8tcDx8tUUwYHQSNILq.jpg,1973-12-26,The Exorcist,False,7.7,8565,"Horror, Drama"
False,/i1yf91svRHX45l9BXL8rVFzLoPH.jpg,"27, 53, 12",578,en,Jaws,"When the seaside community of Amity finds itself under attack by a dangerous great white shark, the town's chief of police, a young marine biologist, and a grizzled shark hunter embark on a desperate quest to kill the beast before it strikes again.",14.36,/tjbLSFwi0I3phZwh8zoHWNfbsEp.jpg,1975-06-20,Jaws,False,7.681,11448,"Horror, Thriller, Adventure"
False,/uvitbjFU4JqvMwIkMWHp69bmUzG.jpg,"18, 80",598,pt,Cidade de Deus,"In the poverty-stricken favelas of Rio de Janeiro in the 1970s, two young men choose different paths. Rocket is a budding photographer who documents the increasing drug-related violence of his neighborhood, while José “Zé” Pequeno is an ambitious drug dealer diving into a dangerous life of crime.",14.3574,/k7eYdWvhYQyRQoU2TB2A2Xu2TfD.jpg,2002-08-30,City of God,False,8.429,8111,"Drama, Crime"
False,/AoSZyb37ljMAxw0RdeQEBHKtgcc.jpg,"10751, 16, 12, 35, 14",330457,en,Frozen II,"Elsa, Anna, Kristoff and Olaf head far into the forest to learn the truth about an ancient mystery of their kingdom.",14.3536,/mINJaa34MtknCYl5AjtNJzWj8cD.jpg,2019-11-20,Frozen II,False,7.233,10231,"Family, Animation, Adventure, Comedy, Fantasy"
False,/rcEDPOOOUTLFxLLQJggfLffbofe.jpg,"16, 28, 14",810693,ja,劇場版 呪術廻戦 0,"Yuta Okkotsu is a nervous high school student who is suffering from a serious problem—his childhood friend Rika has turned into a curse and won't leave him alone. Since Rika is no ordinary curse, his plight is noticed by Satoru Gojo, a teacher at Jujutsu High, a school where fledgling exorcists learn how to combat curses. Gojo convinces Yuta to enroll, but can he learn enough in time to confront the curse that haunts him?",14.3492,/23oJaeBh0FDk2mQ2P240PU9Xxfh.jpg,2021-12-24,Jujutsu Kaisen 0,False,8.113,1700,"Animation, Action, Fantasy"
False,/uo2uaD6vNi62gyf13UMQ3cp7z4O.jpg,"28, 80, 53",273481,en,Sicario,An idealistic FBI agent is enlisted by a government task force to aid in the escalating war against drugs at the border area between the U.S. and Mexico.,14.3279,/lz8vNyXeidqqOdJW9ZjnDAMb5Vr.jpg,2015-09-17,Sicario,False,7.417,9467,"Action, Crime, Thriller"
False,/Ary1sG0AHn4V1DFrwV7g72Fomq0.jpg,"10402, 18, 35",1620551,it,Non abbiam bisogno di parole,"A teenager, the only hearing member of a deaf family, finds her voice and learns to believe in herself through her passion for singing.",14.3274,/4Tf0qTA73XLhBnfP6YgvqtLZBnt.jpg,2026-04-03,Feel My Voice,False,6.5,82,"Music, Drama, Comedy"
False,/70Rm9ItxKuEKN8iu6rNjfwAYUCJ.jpg,"27, 53",760104,en,X,"In 1979, a group of young filmmakers set out to make an adult film in rural Texas, but when their reclusive, elderly hosts catch them in the act, the cast find themselves fighting for their lives.",14.3139,/lopZSVtXzhFY603E9OqF7O1YKsh.jpg,2022-03-17,X,False,6.719,3905,"Horror, Thriller"
False,/k6tdiMTO39RQj3dhfspuzprfoe0.jpg,"80, 28, 53",941109,en,Play Dirty,"Expert thief Parker gets a shot at a major heist, but to pull it off he and his team must outsmart a South American dictator, the New York mob, and the world's richest man.",14.3003,/ovZ0zq0NwRghtWI1oLaM0lWuoEw.jpg,2025-09-30,Play Dirty,False,6.6,601,"Crime, Action, Thriller"
False,/yGByIyqgJerCw7AAphTrTAlrdkJ.jpg,"28, 10752, 53, 36",1328803,en,Prisoner of War,British RAF Wing Commander James Wright is captured by the Japanese during WWII and forced to fight in brutal hand-to-hand combat. The Japanese soldiers get more than they bargained for when Wright’s years of martial arts training in Hong Kong prove him to be a formidable opponent.,14.2671,/4T4yRG6iskDcfMeoLuUZEJYCrjL.jpg,2025-09-19,Prisoner of War,False,7.1,171,"Action, War, Thriller, History"
False,/3nqxXZ7QixMeWoQD10cw6FZf277.jpg,"12, 35, 10751, 14",118,en,Charlie and the Chocolate Factory,"A young boy wins a tour through the most magnificent chocolate factory in the world, led by the world's most unusual candy maker.",14.258,/iKP6wg3c6COUe8gYutoGG7qcPnO.jpg,2005-07-13,Charlie and the Chocolate Factory,False,7.038,16041,"Adventure, Comedy, Family, Fantasy"
False,/y2Ca1neKke2mGPMaHzlCNDVZqsK.jpg,"28, 35, 53",718930,en,Bullet Train,"Unlucky assassin Ladybug is determined to do his job peacefully after one too many gigs gone off the rails. Fate, however, may have other plans, as Ladybug's latest mission puts him on a collision course with lethal adversaries from around the globe—all with connected, yet conflicting, objectives—on the world's fastest train.",14.2578,/j8szC8OgrejDQjjMKSVXyaAjw3V.jpg,2022-08-03,Bullet Train,False,7.412,7417,"Action, Comedy, Thriller"
False,/qx9ts2hBYJrkIQxhryitxnLlm2u.jpg,"16, 10751, 14, 12",62177,en,Brave,"In the mystical Scottish Highlands, Merida is the princess of a kingdom ruled by King Fergus and Queen Elinor. An unruly daughter and an accomplished archer, Merida one day defies a sacred custom of the land and inadvertently brings turmoil to the kingdom. In an attempt to set things right, Merida seeks out an eccentric old Wise Woman and is granted an ill-fated wish. Also figuring into Merida's quest — and serving as comic relief — are the kingdom's three lords: the enormous Lord MacGuffin, the surly Lord Macintosh, and the disagreeable Lord Dingwall.",14.2555,/1XAuDtMWpL0sYSFK0R6EZate2Ux.jpg,2012-06-21,Brave,False,7.022,14088,"Animation, Family, Fantasy, Adventure"
False,/gklkxY0veMajdCiGe6ggsh07VG2.jpg,"10751, 35, 12, 16",940551,en,Migration,"After a migrating duck family alights on their pond with thrilling tales of far-flung places, the Mallard family embarks on a family road trip, from New England, to New York City, to tropical Jamaica.",14.2482,/ldfCF9RhR40mppkzmftxapaHeTo.jpg,2023-12-06,Migration,False,7.35,2216,"Family, Comedy, Adventure, Animation"
False,/liiPM38H376CDqxJ7VeQjan5YUy.jpg,"16, 35, 12, 10751",57800,en,Ice Age: Continental Drift,"Manny, Diego, and Sid embark upon another adventure after their continent is set adrift. Using an iceberg as a ship, they encounter sea creatures and battle pirates as they explore a new world.",14.2393,/dfp1BZF7FxbBUyzHvMOI9t8NWDD.jpg,2012-06-27,Ice Age: Continental Drift,False,6.383,8059,"Animation, Comedy, Adventure, Family"
False,/jsoz1HlxczSuTx0mDl2h0lxy36l.jpg,"14, 28, 35",616037,en,Thor: Love and Thunder,"After his retirement is interrupted by Gorr the God Butcher, a galactic killer who seeks the extinction of the gods, Thor Odinson enlists the help of King Valkyrie, Korg, and ex-girlfriend Jane Foster, who now wields Mjolnir as the Mighty Thor. Together they embark upon a harrowing cosmic adventure to uncover the mystery of the God Butcher’s vengeance and stop him before it’s too late.",14.2384,/pIkRyD18kl4FhoCNQuWxWu5cBLM.jpg,2022-07-06,Thor: Love and Thunder,False,6.372,8486,"Fantasy, Action, Comedy"
False,/n8BYpslKnXDScx4WTWejLel3qZ1.jpg,35,4248,en,Scary Movie 2,"While the original parodied slasher flicks like Scream, Keenen Ivory Wayans's sequel to Scary Movie takes comedic aim at haunted house movies. A group of students visit a mansion called ""Hell House,"" and murderous high jinks ensue.",14.234,/7Eb1JWK0Cb0rbfsYjwfc9g0PbQH.jpg,2001-07-04,Scary Movie 2,False,5.813,5099,Comedy
False,/lZYMXx74pWmbj5Q5jp1QaMvmuuR.jpg,"28, 14, 53",1180831,no,Troll 2,"When a dangerous new troll unleashes devastation across their homeland, Nora, Andreas and Major Kris embark on their most perilous mission yet.",14.2262,/p6xAExLNFbHcLfvSuvLPoM8aqZU.jpg,2025-11-30,Troll 2,False,6.404,459,"Action, Fantasy, Thriller"
False,/h5pAEVma835u8xoE60kmLVopLct.jpg,"16, 10751, 14",16859,ja,魔女の宅急便,"A young witch, on her mandatory year of independent life, finds fitting into a new community difficult while she supports herself by running an air courier service.",14.2182,/Aufa4YdZIv4AXpR9rznwVA5SEfd.jpg,1989-07-29,Kiki's Delivery Service,False,7.834,4526,"Animation, Family, Fantasy"
False,/9trZvBr44UGedUOiGo3jgSUw13e.jpg,"878, 27",300668,en,Annihilation,"A biologist signs up for a dangerous, secret expedition into a mysterious zone where the laws of nature don't apply.",14.2132,/4YRplSk6BhH6PRuE9gfyw9byUJ6.jpg,2018-02-22,Annihilation,False,6.441,9293,"Science Fiction, Horror"
False,/mnNkHbs2onvP54zND5c1Ah5Usaa.jpg,"80, 18, 9648",30018,ko,마더,"A mother lives quietly with her son. One day, a girl is brutally killed, and the boy is charged with the murder. Now, it's his mother's mission to prove him innocent.",14.2019,/8oBnSkZE6GDVugAbLPO6uJd4GcS.jpg,2009-05-28,Mother,False,7.701,1666,"Crime, Drama, Mystery"
False,/5AsIFZ2AJC7JcGpq40aRPuRuaRc.jpg,18,1241752,tl,Rita,"Rita, who finds herself alone when husband Ariel works abroad. They both find solace and sexual satisfaction in other people. When Ariel comes back, they both act like nothing happened. But will this keep their marriage from falling apart?",14.1924,/pXENxAzOBrTSDJGxDcUnlNTNmWr.jpg,2024-03-22,Rita,False,6.0,20,Drama
False,,"18, 10749",737057,ko,수상한 진료실: 엄마친구의 특별한 치료,"A sick hospitalization life in a hospital run by a mother's friend. Shin, who injured her leg in an accident, is admitted to the hospital of her mother's friend Ayumi. Unable to bear the cravings accumulated in the increasingly prolonged hospital life, God secretly masturbates and gets caught by nurse Koharu. Rather than being surprised, Koharu covets God's secret place as an excuse for massage. Moreover, it turns out that Ayumi also has a secret secret.",14.1854,/sP1s76Er7RlV9FyfMkrEowE1wk6.jpg,2018-03-06,Suspicious Practice Room: Special Treatment of Mother's Friend,False,2.7,3,"Drama, Romance"
False,/eTvN54pd83TrSEOz6wbsXEJktCV.jpg,"10752, 28, 53",882569,en,Guy Ritchie's The Covenant,"During the war in Afghanistan, a local interpreter risks his own life to carry an injured sergeant across miles of grueling terrain.",14.18,/kVG8zFFYrpyYLoHChuEeOGAd6Ru.jpg,2023-04-19,Guy Ritchie's The Covenant,False,7.717,3122,"War, Action, Thriller"
False,/fqv8v6AycXKsivp1T5yKtLbGXce.jpg,"878, 12, 28",653346,en,Kingdom of the Planet of the Apes,"Several generations following Caesar's reign, apes – now the dominant species – live harmoniously while humans have been reduced to living in the shadows. As a new tyrannical ape leader builds his empire, one young ape undertakes a harrowing journey that will cause him to question all he's known about the past and to make choices that will define a future for apes and humans alike.",14.1779,/gKkl37BQuKTanygYQG1pyYgLVgf.jpg,2024-05-08,Kingdom of the Planet of the Apes,False,7.056,4196,"Science Fiction, Adventure, Action"
False,/eHaazLxM5LRMh0ySkVy7SK6wUWt.jpg,"12, 28, 878",101299,en,The Hunger Games: Catching Fire,"After surviving the Hunger Games, Katniss and Peeta struggle with the consequences of their victory as unrest spreads across Panem. Forced back into the spotlight, they become symbols of hope and resistance while the Capitol prepares a new and deadly challenge that will change the future of the nation forever.",14.1632,/vrQHDXjVmbYzadOXQ0UaObunoy2.jpg,2013-11-15,The Hunger Games: Catching Fire,False,7.427,18339,"Adventure, Action, Science Fiction"
False,/6TjllWT3cGrPFyqDXurVZ3L8bBi.jpg,"9648, 53, 18",745,en,The Sixth Sense,"Following an unexpected tragedy, child psychologist Malcolm Crowe meets a nine year old boy named Cole Sear, who is hiding a dark secret.",14.1554,/vOyfUXNFSnaTk7Vk5AjpsKTUWsu.jpg,1999-08-06,The Sixth Sense,False,7.95,12754,"Mystery, Thriller, Drama"
False,/egVj5Y9f79xPnyAQJmeDR0Uwow3.jpg,"53, 18, 10749",2251,en,Unfaithful,A New York suburban couple's marriage goes dangerously awry when the wife indulges in an adulterous fling.,14.1521,/bjiHEhuiwhIygzjczbTPAA07cGc.jpg,2002-05-10,Unfaithful,False,6.682,1694,"Thriller, Drama, Romance"
False,/cDJ61O1STtbWNBwefuqVrRe3d7l.jpg,"12, 14, 28",10195,en,Thor,"Against his father Odin's will, The Mighty Thor - a powerful but arrogant warrior god - recklessly reignites an ancient war. Thor is cast down to Earth and forced to live among humans as punishment. Once here, Thor learns what it takes to be a true hero when the most dangerous villain of his world sends the darkest forces of Asgard to invade Earth.",14.1397,/prSfAi1xGrhLQNxVSUFh61xQ4Qy.jpg,2011-04-21,Thor,False,6.769,22231,"Adventure, Fantasy, Action"
False,/oVa4o0C5Fa7G36qHY48n3KHGBDX.jpg,"27, 9648, 878",1091,en,The Thing,A research team in Antarctica is hunted by a shape-shifting alien that assumes the appearance of its victims.,14.1387,/tzGY49kseSE9QAKk47uuDGwnSCu.jpg,1982-06-25,The Thing,False,8.07,7837,"Horror, Mystery, Science Fiction"
False,/pYgj8e2Y6RufnSyOA6OnzmxFXxZ.jpg,"27, 18, 9648",530385,en,Midsommar,"Several friends travel to Sweden to study as anthropologists a summer festival that is held every ninety years in the remote hometown of one of them. What begins as a dream vacation in a place where the sun never sets, gradually turns into a dark nightmare as the mysterious inhabitants invite them to participate in their disturbing festive activities.",14.1281,/7LEI8ulZzO5gy9Ww2NVCrKmHeDZ.jpg,2019-07-03,Midsommar,False,7.152,7984,"Horror, Drama, Mystery"
False,/2QMgoiDlTmrO9FngZft8GgZ2SbX.jpg,"10751, 16, 12, 35",270946,en,Penguins of Madagascar,"Skipper, Kowalski, Rico and Private join forces with undercover organization The North Wind to stop the villainous Dr. Octavius Brine from destroying the world as we know it.",14.1218,/dXbpNrPDZDMEbujFoOxmMNQVMHa.jpg,2014-11-22,Penguins of Madagascar,False,6.5,4437,"Family, Animation, Adventure, Comedy"
False,/hSwgaqwaXMLyeDnPhehLPcYfTdp.jpg,27,292238,cn,人皮高跟鞋,"Someone has been skinning dead bodies and using their hide to make shoes. All of a sudden, a shoe factory whose business has been on the low side for some time improves tremendously.",14.1186,/3aAjnQIfN10t6vuYHuflQAMbDYm.jpg,1996-01-06,Horrible High Heels,False,4.2,12,Horror
False,/A6ki5Sk12qgFvejikLv16kmqxqk.jpg,"53, 18",1145758,en,Birder,A birdwatcher invades a nude queer campground on a remote lake in the New Hampshire wilds. He wears whatever he needs to ensnare the locals in his dark fetish in this nightmarish erotic thriller. Consent has never been more deadly.,14.1039,/h3N0NwMV1GyxOrtSwABQDqqA74.jpg,2023-08-11,Birder,False,4.071,7,"Thriller, Drama"
