adult,backdrop_path,genre_ids,id,original_language,original_title,overview,popularity,poster_path,release_date,title,video,vote_average,vote_count,genre_names
False,/lU1fQews2gye23PocVE48CsTmOQ.jpg,"28, 18, 10749, 53",4588,zh,色‧戒,"During World War II, a secret agent must seduce and assassinate an official who works for the Japanese puppet government in Shanghai.",11.1588,/6c1tqfJEBuIyhQC19SLlLQAUAvJ.jpg,2007-09-24,"Lust, Caution",False,7.3,782,"Action, Drama, Romance, Thriller"
False,/ez8EB8pWGZYDWx9OEVqDR5r9hQc.jpg,"27, 53",1503900,en,Die'ced: Reloaded,"Benny escapes an asylum on Halloween, masked as a scarecrow and hungry for blood. In 1980s Seattle, the hunt is on - and no one is safe.",11.1585,/haFDZfpKszHq7DXvuQd5Zz7shQW.jpg,2025-08-08,Die'ced: Reloaded,False,5.4,9,"Horror, Thriller"
False,/sP6MelWwMBkTuHDqwYh8sjF28qS.jpg,"18, 10749, 10770",248684,en,Cider with Rosie,"This adaptation of Laurie Lee's autobiographical novel follows a young man's maturation in the country town of Gloucestershire near the end of World War I.  As young Laurie comes of age under the protective eye of his mother, he learns to live with an eccentric collection of friends, neighbours, and relatives.  As he enters his teenage years, Laurie discovers women.",11.1558,/bmSeVFaKiOhk52mF6aNIKxYU6r5.jpg,1998-12-26,Cider with Rosie,False,5.4,8,"Drama, Romance, TV Movie"
False,/jqXCrMZDta1qT3pXTeYArAfolAn.jpg,"18, 53",75345,en,I Melt with You,"Former college friends meet up for a reunion that leads them to face the apparent disillusionment that defines their lives. After a week of excessive drug and alcohol abuse, events lead them to contemplate fulfilling a self destructive pact they made when they were young.",11.1369,/6Xq0cwrXOgmyKCTtH3KlOJFS8uu.jpg,2011-12-09,I Melt with You,False,5.3,83,"Drama, Thriller"
False,/lMCifuTi0mWFHfyUoJSeQ5R3JjX.jpg,"27, 80, 9648, 53",86667,en,Grip of the Strangler,A researcher investigating a notorious serial killer who was hanged 20 years earlier seemingly becomes possessed by the long dead strangler.,11.136,/5RdrW6vghcqyyEQ8pqeAHSxfy2k.jpg,1958-05-11,Grip of the Strangler,False,5.9,39,"Horror, Crime, Mystery, Thriller"
False,/dCwIUV23UFYITQMq93gqWsjfc1t.jpg,"35, 12, 28",244998,ms,Senario XX,"One alien crashed in a small village in Malaysia, create havoc with the villagers. To make it worst, there is some bad alien who pursue him.",11.1209,/scoQLzyPEsL7pSzN22Af2xKzl35.jpg,2005-05-19,Senario XX,False,0.0,0,"Comedy, Adventure, Action"
False,/adR7ehgGwnGLNTbqLb28PdgOHAr.jpg,"18, 80, 10749",154515,en,"Dance, Fools, Dance","When misfortune hits hard on the Jordan family of Chicago's upper class, Bonnie Jordan, a dazzling and witty girl, finds a job as an aspiring reporter; however, her naive younger brother Rodney takes a twisted path and gets involved with the wrong people.",11.1174,/dwieBi0VsQpGnKLMOomldAWgipR.jpg,1931-02-07,"Dance, Fools, Dance",False,6.4,20,"Drama, Crime, Romance"
False,/8zhviPFJx25k8PbUOUL5sLOy9XE.jpg,"80, 18, 53",242,en,The Godfather Part III,"In the midst of trying to legitimize his business dealings in 1979 New York and Italy, aging mafia don, Michael Corleone seeks forgiveness for his sins while taking a young protege under his wing.",11.1167,/lm3pQ2QoQ16pextRsmnUbG2onES.jpg,1990-12-25,The Godfather Part III,False,7.418,6745,"Crime, Drama, Thriller"
False,/mZj8EUr6F1x2PWZjKPxaeYd5WRw.jpg,"12, 16, 35, 10751, 14",11688,en,The Emperor's New Groove,"Emperor Kuzco is turned into a llama by his ex-administrator Yzma, and must now regain his throne and his human form with the help of Pacha, a gentle llama herder.",11.1058,/isA0acj3ONKBLp1pKadUNzxEPFv.jpg,2000-12-15,The Emperor's New Groove,False,7.557,7204,"Adventure, Animation, Comedy, Family, Fantasy"
False,,99,223195,en,The Making of a Legend: Gone with the Wind,"This documentary revisits the making of Gone with the Wind via archival footage, screen tests, insightful interviews and rare film footage.",11.1051,/q9CLy7v5Y9aZgMdJIMYd0imqzBA.jpg,1988-10-01,The Making of a Legend: Gone with the Wind,False,8.0,3,Documentary
False,/rQaHA74pevnGsxcKGaoZVGWe9TC.jpg,"16, 10751, 35, 14, 18, 10402",508442,en,Soul,"Joe Gardner is a middle school teacher with a love for jazz music. After a successful audition at the Half Note Club, he suddenly gets into an accident that separates his soul from his body and is transported to the You Seminar, a center in which souls develop and gain passions before being transported to a newborn child. Joe must enlist help from the other souls-in-training, like 22, a soul who has spent eons in the You Seminar, in order to get back to Earth.",11.1035,/6jmppcaubzLF8wkXM36ganVISCo.jpg,2020-12-25,Soul,False,8.094,11248,"Animation, Family, Comedy, Fantasy, Drama, Music"
False,/qPucZJvvI4LNrDkUIMoMl3zEl4Q.jpg,"878, 28, 18, 53, 10770",69315,en,Battlestar Galactica: Razor,"The history and adventures of the Battlestar Pegasus, from shortly before the Cylon invasion to shortly after Lee Adama is made commander. The story is told through the eyes of and largely focuses on one particular member of Pegasus's crew, Kendra Shaw.",11.1022,/tO3EoFJj0FJjKelDW5SUtquDIy2.jpg,2007-11-12,Battlestar Galactica: Razor,False,7.178,452,"Science Fiction, Action, Drama, Thriller, TV Movie"
False,/tIfLu82gSgcgsXS6jvNFjwMqcKp.jpg,"28, 35, 53",1319895,en,Hostile Takeover,"Follows Pete, a professional hitman, as he faces a group of assassins after the boss of a crime syndicate suspects disloyalty due to his attendance at Workaholics Anonymous meetings.",11.0961,/AvAgo0AHVAFAPr0vZLAzHPq0ftL.jpg,2025-08-08,Hostile Takeover,False,6.909,66,"Action, Comedy, Thriller"
False,/mGaMW6VP43jHT6D7E5flk1DJq4Y.jpg,"16, 10751, 35",56553,en,Rescue Squad Mater,"Lightning McQueen and Mater are driving in Radiator Springs and drive past Red, who is hosing some plants near Stanley. Mater tells Lightning that he used to be a firetruck, but Lightning doesn't believe Mater.",11.0848,/2mLBoPMSXshWjknql6dxc2DAfZ1.jpg,2008-10-27,Rescue Squad Mater,False,5.9,100,"Animation, Family, Comedy"
False,,35,1153497,te,చిన్నారి ముద్దుల పాప,"The film begins with 3 happy bachelors Anand, Sudhakar, & Siva who share an apartment with frequent parties and flings. One day, a baby named Maya arrives on their doorstep with a note revealing she is the result of the perfidy of one of them. Then, Anand thinks back about his first love Sunita and they spent the night together. Later, Sunita misconstrues, loathes, and splits from Anand catching sight of his closeness with another girl. So, Anand declares Maya as his child. Accordingly, it forlorn the men to take care of the baby and attempts to dispose of her but fail as they are strongly correlated. Parallelly as a glimpse, Sudhakar & Siva love their neighbors Shanti a modern girl & Jyoti a widow respectively. Aside from this, a dreadful gangster Johnson smuggles precious diamonds on time which struck at Maya's cradle, and they back her.",11.0834,,1990-11-22,Chinnari Muddula Papa,False,0.0,0,Comedy
False,/bdI6U1mT0kCdTJ6TWtiFxQ42GSn.jpg,"80, 18, 53",242582,en,Nightcrawler,"When Lou Bloom, desperate for work, muscles into the world of L.A. crime journalism, he blurs the line between observer and participant to become the star of his own story. Aiding him in his effort is Nina, a TV-news veteran.",11.082,/j9HrX8f7GbZQm1BrBiR40uFQZSb.jpg,2014-10-23,Nightcrawler,False,7.709,11556,"Crime, Drama, Thriller"
False,/8OuE97mvLVhNUj7ANhHFsISvPVz.jpg,"14, 12, 28, 10751, 10749",102651,en,Maleficent,"A beautiful, pure-hearted young woman, Maleficent has an idyllic life growing up in a peaceable forest kingdom, until one day when an invading army threatens the harmony of the land. She rises to be the land's fiercest protector, but she ultimately suffers a ruthless betrayal – an act that begins to turn her heart into stone. Bent on revenge, Maleficent faces an epic battle with the invading King's successor and, as a result, places a curse upon his newborn infant Aurora. As the child grows, Maleficent realizes that Aurora holds the key to peace in the kingdom – and to Maleficent's true happiness as well.",11.0734,/bDG3yei6AJlEAK3A5wN7RwFXQ7V.jpg,2014-05-28,Maleficent,False,7.086,13616,"Fantasy, Adventure, Action, Family, Romance"
False,/wbhoYwvqgadchfMgUOfOp87QZDS.jpg,"36, 10752, 18",1196946,hi,इक्कीस,"Second Lieutenant and India's youngest Param Vir Chakra recipient, Arun Khetarpal, gave his life fighting for his battalion and the country during the 1971 Battle of Basantar. Ikkis also takes a reflective look at the futility of war through the eyes of Khetarpal's father, who visits his ancestral home in Sargodha and Alma Mater for reunion, which now happens to be in post-partition Pakistan, 30 years later.",11.0678,/8PWu0V10nMqG5SrA13wLRXTD2fH.jpg,2026-01-01,Ikkis,False,5.958,11,"History, War, Drama"
False,/yfxwNfjhnE5aIrEXTw29AuR7cOO.jpg,"27, 10770",23692,en,The Initiation of Sarah,"Shy misfit Sarah Goodwin has a secret gift: the ability to control — and destroy — with her mind. When Sarah goes off to college with her more outgoing and popular sister, Patty, their plans to join the most prestigious sorority on campus are scuttled by snobby president, Jennifer Lawrence. Separated from her sister, Sarah is taken in by a rival, less popular sorority, whose mysterious house mother, Mrs. Hunter, is harboring a secret of her own: a scheme to harness Sarah's terrifying power for revenge. Betrayed by Patty, humiliated by Jennifer, it can only be a matter of time before Sorority Hell Week erupts in flame!",11.0665,/scDcr5mSsV3OGKWKGH7Bxkefgz0.jpg,1978-02-06,The Initiation of Sarah,False,5.467,30,"Horror, TV Movie"
False,/tQ8oJYjdiwCIJTlStEnZMGnwlGE.jpg,37,530161,en,Jesse James vs. The Black Train,"Jesse James is a famous outlaw. While many outlaws have encountered the Black Train, he feels unstoppable and tries to take on the train despite getting advice to the contrary.",11.0647,/kcbAH1ILcdcSgUfBBHcmGcAdnkp.jpg,2018-05-01,Jesse James vs. The Black Train,False,1.5,4,Western
False,/f2CcwbPUb3IXIfwDaz4DygDgLwo.jpg,18,482303,de,Murer - Anatomie eines Prozesses,"Franz Murer, the Butcher of Vilnius, a former Austrian SS officer, established, organized, and ruled the Vilnius ghetto in Lithuania during the World War II. Different survivors of the Shoah testify when he is judged in 1963, hoping to do justice, but, although the evidence is overwhelming, the desire to close this obscure chapter of history seems to surpass the desire for justice.",11.0624,/xQiYD5G2jts0C5SDFbvEtOJGk4N.jpg,2018-03-16,Murer: Anatomy of a Trial,False,5.983,30,Drama
False,/88J3AZ8R5U4JZqE9luHyR8bhsyz.jpg,"27, 53, 35, 9648",942890,en,House of Darkness,"Driving home to her secluded estate after meeting at a local bar, a player out to score thinks his beautiful, mysterious date will be another casual hook-up. While getting acquainted, their flirtation turns playful, sexy and sinister. Hoping to get lucky, his luck may have just run out.",11.0572,/1udlXpDFZ4Rc52cX4jmYlOzQecH.jpg,2022-09-09,House of Darkness,False,5.081,136,"Horror, Thriller, Comedy, Mystery"
False,/h5hCdU9KvcCbBihSNfn3vtML7tV.jpg,"10751, 35, 10402",1566269,en,The First Snow of Fraggle Rock,"When the holidays are filled with unexpected adventures and challenges, the Fraggles learn to appreciate each day for being unique and special, like a snowflake.",11.0566,/xyxAOTToALUkeFS9x5V6MOv8YWr.jpg,2025-12-04,The First Snow of Fraggle Rock,False,6.9,11,"Family, Comedy, Music"
False,/uUJuPiZh1QfIeTa1GeLWqnEkaP2.jpg,18,1302011,tl,Init,"When a young barrio lass moves in to the city to study, she lives in a boarding house with other college students. Unknown to them, behind her shy and timid personality is a woman with insatiable hunger for sex.",11.0512,/fGY13rtdRzFqTkDMi5JayUWg6vL.jpg,2024-07-30,Init,False,6.045,11,Drama
False,/bacOuUnRBoAO1NjMfsAGX2EKRrS.jpg,18,1366,en,Rocky,"Rocky Balboa is a Philadelphia club fighter who seems to be going nowhere. But when a stroke of fate puts him in the ring with a world heavyweight champion, Rocky knows that it's his one shot at the big time — a once-in-a-lifetime opportunity to go the distance and come out a winner!",11.0465,/hEjK9A9BkNXejFW4tfacVAEHtkn.jpg,1976-12-03,Rocky,False,7.793,8477,Drama
False,/rjDlta1hy3g4ksKVuUIfYcJtYf6.jpg,"28, 80",13056,en,Punisher: War Zone,"Waging his one-man war on the world of organized crime, ruthless vigilante-hero Frank Castle sets his sights on overeager mob boss Billy Russoti. After Russoti is left horribly disfigured by Castle, he sets out for vengeance under his new alias: Jigsaw. With the ""Punisher Task Force"" hot on his trail and the FBI unable to take Jigsaw in, Frank must stand up to the formidable army that Jigsaw has recruited before more of his evil deeds go unpunished.",11.0437,/oOvKJgYUIpfswGHAdW6159bPbvM.jpg,2008-12-05,Punisher: War Zone,False,5.833,1267,"Action, Crime"
False,/hwPnxzIgQFfXl5zP0Yh8bViCMzf.jpg,"14, 12, 28",57158,en,The Hobbit: The Desolation of Smaug,"The Dwarves, Bilbo and Gandalf have successfully escaped the Misty Mountains, and Bilbo has gained the One Ring. They all continue their journey to get their gold back from the Dragon, Smaug.",11.0334,/xQYiXsheRCDBA39DOrmaw1aSpbk.jpg,2013-12-11,The Hobbit: The Desolation of Smaug,False,7.575,14003,"Fantasy, Adventure, Action"
False,/jJJQ1PPXUEchqyZ9YyWzgSNU39Z.jpg,"28, 80, 53",581528,ko,악인전,"After barely surviving a brutal attack by a sadistic serial killer, crime boss Jang Dong-su is left humiliated. Determined to catch the killer known as K, he forms an uneasy alliance with Jung Tae-seok, a relentless and incorruptible detective who often disrupts his illegal business. However, while Jang Dong-su wants K dead, Jung Tae-suk is determined to bring him to justice. With a deal in place—whoever finds K first will decide his fate—the hunt begins, blurring the lines between crime and law.",11.0273,/oHlM4abRm6BzrRcz9Nup1uidw9H.jpg,2019-05-15,"The Gangster, the Cop, the Devil",False,7.841,1413,"Action, Crime, Thriller"
False,/giYuvpmpZbwkT3NtX4WdNYqGhxw.jpg,35,8363,en,Superbad,Two co-dependent high school seniors are forced to deal with separation anxiety after their plan to stage a booze-soaked party goes awry.,11.0177,/ek8e8txUyUwd2BNqj6lFEerJfbq.jpg,2007-08-17,Superbad,False,7.259,7931,Comedy
False,/6xEdQND18WFuKeRNwfzMfKHoK5N.jpg,"27, 35",1450527,en,Forbidden Fruits,"Free Eden employee Apple secretly runs a witchy femme cult in the basement of the mall store after hours – with fellow fruits Cherry and Fig. But, when new hire Pumpkin challenges their performative sisterhood, the women are forced to face their own poisons or succumb to a bloody fate.",11.0166,/t3hvrrrqvRoURz4y1A1aCys6WD9.jpg,2026-03-27,Forbidden Fruits,False,0.0,0,"Horror, Comedy"
False,/qcDDn7WeKBenM4nLlOPXAeJ4hpg.jpg,"53, 28, 12",1280450,en,Stolen Girl,"In 1993, Maureen’s six-year-old daughter Amina is snuck out of the country by her ex-husband, Karim. After years of unsuccessful attempts to find her, Maureen intersects with a professional retriever of internationally abducted children who promises to help her find Amina in exchange for her collaboration.",11.0091,/fZlNXEHZsBp7unqw009MeBbMv87.jpg,2025-09-04,Stolen Girl,False,6.245,139,"Thriller, Action, Adventure"
False,/kXeUzmOMqdySaeknuuYUTHzMC8H.jpg,35,1586841,es,El paseo 8,"After meeting in Paris, Rosa and Pierre, her French boyfriend, decided to travel to Colombia with the hope of celebrating their wedding and spending their honeymoon. But plans change after introducing the in-laws, who, driven by a bombshell secret, decide to stop the happy marriage at all costs. Amid absurd situations and a dog who, apparently, is the only sane one on the trip, the long-awaited honeymoon will end up turning into a real honeymoon from hell.",11.008,/oP4BuJ4toBC5KLczNy9c38cMgbr.jpg,2025-12-25,The Trip 8,False,8.0,7,Comedy
False,/1EVHnzF3gescyQZSqwbx5LfQ1EN.jpg,"10749, 35",1618945,en,Yoh! Bestie,"Thando is perpetually unlucky in love, but when her bestie returns from his travels with a fiancée in tow, she's forced to face a new emotion — jealousy.",11.0071,/9wBzRaeWfELNOPmcvOVTmB3kDEl.jpg,2026-02-06,Yoh! Bestie,False,6.25,36,"Romance, Comedy"
False,/shqLeIkqPAAXM8iT6wVDiXUYz1p.jpg,"16, 14, 10751",12429,ja,崖の上のポニョ,"When Sosuke, a young boy who lives on a clifftop overlooking the sea, rescues a stranded goldfish named Ponyo, he discovers more than he bargained for. Ponyo is a curious, energetic young creature who yearns to be human, but even as she causes chaos around the house, her father, a powerful sorcerer, schemes to return Ponyo to the sea.",11.007,/yp8vEZflGynlEylxEesbYasc06i.jpg,2008-07-19,Ponyo,False,7.756,4731,"Animation, Fantasy, Family"
False,/3zCPI4JFc54xvLaJ71oI2KoP3az.jpg,"80, 9648, 53",1949,en,Zodiac,"Over the course of a decade, editors of the San Francisco Chronicle entice themselves in the murders of the Zodiac Killer. However, as time runs its course, interest in the case dwindles in the eyes of the professionals. The Killer stops interacting with the public. However, believing he has the answers, an amateur cartoonist from the initial sightings races against time to prevent what he believes is another murder.",11.0045,/6YmeO4pB7XTh8P8F960O1uA14JO.jpg,2007-03-02,Zodiac,False,7.528,11392,"Crime, Mystery, Thriller"
False,/aP1Rxa39OdDXx0bP5l4R3LTRxVP.jpg,"80, 18, 53",645861,en,South of Heaven,"Convicted felon Jimmy gets early parole after serving twelve years for armed robbery. Upon his release, he vows to give Annie, his childhood love, now dying from cancer, the best last year of her life – unfortunately it’s not that simple.",11.0023,/sUdlWpnpNIWPIvXDnucLRjDHOvQ.jpg,2021-10-08,South of Heaven,False,6.4,87,"Crime, Drama, Thriller"
False,/1dqFuNiutgBdNF9d5QOQBWHHvft.jpg,"28, 80, 35, 53",1217602,en,London Calling,"After fleeing the UK from a job gone wrong, a down on his luck hitman is forced to babysit the son of his new crime boss and show him how to become a man.",10.9977,/cpQ4VxBJO7vGV3IUdKzSNf4tH9V.jpg,2025-09-18,London Calling,False,6.674,95,"Action, Crime, Comedy, Thriller"
False,/d5EF8OlcVuQWWHtNjmti4kNpbcG.jpg,"12, 18, 37",3090,en,The Treasure of the Sierra Madre,"Two jobless Americans convince a prospector to travel to the mountains of Mexico with them in search of gold. But the hostile wilderness, local bandits, and greed all get in the way of their journey.",10.9958,/pWcst7zVbi8Z8W6GFrdNE7HHRxL.jpg,1948-01-15,The Treasure of the Sierra Madre,False,8.0,1316,"Adventure, Drama, Western"
False,/8SGEzwvQAurvo1WiMHBPMktpfwC.jpg,"99, 18",1072905,en,You Were My First Boyfriend,"In this high school reunion movie turned inside out, filmmaker Cecilia Aldarondo relives her tortured adolescence, wondering if she remembered it all wrong.",10.9951,/3xliKLdSYAFHptvmWC2VZAGa0Ih.jpg,2024-03-01,You Were My First Boyfriend,False,5.0,6,"Documentary, Drama"
False,/5I27oM8XBdGePryOtTJUpnmkl7T.jpg,"10749, 35, 18",882096,en,A California Christmas: City Lights,"Follows Callie and Joseph one year after they fell in love, now running a dairy farm and winery, but their romance is threatened when business and family obligations call Joseph back to the city.",10.985,/rI1ikNMmbeMDZiDDVATYaOeFEHL.jpg,2021-12-16,A California Christmas: City Lights,False,6.6,189,"Romance, Comedy, Drama"
False,/mrejoAr82g4mSfAaq0H7CjtNfqN.jpg,"28, 16, 12, 878, 27",400136,ja,バイオハザード ヴェンデッタ,"When a fearless enemy out for revenge unleashes a brutal and deadly new virus, BSAA captain Chris Redfield enlists the help of Agent Leon S. Kennedy and Professor Rebecca Chambers to bring down the death merchant and save New York City.",10.9839,/kdiMtgjWXEH9QZ85hgmWaSwshjf.jpg,2017-05-27,Resident Evil: Vendetta,False,6.91,1069,"Action, Animation, Adventure, Science Fiction, Horror"
False,/dnDsxTB1a6sl7gpZTXd119x7cyY.jpg,"99, 10402",33046,en,Blue Note - A Story of Modern Jazz,"""It must schwing!"" was the motto of Alfred Lion and Francis Wolff, two German Jewish immigrants who in 1939 set up Blue Note Records, the jazz label that was home to such greats as Miles Davis, John Coltrane, Herbie Hancock, Thelonious Monk, Art Blakey, Dexter Gordon and Sonny Rollins. Blue Note, the most successful movie ever made about jazz, is a testimony to the passion and vision of these two men and certainly swings like the propulsive sounds that made their label so famous.",10.9836,/veUPaKdctSPBErUJTgoJeTXUsGs.jpg,1997-10-01,Blue Note - A Story of Modern Jazz,False,7.2,7,"Documentary, Music"
False,/iJZsj1FFiZjyDyeFqchLbT2nFKn.jpg,"35, 10749",143819,en,The Kiss in the Tunnel,"Produced and directed by George Albert Smith, the film shows a couple sharing a brief kiss as their train passes through a tunnel. The Kiss in the Tunnel is said to mark the beginnings of narrative editing. It is in fact, two films in one, hence the 2 min length.  Firstly, the  G.A. Smith film here  for the central cheeky scene in the carriage.  The train view footage however is Cecil Hepworth's work, entitled 'View From An Engine Front - Shilla Mill Tunnel', edited into two halves in order to provide a visual narrative of the train entering the tunnel before the kiss and then leaving afterwards. More information about the filming of the phantom train ride can be found searching for the Hepworth film separately.",10.9809,/lwdF4ih4E88Icfdk2nKTDMdUd3K.jpg,1899-11-30,The Kiss in the Tunnel,False,5.8,102,"Comedy, Romance"
False,/igtAso6xH7rxqPtOviwoSq2FmpL.jpg,9648,984387,te,సింబా,"Environmental activist Purushottam Reddy, alias Simbaa, wages a battle against industrial pollution. Saving three lives sparks their gratitude journey, fueling a quest to bring justice against nature's adversaries.",10.9806,/kJ70mwxcNguqoWbgqb8Ai3ey8Dr.jpg,2024-08-09,Simbaa,False,0.0,0,Mystery
False,/x9q1C3kPdYCROabEVcbLo9tp6Yg.jpg,"35, 14, 10751, 10770",55739,en,Single Santa Seeks Mrs. Claus,"Nick's plan to let fate bring his wife to him must be altered because he must replace his father as Santa Claus on December 26. Ernst, the right-hand man to several generations of Santas, generates a list of potential mates. Nick dutifully sets off to meet them, but fate may have a candidate after all.",10.9795,/vDluhxh8bGriK368p2G0rx32Yc6.jpg,2004-01-01,Single Santa Seeks Mrs. Claus,False,5.9,31,"Comedy, Fantasy, Family, TV Movie"
False,/vJbEUMeI2AxBUZKjP6ZVeVNNTLh.jpg,"28, 53, 35",749170,en,Heads of State,"The UK Prime Minister and US President have a public rivalry that risks their countries' alliance. But when they become targets of a powerful enemy, they're forced to rely on each other as they go on a wild, multinational run. Allied with Noel, a brilliant MI6 agent, they must find a way to thwart a conspiracy that threatens the free world.",10.9651,/lVgE5oLzf7ABmzyASEVcjYyHI41.jpg,2025-06-24,Heads of State,False,6.83,981,"Action, Thriller, Comedy"
False,/fW4ZCoEZRBqLAJGFQ2g5AdAfPQR.jpg,"10749, 10751, 16, 14",10020,en,Beauty and the Beast,"Follow the adventures of Belle, a bright young woman who finds herself in the castle of a prince who's been turned into a mysterious beast. With the help of the castle's enchanted staff, Belle soon learns the most important lesson of all -- that true beauty comes from within.",10.9557,/hUJ0UvQ5tgE2Z9WpfuduVSdiCiU.jpg,1991-10-22,Beauty and the Beast,False,7.7,10547,"Romance, Family, Animation, Fantasy"
False,/8ohobj5lAIbl5XWw11FywS3IRrS.jpg,"16, 10751, 35, 14, 10749",809,en,Shrek 2,"Happily ever after never seemed so far far away when a trip to meet the in-laws turns into a hilariously twisted adventure for Shrek and Fiona. With the help of his faithful Donkey, Shrek takes on a potion-brewing Fairy Godmother, the pompous Prince Charming, and the ogre-killer, Puss In Boots.",10.9527,/2yYP0PQjG8zVqturh1BAqu2Tixl.jpg,2004-05-19,Shrek 2,False,7.308,13263,"Animation, Family, Comedy, Fantasy, Romance"
False,/vbkW4KerpshPZnP84w9qwSfYrhu.jpg,"27, 53",1198984,en,We Bury the Dead,"After a catastrophic military disaster, the dead don't just rise—they hunt. The military insists they are harmless and slow-moving, offering hope to grieving families. But when Ava enters a quarantine zone searching for her missing husband, she uncovers the horrifying truth: the undead are growing more violent, more relentless, and more dangerous with every passing hour.",10.9381,/xZqo0yPARmyF8TACVNyaOACkYWG.jpg,2026-01-01,We Bury the Dead,False,6.148,122,"Horror, Thriller"
False,/mUffUjlJ007XAzdogdZqhaqSp4O.jpg,"27, 53",9378,en,Thir13en Ghosts,"Arthur and his two children inherit his uncle's estate: a glass house that serves as a prison to twelve ghosts. When the family, accompanied by a nanny and an attorney, enter the house they find themselves trapped inside an evil machine 'designed by the Devil and powered by the dead' to open the Eye of Hell. Aided by a ghost hunter and his rival, a ghost rights activist out to set the ghosts free, the group must do what they can to get out of the house alive.",10.9367,/6yrrddjIjx0ElCRZp5pTZeqrj3k.jpg,2001-10-26,Thir13en Ghosts,False,6.285,2322,"Horror, Thriller"
False,/my7iRgEZyvw7GO09vUJ06fe5oO3.jpg,"27, 35, 18, 53",29426,en,Survival of the Dead,"Off the coast of North America, locals simultaneously fight a zombie epidemic while hoping for a cure to revert their undead relatives back to normal.",10.9359,/2BmqSRt10J2mpJmCgZbo5YYkQLj.jpg,2010-05-06,Survival of the Dead,False,4.873,502,"Horror, Comedy, Drama, Thriller"
False,/n1ItmvzsDV5yLgDodSCLZpFlsP6.jpg,"18, 53, 80",146233,en,Prisoners,"Keller Dover is facing every parent’s worst nightmare. His six-year-old daughter, Anna, is missing, together with her young friend, Joy, and as minutes turn to hours, panic sets in. The only lead is a dilapidated RV that had earlier been parked on their street.",10.9355,/jsS3a3ep2KyBVmmiwaz3LvK49b1.jpg,2013-09-19,Prisoners,False,8.1,12836,"Drama, Thriller, Crime"
