adult,backdrop_path,genre_ids,id,title,original_language,original_title,overview,popularity,poster_path,release_date,softcore,video,vote_average,vote_count,genre_names
False,/po1niVuud0tX86xOFegO5omQ2wX.jpg,"878, 28, 53",1236153,Mercy,en,Mercy,"In the near future, a detective stands on trial accused of murdering his wife. He has ninety minutes to prove his innocence to the advanced AI Judge he once championed, before it determines his fate.",23.2293,/pyok1kZJCfyuFapYXzHcy7BLlQa.jpg,2026-01-19,False,False,7.018,1306,"Science Fiction, Action, Thriller"
False,/dzWGnIAjUafpmY57F6vnm44FwWB.jpg,"18, 10751, 35",1671548,Dear You,zh,给阿嬷的情书,"Grandma Ye Shurou from Chaoshan lived a simple life, enjoying her twilight years. Her grandson, Xiaowei, burdened by debt, secretly traveled to Thailand to find his rumored billionaire grandfather, Zheng Musheng. However, Xiaowei returned with shocking news: his grandfather was long gone, and the person with whom Grandma had exchanged love letters was a complete stranger. As Xiaowei investigated, a love affair hidden for half a century suddenly surfaced, striking Grandma's heart.",23.1224,/rjmhzdVS3Ia535pFawju857e2Na.jpg,2026-04-30,False,False,9.1,21,"Drama, Family, Comedy"
False,/9tI2BBfTPK4pbYxaQZ16Thca9L9.jpg,"18, 53, 10770",530442,"My Teacher, My Obsession",en,"My Teacher, My Obsession","Riley is struggling to make friends after transferring to a new high school where her father, Chris, is an English teacher. When she meets Kyla, they quickly becomes close friends. However, the friendship takes a strange turn when Riley learns that Kyla is obsessed with her dad. Will Kyla successfully seduce Chris and start a twisted new life with him by removing everyone in her path, or will Riley be able to save her father from Kyla’s treacherous plot before it’s too late?",23.1196,/yh06bjJTNu45xyVgpv0wXuWvkgN.jpg,2018-06-12,False,False,4.94,109,"Drama, Thriller, TV Movie"
False,/nv5wwZou159v5OC61i4ElR7OqyY.jpg,"14, 16, 12",4935,Howl's Moving Castle,ja,ハウルの動く城,"Sophie, a young milliner, is turned into an elderly woman by a witch who enters her shop and curses her. She encounters a wizard named Howl and gets caught up in his resistance to fighting for the king.",23.0625,/13kOl2v0nD2OLbVSHnHk8GUFEhO.jpg,2004-09-09,False,False,8.388,11076,"Fantasy, Animation, Adventure"
False,/5rxEnsgriw8z065q51lrvPKYmCL.jpg,"10749, 18",1367642,Reminders of Him,en,Reminders of Him,"When Diem's custodial grandparents adamantly refuse Kenna's attempts to see her daughter, Kenna discovers unexpected compassion, and then something truer and deeper, with former NFL player and local bar owner Ledger. As their secret romance develops, so do the dangers for both of them, leading Kenna toward heartbreak and, ultimately, the hope for a second chance.",23.0463,/7L6rceYgzQ0NeHD7PRDNrRoQ291.jpg,2026-03-11,False,False,7.553,247,"Romance, Drama"
False,/Aueidj1cfpZBOW5KbyVCyKMSZE1.jpg,"18, 10749, 36",585032,Sa Bang-ji,ko,사방지,"Sa Bangji was an intersex person who according to historical records lived during Korea’s Joseon Dynasty. Taken in by a kindly benefactor, Sa Bangji lives in a monastery that is one day visited by a young widow, Lee So-sa, who is in mourning following the death of her husband. The pair’s meeting seems predestined, with the erotic attraction between Sa Bangji and Lee So-sa soon evolving into something far more transcendent – and dangerous.  While aspects of the film – its stylised depiction of female actors and sex – identify it as a product of its time, Sa Bangji is undeniably a milestone in screen representations of intersex people, a film that refuses to shy away from the horrendous stigmatization faced by its titular character.",22.9574,/uFsTrW5qzU2l3YE0ataLoUgfsjJ.jpg,1988-10-29,False,False,6.6,5,"Drama, Romance, History"
False,/s94NjfKkcSczZ1FembwmQZwsuwY.jpg,"878, 12, 28",617126,The Fantastic 4: First Steps,en,The Fantastic 4: First Steps,"Against the vibrant backdrop of a 1960s-inspired, retro-futuristic world, Marvel's First Family is forced to balance their roles as heroes with the strength of their family bond, while defending Earth from a ravenous space god called Galactus and his enigmatic Herald, Silver Surfer.",22.9352,/abqOz6EL3yXyOOafCPZxjL1M5bQ.jpg,2025-07-23,False,False,6.965,3352,"Science Fiction, Adventure, Action"
False,/sDTnMOJ3H5wI38OxObmCtK7wfd5.jpg,"16, 35, 10751, 14",585,"Monsters, Inc.",en,"Monsters, Inc.","Lovable Sulley and his wisecracking sidekick Mike Wazowski are the top scare team at Monsters, Inc., the scream-processing factory in Monstropolis. When a little girl named Boo wanders into their world, it's the monsters who are scared silly, and it's up to Sulley and Mike to keep her out of sight and get her back home.",22.8289,/wFSpyMsp7H0ttERbxY7Trlv8xry.jpg,2001-11-01,False,False,7.849,19756,"Animation, Comedy, Family, Fantasy"
False,/jr8tSoJGj33XLgFBy6lmZhpGQNu.jpg,"16, 12, 14, 35, 10751",315162,Puss in Boots: The Last Wish,en,Puss in Boots: The Last Wish,"Puss in Boots discovers that his passion for adventure has taken its toll: He has burned through eight of his nine lives, leaving him with only one life left. Puss sets out on an epic journey to find the mythical Last Wish and restore his nine lives.",22.7837,/kuf6dutpsT0vSVehic3EZIqkOBt.jpg,2022-12-07,False,False,8.205,8825,"Animation, Adventure, Fantasy, Comedy, Family"
False,/2kpHOOYgn65P5kdc1vLNJ92nb4.jpg,"18, 10749, 10402",1643729,Ishqa'n De Lekhe,pa,Ishqa'n De Lekhe,"Starring the sensational Gurnam Bhullar alongside the stunning Isha Malviya, this Punjabi cinema is crafted for every soul that has ever loved deeply. Directed by the talented Manvir Brar, Ishqa'n De Lekhe is set to redefine Punjabi romance on the big screen.",22.7738,/eky8n1Xu5oMDe4iu4pKFCdStHkt.jpg,2026-03-06,False,False,10.0,1,"Drama, Romance, Music"
False,/997ToEZvF2Obp9zNZbY5ELVnmrW.jpg,"18, 10749",537915,After,en,After,"Tessa Young is a dedicated student, dutiful daughter and loyal girlfriend to her high school sweetheart. Entering her first semester of college, Tessa's guarded world opens up when she meets Hardin Scott, a mysterious and brooding rebel who makes her question all she thought she knew about herself -- and what she wants out of life.",22.7435,/u3B2YKUjWABcxXZ6Nm9h10hLUbh.jpg,2019-04-11,False,False,7.107,8519,"Drama, Romance"
False,/gvLG3Fnznkxl4SmYfcK8gUuqxM8.jpg,"28, 12, 878",823464,Godzilla x Kong: The New Empire,en,Godzilla x Kong: The New Empire,"Following their explosive showdown, Godzilla and Kong must reunite against a colossal undiscovered threat hidden within our world, challenging their very existence – and our own.",22.7395,/z1p34vh7dEOnLDmyCrlUVLuoDzd.jpg,2024-03-27,False,False,7.05,4673,"Action, Adventure, Science Fiction"
False,/1yktYsxkmUtUFTUnCAUaqG6FEiz.jpg,"28, 53, 80",541671,Ballerina,en,Ballerina,"Taking place during the events of John Wick: Chapter 3 – Parabellum, Eve Macarro begins her training in the assassin traditions of the Ruska Roma.",22.7347,/2VUmvqsHb6cEtdfscEA6fqqVzLg.jpg,2025-06-04,False,False,7.237,2610,"Action, Thriller, Crime"
False,/8VyTWJrNEyV2MTWvniDVp0MpOAe.jpg,"27, 9648",1078605,Weapons,en,Weapons,"When all but one child from the same class mysteriously vanish on the same night at exactly the same time, a community is left questioning who or what is behind their disappearance.",22.6493,/cpf7vsRZ0MYRQcnLWteD5jK9ymT.jpg,2025-08-04,False,False,7.255,3413,"Horror, Mystery"
False,/ifHgVh5c7B3mbq5CfkzwsyMRmpG.jpg,"10749, 18, 35",11013,Secretary,en,Secretary,"A young woman, recently released from a mental hospital, gets a job as a secretary to a demanding lawyer, where their employer-employee relationship turns into a sexual, sadomasochistic one.",22.6157,/mdRXSE7ho185SZlXj0JSwuecEd3.jpg,2002-09-20,False,False,6.8,1913,"Romance, Drama, Comedy"
False,/k24eZq5I3jyz4htPkZCRpnUmBzE.jpg,"18, 10749",1156593,Your Fault,es,Culpa tuya,The love between Noah and Nick seems unwavering despite their parents' attempts to separate them. But his job and her entry into college open up their lives to new relationships that will shake the foundations of both their relationship and the Leister family itself.,22.5338,/1sQA7lfcF9yUyoLYC0e6Zo3jmxE.jpg,2024-12-26,False,False,7.083,1549,"Drama, Romance"
False,/70AV2Xx5FQYj20labp0EGdbjI6E.jpg,"53, 80, 18",637649,Wrath of Man,en,Wrath of Man,"A cold and mysterious new security guard for a Los Angeles cash truck company surprises his co-workers when he unleashes precision skills during a heist. The crew is left wondering who he is and where he came from. Soon, the marksman's ultimate motive becomes clear as he takes dramatic and irrevocable steps to settle a score.",22.533,/M7SUK85sKjaStg4TKhlAVyGlz3.jpg,2021-04-22,False,False,7.575,6096,"Thriller, Crime, Drama"
False,/Adrip2Jqzw56KeuV2nAxucKMNXA.jpg,37,429,"The Good, the Bad and the Ugly",it,"Il buono, il brutto, il cattivo","While the Civil War rages on between the Union and the Confederacy, three men – a quiet loner, a ruthless hitman, and a Mexican bandit – comb the American Southwest in search of a strongbox containing $200,000 in stolen gold.",22.5136,/bX2xnavhMYjWDoZp1VM6VnU1xwe.jpg,1966-12-23,False,False,8.468,9646,Western
False,/w4bTBXcqXc2TUyS5Fc4h67uWbPn.jpg,18,389,12 Angry Men,en,12 Angry Men,"The defense and the prosecution have rested and the jury is filing into the jury room to decide if a young Spanish-American is guilty or innocent of murdering his father. What begins as an open and shut case soon becomes a mini-drama of each of the jurors' prejudices and preconceptions about the trial, the accused, and each other.",22.3676,/zhG3vKWyDRaZYoaww1UVAi29T9h.jpg,1957-04-10,False,False,8.561,9991,Drama
False,/iuRVt8tFiXDPGgzavhuSa3QHRxD.jpg,35,18785,The Hangover,en,The Hangover,"When three friends finally come to after a raucous night of bachelor-party revelry, they find a baby in the closet and a tiger in the bathroom. But they can't seem to locate their best friend, Doug – who's supposed to be tying the knot. Launching a frantic search for Doug, the trio perseveres through a nasty hangover to try to make it to the church on time.",22.3227,/A0uS9rHR56FeBtpjVki16M5xxSW.jpg,2009-06-02,False,False,7.331,18090,Comedy
False,/jhk6D8pim3yaByu1801kMoxXFaX.jpg,"28, 18, 12",98,Gladiator,en,Gladiator,"After the death of Emperor Marcus Aurelius, his devious son takes power and demotes Maximus, one of Rome's most capable generals who Marcus preferred. Eventually, Maximus is forced to become a gladiator and battle to the death against other men for the amusement of paying audiences.",22.2135,/wN2xWp1eIwCKOD0BHTcErTBv1Uq.jpg,2000-05-04,False,False,8.226,20889,"Action, Drama, Adventure"
False,/4s2d3xdyqotiVNHTlTlJjrr3q0H.jpg,"12, 10751, 16, 28, 35",177572,Big Hero 6,en,Big Hero 6,"A special bond develops between plus-sized inflatable robot Baymax, and prodigy Hiro Hamada, who team up with a group of friends to form a band of high-tech heroes.",22.1889,/2mxS4wUimwlLmI1xp6QW6NSU361.jpg,2014-10-24,False,False,7.724,16577,"Adventure, Family, Animation, Action, Comedy"
False,/54BOXpX2ieTXMDzHymdDMnUIzYG.jpg,"27, 53",1228246,Five Nights at Freddy's 2,en,Five Nights at Freddy's 2,"One year since the supernatural nightmare at Freddy Fazbear's Pizza, the stories about what transpired there have been twisted into a campy local legend, inspiring the town's first ever Fazfest. With the truth kept from her, Abby sneaks out to reconnect with Freddy, Bonnie, Chica, and Foxy, setting into motion a terrifying series of events that will reveal dark secrets about the real origin of Freddy's, and unleash a decades-hidden horror.",22.1796,/udAxQEORq2I5wxI97N2TEqdhzBE.jpg,2025-12-03,False,False,6.662,952,"Horror, Thriller"
False,/62a8bMDftwD9aU0dkXr4eN6Q5q2.jpg,"99, 10770",1522126,1000 Men and Me: The Bonnie Blue Story,en,1000 Men and Me: The Bonnie Blue Story,"Adult content creator Bonnie Blue announced that she’d slept with 1057 men in 12 hours. Exploring the polarising debate around Bonnie and the pornification of our society, the film follows her over the most eye-opening six months of her life.",22.0835,/5dcgoyf8nt6Xt4VSR6Nrn6nwhuz.jpg,2025-07-29,False,False,5.6,16,"Documentary, TV Movie"
False,/qGk24C6fV10LkXCEpAJ4BbzViFC.jpg,"35, 27",1657678,Indian Institute of Zombies,hi,Indian Institute of Zombies,"At an elite engineering campus, students must survive a sudden zombie outbreak while navigating academic pressures and social hierarchies, blending horror with comedy and biting satire of privilege and competition.",21.972,/zSiNbahfCoezs5LQYNtJrvczngM.jpg,2026-05-08,False,False,0.0,0,"Comedy, Horror"
False,/7Nwnmyzrtd0FkcRyPqmdzTPppQa.jpg,"80, 18, 35",106646,The Wolf of Wall Street,en,The Wolf of Wall Street,"A New York stockbroker refuses to cooperate in a large securities fraud case involving corruption on Wall Street, corporate banking world and mob infiltration. Based on Jordan Belfort's autobiography.",21.9506,/kW9LmvYHAaS9iA0tHmZVq8hQYoq.jpg,2013-12-25,False,False,8.028,25917,"Crime, Drama, Comedy"
False,/3UbaCMmqOd7mca4Y5DOzY2ZVTyX.jpg,"28, 12, 14",122917,The Hobbit: The Battle of the Five Armies,en,The Hobbit: The Battle of the Five Armies,"Following Smaug's attack on Laketown, Bilbo and the dwarves try to defend Erebor's mountain of treasure from others who claim it: the men of the ruined Laketown and the elves of Mirkwood. Meanwhile an army of Orcs led by Azog the Defiler is marching on Erebor, fueled by the rise of the dark lord Sauron. Dwarves, elves and men must unite, and the hope for Middle-Earth falls into Bilbo's hands.",21.8971,/xT98tLqatZPQApyRmlPL12LtiWp.jpg,2014-12-10,False,False,7.334,15347,"Action, Adventure, Fantasy"
False,/AdyJH8kDm8xT8IKTlgpEC15ny4u.jpg,"14, 28, 12",453395,Doctor Strange in the Multiverse of Madness,en,Doctor Strange in the Multiverse of Madness,"Doctor Strange, with the help of mystical allies both old and new, traverses the mind-bending and dangerous alternate realities of the Multiverse to confront a mysterious new adversary.",21.7742,/ddJcSKbcp4rKZTmuyWaMhuwcfMz.jpg,2022-05-04,False,False,7.23,10322,"Fantasy, Action, Adventure"
False,/rDrZBtUAALP6AmJ4ILMgvUVU0s4.jpg,"28, 35",1631017,Karikaada,kn,ಕರಿಕಾಡ,"Divine love transforms Kaada's hunting heritage into an epic tale of adventure, action, and romance, leading him to abandon his former life.",21.7379,/tL0skwRWivuNZHQD89baWynksct.jpg,2026-02-06,False,False,0.0,0,"Action, Comedy"
False,/iVped1djsF0tvGkvnHbzsE3ZPTF.jpg,"28, 12, 878",68721,Iron Man 3,en,Iron Man 3,"When Tony Stark's world is torn apart by a formidable terrorist called the Mandarin, he starts an odyssey of rebuilding and retribution.",21.6915,/qhPtAc1TKbMPqNvcdXSOn9Bn7hZ.jpg,2013-04-18,False,False,6.933,23418,"Action, Adventure, Science Fiction"
False,/7Zx3wDG5bBtcfk8lcnCWDOLM4Y4.jpg,"10751, 878, 35",552524,Lilo & Stitch,en,Lilo & Stitch,The wildly funny and touching story of a lonely Hawaiian girl and the fugitive alien who helps to mend her broken family.,21.5465,/ckQzKpQJO4ZQDCN5evdpKcfm7Ys.jpg,2025-05-17,False,False,7.2,2160,"Family, Science Fiction, Comedy"
False,/19EpgKZDkLIwY1TI1pjBJtQ5qdr.jpg,"28, 14, 878",9823,Mortal Kombat: Annihilation,en,Mortal Kombat: Annihilation,"A group of heroic warriors has only six days to save the planet in ""Mortal Kombat Annihilation."" To succeed they must survive the most spectacular series of challenges any human, or god, has ever encountered as they battle an evil warlord bent on taking control of Earth.",21.5131,/ttryglcY2osWZE3sRYBf3ewTZsW.jpg,1997-11-11,False,False,4.556,1342,"Action, Fantasy, Science Fiction"
False,/7iUDfakacY1HpajP1DtHrCuDB95.jpg,"16, 35, 10751",863,Toy Story 2,en,Toy Story 2,"Andy heads off to Cowboy Camp, leaving his toys to their own devices. Things shift into high gear when an obsessive toy collector named Al McWhiggen, owner of Al's Toy Barn kidnaps Woody. Andy's toys mount a daring rescue mission, Buzz Lightyear meets his match and Woody has to decide where he and his heart truly belong.",21.4704,/4rbcp3ng8n1MKHjpeqW0L7Fnpzz.jpg,1999-10-30,False,False,7.607,14878,"Animation, Comedy, Family"
False,/5bzPWQ2dFUl2aZKkp7ILJVVkRed.jpg,"12, 35, 878",105,Back to the Future,en,Back to the Future,"Eighties teenager Marty McFly is accidentally sent back in time to 1955, inadvertently disrupting his parents' first meeting and attracting his mother's romantic interest. Marty must repair the damage to history by rekindling his parents' romance and - with the help of his eccentric inventor friend Doc Brown - return to 1985.",21.3618,/vN5B5WgYscRGcQpVhHl6p9DDTP0.jpg,1985-07-03,False,False,8.326,21807,"Adventure, Comedy, Science Fiction"
False,/d354XqicJ7vi48YnPDr1vRk5uhZ.jpg,"28, 80, 18, 53",49026,The Dark Knight Rises,en,The Dark Knight Rises,"Following the death of District Attorney Harvey Dent, Batman assumes responsibility for Dent's crimes to protect the late attorney's reputation and is subsequently hunted by the Gotham City Police Department. Eight years later, Batman encounters the mysterious Selina Kyle and the villainous Bane, a new terrorist leader who overwhelms Gotham's finest. The Dark Knight resurfaces to protect a city that has branded him an enemy.",21.337,/hr0L2aueqlP2BYUblTTjmtn0hw4.jpg,2012-07-17,False,False,7.796,24348,"Action, Crime, Drama, Thriller"
False,/aCHn2TXYJfzPXQKA6r9mKPbMlUB.jpg,"35, 18",37165,The Truman Show,en,The Truman Show,"In a picture-perfect seaside town, an insurance salesman begins to realize that his entire existence may be staged and observed by a vast unseen audience as part of a long-running real-time reality TV show.",21.3099,/vuza0WqY239yBXOadKlGwJsZJFE.jpg,1998-06-04,False,False,8.2,20215,"Comedy, Drama"
False,/xtHonIIIQXverDQM08TMQXjn9Fe.jpg,"35, 14",214756,Ted 2,en,Ted 2,"Newlywed couple Ted and Tami-Lynn want to have a baby, but in order to qualify to be a parent, Ted will have to prove he's a person in a court of law.",21.2681,/38C91I7Xft0gyY7BITm8i4yvuRb.jpg,2015-06-25,False,False,6.3,7988,"Comedy, Fantasy"
False,/wNAfVj1ObGNye5fQM4tJXJGtU0.jpg,"53, 28, 80",156022,The Equalizer,en,The Equalizer,"McCall believes he has put his mysterious past behind him and dedicated himself to beginning a new, quiet life. But when he meets Teri, a young girl under the control of ultra-violent Russian gangsters, he can’t stand idly by – he has to help her. Armed with hidden skills that allow him to serve vengeance against anyone who would brutalize the helpless, McCall comes out of his self-imposed retirement and finds his desire for justice reawakened. If someone has a problem, if the odds are stacked against them, if they have nowhere else to turn, McCall will help. He is The Equalizer.",21.2459,/9u4yW7yPA0BQ2pv9XwiNzItwvp8.jpg,2014-09-24,False,False,7.286,9940,"Thriller, Action, Crime"
False,/8HbNKB2pMiD3mfLgbxe7DgAKjdS.jpg,27,1173559,Insidious Inferno,en,Insidious Inferno,A secluded cottage is plagued by gruesome murders and unbeknownst to the inhabitants something other worldly lurks within the halls. Can the couple solve the mystery of the cursed grounds in time or will they open the door to the inferno?,21.2269,/8kljUAovBatZRYp2ye2RZr239hU.jpg,2024-11-29,False,False,5.6,19,Horror
False,/h2JaQWLKhapm7AuSViJwGiv8ngC.jpg,"9648, 53, 18",210577,Gone Girl,en,Gone Girl,"With his wife's disappearance having become the focus of an intense media circus, a man sees the spotlight turned on him when it's suspected that he may not be innocent.",21.2119,/ts996lKsxvjkO2yiYG0ht4qAicO.jpg,2014-10-01,False,False,7.89,19950,"Mystery, Thriller, Drama"
False,/5jhG1lTgV0MS6tDkBMQSSitttTT.jpg,18,1402,The Pursuit of Happyness,en,The Pursuit of Happyness,A struggling salesman takes custody of his son as he's poised to begin a life-changing professional career.,21.1669,/lBYOKAMcxIvuk9s9hMuecB9dPBV.jpg,2006-12-14,False,False,7.886,10588,Drama
False,/kHJlXiwxcMAf9R934f0ncEBAMXg.jpg,"10749, 18",1252309,Tell Me What You Want,es,Pídeme lo que quieras,"After his father's death, Eric Zimmerman travels to Spain to oversee his company's branches. In Madrid, he falls for Judith and engage in an intense, erotic relationship full of exploration. However, Eric fears his secret may end their affair.",21.1167,/yZXYCiZQPB7Ui6D5206W1zDKv8P.jpg,2024-11-29,False,False,6.2,290,"Romance, Drama"
False,/m5dA4JZsj78EBTa2D6imWOAebwB.jpg,35,4247,Scary Movie,en,Scary Movie,"A familiar-looking group of teenagers find themselves being stalked by a more-than-vaguely recognizable masked killer! As the victims begin to pile up and the laughs pile on, none of your favorite scary movies escape the razor-sharp satire of this outrageously funny parody!",21.1036,/fVQFPRuw3yWXojYDJvA5EoFjUOY.jpg,2000-07-07,False,False,6.394,7761,Comedy
False,/aHj7d7wSLqrg5cjAcgHhiGr97Ih.jpg,"28, 53, 878",798645,The Running Man,en,The Running Man,"Desperate to save his sick daughter, working-class Ben Richards is convinced by The Running Man's charming but ruthless producer to enter the deadly competition game as a last resort. But Ben's defiance, instincts, and grit turn him into an unexpected fan favorite — and a threat to the entire system. As ratings skyrocket, so does the danger, and Ben must outwit not just the Hunters, but a nation addicted to watching him fall.",21.0636,/dKL78O9zxczVgjtNcQ9UkbYLzqX.jpg,2025-11-11,False,False,6.783,1566,"Action, Thriller, Science Fiction"
False,/z9aMQn1ciokeMvY2gVBgtZ8gu2.jpg,"28, 35, 878",30471,Spiderbabe,en,Spiderbabe,A socially awkward young woman gets bitten by a radioactive spider and becomes a crime-fighting superhero and tries to defeat a nefarious super villain while going after any man (or woman) she wants to bed down with.,19.651,/mh7oL7A43NvNy1o5O2CouyoQTKl.jpg,2003-10-14,False,False,4.5,39,"Action, Comedy, Science Fiction"
False,/bf5TG9RODkPXmtJSgf8Iymof1wl.jpg,"36, 18",1214931,Nuremberg,en,Nuremberg,"In postwar Germany, an American psychiatrist must determine whether Nazi prisoners are fit to go on trial for war crimes, and finds himself in a complex battle of intellect and ethics with Hermann Göring, Hitler's right-hand man.",20.0347,/xthXNYltOOm80vW5Kxjzxx5gvQ6.jpg,2025-11-06,False,False,7.549,1030,"History, Drama"
False,/eTlcNXGv32zkVI7ZDHhfeaKHXKQ.jpg,"28, 9648, 878, 53",198663,The Maze Runner,en,The Maze Runner,"A teenager with no memory of his past finds himself among a group of boys living in a walled enclosure surrounded by a massive, ever-changing maze. As he struggles to adapt to their rules and society, he begins to uncover clues that may lead to escape and the truth behind their confinement.",20.8388,/ode14q7WtDugFDp78fo9lCsmay9.jpg,2014-09-10,False,False,7.188,18093,"Action, Mystery, Science Fiction, Thriller"
False,/o6f1sJ0ZYg6TA2tMgoHdupB68QB.jpg,"28, 10752, 36",855,Black Hawk Down,en,Black Hawk Down,"When U.S. Rangers and an elite Delta Force team attempt to kidnap two underlings of a Somali warlord, their Black Hawk helicopters are shot down, and the Americans suffer heavy casualties, facing intense fighting from the militia on the ground.",19.5634,/7fU5dSqKRL4XHeEUz62rCKBfYok.jpg,2001-12-28,False,False,7.393,6359,"Action, War, History"
False,/8fZyDQqkuD4R8MPiduiKNQ3JYz3.jpg,"28, 18",1665724,Shera,pa,Shera,"A high-energy action drama centered on strength, loyalty, and confrontation. The story unfolds through intense moments and gripping action as the protagonist faces powerful forces and personal challenges.",21.15,/7qgjO10RA9Jd7ffXbYeqQAwf1WF.jpg,2026-05-15,False,False,0.0,0,"Action, Drama"
False,/wspOfgFVJde2jjD4vlIqy5Jc3yy.jpg,18,1669057,Check-In,tl,Check-In,"VMX hottest star Aliya Raymundo teams up with sexy siren Anya Austria as two receptionists in a cheap motel. Their quiet routine heats up with the arrival of a mysterious regular guest who begins to stir tension, desire, and conflict in their fragile relationship.",20.0852,/r7tXZoO3rfkOpYQPCXftwugwny9.jpg,2026-05-01,False,False,5.0,2,Drama
False,/3upEZ0ltY7WwOSFVXrtiP34D48p.jpg,"53, 18, 10749",290098,The Handmaiden,ko,아가씨,"1930s Korea, in the period of Japanese occupation, a new girl, Sook-hee, is hired as a handmaiden to a Japanese heiress, Hideko, who lives a secluded life on a large countryside estate with her domineering Uncle Kouzuki. But the maid has a secret. She is a pickpocket recruited by a swindler posing as a Japanese Count to help him seduce the Lady to steal her fortune.",22.5905,/dLlH4aNHdnmf62umnInL8xPlPzw.jpg,2016-06-01,False,False,8.187,4320,"Thriller, Drama, Romance"
False,/hniERZojXCEc7Fp3yljZUigOAhm.jpg,"27, 53",1290417,Thrash,en,Thrash,"When a Category 5 hurricane decimates a coastal town, the storm surge brings devastation, chaos, and something far more frightening onto shore: hungry sharks.",20.3668,/adk8weka3O5648g3de4z3y4aE7G.jpg,2026-04-10,False,False,6.026,607,"Horror, Thriller"
False,/kIBK5SKwgqIIuRKhhWrJn3XkbPq.jpg,"28, 12, 878",99861,Avengers: Age of Ultron,en,Avengers: Age of Ultron,"When Tony Stark tries to jumpstart a dormant peacekeeping program, things go awry and Earth’s Mightiest Heroes are put to the ultimate test as the fate of the planet hangs in the balance. As the villainous Ultron emerges, it is up to The Avengers to stop him from enacting his terrible plans, and soon uneasy alliances and unexpected action pave the way for an epic and unique global adventure.",21.6729,/4ssDuvEDkSArWEdyBl2X5EHvYKU.jpg,2015-04-22,False,False,7.272,24426,"Action, Adventure, Science Fiction"
