adult,backdrop_path,genre_ids,id,title,original_language,original_title,overview,popularity,poster_path,release_date,softcore,video,vote_average,vote_count,genre_names
False,/kxQiIJ4gVcD3K6o14MJ72p5yRcE.jpg,"10751, 35, 12, 14, 16",1226863,The Super Mario Galaxy Movie,en,The Super Mario Galaxy Movie,"Having thwarted Bowser's previous plot to marry Princess Peach, Mario and Luigi now face a fresh threat in Bowser Jr., who is determined to liberate his father from captivity and restore the family legacy. Alongside companions new and old, the brothers travel across the stars to stop the young heir's crusade.",613.4012,/eJGWx219ZcEMVQJhAgMiqo8tYY.jpg,2026-04-01,False,False,6.74,587,"Family, Comedy, Adventure, Fantasy, Animation"
False,/1x9e0qWonw634NhIsRdvnneeqvN.jpg,"10749, 18",1523145,Your Heart Will Be Broken,ru,Твоё сердце будет разбито,"High school student Polina is saved from bullying at her new school and makes a deal with the main bully Bars: he must pretend to be her boyfriend and protect her, and she must do everything he says. During this game, the couple develops real feelings, but her family and classmates have reasons to separate the lovers.",369.7483,/7wIBfBl2gejt6xHxNSK0reVIm7E.jpg,2026-03-26,False,False,6.9,73,"Romance, Drama"
False,/gCmfeKmEAZBP5gcXpiqb0gii9rS.jpg,"27, 53, 35",1198994,Send Help,en,Send Help,"Two colleagues become stranded on a deserted island, the only survivors of a plane crash. On the island, they must overcome past grievances and work together to survive, but ultimately, it's a battle of wills and wits to make it out alive.",318.5276,/mjkS2iAgWj3ik1DTjvI15nHZ7yl.jpg,2026-01-22,False,False,7.045,1064,"Horror, Thriller, Comedy"
False,/sS3zGYFPcfM5pArVNWl6qLyaSmU.jpg,"16, 28, 12, 14",980431,Avatar Aang: The Last Airbender,en,Avatar Aang: The Last Airbender,"Avatar Aang, the world's last Airbender, learns of an ancient power that could save his culture from extinction. With the help of his friends, he embarks on a global quest to find it before it falls into the wrong hands and threatens to upend the peace they sacrificed everything to achieve.",277.9116,/29Jdsak3SrwGds5k1t43kH6Khed.jpg,2026-10-09,False,False,0.0,0,"Animation, Action, Adventure, Fantasy"
False,/u8DU5fkLoM5tTRukzPC31oGPxaQ.jpg,"878, 12, 14",83533,Avatar: Fire and Ash,en,Avatar: Fire and Ash,"In the wake of the devastating war against the RDA and the loss of their eldest son, Jake Sully and Neytiri face a new threat on Pandora: the Ash People, a violent and power-hungry Na'vi tribe led by the ruthless Varang. Jake's family must fight for their survival and the future of Pandora in a conflict that pushes them to their emotional and physical limits.",246.3145,/aabwWZWx6z1aYP4PX2ADvbDKktd.jpg,2025-12-17,False,False,7.373,2704,"Science Fiction, Adventure, Fantasy"
False,/jJmlCFi5EjpH5vHmOczRiVDm0qS.jpg,"28, 53",1613798,Vengeance,es,Venganza,"The brutal murder of the wife of “Toro,” a military hero in the special forces, turns him into a man with a single purpose: revenge. After a stroke of fate makes him a millionaire, Carlos transforms his fortune into an arsenal and, together with his closest soldiers, sets out to hunt down those responsible.",238.9347,/ygWXPL0RS91JyJPNOfK34eV3bRE.jpg,2026-02-26,False,False,6.878,74,"Action, Thriller"
False,/8Tfys3mDZVp4tNoH2ktm06a0Tau.jpg,"878, 12",687163,Project Hail Mary,en,Project Hail Mary,"Science teacher Ryland Grace wakes up on a spaceship light years from home with no recollection of who he is or how he got there. As his memory returns, he begins to uncover his mission: solve the riddle of the mysterious substance causing the sun to die out. He must call on his scientific knowledge and unorthodox ideas to save everything on Earth from extinction… but an unexpected friendship means he may not have to do it alone.",206.8121,/yihdXomYb5kTeSivtFndMy5iDmf.jpg,2026-03-15,False,False,8.215,1687,"Science Fiction, Adventure"
False,/gM1kQRPwOVW1Eos5tVWqcYmHR5S.jpg,"27, 9648",1470130,The Mortuary Assistant,en,The Mortuary Assistant,"Rebecca Owens, a recent mortuary science graduate takes a night shift job at River Fields Mortuary. Initially, the job seems straightforward — embalming bodies, completing paperwork, and keeping things tidy. But once Rebecca starts working the night shift, things take a dark turn.",189.5795,/72AoFPC5TY4DfJwXXS9rPwPeReD.jpg,2026-02-13,False,False,5.4,79,"Horror, Mystery"
False,/nHxWyy18SvAZ8jJeemtS8k1UNjM.jpg,"28, 80, 53",1290821,Shelter,en,Shelter,"A man living in self-imposed exile on a remote island rescues a young girl from a violent storm, setting off a chain of events that forces him out of seclusion to protect her from enemies tied to his past.",180.0595,/buPFnHZ3xQy6vZEHxbHgL1Pc6CR.jpg,2026-01-28,False,False,6.795,592,"Action, Crime, Thriller"
False,/u53UYu5XG2hNgWGvs3xGhAVzypl.jpg,"16, 10751, 878, 35, 12",1327819,Hoppers,en,Hoppers,"Scientists have discovered how to 'hop' human consciousness into lifelike robotic animals, allowing people to communicate with animals as animals. Animal lover Mabel seizes an opportunity to use the technology, uncovering mysteries within the animal world beyond anything she could have imagined.",171.4006,/xjtWQ2CL1mpmMNwuU5HeS4Iuwuu.jpg,2026-03-04,False,False,7.577,510,"Animation, Family, Science Fiction, Comedy, Adventure"
False,/be5T7oHxmDG4ytEimwPdmDHZD9N.jpg,27,1352874,The Crucifix: Blood of the Exorcist,en,The Crucifix: Blood of the Exorcist,"A gruesome discovery in the grounds of their new home plunges a young couple into a maelstrom of spiritual possession, pagan rituals, Viking battles, and violent revenge.",153.8491,/uLXxpWRfoIPfB2fwM8hsAMIjSWf.jpg,2025-01-09,False,False,6.208,24,Horror
False,/zc08qkHtWfZ2cQGQBK1S5yafJmR.jpg,"27, 9648",1304313,Lee Cronin's The Mummy,en,Lee Cronin's The Mummy,"The young daughter of a journalist disappears into the desert without a trace—eight years later, the broken family is shocked when she is returned to them, as what should be a joyful reunion turns into a living nightmare.",147.0478,/8L8efNkz8rUmwR7sV0g3vnC9yjn.jpg,2026-04-15,False,False,6.9,131,"Horror, Mystery"
False,/3ooXDVaz4xHKtwe4lkmF1gNopOC.jpg,"27, 53",1290417,Thrash,en,Thrash,"When a Category 5 hurricane decimates a coastal town, the storm surge brings devastation, chaos, and something far more frightening onto shore: hungry sharks.",142.4595,/adk8weka3O5648g3de4z3y4aE7G.jpg,2026-04-10,False,False,5.961,410,"Horror, Thriller"
False,/vG42HeYtoTFflqwP42wYD7tBuNr.jpg,"80, 53",1171145,Crime 101,en,Crime 101,"When an elusive thief whose high-stakes heists unfold along the iconic 101 freeway in Los Angeles eyes the score of a lifetime, with hopes of this being his final job, his path collides with a disillusioned insurance broker who is facing her own crossroads. Determined to crack the case, a relentless detective closes in on the operation, raising the stakes even higher.",135.4819,/tVvpFIoteRHNnoZMhdnwIVwJpCA.jpg,2026-02-11,False,False,6.955,764,"Crime, Thriller"
False,/7lizs4SuEU2ihkkAa0SZ66NtHbl.jpg,"28, 53",1641319,Sniper: No Nation,en,Sniper: No Nation,Brandon Beckett and Agent Zero lead a rescue mission in Costa Verde when their friends are taken hostage.,134.4964,/tUmARo0TZEK1EaSuS6dU35FhDyU.jpg,2026-04-07,False,False,6.2,34,"Action, Thriller"
False,/tq3h43fZy0H80vzf47MAY7R9Mxo.jpg,"16, 35, 10751",1297842,GOAT,en,GOAT,"A small goat with big dreams gets a once-in-a-lifetime shot to join the pros and play roarball, a high-intensity, co-ed, full-contact sport dominated by the fastest, fiercest animals in the world.",133.8407,/wfuqMlaExcoYiUEvKfVpUTt1v4u.jpg,2026-02-11,False,False,7.896,436,"Animation, Comedy, Family"
False,/jRsjWwZzI39bTm44FNhRtiICd9k.jpg,"35, 28, 12",1084577,Balls Up,en,Balls Up,"Two marketing executives go ""balls out"" and pitch a bold full‑coverage condom sponsorship with the World Cup. After their drunken celebration in Brazil sparks a global scandal, they must outrun furious fans, criminals, and power-hungry officials to salvage their careers and make it home alive.",132.821,/xwvJ3WzdJ1OCuDoY8LAxBUlQyig.jpg,2026-04-15,False,False,5.636,118,"Comedy, Action, Adventure"
False,/wns4x1GyxCudgOZRyhXKjXVJf3T.jpg,"12, 53, 878",840464,Greenland 2: Migration,en,Greenland 2: Migration,"Having found the safety of the Greenland bunker after the comet Clarke decimated the Earth, the Garrity family must now risk everything to embark on a perilous journey across the wasteland of Europe to find a new home.",132.3877,/z2tqCJLsw6uEJ8nJV8BsQXGa3dr.jpg,2026-01-07,False,False,6.5,908,"Adventure, Thriller, Science Fiction"
False,/1RgPyOhN4DRs225BGTlHJqCudII.jpg,"16, 28, 14",1311031,Demon Slayer: Kimetsu no Yaiba Infinity Castle,ja,劇場版「鬼滅の刃」無限城編 第一章 猗窩座再来,"The Demon Slayer Corps are drawn into the Infinity Castle, where Tanjiro, Nezuko, and the Hashira face terrifying Upper Rank demons in a desperate fight as the final battle against Muzan Kibutsuji begins.",125.613,/fWVSwgjpT2D78VUh6X8UBd2rorW.jpg,2025-07-18,False,False,7.687,809,"Animation, Action, Fantasy"
False,/fPfDB0IHOqvmKIzFP9CA51OOS1N.jpg,"27, 53",1010755,The Strangers: Chapter 3,en,The Strangers: Chapter 3,"Tethered by a frightening conclusion, Maya and the Strangers are locked on an unavoidable, unforgiving collision course — a showdown that proves they’re far from strangers now.",122.6383,/yPHwX78mcwJw3I6YOJ9qh2wQBFr.jpg,2026-02-05,False,False,5.627,118,"Horror, Thriller"
False,/61RYedFgX1K07xgVIvdJzukSR4g.jpg,"35, 18, 10751, 10749",848116,Rocky Aur Rani Kii Prem Kahaani,hi,रॉकी और रानी की प्रेम कहानी,"Gym-freak brat Rocky falls in love with Rani, who comes from a well-educated Bengali family. Being from polar opposite worlds, the two decide to switch their families to adjust to each other's cultures and backgrounds and to know if their marriage will survive. Rocky and Rani are trapped in a world where they are united by love but divided by families and the ultimate question is will they fit in?",113.7921,/vTQIqlxUkOuyf2UKhlM2OUaFGKz.jpg,2023-07-28,False,False,6.068,81,"Comedy, Drama, Family, Romance"
False,/xBT0oNq6rsTFv4SxG5uGRIEOrq6.jpg,"10402, 18",936075,Michael,en,Michael,"Discover the story of Michael Jackson, one of the most influential artists the world has ever known, and his life beyond the music, tracing his journey from the discovery of his extraordinary talent as the lead of the Jackson Five, to the visionary artist whose creative ambition fueled a relentless pursuit to become the biggest entertainer in the world, highlighting both his life off-stage and some of the most iconic performances from his early solo career.",113.6273,/3Qud19bBUrrJAzy0Ilm8gRJlJXP.jpg,2026-04-22,False,False,7.33,109,"Music, Drama"
False,/qXxFWyur7jFkg2aQgENcXuyYeHF.jpg,"27, 9648",1480387,undertone,en,undertone,The host of a popular paranormal podcast becomes haunted by terrifying recordings mysteriously sent her way.,110.632,/2PFgFMnrdCPXWiZl1PUvky7Mo9D.jpg,2026-03-12,False,False,6.547,95,"Horror, Mystery"
False,/9n2tJBplPbgR2ca05hS5CKXwP2c.jpg,"10751, 35, 12, 14, 16",502356,The Super Mario Bros. Movie,en,The Super Mario Bros. Movie,"While working underground to fix a water main, Brooklyn plumbers—and brothers—Mario and Luigi are transported down a mysterious pipe and wander into a magical new world. But when the brothers are separated, Mario embarks on an epic quest to find Luigi.",107.9423,/qNBAXBIQlnOThrVvA6mA2B5ggV6.jpg,2023-04-05,False,False,7.588,10515,"Family, Comedy, Adventure, Fantasy, Animation"
False,/t9J2HXaDuJR7bvIG9XF7mttn4VY.jpg,"27, 9648, 80",1159559,Scream 7,en,Scream 7,"When a new Ghostface killer emerges in the quiet town where Sidney Prescott has built a new life, her darkest fears are realized as her daughter becomes the next target. Determined to protect her family, Sidney must face the horrors of her past to put an end to the bloodshed once and for all.",103.5737,/jjyuk0edLiW8vOSnlfwWCCLpbh5.jpg,2026-02-25,False,False,6.057,787,"Horror, Mystery, Crime"
False,/lgotja3xMoJZbynwHfcQcJAEMWH.jpg,"16, 10751, 9648, 12, 35",1084242,Zootopia 2,en,Zootopia 2,"After cracking the biggest case in Zootopia's history, rookie cops Judy Hopps and Nick Wilde find themselves on the twisting trail of a great mystery when Gary De'Snake arrives and turns the animal metropolis upside down. To crack the case, Judy and Nick must go undercover to unexpected new parts of town, where their growing partnership is tested like never before.",102.4753,/oJ7g2CifqpStmoYQyaLQgEU32qO.jpg,2025-11-26,False,False,7.609,2597,"Animation, Family, Mystery, Adventure, Comedy"
False,/CpLAfXgSNeNRRbRzPrTuzKmIHO.jpg,"18, 35",350,The Devil Wears Prada,en,The Devil Wears Prada,"A young woman from the Midwest gets more than she bargained for when she moves to New York to become a writer and ends up as the assistant to the tyrannical, larger-than-life editor-in-chief of a major fashion magazine.",99.7349,/8912AsVuS7Sj915apArUFbv6F9L.jpg,2006-06-29,False,False,7.39,12973,"Drama, Comedy"
False,/1ZruuRXztqC3QQybbgbVxVrdNjv.jpg,"35, 10749",1601797,¿Quieres Ser Mi Novia?,es,¿Quieres Ser Mi Novia?,"Javi and Lu's relationship faces dangerous territory as old and new temptations emerge: a young woman reigniting Javi's chemistry and a mature man pursuing Lu. Through humor, entanglements, and surprises, their love is tested.",97.6989,/oscW8xV8EhRYj7iAhyVlBohKqxo.jpg,2026-02-12,False,False,8.132,34,"Comedy, Romance"
False,/zTnAnYIn0Iv3cn0ZHlzLhou3ybm.jpg,"9648, 53",1368166,The Housemaid,en,The Housemaid,"Trying to escape her past, Millie Calloway accepts a job as a live-in housemaid for the wealthy Nina and Andrew Winchester. But what begins as a dream job quickly unravels into something far more dangerous—a sexy, seductive game of secrets, scandal, and power.",89.6385,/cWsBscZzwu5brg9YjNkGewRUvJX.jpg,2025-12-18,False,False,7.224,1906,"Mystery, Thriller"
False,/4BtL2vvEufDXDP4u6xQjjQ1Y2aT.jpg,"28, 80, 18, 53",1419406,The Shadow's Edge,zh,捕风追影,Macau Police brings the tracking expert police officer out of retirement to help catch a dangerous group of professional thieves.,85.9531,/e0RU6KpdnrqFxDKlI3NOqN8nHL6.jpg,2025-08-16,False,False,7.227,586,"Action, Crime, Drama, Thriller"
False,/yJi6g0CnsqANLNuVaRX28tZxeHX.jpg,"27, 9648",1193501,Whistle,en,Whistle,"A misfit group of unwitting high school students stumble upon a cursed object, an ancient Aztec Death Whistle. They discover that blowing the whistle and the terrifying sound it emits will summon their future deaths to hunt them down.",80.7629,/eGxPyseSnEZBMJaopGfRUO9HSYx.jpg,2026-01-20,False,False,6.0,249,"Horror, Mystery"
False,/hpEjnTB0gAhMCBN42CJZawRfWuv.jpg,35,1511057,Roommates,en,Roommates,"When shy college freshman Devon asks cool-girl Celeste to be her roommate, a blossoming friendship quickly spirals into a war of passive aggression.",75.8206,/eW1s6omXIfVkTlmKVe9y9Dwwt4u.jpg,2026-04-13,False,False,6.386,58,Comedy
False,/iZLqwEwUViJdSkGVjePGhxYzbDb.jpg,"878, 53",755898,War of the Worlds,en,War of the Worlds,"Will Radford is a top analyst for Homeland Security who tracks potential threats through a mass surveillance program, until one day an attack by an unknown entity leads him to question whether the government is hiding something from him... and from the rest of the world.",75.6582,/yvirUYrva23IudARHn3mMGVxWqM.jpg,2025-07-29,False,False,4.132,964,"Science Fiction, Thriller"
False,/6yeVcxFR0j08vlv2OlL6zbewm4D.jpg,"28, 878, 53",1265609,War Machine,en,War Machine,"On one last grueling mission during Army Ranger training, a combat engineer must lead his unit in a fight against a giant otherworldly killing machine.",74.9979,/rFhKkXhk7ClU03jQ5rHIApJDwev.jpg,2026-02-12,False,False,7.23,1498,"Action, Science Fiction, Thriller"
False,/iQSXJs6RbTumcwxMjCedDoK99rx.jpg,"53, 80, 18",1659087,180,en,180,"When an unexpected road rage incident puts his son in critical condition, an enraged father spirals down a dark path of emotional turmoil and vengeance.",74.1539,/9ISjrhA38HpSSGtfiCk8lpziC3K.jpg,2026-04-16,False,False,5.554,46,"Thriller, Crime, Drama"
False,/swxhEJsAWms6X1fDZ4HdbvYBSf9.jpg,"12, 35, 27",1234731,Anaconda,en,Anaconda,"A group of friends facing mid-life crises head to the rainforest with the intention of remaking their favorite movie from their youth, only to find themselves in a fight for their lives against natural disasters, giant snakes and violent criminals.",73.8447,/hBxN6dwrANN1ic3a4G9x6JZcR3C.jpg,2025-12-24,False,False,5.866,1039,"Adventure, Comedy, Horror"
False,/v0NEB75SZjxY8GS3ho8WeEvjIT3.jpg,"9648, 18, 27",680493,Return to Silent Hill,en,Return to Silent Hill,"When James receives a mysterious letter from his lost love Mary, he is drawn to Silent Hill—a once-familiar town now consumed by darkness. As he searches for her, James faces monstrous creatures and unravels a terrifying truth that will push him to the edge of his sanity.",73.3786,/fqAGFN2K2kDL0EHxvJaXzaMUkkt.jpg,2026-01-21,False,False,5.243,407,"Mystery, Drama, Horror"
False,/kt9p1cS4O72aSeFRGQzlLuI1mY4.jpg,"80, 27, 9648",1107166,Psycho Killer,en,Psycho Killer,"Following the brutal murder of her husband, a Kansas highway patrol officer sets out on a journey to track down the perpetrator. As the hunt progresses, she comes to realize the man responsible is a sadistic serial killer, and the depth of his mental depravity and his sinister agenda is more twisted than anyone could have imagined.",72.1803,/5xgxxmLivJXL8aF0HdZfpx8aAIo.jpg,2026-02-19,False,False,5.611,36,"Crime, Horror, Mystery"
False,/1ytf7rzkZ7RLlMnBdGggQ0ENe6z.jpg,"27, 53",1418657,The Yeti,en,The Yeti,"When an oil tycoon and a famous adventurer vanish into the harsh winter of remote northern Alaska, a hand-picked rescue team endeavors to bring them home. What they don’t know is that they are trespassing on The Yeti’s territory, and the elements are the least of their worries.",72.1618,/zaqEfoKcWkVni2eONhJ7DRhMO8Q.jpg,2026-04-04,False,False,6.843,35,"Horror, Thriller"
False,/zD5v1E4joAzFvmAEytt7fM3ivyT.jpg,"28, 12, 878",634649,Spider-Man: No Way Home,en,Spider-Man: No Way Home,"Peter Parker is unmasked and no longer able to separate his normal life from the high-stakes of being a super-hero. When he asks for help from Doctor Strange the stakes become even more dangerous, forcing him to discover what it truly means to be Spider-Man.",70.9393,/1g0dhYtq4irTY1GPXvft6k4YLjm.jpg,2021-12-15,False,False,7.933,21828,"Action, Adventure, Science Fiction"
False,/tZiRd4IpoNiaoLXr2o2YfhTMjE2.jpg,"12, 28",662707,Starbright,en,Starbright,"A young woman becomes the guardian of a fallen star, which she must protect from dangerous forces with the help of a brave stranger.",65.8333,/m1Zl07DNYeSyNcz9hf8hDsS2oB5.jpg,2026-02-27,False,False,6.833,15,"Adventure, Action"
False,/gaKFXcB5J1gz0QqYj8bWIfrPc04.jpg,"28, 878, 12",1242898,Predator: Badlands,en,Predator: Badlands,"Cast out from his clan, a young Predator finds an unlikely ally in a damaged android and embarks on a treacherous journey in search of the ultimate adversary.",64.5955,/pHpq9yNUIo6aDoCXEBzjSolywgz.jpg,2025-11-05,False,False,7.692,2648,"Action, Science Fiction, Adventure"
False,/z3bzhmC0CPikWeerUkLO73YvGrC.jpg,"10402, 53, 28, 27",1084187,Pretty Lethal,en,Pretty Lethal,A troupe of ballerinas find themselves fighting for survival as they attempt to escape from a remote inn after their bus breaks down on the way to a dance competition.,64.0874,/znTPnXCK3lEQJgqXCvP7e5FUz6f.jpg,2026-03-13,False,False,6.778,302,"Music, Thriller, Action, Horror"
False,/2OHa6ukEq3Hce7Pc2kvu8wkmMFY.jpg,"28, 12, 53, 80, 18",7451,xXx,en,xXx,"Xander Cage is your standard adrenaline junkie with no fear and a lousy attitude. When the US Government ""recruits"" him to go on a mission, he's not exactly thrilled. His mission: to gather information on an organization that may just be planning the destruction of the world, led by the nihilistic Yorgi.",63.9721,/xeEw3eLeSFmJgXZzmF2Efww0q3s.jpg,2002-08-09,False,False,5.986,4866,"Action, Adventure, Thriller, Crime, Drama"
False,/3Sq9c1Lxh75neQ2BC9thaTO74FZ.jpg,99,440249,After Porn Ends 2,en,After Porn Ends 2,"After Porn Ends 2 picks up where its predecessor left off and not only turns back the clock to meet the oldest living stars in adult film's history, but goes in depth with some of Its most current retirees and juxtaposes their experiences in a life after porn. Delving deeper into society's ongoing stigmas of race, misogyny, and the reality of decreasing opportunities for these former VHS box cover stars. For some, their careers in adult entertainment is accepted proudly and without regret. In fact, it seems to have proven to be the pathway to their current happiness and inner peace. For others, however, a career in porn has proven to be a conduit to certain despair as they struggle to find a way to bury their past and emerge with a new career or calling.",60.4712,/rfItXrtDGILwsCdmgVxX79phFuI.jpg,2017-03-28,False,False,5.3,246,Documentary
False,/5rxEnsgriw8z065q51lrvPKYmCL.jpg,"10749, 18",1367642,Reminders of Him,en,Reminders of Him,"When Diem's custodial grandparents adamantly refuse Kenna's attempts to see her daughter, Kenna discovers unexpected compassion, and then something truer and deeper, with former NFL player and local bar owner Ledger. As their secret romance develops, so do the dangers for both of them, leading Kenna toward heartbreak and, ultimately, the hope for a second chance.",60.1119,/7L6rceYgzQ0NeHD7PRDNrRoQ291.jpg,2026-03-11,False,False,7.205,149,"Romance, Drama"
False,/pmGkvEWKFDapogIzkG7TqB0aeYE.jpg,"27, 53",1526650,Mudborn,zh,泥娃娃,"Hsu-Chuan, who works at a game company, accidentally brings home a broken clay doll from a haunted house while developing a new horror VR game. Unexpectedly, his pregnant wife, Mu-Hua, a cultural relic restorer, develops an obsession with the doll and relentlessly tries to repair it. As strange things begin to happen in the house, Mu-Hua's condition deteriorates, and Hsu-Chuan, at his wits' end, seeks help from a spiritual medium, Ah-Sheng. Meanwhile, the horrifying secret hidden behind the clay doll begins to surface.",59.4546,/ifYNeKwpyKUTtjkUExrqTc65L2p.jpg,2025-10-09,False,False,6.904,26,"Horror, Thriller"
False,/l8rKKMU2M9dDULO9CEtDNdWAEUJ.jpg,"878, 27, 14",1159831,The Bride!,en,The Bride!,A lonely Frankenstein travels to 1930s Chicago to ask groundbreaking scientist Dr. Euphronious to create a companion for him. The two revive a murdered young woman and The Bride is born. But what ensues is beyond what either of them imagined.,59.1743,/lV8YHwGkYZsm6EfIqnhaSz2avKt.jpg,2026-03-04,False,False,6.258,355,"Science Fiction, Horror, Fantasy"
False,/uNToXatdunyvWXyXMrTI1nLvh6r.jpg,"35, 878, 80",1115544,Mike & Nick & Nick & Alice,en,Mike & Nick & Nick & Alice,"Two gangsters and the woman they love try to survive the most dangerous night of their lives. As if that wasn’t enough, there’s one wild ingredient added to the mix: a time machine.",57.7111,/7F0jc75HrSkLVcvOXR2FXAIwuEv.jpg,2026-03-14,False,False,6.746,262,"Comedy, Science Fiction, Crime"
False,/5KFThZkdBEQkp9gPWWWNb5CI5yD.jpg,"53, 28, 18",1268127,Humint,ko,휴민트,A South Korean agent hunts a drug ring in Russia and goes head-to-head with a North Korean operative — pulling both into peril and tangled secrets.,56.7227,/82bX2GK4PhaJQtfkTnfmd2P7erG.jpg,2026-02-11,False,False,7.202,104,"Thriller, Action, Drama"
False,/2ssWTSVklAEc98frZUQhgtGHx7s.jpg,"12, 18, 878",157336,Interstellar,en,Interstellar,The adventures of a group of explorers who make use of a newly discovered wormhole to surpass the limitations on human space travel and conquer the vast distances involved in an interstellar voyage.,55.9281,/yQvGrMoipbRoddT0ZR8tPoR7NfX.jpg,2014-11-05,False,False,8.47,39460,"Adventure, Drama, Science Fiction"
False,/lUbc4XVpCe1q4aqZyQqFCIubaDN.jpg,18,10867,Malena,it,Malèna,"12-year-old Renato experiences three significant events on the same day: the beginning of the Second World War, getting a bike, and witnessing the arrival of the gorgeous Malèna. Through his eyes, we see the curse of beauty and loneliness of Malena, whose husband is presumed dead, and, through his soul, we see his love for her.",54.852,/3OyQTl0IGkbnjDxd3MhztfPE34g.jpg,2000-10-27,False,False,7.4,2475,Drama
False,/tId87yE7JnQsQsqOpnGXjz9PoEe.jpg,"18, 35, 27",329505,Lola's Secret,it,Il peccato di Lola,Young man has his dreams come true when the sexy new maid seduces him. But she also has a secret that leads to trouble.,53.3178,/qaJ4iQngrLbyz9OgaQkJLppDN6m.jpg,1984-05-04,False,False,7.007,70,"Drama, Comedy, Horror"
False,/7uXzE0ZBkbAeKylOz7cUQF4Yw75.jpg,18,879945,The Unknown Man,nl,L'homme inconnu,"Louis, a Flemish writer, decides to isolate himself at the Côte d’Azur, hoping this place will bring him inspiration.",53.292,/4TpBhdaSl5ALHbgeaYOLF8Q3haz.jpg,2021-10-16,False,False,7.3,3,Drama
False,/9BBTo63ANSmhC4e6r62OJFuK2GL.jpg,"878, 28, 12",24428,The Avengers,en,The Avengers,"When an unexpected enemy emerges and threatens global safety and security, Nick Fury, director of the international peacekeeping agency known as S.H.I.E.L.D., finds himself in need of a team to pull the world back from the brink of disaster. Spanning the globe, a daring recruitment effort begins!",53.0508,/RYMX2wcKCBAr24UyPD7xwmjaTn.jpg,2012-04-25,False,False,8.006,37392,"Science Fiction, Action, Adventure"
False,/vSQSYd2zZTqc0zmHImwWEGGluMI.jpg,"10749, 18",1316092,"""Wuthering Heights""",en,"""Wuthering Heights""","Tragedy strikes when Heathcliff falls in love with Catherine Earnshaw, a woman from a wealthy family in 18th-century England.",51.6119,/3YBce6dTh1D5oCMITXk2S5QhPt.jpg,2026-02-11,False,False,6.5,805,"Romance, Drama"
