adult,backdrop_path,genre_ids,id,title,original_language,original_title,overview,popularity,poster_path,release_date,softcore,video,vote_average,vote_count,genre_names
False,/fVpFOcQyHJM2di9upgSIwWD5wac.jpg,"27, 53, 28, 12",396535,Train to Busan,ko,부산행,"When a zombie virus pushes Korea into a state of emergency, those trapped on an express train to Busan must fight for their own survival.",18.3189,/vNVFt6dtcqnI7hqa6LFBUibuFiw.jpg,2016-07-20,False,False,7.747,8291,"Horror, Thriller, Action, Adventure"
False,/gbhIwMUCATqdsjR1t01LttQeu7W.jpg,"27, 53, 878",1400940,Clayface,en,Clayface,"Follow the terrifying descent into hell of a promising Hollywood actor who has become a monster driven by revenge, exploring the loss of identity and humanity, the ravages of toxic love and the dark side of scientific ambition.",19.167,/5jCpQnWPikggmQZoDp1eAi6BI6w.jpg,2026-10-21,False,False,0.0,0,"Horror, Thriller, Science Fiction"
False,/otkJlfjB7zJ5h34FEIfemenMbCy.jpg,"878, 28, 12, 53",106,Predator,en,Predator,A team of elite commandos on a secret mission in a Central American jungle come to find themselves hunted by an extraterrestrial warrior.,18.7734,/k3mW4qfJo6SKqe6laRyNGnbB9n5.jpg,1987-06-12,False,False,7.546,9009,"Science Fiction, Action, Adventure, Thriller"
False,/3pu0Opw5DZbYgLGpmf4yw5XolsA.jpg,"53, 27",1397937,NN4444,ja,NN4444,"Four unsettling short films exploring psychological horror: a man who barks like a dog at strangers, madness at a party, eerie phenomena following a friend's death, and a lakeside gathering cursed by water.",19.9248,/lXal7UQkg9sNYcPj9uCEnjqkGle.jpg,2024-02-16,False,False,0.0,0,"Thriller, Horror"
False,/1qM2BYNE11Viby8ImC9LC00DgDr.jpg,"28, 80, 18",111,Scarface,en,Scarface,"After getting a green card in exchange for assassinating a Cuban government official, Tony Montana stakes a claim on the drug trade in Miami. Viciously murdering anyone who stands in his way, Tony eventually becomes the biggest drug lord in the state, controlling nearly all the cocaine that comes through Miami. But increased pressure from the police, wars with Colombian drug cartels and his own drug-fueled paranoia serve to fuel the flames of his eventual downfall.",20.0159,/iQ5ztdjvteGeboxtmRdXEChJOHh.jpg,1983-12-09,False,False,8.155,12913,"Action, Crime, Drama"
False,/k24eZq5I3jyz4htPkZCRpnUmBzE.jpg,"18, 10749",1156593,Your Fault,es,Culpa tuya,The love between Noah and Nick seems unwavering despite their parents' attempts to separate them. But his job and her entry into college open up their lives to new relationships that will shake the foundations of both their relationship and the Leister family itself.,18.8335,/1sQA7lfcF9yUyoLYC0e6Zo3jmxE.jpg,2024-12-26,False,False,7.087,1532,"Drama, Romance"
False,/qVGpxnjrGlHaSTCqTQI6viBDSfp.jpg,"27, 53, 18",346364,It,en,It,"In a small town in Maine, seven children known as The Losers Club come face to face with life problems, bullies and a monster that takes the shape of a clown called Pennywise.",17.2644,/9E2y5Q7WlCVNEhP5GiVTjhEhx1o.jpg,2017-09-06,False,False,7.239,20231,"Horror, Thriller, Drama"
False,/eCynaAOgYYiw5yN5lBwz3IxqvaW.jpg,"16, 10751, 12",12,Finding Nemo,en,Finding Nemo,"Nemo, an adventurous young clownfish, is unexpectedly taken from his Great Barrier Reef home to a dentist's office aquarium. It's up to his worrisome father Marlin and a friendly but forgetful fish Dory to bring Nemo home -- meeting vegetarian sharks, surfer dude turtles, hypnotic jellyfish, hungry seagulls, and more along the way.",17.9928,/eHuGQ10FUzK1mdOY69wF5pGgEf5.jpg,2003-05-30,False,False,7.817,20443,"Animation, Family, Adventure"
False,/vDKRMZGFTKP9nQolzeSB1rB1w6p.jpg,"18, 36, 10752",324786,Hacksaw Ridge,en,Hacksaw Ridge,"WWII American Army Medic Desmond T. Doss, who served during the Battle of Okinawa, refuses to kill people and becomes the first Conscientious Objector in American history to receive the Congressional Medal of Honor.",18.4051,/fnOMP6mjmOmZwmlC1n0K7ivrzt1.jpg,2016-10-07,False,False,8.189,14747,"Drama, History, War"
False,/m6ciqp691frwE1nNeMgWFBr0AZf.jpg,"28, 14, 12",931285,Mortal Kombat II,en,Mortal Kombat II,"The fan favorite champions—now joined by Johnny Cage himself—are pitted against one another in the ultimate, no-holds barred, gory battle to defeat the dark rule of Shao Kahn that threatens the very existence of the Earthrealm and its defenders.",19.0903,/lIsMeDbwntNXSUVHmWMMRXEZOVc.jpg,2026-05-06,False,False,0.0,0,"Action, Fantasy, Adventure"
False,/rj58WQ9ImI0mYDptXdM7euX1Wjt.jpg,"16, 10751, 12, 14",109445,Frozen,en,Frozen,"Young princess Anna of Arendelle dreams about finding true love at her sister Elsa’s coronation. Fate takes her on a dangerous journey in an attempt to end the eternal winter that has fallen over the kingdom. She's accompanied by ice delivery man Kristoff, his reindeer Sven, and snowman Olaf. On an adventure where she will find out what friendship, courage, family, and true love really means.",18.7259,/itAKcobTYGpYT8Phwjd8c9hleTo.jpg,2013-11-20,False,False,7.248,17492,"Animation, Family, Adventure, Fantasy"
False,/vr6n6ZFUZvedvIlhfYcbCWcaKyW.jpg,"12, 14, 28",58,Pirates of the Caribbean: Dead Man's Chest,en,Pirates of the Caribbean: Dead Man's Chest,"Captain Jack Sparrow’s got a blood debt to pay: he owes his soul to the legendary Davy Jones, ghastly Ruler of the Ocean Depths. To escape eternal servitude aboard the Flying Dutchman, ever-crafty Jack must track down the still-beating heart of Jones. But he won’t do it alone: Will Turner and Elizabeth Swann are drawn back into another one of his perilous quests—assuming they can evade execution for aiding a pirate.",18.7094,/uXEqmloGyP7UXAiphJUu2v2pcuE.jpg,2006-07-06,False,False,7.375,17037,"Adventure, Fantasy, Action"
False,/7I6VUdPj6tQECNHdviJkUHD2u89.jpg,"28, 53, 80",603692,John Wick: Chapter 4,en,John Wick: Chapter 4,"With the price on his head ever increasing, John Wick uncovers a path to defeating The High Table. But before he can earn his freedom, Wick must face off against a new enemy with powerful alliances across the globe and forces that turn old friends into foes.",18.6854,/vZloFAK7NmvMGKE7VkF5UHaz0I.jpg,2023-03-21,False,False,7.706,7838,"Action, Thriller, Crime"
False,/jVntc0iqXRRAyLd9B4xGVrqO1pI.jpg,"28, 53",35739,Do or Die,en,Do or Die,"Asian crime boss Kaneshiro captures two voluptuous undercover federal agents, Donna and Nicole. But instead of liquidating them, he gives the busty duo a head start in a deadly cat-and-mouse game involving six other assassin teams. The heated action takes them from Hawaii to Las Vegas and Louisiana.",18.6518,/xrAgzeYhng1sQjfjJFJdrcZcFK3.jpg,1991-06-28,False,False,4.2,40,"Action, Thriller"
False,/rthMuZfFv4fqEU4JVbgSW9wQ8rs.jpg,"28, 878, 12",986056,Thunderbolts*,en,Thunderbolts*,"After finding themselves ensnared in a death trap, seven disillusioned castoffs must embark on a dangerous mission that will force them to confront the darkest corners of their pasts.",18.6464,/hqcexYHbiTBfDIdDWxrxPtVndBX.jpg,2025-04-30,False,False,7.291,3398,"Action, Science Fiction, Adventure"
False,/eJPPP5MQiwUMo9wxWvsVyZVKTVk.jpg,"14, 53, 18",1469458,Sambhavam Adhyayam Onnu,ml,സംഭവം അദ്ധ്യായം ഒന്ന്,"After becoming stuck in a time loop in a haunted forest, a man works to save himself and the other trapped souls around him.",18.5983,/tBNSo4T0R8UztkkpjYkzXI4bFAT.jpg,2026-03-06,False,False,6.2,4,"Fantasy, Thriller, Drama"
False,/ze6Mx4QE5mQVXRYmG2flncqqle4.jpg,"12, 14",767,Harry Potter and the Half-Blood Prince,en,Harry Potter and the Half-Blood Prince,"As Lord Voldemort tightens his grip on both the Muggle and wizarding worlds, Hogwarts is no longer a safe haven. Harry suspects perils may even lie within the castle, but Dumbledore is more intent upon preparing him for the final battle fast approaching. Together they work to find the key to unlock Voldemorts defenses and to this end, Dumbledore recruits his old friend and colleague Horace Slughorn, whom he believes holds crucial information. Even as the decisive showdown looms, romance blossoms for Harry, Ron, Hermione and their classmates. Love is in the air, but danger lies ahead and Hogwarts may never be the same again.",18.5175,/z7uo9zmQdQwU5ZJHFpv2Upl30i1.jpg,2009-07-15,False,False,7.681,20666,"Adventure, Fantasy"
False,/A7BiqPOKvGNalAZhFn1WfSeG9aO.jpg,"27, 9648, 53, 10770",137051,Midnight Matinee,en,Midnight Matinee,"Even though a devastating murder took place during a small town's horror film festival two years earlier, townspeople want another festival.",18.5161,/czam6wq46B9UCZvq85vicElckFq.jpg,1988-10-12,False,False,5.0,6,"Horror, Mystery, Thriller, TV Movie"
False,/9NSXdVHeSfSHUv49OzLispFcpz1.jpg,"28, 53",560016,Monkey Man,en,Monkey Man,"Kid is an anonymous young man who ekes out a meager living in an underground fight club where, night after night, wearing a gorilla mask, he is beaten bloody by more popular fighters for cash. After years of suppressed rage, Kid discovers a way to infiltrate the enclave of the city’s sinister elite. As his childhood trauma boils over, his mysteriously scarred hands unleash an explosive campaign of retribution to settle the score with the men who took everything from him.",18.447,/4lhR4L2vzzjl68P1zJyCH755Oz4.jpg,2024-04-03,False,False,6.9,1376,"Action, Thriller"
False,/en971MEXui9diirXlogOrPKmsEn.jpg,"28, 12, 35",293660,Deadpool,en,Deadpool,"The origin story of former Special Forces operative turned mercenary Wade Wilson, who, after being subjected to a rogue experiment that leaves him with accelerated healing powers, adopts the alter ego Deadpool. Armed with his new abilities and a dark, twisted sense of humor, Deadpool hunts down the man who nearly destroyed his life.",18.4299,/3E53WEZJqP6aM84D8CckXx4pIHw.jpg,2016-02-09,False,False,7.623,32595,"Action, Adventure, Comedy"
False,/jr8tSoJGj33XLgFBy6lmZhpGQNu.jpg,"16, 12, 14, 35, 10751",315162,Puss in Boots: The Last Wish,en,Puss in Boots: The Last Wish,"Puss in Boots discovers that his passion for adventure has taken its toll: He has burned through eight of his nine lives, leaving him with only one life left. Puss sets out on an epic journey to find the mythical Last Wish and restore his nine lives.",18.4173,/kuf6dutpsT0vSVehic3EZIqkOBt.jpg,2022-12-07,False,False,8.2,8745,"Animation, Adventure, Fantasy, Comedy, Family"
False,/hO7KbdvGOtDdeg0W4Y5nKEHeDDh.jpg,"80, 53, 18",475557,Joker,en,Joker,"During the 1980s, a failed stand-up comedian is driven insane and turns to a life of crime and chaos in Gotham City while becoming an infamous psychopathic crime figure.",18.3836,/udDclJoHjfjb8Ekgsd4FDteOkCU.jpg,2019-10-01,False,False,8.126,27562,"Crime, Thriller, Drama"
False,/nSVwus6Vcnw06zqKAa1ioacrpUF.jpg,"80, 35",877817,Wolfs,en,Wolfs,"Hired to cover up a high-profile crime, a fixer soon finds his night spiralling out of control when he's forced to work with an unexpected counterpart.",18.3646,/vOX1Zng472PC2KnS0B9nRfM8aaZ.jpg,2024-09-20,False,False,6.5,1399,"Crime, Comedy"
False,/jRJrQ72VLyEnVsvwfep8Xjlvu8c.jpg,"80, 18, 28",101,Léon: The Professional,fr,Léon,"Léon, the top hit man in New York, has earned a rep as an effective ""cleaner"". But when his next-door neighbors are wiped out by a loose-cannon DEA agent, he becomes the unwilling custodian of 12-year-old Mathilda. Before long, Mathilda's thoughts turn to revenge, and she considers following in Léon's footsteps.",18.3547,/bxB2q91nKYp8JNzqE7t7TWBVupB.jpg,1994-09-14,False,False,8.295,15987,"Crime, Drama, Action"
False,/jhk6D8pim3yaByu1801kMoxXFaX.jpg,"28, 18, 12",98,Gladiator,en,Gladiator,"After the death of Emperor Marcus Aurelius, his devious son takes power and demotes Maximus, one of Rome's most capable generals who Marcus preferred. Eventually, Maximus is forced to become a gladiator and battle to the death against other men for the amusement of paying audiences.",18.3129,/wN2xWp1eIwCKOD0BHTcErTBv1Uq.jpg,2000-05-04,False,False,8.224,20752,"Action, Drama, Adventure"
False,/yYvBNN96Ym3wtPxGCFl7F888WwB.jpg,18,207,Dead Poets Society,en,Dead Poets Society,"At an elite, old-fashioned boarding school in New England, a passionate English teacher inspires his students to rebel against convention and seize the potential of every day, courting the disdain of the stern headmaster.",18.2043,/erzbMlcNHOdx24AXOcn2ZKA7R1q.jpg,1989-06-02,False,False,8.299,12494,Drama
False,/1w8kutrRucTd3wlYyu5QlUDMiG1.jpg,"12, 10751, 16",762509,Mufasa: The Lion King,en,Mufasa: The Lion King,"Mufasa, a cub lost and alone, meets a sympathetic lion named Taka, the heir to a royal bloodline. The chance meeting sets in motion an expansive journey of a group of misfits searching for their destiny.",18.203,/9bXHaLlsFYpJUutg4E6WXAjaxDi.jpg,2024-12-18,False,False,7.3,2612,"Adventure, Family, Animation"
False,/iVped1djsF0tvGkvnHbzsE3ZPTF.jpg,"28, 12, 878",68721,Iron Man 3,en,Iron Man 3,"When Tony Stark's world is torn apart by a formidable terrorist called the Mandarin, he starts an odyssey of rebuilding and retribution.",18.1892,/qhPtAc1TKbMPqNvcdXSOn9Bn7hZ.jpg,2013-04-18,False,False,6.931,23323,"Action, Adventure, Science Fiction"
False,/HVcza6tJtWFrLriuh3Ano4Vt46.jpg,"28, 12, 878",1930,The Amazing Spider-Man,en,The Amazing Spider-Man,"Peter Parker is an outcast high schooler abandoned by his parents as a boy, leaving him to be raised by his Uncle Ben and Aunt May. Like most teenagers, Peter is trying to figure out who he is and how he got to be the person he is today. As Peter discovers a mysterious briefcase that belonged to his father, he begins a quest to understand his parents' disappearance – leading him directly to Oscorp and the lab of Dr. Curt Connors, his father's former partner. As Spider-Man is set on a collision course with Connors' alter ego, The Lizard, Peter will make life-altering choices to use his powers and shape his destiny to become a hero.",18.1858,/jexoNYnPd6vVrmygwF6QZmWPFdu.jpg,2012-06-23,False,False,6.732,18400,"Action, Adventure, Science Fiction"
False,/w4bTBXcqXc2TUyS5Fc4h67uWbPn.jpg,18,389,12 Angry Men,en,12 Angry Men,"The defense and the prosecution have rested and the jury is filing into the jury room to decide if a young Spanish-American is guilty or innocent of murdering his father. What begins as an open and shut case soon becomes a mini-drama of each of the jurors' prejudices and preconceptions about the trial, the accused, and each other.",18.1667,/zhG3vKWyDRaZYoaww1UVAi29T9h.jpg,1957-04-10,False,False,8.559,9903,Drama
False,/9SRfeSuAu0PiuiPsfumR6p4vJpQ.jpg,35,1621,Trading Places,en,Trading Places,A snobbish investor and a wily street con-artist find their positions reversed as part of a bet by two callous millionaires.,18.1079,/8mBuLCOcpWnmYtZc4aqtvDXslv6.jpg,1983-06-07,False,False,7.231,3623,Comedy
False,/82C04rTiXYZ7c8XZv91Nu53w82Y.jpg,"28, 53",1007734,Nobody 2,en,Nobody 2,"Former assassin Hutch Mansell takes his family on a nostalgic vacation to a small-town theme park, only to be pulled back into violence when they clash with a corrupt operator, a crooked sheriff, and a ruthless crime boss.",18.0661,/svXVRoRSu6zzFtCzkRsjZS7Lqpd.jpg,2025-08-13,False,False,6.945,1455,"Action, Thriller"
False,/i7AeVOx2Nc03sTcO6e39bwfPBwd.jpg,10749,1231914,Female Workers: Romance at Work 3,ko,여직원들 : 직장 연애사 3,"Yoo-ra succeeded in finding a job after a difficult time. Despite her stunning beauty, her family's financial situation is difficult. Her male assistant manager knows of her difficult situation, so he asks for her body with money as bait. On the other hand, Hye-seon, the female manager of the same company, seduces the handsome new employee, Min-soo. Employees enjoy the world of animals in the workplace without knowing each other.",18.0076,/c4HACOcvKsWAaNTsyYs1JzfwXWi.jpg,2023-11-25,False,False,4.0,1,Romance
False,/4XM8DUTQb3lhLemJC51Jx4a2EuA.jpg,"28, 80, 53",385687,Fast X,en,Fast X,"Over many missions and against impossible odds, Dom Toretto and his family have outsmarted, out-nerved and outdriven every foe in their path. Now, they confront the most lethal opponent they've ever faced: A terrifying threat emerging from the shadows of the past who's fueled by blood revenge, and who is determined to shatter this family and destroy everything—and everyone—that Dom loves, forever.",17.9954,/fiVW06jE7z9YnO4trhaMEdclSiC.jpg,2023-05-17,False,False,6.998,6266,"Action, Crime, Thriller"
False,/xgDj56UWyeWQcxQ44f5A3RTWuSs.jpg,"16, 35, 10751, 14",2062,Ratatouille,en,Ratatouille,"Remy, a rat, possesses a palate far more refined than that of his fellow comrades. He dreams of becoming a chef, one who creates rather than scavenges. When fate deposits him in the sewers beneath one of Paris’s most famous restaurants, he finds himself ideally placed to fulfill his dream. Forming an unusual alliance with a hapless young kitchen worker, Remy begins a daring culinary double life.  As Remy pursues his vision, he must navigate the suspicions of the calculating Head Chef Skinner, the disapproval of Remy’s own colony, and the foreboding presence of renowned food critic Anton Ego, who strikes fear in the hearts of chefs all throughout France.",17.9356,/t3vaWRPSf6WjDSamIkKDs1iQWna.jpg,2007-06-28,False,False,7.8,18363,"Animation, Comedy, Family, Fantasy"
False,/rbZvGN1A1QyZuoKzhCw8QPmf2q0.jpg,"18, 53, 9648",11324,Shutter Island,en,Shutter Island,"World War II soldier-turned-U.S. Marshal Teddy Daniels investigates the disappearance of a patient from a hospital for the criminally insane, but his efforts are compromised by troubling visions and a mysterious doctor.",17.883,/nrmXQ0zcZUL8jFLrakWc90IR8z9.jpg,2010-02-14,False,False,8.198,25685,"Drama, Thriller, Mystery"
False,/cYyNJzwhaj7aC4uTlUctrfaERbf.jpg,"28, 18, 36",1305781,Blades of the Guardians: Wind Rises in the Desert,zh,镖人：风起大漠,"Dao Ma, the ""second most wanted fugitive,"" is entrusted by his benefactor, the chief of Mo family clan, to take on a mysterious escort mission-escorting the ""most wanted fugitive"" to Chang'an.",17.8565,/4QZwryGm8l7N5XdEjPchNPl0BV7.jpg,2026-02-17,False,False,7.2,35,"Action, Drama, History"
False,/t6O6XWelu27BD0OmIDCCufZZT6d.jpg,"9648, 80, 35, 10751",1301421,The Sheep Detectives,en,The Sheep Detectives,"George is a shepherd who reads detective novels to his beloved sheep every night, assuming they can't possibly understand. But when a mysterious incident disrupts life on the farm, the sheep realize they must become the detectives. As they follow the clues and investigate human suspects, they prove that even sheep can be brilliant crime-solvers.",17.8499,/hTirV44jiLh6NqdiB6jtxPsDIoG.jpg,2026-05-02,False,False,0.0,0,"Mystery, Crime, Comedy, Family"
False,/sNhzcUw5cg4JwICjnHZ5XhTKNrU.jpg,"53, 28, 878",766507,Prey,en,Prey,"When danger threatens her camp, the fierce and highly skilled Comanche warrior Naru sets out to protect her people. But the prey she stalks turns out to be a highly evolved alien predator with a technically advanced arsenal.",17.8375,/2FKjLRt7oK1bRRIrxgWmthbBdFh.jpg,2022-08-02,False,False,7.66,7635,"Thriller, Action, Science Fiction"
False,/pkxPkHOPJjOvzfQOclANEBT8OfK.jpg,"12, 14",675,Harry Potter and the Order of the Phoenix,en,Harry Potter and the Order of the Phoenix,"Returning for his fifth year at Hogwarts, Harry is stunned to find that his warnings about the return of Lord Voldemort have been ignored. Left with no choice, Harry takes matters into his own hands, training a small group of motivated students to defend themselves against the Dark Arts.",17.7643,/5aOyriWkPec0zUDxmHFP9qMmBaj.jpg,2007-07-08,False,False,7.672,20690,"Adventure, Fantasy"
False,/xKsnZDERG1dk95wuZ5q9iks3OL3.jpg,"80, 18, 28",949,Heat,en,Heat,Obsessive master thief Neil McCauley leads a top-notch crew on various daring heists throughout Los Angeles while determined detective Vincent Hanna pursues him without rest. Each man recognizes and respects the ability and the dedication of the other even though they are aware their cat-and-mouse game may end in violence.,17.7597,/umSVjVdbVwtx5ryCA2QXL44Durm.jpg,1995-12-15,False,False,7.931,8248,"Crime, Drama, Action"
False,/aCHn2TXYJfzPXQKA6r9mKPbMlUB.jpg,"35, 18",37165,The Truman Show,en,The Truman Show,"In a picture-perfect seaside town, an insurance salesman begins to realize that his entire existence may be staged and observed by a vast unseen audience as part of a reality TV show.",17.7093,/vuza0WqY239yBXOadKlGwJsZJFE.jpg,1998-06-04,False,False,8.152,20058,"Comedy, Drama"
False,/uKPbFF08QkRMvIAsgCh1soeyPhZ.jpg,"18, 878, 9648",329865,Arrival,en,Arrival,"Taking place after alien crafts land around the world, an expert linguist is recruited by the military to determine whether they come in peace or are a threat.",17.6793,/pEzNVQfdzYDzVK0XqxERIw2x2se.jpg,2016-11-10,False,False,7.6,19205,"Drama, Science Fiction, Mystery"
False,/95ckrV6wQgbffurAVmETQ5YKASL.jpg,"10752, 18, 28",228150,Fury,en,Fury,"April, 1945. As the Allies make their final push in the European Theatre, a battle-hardened army sergeant named Wardaddy commands a Sherman tank and her five-man crew on a deadly mission behind enemy lines. Outnumbered and outgunned, and with a rookie soldier thrust into their platoon, Wardaddy and his men face overwhelming odds in their heroic attempts to strike at the heart of Nazi Germany.",17.6723,/pfte7wdMobMF4CVHuOxyu6oqeeA.jpg,2014-10-15,False,False,7.543,12850,"War, Drama, Action"
False,/gvLG3Fnznkxl4SmYfcK8gUuqxM8.jpg,"28, 12, 878",823464,Godzilla x Kong: The New Empire,en,Godzilla x Kong: The New Empire,"Following their explosive showdown, Godzilla and Kong must reunite against a colossal undiscovered threat hidden within our world, challenging their very existence – and our own.",17.6642,/z1p34vh7dEOnLDmyCrlUVLuoDzd.jpg,2024-03-27,False,False,7.0,4601,"Action, Adventure, Science Fiction"
False,/6D6M5z4reppUxo2cnBEKI02Csp1.jpg,"28, 80, 53, 37",1601243,Oscar Shaw,en,Oscar Shaw,"After retiring from the police force, a relentless detective haunted by the tragic loss of his closest friend sets out on a perilous quest for vengeance, seeking redemption and fighting to restore justice to the streets he once swore to protect.",17.6595,/tsE3nySukwrfUjouz8vzvKTcXNC.jpg,2026-01-09,False,False,6.483,29,"Action, Crime, Thriller, Western"
False,/dBgxEkWe17R0AJDAvAhpeVELQx2.jpg,"28, 18, 10749",744,Top Gun,en,Top Gun,"For Lieutenant Pete 'Maverick' Mitchell and his friend and co-pilot Nick 'Goose' Bradshaw, being accepted into an elite training school for fighter pilots is a dream come true. But a tragedy, as well as personal demons, will threaten Pete's dreams of becoming an ace pilot.",17.6502,/xUuHj3CgmZQ9P2cMaqQs4J0d4Zc.jpg,1986-05-16,False,False,7.1,9461,"Action, Drama, Romance"
False,,10749,1236814,Swapping Workshop for Middle-aged Couples,ko,중년부부 스와핑 워크샵,"The young deputy Dong-sik and his wife, along with the middle-aged couple manager, went on a trip together as a couple. In fact, Dong-sik became involved in their friendship trip with ambitions for promotion. However, Dong-sik's wife, Eun-joo, takes care of her wives and is full of dissatisfaction because she seems to have become a helper for them instead of a trip. By chance, Dong-sik witnesses the manager's wife, Mal-sook, having an affair with her manager Seong-gil. In order to shut Dong-sik's mouth, Mal-sook starts her secret proposal...",17.6176,/1iVFVLcw9VN1P9kSrit8uw0iBUH.jpg,2023-04-21,False,False,9.0,1,Romance
False,/kTrgxhRSj2sun89bDbnGCPBiey6.jpg,"16, 10751, 35",378236,The Emoji Movie,en,The Emoji Movie,"Gene, a multi-expressional emoji, sets out on a journey to become a normal emoji.",17.6111,/60bTx5z9zL1AqCjZ0gmWoRMJ6Bb.jpg,2017-07-23,False,False,5.392,3300,"Animation, Family, Comedy"
False,/fe6kkxaxn0mCU2gl1vfU44IYWsy.jpg,"18, 36",1317149,I Swear,en,I Swear,"Diagnosed with Tourette Syndrome at 15, John Davidson navigates his way against the odds through troubled teenage years and into adulthood, finding inspiration in the kindness of others to discover his true purpose in life.",17.5861,/vUwyhNWBKkSwK8ELvEeBRwV724h.jpg,2025-09-22,False,False,8.293,229,"Drama, History"
False,/hwNtEmmugU5Yd7hpfprNWI0DGIn.jpg,"18, 53, 10752",16869,Inglourious Basterds,en,Inglourious Basterds,"In Nazi-occupied France during World War II, a group of Jewish-American soldiers known as ""The Basterds"" are chosen specifically to spread fear throughout the Third Reich by scalping and brutally killing Nazis. The Basterds, lead by Lt. Aldo Raine soon cross paths with a French-Jewish teenage girl who runs a movie theater in Paris which is targeted by the soldiers.",17.56,/7sfbEnaARXDDhKm0CZ7D7uc2sbo.jpg,2009-08-02,False,False,8.2,24025,"Drama, Thriller, War"
False,/tuDhEdza074bA497bO9WFEPs6O6.jpg,"12, 10751, 14",411,"The Chronicles of Narnia: The Lion, the Witch and the Wardrobe",en,"The Chronicles of Narnia: The Lion, the Witch and the Wardrobe","Siblings Lucy, Edmund, Susan and Peter step through a magical wardrobe and find the land of Narnia. There, they discover a charming, once peaceful kingdom that has been plunged into eternal winter by the evil White Witch, Jadis. Aided by the wise and magnificent lion, Aslan, the children lead Narnia into a spectacular, climactic battle to be free of the Witch's glacial powers forever.",17.5526,/iREd0rNCjYdf5Ar0vfaW32yrkm.jpg,2005-12-07,False,False,7.1,11429,"Adventure, Family, Fantasy"
False,/3q01ACG0MWm0DekhvkPFCXyPZSu.jpg,"28, 35, 80",573435,Bad Boys: Ride or Die,en,Bad Boys: Ride or Die,"After their late former Captain is framed, Lowrey and Burnett try to clear his name, only to end up on the run themselves.",17.5251,/oGythE98MYleE6mZlGs5oBGkux1.jpg,2024-06-05,False,False,7.3,3289,"Action, Comedy, Crime"
