adult,backdrop_path,genre_ids,id,title,original_language,original_title,overview,popularity,poster_path,release_date,softcore,video,vote_average,vote_count,genre_names
False,/9ywA15OAiwjSTvg3cBs9B7kOCBF.jpg,"18, 10749",337167,Fifty Shades Freed,en,Fifty Shades Freed,"Believing they have left behind shadowy figures from their past, newlyweds Christian and Ana fully embrace an inextricable connection and shared life of luxury. But just as she steps into her role as Mrs. Grey and he relaxes into an unfamiliar stability, new threats could jeopardize their happy ending before it even begins.",21.2102,/jjPJ4s3DWZZvI4vw8Xfi4Vqa1Q8.jpg,2018-01-17,False,False,6.7,8377,"Drama, Romance"
False,/hlfu6g0h0D65SjkVhQBU20zePTl.jpg,"28, 12, 14, 16",1357633,Solo Leveling -ReAwakening-,ja,俺だけレベルアップな件 -ReAwakening-,"Over a decade after 'gates' connecting worlds appeared, awakening 'hunters' with superpowers, weakest hunter Sung Jinwoo encounters a double dungeon and accepts a mysterious quest, becoming the only one able to level up, changing his fate. A catch-up recap of the first season coupled with an exclusive sneak peek of the first two episodes of the highly anticipated second season in one momentous theatrical fan experience.",21.163,/dblIFen0bNZAq8icJXHwrjfymDW.jpg,2024-11-26,False,False,7.16,272,"Action, Adventure, Fantasy, Animation"
False,/iGBbWXmAIgpiWg9Mx2D2gLzbg4n.jpg,"18, 10749",269955,Obsessed,ko,인간중독,"A secret, passionate affair happens in the summer of 1969 between Colonel Jin Pyeong, trapped in a loveless marriage with Soo Jin, and Jong Ga Heun, the Chinese-Korean wife of Captain Kyung Woo Jin.",21.1599,/fetCtoAvZShCk1nqAWZFuKZschR.jpg,2014-05-14,False,False,6.7,82,"Drama, Romance"
False,/gGBF7gDBsbddvSdps6fvNKQoqDh.jpg,"14, 27",105825,Erotic Ghost Story III,cn,聊齋三集之燈草和尚,"A wanderer meets a monk with magical powers and becomes entranced by a mural of exquisite dancing women. He enters the painting, unaware of the conspiracy behind it, and must rescue the women who are trapped within.",21.1424,/2b1Y6NbZenY45DgC5CwncoLkpo.jpg,1992-03-05,False,False,5.6,31,"Fantasy, Horror"
False,/bVGHSe47W6oCQL1Q88pvRAet51A.jpg,"18, 9648",1330021,Remarkably Bright Creatures,en,Remarkably Bright Creatures,"Through unlikely bonds formed during night shifts at a local aquarium, Tova, an elderly widow, learns of a life-changing discovery that may bring her joy and wonder once again.",21.1297,/9HcEqn3D4J6b2Z0jK54id9nA0fr.jpg,2026-05-07,False,False,8.553,705,"Drama, Mystery"
False,/3ffPx9jqg0yj9y1KWeagT7D20CB.jpg,"28, 12, 16, 35, 10751, 14",1011985,Kung Fu Panda 4,en,Kung Fu Panda 4,"Po is gearing up to become the spiritual leader of his Valley of Peace, but also needs someone to take his place as Dragon Warrior. As such, he will train a new kung fu practitioner for the spot and will encounter a villain called the Chameleon who conjures villains from the past.",21.0885,/kDp1vUBnMpe8ak4rjgl3cLELqjU.jpg,2024-03-02,False,False,7.004,3572,"Action, Adventure, Animation, Comedy, Family, Fantasy"
False,/cyecB7godJ6kNHGONFjUyVN9OX5.jpg,"28, 878, 12",1726,Iron Man,en,Iron Man,"After being held captive in an Afghan cave, billionaire engineer Tony Stark creates a unique weaponized suit of armor to fight evil.",21.0649,/78lPtwv72eTNqFW9COBYI0dWDJa.jpg,2008-04-30,False,False,7.662,28290,"Action, Science Fiction, Adventure"
False,/A2tzVTVtnTvpji96IZmleN78KKv.jpg,"27, 35",1239134,Bhooth Bangla,hi,भूत बंगला,"A man inherits a palace in rural Mangalpur and plans his sister's wedding there, but strange supernatural events and panicked locals force him to investigate the property's mysterious past.",21.0586,/ArIS4vwUxdhm3j7tsTHmffdfU8W.jpg,2026-04-16,False,False,5.431,51,"Horror, Comedy"
False,/drRxbu2OHG0DEENptZ8wI5f0uEU.jpg,"878, 28, 35",1119449,"Good Luck, Have Fun, Don't Die",en,"Good Luck, Have Fun, Don't Die",A 'Man from the Future' arrives at an LA diner where he must recruit the precise combination of disgruntled patrons to join him on a one-night quest to save the world from the terminal threat of a rogue artificial intelligence.,21.0215,/rWcfOdY7TU6lTdazWj0ebDZnAfO.jpg,2026-02-13,False,False,7.075,681,"Science Fiction, Action, Comedy"
False,/r9leYNa8nTRCceZrZhP1DXkgKVb.jpg,"27, 9648, 878",1091,The Thing,en,The Thing,A research team in Antarctica is hunted by a shape-shifting alien that assumes the appearance of its victims.,20.9256,/tzGY49kseSE9QAKk47uuDGwnSCu.jpg,1982-06-25,False,False,8.074,8018,"Horror, Mystery, Science Fiction"
False,/mZ6J2g6HCV2gj3iuCdSxcyBXq9c.jpg,"16, 10751, 18, 36, 12",1167307,David,en,David,"From the songs of his mother’s heart to the whispers of a faithful God, David’s story begins in quiet devotion. When the giant Goliath rises to terrorize a nation, a young shepherd armed with only a sling, a few stones, and unshakable faith steps forward. Pursued by power and driven by purpose, his journey tests the limits of loyalty, love, and courage—culminating in a battle not just for a crown, but for the soul of a kingdom.",20.858,/bESlrLOrsQ9gKzaGQGHXKOyIUtX.jpg,2025-12-14,False,False,8.0,163,"Animation, Family, Drama, History, Adventure"
False,/5bzPWQ2dFUl2aZKkp7ILJVVkRed.jpg,"12, 35, 878",105,Back to the Future,en,Back to the Future,"Eighties teenager Marty McFly is accidentally sent back in time to 1955, inadvertently disrupting his parents' first meeting and attracting his mother's romantic interest. Marty must repair the damage to history by rekindling his parents' romance and - with the help of his eccentric inventor friend Doc Brown - return to 1985.",20.8487,/vN5B5WgYscRGcQpVhHl6p9DDTP0.jpg,1985-07-03,False,False,8.326,21953,"Adventure, Comedy, Science Fiction"
False,/cbcpDn6XJaIGoOil1bKuskU8ds4.jpg,"12, 14",12445,Harry Potter and the Deathly Hallows: Part 2,en,Harry Potter and the Deathly Hallows: Part 2,"Harry, Ron and Hermione continue their quest to vanquish the evil Voldemort once and for all. Just as things begin to look hopeless for the young wizards, Harry discovers a trio of magical objects that endow him with powers to rival Voldemort's formidable skills.",20.8177,/c54HpQmuwXjHq2C9wmoACjxoom3.jpg,2011-07-12,False,False,8.08,22105,"Adventure, Fantasy"
False,/lFIXZpwwlF9hg8NM3RazaIJDuaj.jpg,18,207,Dead Poets Society,en,Dead Poets Society,"At an elite, old-fashioned boarding school in New England, a passionate English teacher inspires his students to rebel against convention and seize the potential of every day, courting the disdain of the stern headmaster.",20.7525,/erzbMlcNHOdx24AXOcn2ZKA7R1q.jpg,1989-06-02,False,False,8.3,12699,Drama
False,/ojgXOhVi9Yk8irDpRfDkIzdD1LK.jpg,"35, 10749, 18",18240,The Proposal,en,The Proposal,"When she learns she's in danger of losing her visa status and being deported, overbearing book editor Margaret Tate forces her put-upon assistant, Andrew Paxton, to marry her.",20.7469,/6stnAm1wSek8ZrislwK4xGTyCnt.jpg,2009-06-02,False,False,7.174,7603,"Comedy, Romance, Drama"
False,/htmYEfH7TQgzsXHCnNXxmoYKQtL.jpg,"12, 14",673,Harry Potter and the Prisoner of Azkaban,en,Harry Potter and the Prisoner of Azkaban,Harry Potter's life is in danger once more as dangerous wizard Sirius Black has escaped from Azkaban Prison and is heading to Hogwarts.,20.7305,/aWxwnYoe8p2d2fcxOqtvAtJ72Rw.jpg,2004-05-31,False,False,8.009,23296,"Adventure, Fantasy"
False,/pMxO1beNNFYMDM7RcDyKW5Wheuz.jpg,"12, 16, 35, 10751, 14",991494,The SpongeBob Movie: Search for SquarePants,en,The SpongeBob Movie: Search for SquarePants,"Desperate to be a big guy, SpongeBob sets out to prove his bravery to Mr. Krabs by following The Flying Dutchman – a mysterious swashbuckling ghost pirate – on a seafaring adventure that takes him to the deepest depths of the deep sea, where no Sponge has gone before.",20.6017,/xJnOMMsFASxNiFnG7v3TNIQ3ife.jpg,2025-12-16,False,False,6.85,313,"Adventure, Animation, Comedy, Family, Fantasy"
False,/fbWHVtOATFhpipizRBNeulJNbcH.jpg,18,482706,Oligosaccharide The Movie,ko,올리고당 더 무비,"A truth tale about ""Oligosaccharide"" written by Crocodile Man. One 'Geun-hyeok' and ten 'Mi-jeongs' put on a sexy adult fantasy! Geun-hyeok and Mi-jeong switch bodies after they have intercourse. Mi-jeong asks Geun-hyeok for something as she's about to get married... Mi-jeong is a call girl who seduces Geun-seok. She's actually a killer. What is she? Tae-sik only drinks black coffee and Mi-jeong likes him. Will they come true? Tae-sik is a loser who uses his wife to rip money off of other men. Geun-hyeok loves her. What will happen to them? What if someone is watching me? Mi-jeong asks detective Geun-hyeok for help... ""I have a wife!"" Geun-hyeok drinks with his sexy superior Mi-jeong and thing happen. Mi-jeong and her husband have a pile of debt. Mi-jeong goes to her friend Geun-hyeok who can foresee the future. Geun-hyeok is perfect and Mi-jeong loves her husband but she can't help feeling unsteady. Tae-sik leaves on a suicide journey and meets Mi-jeong. They fall in love...",20.4959,/8hRAm3H3wwBGRBCre6xfQfpwmHj.jpg,2017-06-15,False,False,4.5,11,Drama
False,/eCynaAOgYYiw5yN5lBwz3IxqvaW.jpg,"16, 10751, 12",12,Finding Nemo,en,Finding Nemo,"Nemo, an adventurous young clownfish, is unexpectedly taken from his Great Barrier Reef home to a dentist's office aquarium. It's up to his worrisome father Marlin and a friendly but forgetful fish Dory to bring Nemo home -- meeting vegetarian sharks, surfer dude turtles, hypnotic jellyfish, hungry seagulls, and more along the way.",20.4745,/5lc6nQc0VhWFYFbNv016xze8Jvy.jpg,2003-05-30,False,False,7.82,20660,"Animation, Family, Adventure"
False,/rlay2M5QYvi6igbGcFjq8jxeusY.jpg,"80, 53, 18",475557,Joker,en,Joker,"During the 1980s, a failed stand-up comedian is driven insane and turns to a life of crime and chaos in Gotham City while becoming an infamous psychopathic crime figure.",20.4107,/udDclJoHjfjb8Ekgsd4FDteOkCU.jpg,2019-10-01,False,False,8.123,27876,"Crime, Thriller, Drama"
False,/b7xQ5fuyVO4c24igizCfPgF6n7q.jpg,"10751, 18",406997,Wonder,en,Wonder,"The story of August Pullman – a boy with facial differences – who enters fifth grade, attending a mainstream elementary school for the first time.",20.3494,/sONh3LYGFcVDTy8pm1tbSOB13Li.jpg,2017-11-13,False,False,8.106,8289,"Family, Drama"
False,,"18, 35",448772,A Great Love,it,Un grande amore,Two couples meet at a spa when they realize their respective suites share a bathroom.,20.3443,/jZolzsQj3zPINjmGuNuIA6iZPZG.jpg,1995-01-01,False,False,5.0,5,"Drama, Comedy"
False,/AoSZyb37ljMAxw0RdeQEBHKtgcc.jpg,"10751, 16, 12, 35, 14",330457,Frozen II,en,Frozen II,"Elsa, Anna, Kristoff and Olaf head far into the forest to learn the truth about an ancient mystery of their kingdom.",20.3353,/mINJaa34MtknCYl5AjtNJzWj8cD.jpg,2019-11-20,False,False,7.229,10335,"Family, Animation, Adventure, Comedy, Fantasy"
False,/34jW8LvjRplM8Pv06cBFDpLlenR.jpg,"28, 12, 878",429617,Spider-Man: Far From Home,en,Spider-Man: Far From Home,"Peter Parker and his friends go on a summer trip to Europe. However, they will hardly be able to rest - Peter will have to agree to help Nick Fury uncover the mystery of creatures that cause natural disasters and destruction throughout the continent.",20.2932,/4q2NNj4S5dG2RLF9CpXsej7yXl.jpg,2019-06-28,False,False,7.395,17083,"Action, Adventure, Science Fiction"
False,/akJghVpe8jwWXEA5aWRNhJWozGL.jpg,35,30723,Cavegirl,en,Cavegirl,"On a class excursion to a cave with stone age paintings the clumsy Rex gets lost. A mysterious crystal opens a gateway in time and sets him back to the stone ages, where he meets a group of prehistoric fellows and the gorgeous Eba. While teaching her English and doing some pseudo-research on her fellows, his main goal is to get her sleeping with him. However the curiosity of the clan chief disturbs his attempts.",20.2898,/kONbgktPKsm3EMj3MiES0IP8BRr.jpg,1985-05-01,False,False,4.0,23,Comedy
False,/5n417Ff5GXOGCOKj3ZLMRAxEP0o.jpg,"18, 9648",249397,Nymphomaniac: Vol. II,en,Nymphomaniac: Vol. II,The continuation of Joe's sexually dictated life delves into the darker aspects of her adult life and what led to her being in Seligman's care.,20.2692,/iLUNqgNKuWn667kXCKztSxYbT3k.jpg,2013-12-25,False,False,6.714,3208,"Drama, Mystery"
False,/nv5wwZou159v5OC61i4ElR7OqyY.jpg,"14, 16, 12",4935,Howl's Moving Castle,ja,ハウルの動く城,"Sophie, a young milliner, is turned into an elderly woman by a witch who enters her shop and curses her. She encounters a wizard named Howl and gets caught up in his resistance to fighting for the king.",20.1731,/13kOl2v0nD2OLbVSHnHk8GUFEhO.jpg,2004-09-09,False,False,8.388,11183,"Fantasy, Animation, Adventure"
False,/7IGKrY1f1KfwMipx9wZC4NRgIdF.jpg,"18, 10749, 53",216015,Fifty Shades of Grey,en,Fifty Shades of Grey,"When college senior Anastasia Steele steps in for her sick roommate to interview prominent businessman Christian Grey for their campus paper, little does she realize the path her life will take. Christian, as enigmatic as he is rich and powerful, finds himself strangely drawn to Ana, and she to him. Though sexually inexperienced, Ana plunges headlong into an affair -- and learns that Christian's true sexual proclivities push the boundaries of pain and pleasure.",20.1587,/63kGofUkt1Mx0SIL4XI4Z5AoSgt.jpg,2015-02-11,False,False,5.866,12434,"Drama, Romance, Thriller"
False,/6pqJ5v7Q49aUZYtjnKqoJs2PTaf.jpg,10749,1232221,Mother-in-law in Love With Son-in-law 4,ko,사위 사랑은 장모 4,"Joon-yeon and So-hyeon are living together with Joon-yeon's young and pretty mother-in-law for a while after his father-in-law remarries. One day, Joon-yeon is left home alone with his mother-in-law due to So-hyeon and her father-in-law's sudden business trip. The mother-in-law seduces her handsome son-in-law on a hot night. Unable to forget the sex he had with his mother-in-law, Joon-yeon even plans to have a threesome with his wife and his mother-in-law.",19.8835,/o3yMT5okmLA3x9rTe5tCrqke1oI.jpg,2023-12-26,False,False,4.0,1,Romance
False,/9X7Im1YuBhyHYVD8r7CAONPJR5k.jpg,"28, 878, 12",68726,Pacific Rim,en,Pacific Rim,"Using massive piloted robots to combat the alien threat, earth's survivors take the fight to the invading alien force lurking in the depths of the Pacific Ocean. Nearly defenseless in the face of the relentless enemy, the forces of mankind have no choice but to turn to two unlikely heroes who now stand as earth's final hope against the mounting apocalypse.",19.7717,/8wo4eN8dWKaKlxhSvBz19uvj8gA.jpg,2013-07-11,False,False,6.933,13482,"Action, Science Fiction, Adventure"
False,/jPu8yiadqgzwFPGKJmGo637ASVP.jpg,"878, 28, 12",1724,The Incredible Hulk,en,The Incredible Hulk,"Scientist Bruce Banner scours the planet for an antidote to the unbridled force of rage within him: the Hulk. But when the military masterminds who dream of exploiting his powers force him back to civilization, he finds himself coming face to face with a new, deadly foe.",19.7538,/gKzYx79y0AQTL4UAk1cBQJ3nvrm.jpg,2008-06-12,False,False,6.245,12779,"Science Fiction, Action, Adventure"
False,/xKsnZDERG1dk95wuZ5q9iks3OL3.jpg,"80, 18, 28",949,Heat,en,Heat,Obsessive master thief Neil McCauley leads a top-notch crew on various daring heists throughout Los Angeles while determined detective Vincent Hanna pursues him without rest. Each man recognizes and respects the ability and the dedication of the other even though they are aware their cat-and-mouse game may end in violence.,19.7013,/e09dLw1Ljtccd2P4NsuUvVtS5du.jpg,1995-12-15,False,False,7.939,8438,"Crime, Drama, Action"
False,/gIClklFGYBe0uiOoiP2vtocJbss.jpg,"878, 28, 53",1236153,Mercy,en,Mercy,"In the near future, a detective stands on trial accused of murdering his wife. He has ninety minutes to prove his innocence to the advanced AI Judge he once championed, before it determines his fate.",19.5882,/pyok1kZJCfyuFapYXzHcy7BLlQa.jpg,2026-01-19,False,False,7.07,1460,"Science Fiction, Action, Thriller"
False,/z3br1ub7spqGMkxgjgJSdM4DC21.jpg,"18, 9648, 878",1124,The Prestige,en,The Prestige,"A mysterious story of two magicians whose intense rivalry leads them on a life-long battle for supremacy -- full of obsession, deceit and jealousy with dangerous and deadly consequences.",19.5767,/Ag2B2KHKQPukjH7WutmgnnSNurZ.jpg,2006-10-19,False,False,8.21,17705,"Drama, Mystery, Science Fiction"
False,/AmR3JG1VQVxU8TfAvljUhfSFUOx.jpg,"27, 878",348,Alien,en,Alien,"During its return to the earth, commercial spaceship Nostromo intercepts a distress signal from a distant planet. When a three-member team of the crew discovers a chamber containing thousands of eggs on the planet, a creature inside one of the eggs attacks an explorer. The entire crew is unaware of the impending nightmare set to descend upon them when the alien parasite planted inside its unfortunate host is birthed.",19.576,/vfrQk5IPloGg1v9Rzbh2Eg3VGyM.jpg,1979-05-25,False,False,8.2,16502,"Horror, Science Fiction"
False,/y51M7Ca95sCXTCDvJaRP1uzxKbg.jpg,"10752, 28, 36",652,Troy,en,Troy,"In year 1250 B.C. during the late Bronze age, two emerging nations begin to clash. Paris, the Trojan prince, convinces Helen, Queen of Sparta, to leave her husband Menelaus, and sail with him back to Troy. After Menelaus finds out that his wife was taken by the Trojans, he asks his brother Agamemnon to help him get her back. Agamemnon sees this as an opportunity for power. They set off with 1,000 ships holding 50,000 Greeks to Troy.",19.5482,/a07wLy4ONfpsjnBqMwhlWTJTcm.jpg,2004-05-13,False,False,7.178,11133,"War, Action, History"
False,/3upEZ0ltY7WwOSFVXrtiP34D48p.jpg,"53, 18, 10749",290098,The Handmaiden,ko,아가씨,"1930s Korea, in the period of Japanese occupation, a new girl, Sook-hee, is hired as a handmaiden to a Japanese heiress, Hideko, who lives a secluded life on a large countryside estate with her domineering Uncle Kouzuki. But the maid has a secret. She is a pickpocket recruited by a swindler posing as a Japanese Count to help him seduce the Lady to steal her fortune.",19.5125,/dLlH4aNHdnmf62umnInL8xPlPzw.jpg,2016-06-01,False,False,8.184,4369,"Thriller, Drama, Romance"
False,/4fza1QWpGAoxReiEsnvdFBeMyfX.jpg,"10749, 18, 35",286687,Love Lesson,ko,화려한 외출,"Korea's most popular song writer Hee-soo runs into a nineteen-year-old boy in the elevator. Hee-soo is inspired by a new song watching him shake at her figure. She starts to tell him about women under the excuse that she's teaching him music. They fall for each other but things get complicated when her life teacher, Joon-ho who taught her about life and music comes back.",19.5031,/yUQg6yvZIRQUSyQ36TQo0Tp1gzr.jpg,2013-12-05,False,False,6.8,42,"Romance, Drama, Comedy"
False,/4BSJVRQ3EsHMIVZSiKz1l58jDhg.jpg,"27, 9648",1480387,undertone,en,undertone,The host of a popular paranormal podcast becomes haunted by terrifying recordings mysteriously sent her way.,19.5016,/2PFgFMnrdCPXWiZl1PUvky7Mo9D.jpg,2026-03-12,False,False,6.1,313,"Horror, Mystery"
False,/s94NjfKkcSczZ1FembwmQZwsuwY.jpg,"878, 12, 28",617126,The Fantastic 4: First Steps,en,The Fantastic 4: First Steps,"Against the vibrant backdrop of a 1960s-inspired, retro-futuristic world, Marvel's First Family is forced to balance their roles as heroes with the strength of their family bond, while defending Earth from a ravenous space god called Galactus and his enigmatic Herald, Silver Surfer.",19.4188,/nf5qaSEvyYSNeFH0YhSs5EsBLX9.jpg,2025-07-23,False,False,6.954,3481,"Science Fiction, Adventure, Action"
False,/1OV7hau4D3rWGS5bu8sqBYeVpe.jpg,"12, 14",674,Harry Potter and the Goblet of Fire,en,Harry Potter and the Goblet of Fire,"When his name emerges from the Goblet of Fire, Harry Potter becomes a competitor in a grueling battle for glory among three wizarding schools. Signs of Voldemort's return emerge as Harry's friends help him prepare for the Triwizard Tournament.",19.3848,/fECBtHlr0RB3foNHDiCBXeg9Bv9.jpg,2005-11-16,False,False,7.804,22303,"Adventure, Fantasy"
False,/rj58WQ9ImI0mYDptXdM7euX1Wjt.jpg,"16, 10751, 12, 14",109445,Frozen,en,Frozen,"Young princess Anna of Arendelle dreams about finding true love at her sister Elsa’s coronation. Fate takes her on a dangerous journey in an attempt to end the eternal winter that has fallen over the kingdom. She's accompanied by ice delivery man Kristoff, his reindeer Sven, and snowman Olaf. On an adventure where she will find out what friendship, courage, family, and true love really means.",19.3603,/itAKcobTYGpYT8Phwjd8c9hleTo.jpg,2013-11-20,False,False,7.2,17651,"Animation, Family, Adventure, Fantasy"
False,/zdXnJqBaGFVtLoPNuMeKfEYUViZ.jpg,"10749, 18",11036,The Notebook,en,The Notebook,"An epic love story centered around an older man who reads aloud to a woman with Alzheimer's. From a faded notebook, the old man's words bring to life the story about a couple who is separated by World War II, and is then passionately reunited, seven years later, after they have taken different paths.",19.3318,/rNzQyW4f8B8cQeg7Dgj3n6eT5k9.jpg,2004-06-25,False,False,7.89,12641,"Romance, Drama"
False,/k0hlAzTryCYX1O1LyC6P8tAa8s0.jpg,"28, 12, 878",102382,The Amazing Spider-Man 2,en,The Amazing Spider-Man 2,"For Peter Parker, life is busy. Between taking out the bad guys as Spider-Man and spending time with the person he loves, Gwen Stacy, high school graduation cannot come quickly enough. Peter has not forgotten about the promise he made to Gwen’s father to protect her by staying away, but that is a promise he cannot keep. Things will change for Peter when a new villain, Electro, emerges, an old friend, Harry Osborn, returns, and Peter uncovers new clues about his past.",19.3272,/dGjoPttcbKR5VWg1jQuNFB247KL.jpg,2014-04-16,False,False,6.545,14343,"Action, Adventure, Science Fiction"
False,/5YZbUmjbMa3ClvSW1Wj3D6XGolb.jpg,"878, 12, 28",447365,Guardians of the Galaxy Vol. 3,en,Guardians of the Galaxy Vol. 3,"Peter Quill, still reeling from the loss of Gamora, must rally his team around him to defend the universe along with protecting one of their own. A mission that, if not completed successfully, could quite possibly lead to the end of the Guardians as we know them.",19.3048,/r2J02Z2OpNTctfOSN1Ydgii51I3.jpg,2023-05-03,False,False,7.932,8458,"Science Fiction, Adventure, Action"
False,/lMLyfSiaumaKniwynwAxu69CLTz.jpg,"18, 10749, 36",858024,Hamnet,en,Hamnet,"The powerful story of love and loss that inspired the creation of Shakespeare's timeless masterpiece, Hamlet.",19.2943,/zIcd6yuBucRNof5t9KVuGBHIhXU.jpg,2025-11-26,False,False,7.733,1428,"Drama, Romance, History"
False,/vpuPY4UziUCxv7gYYoaZQ3LX7to.jpg,"28, 53",1383731,Protector,en,Protector,"Nikki's life is shattered when her daughter is kidnapped. Thrust into the criminal underworld while hunted by cops and military, she must fight to rescue her child.",19.2719,/icOZpnGuH9YrEaW3wrw5GJaXGih.jpg,2026-02-20,False,False,8.547,411,"Action, Thriller"
False,/54BOXpX2ieTXMDzHymdDMnUIzYG.jpg,"27, 53",1228246,Five Nights at Freddy's 2,en,Five Nights at Freddy's 2,"One year since the supernatural nightmare at Freddy Fazbear's Pizza, the stories about what transpired there have been twisted into a campy local legend, inspiring the town's first ever Fazfest. With the truth kept from her, Abby sneaks out to reconnect with Freddy, Bonnie, Chica, and Foxy, setting into motion a terrifying series of events that will reveal dark secrets about the real origin of Freddy's, and unleash a decades-hidden horror.",19.2385,/udAxQEORq2I5wxI97N2TEqdhzBE.jpg,2025-12-03,False,False,6.645,1035,"Horror, Thriller"
False,/nnmbJvYyDS1VkMOCbxSpdBi3WbJ.jpg,"28, 18, 36",1579,Apocalypto,en,Apocalypto,"Set in the Mayan civilization, when a man's idyllic presence is brutally disrupted by a violent invading force, he is taken on a perilous journey to a world ruled by fear and oppression where a harrowing end awaits him. Through a twist of fate and spurred by the power of his love for his woman and his family he will make a desperate break to return home and to ultimately save his way of life.",19.2195,/cRY25Q32kDNPFDkFkxAs6bgCq3L.jpg,2006-12-07,False,False,7.649,6472,"Action, Drama, History"
False,/IYUD7rAIXzBM91TT3Z5fILUS7n.jpg,"80, 9648, 53",414906,The Batman,en,The Batman,"In his second year of fighting crime, Batman uncovers corruption in Gotham City that connects to his own family while facing a serial killer known as the Riddler.",19.2111,/74xTEgt7R36Fpooo50r9T25onhq.jpg,2022-03-01,False,False,7.663,12091,"Crime, Mystery, Thriller"
False,/w1oD1MzHjnBJc5snKupIQaSBLIh.jpg,"28, 12, 878",559,Spider-Man 3,en,Spider-Man 3,"The seemingly invincible Spider-Man goes up against an all-new crop of villains—including the shape-shifting Sandman. While Spider-Man’s superpowers are altered by an alien organism, his alter ego, Peter Parker, deals with nemesis Eddie Brock and also gets caught up in a love triangle.",19.2105,/qFmwhVUoUSXjkKRmca5yGDEXBIj.jpg,2007-05-01,False,False,6.463,15328,"Action, Adventure, Science Fiction"
False,,35,1611380,My Worst Enemy,es,Mi mejor enemiga,"Valeria and her former high school classmates reunite twenty-five years later at the place where they shared their last unforgettable summer. During the reunion, old rivalries resurface, leading them into hilarious situations where they will discover the true value of friendship and the weight of the past on the present.",19.1453,/tZ5I6cq7TpsY7nwpM4n47p7XcZK.jpg,2026-02-05,False,False,5.9,10,Comedy
False,/fj0hwDJEOOHllRim2BMt5L7tbjf.jpg,"80, 18, 28",101,Léon: The Professional,fr,Léon,"Léon, the top hit man in New York, has earned a rep as an effective ""cleaner"". But when his next-door neighbors are wiped out by a loose-cannon DEA agent, he becomes the unwilling custodian of 12-year-old Mathilda. Before long, Mathilda's thoughts turn to revenge, and she considers following in Léon's footsteps.",19.1439,/bxB2q91nKYp8JNzqE7t7TWBVupB.jpg,1994-09-14,False,False,8.295,16207,"Crime, Drama, Action"
