adult,backdrop_path,genre_ids,id,title,original_language,original_title,overview,popularity,poster_path,release_date,softcore,video,vote_average,vote_count,genre_names
False,/4mcOCiR06dqQ5eoEJcG3zvonjOa.jpg,"878, 28, 53, 12",294254,Maze Runner: The Scorch Trials,en,Maze Runner: The Scorch Trials,"Thomas and his fellow Gladers face their greatest challenge yet: searching for clues about the mysterious and powerful organization known as WCKD. Their journey takes them to the Scorch, a desolate landscape filled with unimaginable obstacles. Teaming up with resistance fighters, the Gladers take on WCKD’s vastly superior forces and uncover its shocking plans for them all.",11.5787,/mYw7ZyejqSCPFlrT2jHZOESZDU3.jpg,2015-09-09,False,False,6.729,11024,"Science Fiction, Action, Thriller, Adventure"
False,/AgvVh3ej3UrTl6PITR0et8JKGA3.jpg,18,1523667,69,tl,69,"Five lives. One city. In the heart of Manila, their stories intertwine through desire, heartbreak, and the rawness of life.",11.5716,/7s0S70dwEOhrIGMV2nowoN9eqCY.jpg,2025-08-22,False,False,6.6,7,Drama
False,/2ndw55F40IkALzWyjCCza3M6nqM.jpg,18,14,American Beauty,en,American Beauty,"Lester Burnham, a depressed suburban father in a mid-life crisis, decides to turn his hectic life around after developing an infatuation with his daughter's attractive friend.",11.5707,/wby9315QzVKdW9BonAefg8jGTTb.jpg,1999-09-15,False,False,8.001,13047,Drama
False,/2IIKts2A9vnUdM9tTC76B8tDmuZ.jpg,27,1151031,Bring Her Back,en,Bring Her Back,"Following the death of their father, a brother and sister are sent to live with a foster mother, only to learn that she is hiding a terrifying secret.",11.569,/1Q3GlCXGYWELifxANYZ5OVMRVZl.jpg,2025-05-19,False,False,7.343,1667,Horror
False,/iwvP8XVpYVmJ3xfF9xdBi5uAOWl.jpg,"80, 18, 53, 28",75780,Jack Reacher,en,Jack Reacher,"One morning in an ordinary town, five people are shot dead in a seemingly random attack. All evidence points to a single suspect: an ex-military sniper who is quickly brought into custody. The interrogation yields one written note: 'Get Jack Reacher!'. Reacher, an enigmatic ex-Army investigator, believes the authorities have the right man but agrees to help the sniper's defense attorney. However, the more Reacher delves into the case, the less clear-cut it appears. So begins an extraordinary chase for the truth, pitting Jack Reacher against an unexpected enemy, with a skill for violence and a secret to keep.",11.569,/uQBbjrLVsUibWxNDGA4Czzo8lwz.jpg,2012-12-20,False,False,6.661,7627,"Crime, Drama, Thriller, Action"
False,/mjudUA3QNsJCtuDeXUx55MLzuKM.jpg,"10752, 28",452557,Wolf Warrior 2,zh,战狼2,"China's deadliest special forces operative settles into a quiet life on the sea. When sadistic mercenaries begin targeting nearby civilians, he must leave his newfound peace behind and return to his duties as a soldier and protector.",11.5617,/87aWrVqaVhXhblhO7sYHLC2y8TT.jpg,2017-07-27,False,False,6.509,332,"War, Action"
False,/5jnoAA74Qwb5w6B9FMvnc20n6Ie.jpg,"28, 12",353081,Mission: Impossible - Fallout,en,Mission: Impossible - Fallout,"When an IMF mission ends badly, the world is faced with dire consequences. As Ethan Hunt takes it upon himself to fulfill his original briefing, the CIA begin to question his loyalty and his motives. The IMF team find themselves in a race against time, hunted by assassins while trying to prevent a global catastrophe.",11.5608,/AkJQpZp9WoNdj7pLYSj1L0RcMMN.jpg,2018-07-25,False,False,7.449,9131,"Action, Adventure"
False,/h31SOVlekuHXsMWVGxI8nPPfY82.jpg,"18, 37",335,Once Upon a Time in the West,it,C'era una volta il West,"As the railroad builders advance unstoppably through the Arizona desert on their way to the sea, Jill arrives in the small town of Flagstone with the intention of starting a new life.",11.5588,/qbYgqOczabWNn2XKwgMtVrntD6P.jpg,1968-12-21,False,False,8.274,4898,"Drama, Western"
False,/uFcFomOJbRHGsPId6U4Xcdacvt1.jpg,35,4257,Scary Movie 4,en,Scary Movie 4,"Cindy finds out the house she lives in is haunted by a little boy and goes on a quest to find out who killed him and why. Also, Alien ""Tr-iPods"" are invading the world and she has to uncover the secret in order to stop them.",11.5547,/sEqFdw1wLtY94RKCSPolsHWzn6r.jpg,2006-04-12,False,False,5.482,3584,Comedy
False,/lqxxwTRk0l7CubY6JkJdhnwJEkn.jpg,"18, 10749",331482,Little Women,en,Little Women,Four sisters come of age in America in the aftermath of the Civil War.,11.5475,/yn5ihODtZ7ofn8pDYfxCmxh8AXI.jpg,2019-12-25,False,False,7.855,6832,"Drama, Romance"
False,/yBCekmb7vK70xUhtsRQBcTu65sB.jpg,"878, 18",840,Close Encounters of the Third Kind,en,Close Encounters of the Third Kind,"After an encounter with UFOs, an electricity linesman feels undeniably drawn to an isolated area in the wilderness where something spectacular is about to happen.",11.5342,/yaPx3cK9zGFX3SbcKwxWM1QIbUh.jpg,1977-12-14,False,False,7.35,4641,"Science Fiction, Drama"
False,/bWvGtxd3a6wW7ocQPlYza3ycpxk.jpg,"10749, 35",1317448,No Place to Be Single,it,Non è un paese per single,"A brilliant and intelligent love comedy that celebrates second chances and new horizons, starring a strong and determined woman who settles the score.",11.5277,/nsROal9WTDvbB7ITBZZGrVOlz5z.jpg,2026-05-08,False,False,6.678,76,"Romance, Comedy"
False,/94cS0mzODEoNIXFT7nhPcI8V4IJ.jpg,"878, 28, 12",842675,The Wandering Earth II,zh,流浪地球2,"Humans built huge engines on the surface of the earth to find a new home. But the road to the universe is perilous. In order to save earth, young people once again have to step forward to start a race against time for life and death.",11.5228,/hEA7bpWw5IRKOW2MVjvx46SWevU.jpg,2023-01-22,False,False,7.3,717,"Science Fiction, Action, Adventure"
False,/nFCUBRDF4C6RWopNo0nAfvMA6mm.jpg,35,225886,Sex Tape,en,Sex Tape,"When Jay and Annie first got together, their romantic connection was intense – but ten years and two kids later, the flame of their love needs a spark.  To kick things up a notch, they decide – why not? – to make a video of themselves trying out every position in The Joy of Sex in one marathon three-hour session.  It seems like a great idea – until they discover that their most private video is no longer private.  With their reputations on the line, they know they’re just one click away from being laid bare to the world... but as their race to reclaim their video leads to a night they'll never forget, they'll find that their video will expose even more than they bargained for.",11.5151,/pFdS7SIdjcrYXtf141dabWVly9B.jpg,2014-07-17,False,False,5.407,4218,Comedy
False,/mWRjVb2Lj9pjOlNcDP7lNvrvSo8.jpg,"80, 35",1400357,The Christophers,en,The Christophers,"The estranged children of a once-famous artist hire a forger to complete his unfinished works so they can be ""discovered"" and sold after his death.",11.5139,/s6oUrGMNl8hVh7fn0O8oF2rHwrM.jpg,2026-03-30,False,False,6.833,30,"Crime, Comedy"
False,/xuLA0pii2IMJW2puT7EvJtgpg0H.jpg,"28, 12, 10751, 35",675353,Sonic the Hedgehog 2,en,Sonic the Hedgehog 2,"After settling in Green Hills, Sonic is eager to prove he has what it takes to be a true hero. His test comes when Dr. Robotnik returns, this time with a new partner, Knuckles, in search for an emerald that has the power to destroy civilizations. Sonic teams up with his own sidekick, Tails, and together they embark on a globe-trotting journey to find the emerald before it falls into the wrong hands.",11.4978,/6DrHO1jr3qVrViUO6s6kFiAGM7.jpg,2022-03-30,False,False,7.429,5869,"Action, Adventure, Family, Comedy"
False,/1n00NlOGRFZVs8coBxyZLm5l4EC.jpg,"28, 12, 878",335988,Transformers: The Last Knight,en,Transformers: The Last Knight,"Humans and Transformers are at war. Optimus Prime is gone. The key to saving our future lies buried in the secrets of the past, in the hidden history of Transformers on Earth. Saving our world falls upon the shoulders of an unlikely alliance: Cade Yeager; Bumblebee; an English Lord; and an Oxford Professor.",11.49,/s5HQf2Gb3lIO2cRcFwNL9sn1o1o.jpg,2017-06-16,False,False,6.058,6715,"Action, Adventure, Science Fiction"
False,/jWq20KNbg5txb28tLxJl0yLYuxp.jpg,35,76493,The Dictator,en,The Dictator,The heroic story of a dictator who risks his life to ensure that democracy would never come to the country he so lovingly oppressed.,11.4868,/n0W7kajF4GFMRk2c0wWwMQqTaDM.jpg,2012-05-15,False,False,6.231,6445,Comedy
False,/mabuNsGJgRuCTuGqjFkWe1xdu19.jpg,"28, 12, 16, 10751",260513,Incredibles 2,en,Incredibles 2,"Elastigirl springs into action to save the day, while Mr. Incredible faces his greatest challenge yet – taking care of the problems of his three children.",11.4839,/9lFKBtaVIhP7E2Pk0IY1CwTKTMZ.jpg,2018-06-14,False,False,7.452,13674,"Action, Adventure, Animation, Family"
False,/fGBJEfGjHmhg7nLAT0Jkcv9qV5e.jpg,"18, 35, 10749",43347,Love & Other Drugs,en,Love & Other Drugs,"Maggie is an alluring free spirit who won't let anyone – or anything – tie her down. But she meets her match in Jamie, whose relentless and nearly infallible charm serves him well with the ladies and the cutthroat world of pharmaceutical sales. Maggie and Jamie's evolving relationship takes them both by surprise, as they find themselves under the influence of the ultimate drug: love.",11.4738,/wZLM2uKJRYNchLmiCIjosX0rXy8.jpg,2010-11-22,False,False,7.044,5609,"Drama, Comedy, Romance"
False,/abwxHfymXGAbbH3lo9PDEJEfvtW.jpg,"12, 28, 878",1894,Star Wars: Episode II - Attack of the Clones,en,Star Wars: Episode II - Attack of the Clones,"Following an assassination attempt on Senator Padmé Amidala, Jedi Knights Anakin Skywalker and Obi-Wan Kenobi investigate a mysterious plot into the heart of the Separatist movement and the beginning of the Clone Wars.",11.473,/oZNPzxqM2s5DyVWab09NTQScDQt.jpg,2002-05-15,False,False,6.595,14341,"Adventure, Action, Science Fiction"
False,/xnShZK7y4lupUmXghz75HRSooW9.jpg,27,9373,The Texas Chainsaw Massacre,en,The Texas Chainsaw Massacre,"After picking up a traumatized young hitchhiker, five friends find themselves stalked and hunted by a chainsaw-wielding killer and his family of equally psychopathic killers.",11.4636,/781px1eOtfVt1RdIsL4Dt1s3x7R.jpg,2003-05-21,False,False,6.301,2905,Horror
False,/bBiZN1epQTu3F8iFLBuMhc4TRzr.jpg,18,10997,Farewell My Concubine,zh,霸王别姬,"In an epic tale of theater, gender, love and class, two Beijing opera actors navigate political turmoil as their friendship evolves over decades.",11.4634,/f54hNIiHNINw3JiUJB2XaQl5wCN.jpg,1993-01-01,False,False,7.896,677,Drama
False,/rwgmDkIEv8VjAsWx25ottJrFvpO.jpg,"10749, 18",744276,After Ever Happy,en,After Ever Happy,"As a shocking truth about a couple's families emerges, the two lovers discover they are not so different from each other. Tessa is no longer the sweet, simple, good girl she was when she met Hardin — any more than he is the cruel, moody boy she fell so hard for.",11.4369,/moogpu8rNkEjTgFyLXwhPghft5w.jpg,2022-08-24,False,False,6.772,1369,"Romance, Drama"
False,/vO5poa7WpgBqzgiGSVtTdtQrecJ.jpg,10749,716273,Just A Bite,ko,한입만,"Arang doesn't have a quick match with her husband Chan-jun. I live by satisfying my needs through masturbation. Meanwhile, Chan Joon is tired of Arang, who is not satisfied with his sex life. I secretly enjoyed affair with Arang's friend Bora.",11.4264,/fBfbWJiG5CUGr1gjiaVPA6l94RW.jpg,2020-06-11,False,False,0.0,0,Romance
False,/4Wftv3PCDTJM2NtTX3dfCF1DSNm.jpg,"28, 80, 53",1421155,Ikatan Darah,id,Ikatan Darah,"A former martial arts athlete must face a network of loan sharks to save her younger brother, who is trapped in online gambling debt and risking their family’s safety.",11.4243,/lF9amilOGIudUIq6NgDnz2YrPPa.jpg,2026-04-30,False,False,6.5,4,"Action, Crime, Thriller"
False,/5rARlA8beRAVXPYzSaF2NoS8Ry5.jpg,"16, 35, 10751, 14",76492,Hotel Transylvania,en,Hotel Transylvania,"Welcome to Hotel Transylvania, Dracula's lavish five-stake resort, where monsters and their families can live it up and no humans are allowed. One special weekend, Dracula has invited all his best friends to celebrate his beloved daughter Mavis's 118th birthday. For Dracula catering to all of these legendary monsters is no problem but the party really starts when one ordinary guy stumbles into the hotel and changes everything!",11.4193,/eJGvzGrsfe2sqTUPv5IwLWXjVuR.jpg,2012-09-20,False,False,6.964,9173,"Animation, Comedy, Family, Fantasy"
False,/rfkIeCaIHhN3K5wjJJqKmfUjYp8.jpg,"18, 36",381284,Hidden Figures,en,Hidden Figures,"The untold story of Katherine G. Johnson, Dorothy Vaughan and Mary Jackson – brilliant African-American women working at NASA and serving as the brains behind one of the greatest operations in history – the launch of astronaut John Glenn into orbit. The visionary trio crossed all gender and race lines to inspire generations to dream big.",11.4133,/9lfz2W2uGjyow3am00rsPJ8iOyq.jpg,2016-12-10,False,False,8.043,10436,"Drama, History"
False,/sM42bpH73dmf3kJrE8xr4kztYqR.jpg,"878, 9648, 27",70981,Prometheus,en,Prometheus,"A team of explorers discover a clue to the origins of mankind on Earth, leading them on a journey to the darkest corners of the universe. There, they must fight a terrifying battle to save the future of the human race.",11.4073,/qsYQflQhOuhDpQ0W2aOcwqgDAeI.jpg,2012-05-30,False,False,6.596,13256,"Science Fiction, Mystery, Horror"
False,/lMRMjd9yJsZLyaT97eiURu2zVb4.jpg,"28, 53",8681,Taken,en,Taken,"Bryan Mills, a former government operative, is trying to reconnect with his teenage daughter Kim. After reluctantly agreeing with his ex-wife to let Kim go to Paris on vacation with a friend, his worst nightmare comes true. While on the phone with his daughter shortly after she arrives in Paris, she and her friend are abducted by a gang of human traffickers. Working against the clock, Bryan relies on his extensive training and skills to track down the ruthless gang that abducted her and launch a one-man war to rescue his daughter.",11.3975,/ognkaUSNgJe1a2pjB4UNdzEo5jT.jpg,2008-02-18,False,False,7.406,12102,"Action, Thriller"
False,/1McO40rFBnUSz0EB2EwYQlUv9LV.jpg,"27, 53",776797,The Sadness,zh,哭悲,"A young couple is pushed to the limits of sanity as they attempt to be reunited amid the chaos of a pandemic outbreak. The streets erupt into violence and depravity, as those infected are driven to enact the most cruel and ghastly things imaginable.",11.3882,/mi5lh2brPMzuWYddyUKuCtcnjt1.jpg,2021-01-22,False,False,6.817,1114,"Horror, Thriller"
False,/2vq5GTJOahE03mNYZGxIynlHcWr.jpg,"18, 28, 36",359724,Ford v Ferrari,en,Ford v Ferrari,"American car designer Carroll Shelby and the British-born driver Ken Miles work together to battle corporate interference, the laws of physics, and their own personal demons to build a revolutionary race car for Ford Motor Company and take on the dominating race cars of Enzo Ferrari at the 24 Hours of Le Mans in France in 1966.",11.3782,/dR1Ju50iudrOh3YgfwkAU1g2HZe.jpg,2019-11-13,False,False,8.007,8971,"Drama, Action, History"
False,/zDIievPXqjfjLogXFqnnopU0OkK.jpg,"12, 16, 35, 10751",412117,The Secret Life of Pets 2,en,The Secret Life of Pets 2,"Max the terrier must cope with some major life changes when his owner gets married and has a baby. When the family takes a trip to the countryside, nervous Max has numerous run-ins with canine-intolerant cows, hostile foxes and a scary turkey. Luckily for Max, he soon catches a break when he meets Rooster, a gruff farm dog who tries to cure the lovable pooch of his neuroses.",11.3597,/s9xg4V5EDKiphgIksVJ9gewBM11.jpg,2019-05-24,False,False,6.948,3327,"Adventure, Animation, Comedy, Family"
False,/wyvUmyzqGOBDyqLHRSukGDjI7bH.jpg,18,50014,The Help,en,The Help,"Aibileen Clark is a middle-aged African-American maid who has spent her life raising white children and has recently lost her only son; Minny Jackson is an African-American maid who has often offended her employers despite her family's struggles with money and her desperate need for jobs; and Eugenia ""Skeeter"" Phelan is a young white woman who has recently moved back home after graduating college to find out her childhood maid has mysteriously disappeared. These three stories intertwine to explain how life in Jackson, Mississippi revolves around ""the help""; yet they are always kept at a certain distance because of racial lines.",11.3544,/3kmfoWWEc9Vtyuaf9v5VipRgdjx.jpg,2011-08-09,False,False,8.202,9040,Drama
False,/37y53Jt8K6MvN6s4zJVFa61luO2.jpg,"10749, 18",851644,20th Century Girl,ko,20세기 소녀,"In 1999, a teen girl keeps close tabs on a boy in school on behalf of her deeply smitten best friend – then she gets swept up in a love story of her own.",11.3457,/od22ftNnyag0TTxcnJhlsu3aLoU.jpg,2022-10-06,False,False,8.154,814,"Romance, Drama"
False,/eUERZRVjCTNdgnESlQxyaOJ2d4K.jpg,28,1584215,The Internship,en,The Internship,"A CIA-trained assassin recruits other graduates from her secret childhood program, The Internship, to violently destroy the organization. The CIA fights back with deadly force.",10.0753,/fYqSOkix4rbDiZW0ACNnvZCpT6X.jpg,2026-01-13,False,False,6.274,73,Action
False,/g1OvTd1eF346vmx8qsJnjaiooZ6.jpg,"12, 14, 10751",630,The Wizard of Oz,en,The Wizard of Oz,"Young Dorothy finds herself in a magical world where she makes friends with a lion, a scarecrow and a tin man as they make their way along the yellow brick road to talk with the Wizard and ask for the things they miss most in their lives. The Wicked Witch of the West is the only thing that could stop them.",11.3937,/uCC3j4pV9eOZwzDUWp2ilbcTf1f.jpg,1939-08-15,False,False,7.6,6114,"Adventure, Fantasy, Family"
False,/u2Z5gaD5IgGf1gnmW7FvXTrRGKJ.jpg,28,91612,Caged Fury,en,Caged Fury,"Kat arrives in Los Angeles to audition for movies. However, after meeting a sleazy producer, she and her new friend find themselves in a women's prison run by sadistic guards and a lesbian warden.",7.9776,/bkDD3t7z5mIOOb7WLDMieF9nVnL.jpg,1990-03-01,False,False,4.076,47,Action
False,/6qHI1IYj7QlLSCwHRzkL62X175s.jpg,18,73,American History X,en,American History X,"Derek Vineyard is paroled after serving 3 years in prison for killing two African-American men. Through his brother, Danny Vineyard's narration, we learn that before going to prison, Derek was a skinhead and the leader of a violent white supremacist gang that committed acts of racial crime throughout L.A. and his actions greatly influenced Danny. Reformed and fresh out of prison, Derek severs contact with the gang and becomes determined to keep Danny from going down the same violent path as he did.",11.2829,/x2drgoXYZ8484lqyDj7L1CEVR4T.jpg,1998-07-01,False,False,8.328,12572,Drama
False,/kJYPag1YrA4PsXIftFdq3QEaanV.jpg,"12, 28, 53, 878",605,The Matrix Revolutions,en,The Matrix Revolutions,The human city of Zion defends itself against the massive invasion of the machines as Neo fights to end the war at another front while also opposing the rogue Agent Smith.,10.4782,/bkkS61w94ZVMNVd8KEyyJl2tnY5.jpg,2003-11-05,False,False,6.753,10813,"Adventure, Action, Thriller, Science Fiction"
False,/7NKfxJrQn053UJeLftlx4m4NTzo.jpg,"27, 28",36647,Blade,en,Blade,"The Daywalker known as ""Blade"" - a half-vampire, half-mortal man - becomes the protector of humanity against an underground army of vampires.",10.2673,/oWT70TvbsmQaqyphCZpsnQR7R32.jpg,1998-08-21,False,False,6.836,6701,"Horror, Action"
False,/85PMh0cKywekAJYDnRXfezYAmEc.jpg,"53, 28, 12, 878",44833,Battleship,en,Battleship,"When mankind beams a radio signal into space, a reply comes from ‘Planet G’, in the form of several alien crafts that splash down in the waters off Hawaii. Lieutenant Alex Hopper is a weapons officer assigned to the USS John Paul Jones, part of an international naval coalition which becomes the world's last hope for survival as they engage the hostile alien force of unimaginable strength. While taking on the invaders, Hopper must also try to live up to the potential that his brother, and his fiancée's father—an Admiral—expect of him.",11.7077,/9b0Im7SfedHiajTwzSL9zGyBI7M.jpg,2012-04-11,False,False,5.9,5960,"Thriller, Action, Adventure, Science Fiction"
False,/mPfy2cQto2GoahuLeknwcrUcE8M.jpg,"53, 12, 28",80785,Amazon Jail,pt,Curral de Mulheres,"Young women in the Amazon are kidnapped by a ring of devil-worshipers, who plan to sell them as sex slaves. Some of the women escape, but are pursued into the jungle by their captors. The women must band together to turn the tables on their kidnappers.",11.1403,/ob0TfLdSvNvRCPM09a9E4iAbugX.jpg,1982-01-01,False,False,4.34,25,"Thriller, Adventure, Action"
False,/2TPoqmatGDfBOiRxqNoL11ncCJe.jpg,"27, 53",1111873,Abigail,en,Abigail,"A group of criminals kidnap a teenage ballet dancer, the daughter of a notorious gang leader, in order to obtain a ransom of $50 million, but over time, they discover that she is not just an ordinary girl. After the kidnappers begin to diminish, one by one, they discover, to their increasing horror, that they are locked inside with no normal little girl.",10.3794,/5gKKSoD3iezjoL7YqZONjmyAiRA.jpg,2024-04-16,False,False,6.666,2073,"Horror, Thriller"
False,/71FjlP0qZPc1iymcHf8u5vXfH50.jpg,"16, 10751",73723,The Lorax,en,The Lorax,"A 12-year-old boy searches for the one thing that will enable him to win the affection of the girl of his dreams. To find it he must discover the story of the Lorax, the grumpy yet charming creature who fights to protect his world.",11.3024,/tePFnZFw5JvjwjQjaKkqDPNMLPU.jpg,2012-03-01,False,False,6.526,3873,"Animation, Family"
False,/rBN6GPKUDZ6ZKAQiEZegZ0DZb6V.jpg,"14, 28, 80",268,Batman,en,Batman,"Having witnessed his parents' brutal murder as a child, millionaire philanthropist Bruce Wayne fights crime in Gotham City disguised as Batman, a costumed hero who strikes fear into the hearts of villains. But when a deformed madman known as 'The Joker' seizes control of Gotham's criminal underworld, Batman must face his most ruthless nemesis ever while protecting both his identity and his love interest, reporter Vicki Vale.",10.7225,/cij4dd21v2Rk2YtUQbV5kW69WB2.jpg,1989-06-21,False,False,7.2,8569,"Fantasy, Action, Crime"
False,/2gm0EEn4RsfvOOV20GOZrwAZ5mA.jpg,"18, 10749",859,Dangerous Liaisons,en,Dangerous Liaisons,"In 18th century France, Marquise de Merteuil asks her ex-lover Vicomte de Valmont to seduce the future wife of another ex-lover of hers in return for one last night with her. Yet things don’t go as planned.",8.5906,/eNvJXuTQ7lusuUrIvS7wplORXBX.jpg,1988-12-21,False,False,7.192,1271,"Drama, Romance"
False,/AecGG1XVCmkk7fT10ko3FC0dLIP.jpg,"14, 28, 27",1043197,Dust Bunny,en,Dust Bunny,"Ten-year-old Aurora asks her hitman neighbor to kill the monster under her bed that she claims ate her family. To protect her, he must battle an onslaught of assassins while accepting that some monsters are real.",9.9204,/qa5aZpO8tQqhlDaE0flalS1TuIS.jpg,2025-12-11,False,False,6.749,306,"Fantasy, Action, Horror"
False,/wZS4xSfPtk1NPQnx9zsT5R2WhCu.jpg,"35, 80, 878, 16, 10751",438148,Minions: The Rise of Gru,en,Minions: The Rise of Gru,"A fanboy of a supervillain supergroup known as the Vicious 6, Gru hatches a plan to become evil enough to join them, with the backup of his followers, the Minions.",11.0795,/wKiOkZTN9lUUUNZLmtnwubZYONg.jpg,2022-06-29,False,False,7.266,4014,"Comedy, Crime, Science Fiction, Animation, Family"
False,/8xyJcJnYbupkPPMvwTEJaUwjxDI.jpg,"27, 53",71672,Wrong Turn 4: Bloody Beginnings,en,Wrong Turn 4: Bloody Beginnings,"A group of friends take refuge in a deserted sanatorium after they are left stranded in a snowstorm. Later, the place becomes a death trap when man-eating cannibals surround them.",10.8173,/l1vD4GY7tlT420KJ3xWTzyQ2Aa9.jpg,2011-10-17,False,False,5.74,1215,"Horror, Thriller"
False,/8zyQbsmMlXfLkcctjNz5YZZwpkw.jpg,27,999136,Do Not Enter,en,Do Not Enter,"A group of young explorers investigates an old abandoned hotel, only to encounter a strange supernatural being and a competing group looking for a legendary hidden treasure.",10.0677,/stM9N7eJmHKLmFR59JG4tLdN7Wk.jpg,2026-03-19,False,False,5.589,96,Horror
False,/v8DepuF6gizphLzIyNZeQiB0hij.jpg,"28, 12, 18, 10751",38575,The Karate Kid,en,The Karate Kid,"12-year-old Dre Parker could've been the most popular kid in Detroit, but his mother's latest career move has landed him in China. Dre immediately falls for his classmate Mei Ying but the cultural differences make such a friendship impossible. Even worse, Dre's feelings make him an enemy of the class bully, Cheng. With no friends in a strange land, Dre has nowhere to turn but maintenance man Mr. Han, who is a kung fu master. As Han teaches Dre that kung fu is not about punches and parries, but maturity and calm, Dre realizes that facing down the bullies will be the fight of his life.",10.0127,/b1RBy3l297N0c7PHjlz35cClWju.jpg,2010-06-10,False,False,6.567,6552,"Action, Adventure, Drama, Family"
False,/AlW7KZl1HMD1nulwNcp9grQJoRN.jpg,"35, 878",85877,The 33D Invader,cn,蜜桃成熟時33D,"A young woman named Future is sent from the year 2046 to the year 2011 in Hong Kong. Future was sent by the United Nations in order to get pregnant, where she can then extract her genes and repopulate the earth as 99% of males have become infertile in the future due to attacks from Planet Xucker. Two assassins from Xuckler are sent after her to stop her. Future meets three University students: Felix, Dan-san and Sing. The men are obsessed with female students next door: Chin-chin, Chen-chen and Sai-sai. The students agree to help Future find a mate at the university.",11.5719,/bBC1fBHyFBmc6fn4UDedtkOVSaD.jpg,2011-10-06,False,False,5.7,32,"Comedy, Science Fiction"
