adult,backdrop_path,genre_ids,id,original_language,original_title,overview,popularity,poster_path,release_date,title,video,vote_average,vote_count,genre_names
False,/jhk6D8pim3yaByu1801kMoxXFaX.jpg,"28, 18, 12",98,en,Gladiator,"After the death of Emperor Marcus Aurelius, his devious son takes power and demotes Maximus, one of Rome's most capable generals who Marcus preferred. Eventually, Maximus is forced to become a gladiator and battle to the death against other men for the amusement of paying audiences.",17.6324,/wN2xWp1eIwCKOD0BHTcErTBv1Uq.jpg,2000-05-04,Gladiator,False,8.224,20750,"Action, Drama, Adventure"
False,/g7CHF8gTLGooTbP4GznIGwaqAGL.jpg,"10751, 16, 10402, 12",354912,en,Coco,"Despite his family’s baffling generations-old ban on music, Miguel dreams of becoming an accomplished musician like his idol, Ernesto de la Cruz. Desperate to prove his talent, Miguel finds himself in the stunning and colorful Land of the Dead following a mysterious chain of events. Along the way, he meets charming trickster Hector, and together, they set off on an extraordinary journey to unlock the real story behind Miguel's family history.",19.6438,/6Ryitt95xrO8KXuqRGm1fUuNwqF.jpg,2017-10-27,Coco,False,8.197,20837,"Family, Animation, Music, Adventure"
False,/rj58WQ9ImI0mYDptXdM7euX1Wjt.jpg,"16, 10751, 12, 14",109445,en,Frozen,"Young princess Anna of Arendelle dreams about finding true love at her sister Elsa’s coronation. Fate takes her on a dangerous journey in an attempt to end the eternal winter that has fallen over the kingdom. She's accompanied by ice delivery man Kristoff, his reindeer Sven, and snowman Olaf. On an adventure where she will find out what friendship, courage, family, and true love really means.",18.9058,/itAKcobTYGpYT8Phwjd8c9hleTo.jpg,2013-11-20,Frozen,False,7.248,17492,"Animation, Family, Adventure, Fantasy"
False,/wdwcOBMkt3zmPQuEMxB3FUtMio2.jpg,"12, 28, 878",271110,en,Captain America: Civil War,"Following the events of Age of Ultron, the collective governments of the world pass an act designed to regulate all superhuman activity. This polarizes opinion amongst the Avengers, causing two factions to side with Iron Man or Captain America, which causes an epic battle between former allies.",19.1802,/rAGiXaUfPzY7CDEyNKUofk3Kw2e.jpg,2016-04-27,Captain America: Civil War,False,7.447,23909,"Adventure, Action, Science Fiction"
False,/hO7KbdvGOtDdeg0W4Y5nKEHeDDh.jpg,"80, 53, 18",475557,en,Joker,"During the 1980s, a failed stand-up comedian is driven insane and turns to a life of crime and chaos in Gotham City while becoming an infamous psychopathic crime figure.",19.8781,/udDclJoHjfjb8Ekgsd4FDteOkCU.jpg,2019-10-01,Joker,False,8.126,27556,"Crime, Thriller, Drama"
False,/8FWLJHuWB72UXBmiMtxwTvQVumN.jpg,"10751, 35, 80, 12, 16",1175942,en,The Bad Guys 2,"The now-reformed Bad Guys are trying (very, very hard) to be good, but instead find themselves hijacked into a high-stakes, globe-trotting heist, masterminded by a new team of criminals they never saw coming: The Bad Girls.",17.6014,/26oSPnq0ct59l07QOXZKyzsiRtN.jpg,2025-07-24,The Bad Guys 2,False,7.656,748,"Family, Comedy, Crime, Adventure, Animation"
False,/kzeBfhXMRWiykBsqoL3UbfaM0S.jpg,"28, 35, 80",1035259,en,The Naked Gun,"Only one man has the particular set of skills... to lead Police Squad and save the world: Lt. Frank Drebin Jr. Following in his father's footsteps, he must solve a murder case to prevent Police Squad from closure.",20.0648,/rwla9vqzrKVVKVKiOuROTIXGsxj.jpg,2025-07-30,The Naked Gun,False,6.359,1625,"Action, Comedy, Crime"
False,/99W7BptqslScAyupDqg9NADLhh1.jpg,"28, 80, 53",1242332,en,Normal,"Interim sheriff Ulysses, called to the snowbound town of Normal, MN, uncovers an international criminal conspiracy at the heart of the seemingly quaint whistle-stop when he comes to the aid of a bank-robbing couple caught up in a deadly mess.",20.0486,/dHP7nurzOYGHNcNK1O4naVzsGCv.jpg,2026-04-16,Normal,False,7.2,16,"Action, Crime, Thriller"
False,/HVcza6tJtWFrLriuh3Ano4Vt46.jpg,"28, 12, 878",1930,en,The Amazing Spider-Man,"Peter Parker is an outcast high schooler abandoned by his parents as a boy, leaving him to be raised by his Uncle Ben and Aunt May. Like most teenagers, Peter is trying to figure out who he is and how he got to be the person he is today. As Peter discovers a mysterious briefcase that belonged to his father, he begins a quest to understand his parents' disappearance – leading him directly to Oscorp and the lab of Dr. Curt Connors, his father's former partner. As Spider-Man is set on a collision course with Connors' alter ego, The Lizard, Peter will make life-altering choices to use his powers and shape his destiny to become a hero.",20.0317,/jexoNYnPd6vVrmygwF6QZmWPFdu.jpg,2012-06-23,The Amazing Spider-Man,False,6.732,18394,"Action, Adventure, Science Fiction"
False,/k24eZq5I3jyz4htPkZCRpnUmBzE.jpg,"18, 10749",1156593,es,Culpa tuya,The love between Noah and Nick seems unwavering despite their parents' attempts to separate them. But his job and her entry into college open up their lives to new relationships that will shake the foundations of both their relationship and the Leister family itself.,20.0061,/1sQA7lfcF9yUyoLYC0e6Zo3jmxE.jpg,2024-12-26,Your Fault,False,7.088,1531,"Drama, Romance"
False,/sdwjQEM869JFwMytTmvr6ggvaUl.jpg,"18, 53, 9648, 28",670,ko,올드보이,"With no clue how he came to be imprisoned, drugged and tortured for 15 years, a desperate man seeks revenge on his captors.",19.9585,/pWDtjs568ZfOTMbURQBYuT4Qxka.jpg,2003-11-21,Oldboy,False,8.2,9736,"Drama, Thriller, Mystery, Action"
False,/zDIievPXqjfjLogXFqnnopU0OkK.jpg,"10751, 35, 12, 16",412117,en,The Secret Life of Pets 2,"Max the terrier must cope with some major life changes when his owner gets married and has a baby. When the family takes a trip to the countryside, nervous Max has numerous run-ins with canine-intolerant cows, hostile foxes and a scary turkey. Luckily for Max, he soon catches a break when he meets Rooster, a gruff farm dog who tries to cure the lovable pooch of his neuroses.",19.9311,/s9xg4V5EDKiphgIksVJ9gewBM11.jpg,2019-05-24,The Secret Life of Pets 2,False,6.948,3302,"Family, Comedy, Adventure, Animation"
False,/7I6VUdPj6tQECNHdviJkUHD2u89.jpg,"28, 53, 80",603692,en,John Wick: Chapter 4,"With the price on his head ever increasing, John Wick uncovers a path to defeating The High Table. But before he can earn his freedom, Wick must face off against a new enemy with powerful alliances across the globe and forces that turn old friends into foes.",19.9218,/vZloFAK7NmvMGKE7VkF5UHaz0I.jpg,2023-03-21,John Wick: Chapter 4,False,7.706,7832,"Action, Thriller, Crime"
False,/otkJlfjB7zJ5h34FEIfemenMbCy.jpg,"878, 28, 12, 53",106,en,Predator,A team of elite commandos on a secret mission in a Central American jungle come to find themselves hunted by an extraterrestrial warrior.,19.9113,/k3mW4qfJo6SKqe6laRyNGnbB9n5.jpg,1987-06-12,Predator,False,7.546,8998,"Science Fiction, Action, Adventure, Thriller"
False,/jRJrQ72VLyEnVsvwfep8Xjlvu8c.jpg,"80, 18, 28",101,fr,Léon,"Léon, the top hit man in New York, has earned a rep as an effective ""cleaner"". But when his next-door neighbors are wiped out by a loose-cannon DEA agent, he becomes the unwilling custodian of 12-year-old Mathilda. Before long, Mathilda's thoughts turn to revenge, and she considers following in Léon's footsteps.",19.8306,/bxB2q91nKYp8JNzqE7t7TWBVupB.jpg,1994-09-14,Léon: The Professional,False,8.295,15984,"Crime, Drama, Action"
False,/tuDhEdza074bA497bO9WFEPs6O6.jpg,"12, 10751, 14",411,en,"The Chronicles of Narnia: The Lion, the Witch and the Wardrobe","Siblings Lucy, Edmund, Susan and Peter step through a magical wardrobe and find the land of Narnia. There, they discover a charming, once peaceful kingdom that has been plunged into eternal winter by the evil White Witch, Jadis. Aided by the wise and magnificent lion, Aslan, the children lead Narnia into a spectacular, climactic battle to be free of the Witch's glacial powers forever.",19.768,/iREd0rNCjYdf5Ar0vfaW32yrkm.jpg,2005-12-07,"The Chronicles of Narnia: The Lion, the Witch and the Wardrobe",False,7.136,11427,"Adventure, Family, Fantasy"
False,/9ywA15OAiwjSTvg3cBs9B7kOCBF.jpg,"18, 10749",337167,en,Fifty Shades Freed,"Believing they have left behind shadowy figures from their past, newlyweds Christian and Ana fully embrace an inextricable connection and shared life of luxury. But just as she steps into her role as Mrs. Grey and he relaxes into an unfamiliar stability, new threats could jeopardize their happy ending before it even begins.",19.748,/jjPJ4s3DWZZvI4vw8Xfi4Vqa1Q8.jpg,2018-01-17,Fifty Shades Freed,False,6.7,8320,"Drama, Romance"
False,/cT9ZfwoPDk8JbgkessmQgxAWiaM.jpg,"28, 878, 53",1071585,en,M3GAN 2.0,"After the underlying tech for M3GAN is stolen and misused by a powerful defense contractor to create a military-grade weapon known as Amelia, M3GAN's creator Gemma realizes that the only option is to resurrect M3GAN and give her a few upgrades, making her faster, stronger, and more lethal.",19.7452,/oekamLQrwlJjRNmfaBE4llIvkir.jpg,2025-06-25,M3GAN 2.0,False,7.225,1264,"Action, Science Fiction, Thriller"
False,/7nAVXGHHtaNcdsqvDXmY6R9N0fG.jpg,"28, 35",1363123,en,The Family Plan 2,"Now that Dan's assassin days are behind him, all he wants for Christmas is quality time with his kids. But when he learns his daughter has her own plans, he books a family trip to London—putting them all in the crosshairs of an unexpected enemy.",19.7078,/semFxuYx6HcrkZzslgAkBqfJvZk.jpg,2025-11-11,The Family Plan 2,False,6.5,543,"Action, Comedy"
False,/jr8tSoJGj33XLgFBy6lmZhpGQNu.jpg,"16, 12, 14, 35, 10751",315162,en,Puss in Boots: The Last Wish,"Puss in Boots discovers that his passion for adventure has taken its toll: He has burned through eight of his nine lives, leaving him with only one life left. Puss sets out on an epic journey to find the mythical Last Wish and restore his nine lives.",19.7036,/kuf6dutpsT0vSVehic3EZIqkOBt.jpg,2022-12-07,Puss in Boots: The Last Wish,False,8.201,8738,"Animation, Adventure, Fantasy, Comedy, Family"
False,/4fza1QWpGAoxReiEsnvdFBeMyfX.jpg,"10749, 18, 35",286687,ko,화려한 외출,"Korea's most popular song writer Hee-soo runs into a nineteen-year-old boy in the elevator. Hee-soo is inspired by a new song watching him shake at her figure. She starts to tell him about women under the excuse that she's teaching him music. They fall for each other but things get complicated when her life teacher, Joon-ho who taught her about life and music comes back.",19.6635,/yUQg6yvZIRQUSyQ36TQo0Tp1gzr.jpg,2013-12-05,Love Lesson,False,6.8,42,"Romance, Drama, Comedy"
False,/9QusGjxcYvfPD1THg6oW3RLeNn7.jpg,"28, 12, 14",297802,en,Aquaman,"Half-human, half-Atlantean Arthur Curry is taken on the journey of his lifetime to discover if he is worth of being a king.",19.6144,/ufl63EFcc5XpByEV2Ecdw6WJZAI.jpg,2018-12-07,Aquaman,False,6.867,14836,"Action, Adventure, Fantasy"
False,/sYQwMTzlb8uSyaE7e3cfpfYOshu.jpg,18,1658214,tl,Scorpio Nights 4,"A countryside boy rents a room from a couple and discovers a hole exposing their secrets. His voyeurism leads into tangled affairs with two women, unraveling a twisted game of lust and betrayal.",19.6072,/lhgGvrHkwu9mtNeAhzaG828boH4.jpg,2026-03-31,Scorpio Nights 4,False,7.5,2,Drama
False,/ecKQlAEG95k62SMGhvX83oEqANK.jpg,"27, 53",138843,en,The Conjuring,"Paranormal investigators Ed and Lorraine Warren work to help a family terrorized by a dark presence in their farmhouse. Forced to confront a powerful entity, the Warrens find themselves caught in the most terrifying case of their lives.",19.5487,/wVYREutTvI2tmxr6ujrHT704wGF.jpg,2013-07-18,The Conjuring,False,7.536,12624,"Horror, Thriller"
False,/eCynaAOgYYiw5yN5lBwz3IxqvaW.jpg,"16, 10751, 12",12,en,Finding Nemo,"Nemo, an adventurous young clownfish, is unexpectedly taken from his Great Barrier Reef home to a dentist's office aquarium. It's up to his worrisome father Marlin and a friendly but forgetful fish Dory to bring Nemo home -- meeting vegetarian sharks, surfer dude turtles, hypnotic jellyfish, hungry seagulls, and more along the way.",19.5463,/eHuGQ10FUzK1mdOY69wF5pGgEf5.jpg,2003-05-30,Finding Nemo,False,7.817,20438,"Animation, Family, Adventure"
False,/3q01ACG0MWm0DekhvkPFCXyPZSu.jpg,"28, 35, 80",573435,en,Bad Boys: Ride or Die,"After their late former Captain is framed, Lowrey and Burnett try to clear his name, only to end up on the run themselves.",19.5229,/oGythE98MYleE6mZlGs5oBGkux1.jpg,2024-06-05,Bad Boys: Ride or Die,False,7.328,3284,"Action, Comedy, Crime"
False,/kG8bBajeSTUxJGmS47WujcraZUk.jpg,"27, 35, 18",1284120,no,Den stygge stesøsteren,"In a fairy-tale kingdom where beauty is a brutal business, Elvira battles to compete with her incredibly beautiful stepsister, and she will go to any length to catch the prince’s eye.",19.4958,/rayAREIKtSinuov10GvrZHyXfXH.jpg,2025-03-07,The Ugly Stepsister,False,7.307,1100,"Horror, Comedy, Drama"
False,/6D6M5z4reppUxo2cnBEKI02Csp1.jpg,"28, 80, 53, 37",1601243,en,Oscar Shaw,"After retiring from the police force, a relentless detective haunted by the tragic loss of his closest friend sets out on a perilous quest for vengeance, seeking redemption and fighting to restore justice to the streets he once swore to protect.",19.4765,/tsE3nySukwrfUjouz8vzvKTcXNC.jpg,2026-01-09,Oscar Shaw,False,6.483,29,"Action, Crime, Thriller, Western"
False,/clFFCapyGpE7KD4Jsu5pUbFBZF4.jpg,"28, 53, 18",359410,en,Road House,"Ex-UFC fighter Dalton takes a job as a bouncer at a Florida Keys roadhouse, only to discover that this paradise is not all it seems.",19.4392,/fDEdtS4P0gJsxHDIt8dG8TR5dx1.jpg,2024-03-08,Road House,False,6.922,2953,"Action, Thriller, Drama"
False,/izkMjmhauFx9DjoBQqM5sM5WAwE.jpg,"28, 53, 878",280,en,Terminator 2: Judgment Day,"Ten years after the events of the original, a reprogrammed T-800 is sent back in time to protect young John Connor from the shape-shifting T-1000. Together with his mother Sarah, he fights to stop Skynet from triggering a nuclear apocalypse.",19.4318,/jFTVD4XoWQTcg7wdyJKa8PEds5q.jpg,1991-07-03,Terminator 2: Judgment Day,False,8.145,14146,"Action, Thriller, Science Fiction"
False,/yCatt8lmp3oRFEcOZF8KHhsiASQ.jpg,"28, 10752",1223601,fi,Sisu 2,"Returning to the house where his family was brutally murdered during the war, ""the man who refuses to die"" dismantles it, loads it on a truck, and is determined to rebuild it somewhere safe in their honor. When the commander who killed his family comes back hellbent on finishing the job, a relentless, eye-popping cross-country chase ensues.",19.3319,/jNsttCWZyPtW66MjhUozBzVsRb7.jpg,2025-10-21,Sisu: Road to Revenge,False,7.318,677,"Action, War"
False,/2XSeKDmIa2KxaiJy4J9e8FrIZhk.jpg,"10751, 35, 16, 878, 80",20352,en,Despicable Me,"Gru is a supervillain determined to prove he’s the greatest by stealing the Moon. To pull off his plan, he adopts three orphaned girls—Margo, Edith, and Agnes—intending to use them as part of his scheme. However, as Gru bonds with the girls, his cold, villainous exterior begins to melt.",19.3184,/b1BT309QWjtFUlJPLmXmrcHOWEL.jpg,2010-07-08,Despicable Me,False,7.257,15980,"Family, Comedy, Animation, Science Fiction, Crime"
False,/m3WlBJJRbFPaut1QS0PbOG8Wezy.jpg,"10749, 18",1327862,en,Regretting You,"Morgan Grant and her daughter Clara explore what's left behind after a devastating accident reveals a shocking betrayal and forces them to confront family secrets, redefine love, and rediscover each other.",19.3109,/z4gVnxTaks3anTycwKjDmvQSuWt.jpg,2025-10-22,Regretting You,False,6.953,363,"Romance, Drama"
False,/6zdnsUUdtBzZ9ygp6cRo5LKdzoQ.jpg,18,734286,ja,ミルク　滴る女,"A woman, born in a cowshed, grows up working a dairy farm.  Suffering under the gaze of her male coworkers,  she longs for the attention of the newspaper delivery boy.",19.3095,/geo6Wb7kyA0bxJh9r2fBd2AGSjZ.jpg,2010-11-19,MiLK,False,7.8,2,Drama
False,/xKsnZDERG1dk95wuZ5q9iks3OL3.jpg,"80, 18, 28",949,en,Heat,Obsessive master thief Neil McCauley leads a top-notch crew on various daring heists throughout Los Angeles while determined detective Vincent Hanna pursues him without rest. Each man recognizes and respects the ability and the dedication of the other even though they are aware their cat-and-mouse game may end in violence.,19.308,/umSVjVdbVwtx5ryCA2QXL44Durm.jpg,1995-12-15,Heat,False,7.931,8244,"Crime, Drama, Action"
False,/hlxduUs8y9icWGMzYCDLcYHEQ2u.jpg,53,985939,en,Fall,"For best friends Becky and Hunter, life is all about conquering fears and pushing limits. But after they climb 2,000 feet to the top of a remote, abandoned radio tower, they find themselves stranded with no way down. Now Becky and Hunter's expert climbing skills will be put to the ultimate test as they desperately fight to survive the elements, a lack of supplies, and vertigo-inducing heights.",19.2759,/spCAxD99U1A6jsiePFoqdEcY0dG.jpg,2022-08-11,Fall,False,7.107,4463,Thriller
False,/fVpFOcQyHJM2di9upgSIwWD5wac.jpg,"27, 53, 28, 12",396535,ko,부산행,"When a zombie virus pushes Korea into a state of emergency, those trapped on an express train to Busan must fight for their own survival.",19.2538,/vNVFt6dtcqnI7hqa6LFBUibuFiw.jpg,2016-07-20,Train to Busan,False,7.748,8286,"Horror, Thriller, Action, Adventure"
False,/A7BiqPOKvGNalAZhFn1WfSeG9aO.jpg,"27, 9648, 53, 10770",137051,en,Midnight Matinee,"Even though a devastating murder took place during a small town's horror film festival two years earlier, townspeople want another festival.",19.2524,/czam6wq46B9UCZvq85vicElckFq.jpg,1988-10-12,Midnight Matinee,False,5.0,6,"Horror, Mystery, Thriller, TV Movie"
False,/ifUfE79O1raUwbaQRIB7XnFz5ZC.jpg,"27, 9648",646385,en,Scream,"Twenty-five years after a streak of brutal murders shocked the quiet town of Woodsboro, a new killer has donned the Ghostface mask and begins targeting a group of teenagers to resurrect secrets from the town’s deadly past.",19.2275,/1m3W6cpgwuIyjtg5nSnPx7yFkXW.jpg,2022-01-12,Scream,False,6.687,3824,"Horror, Mystery"
False,/yuWHa0E8bTkwvXkbSBPYXqfrXRt.jpg,18,256683,ja,ラバーズ ～覆う女～,"This psychological film follows for several days a very shy young adult woman, a loner with a good heart, who has the misfortune of growing up with obsessional attraction to rubber clothing, the attraction that potentially could make her a target for social rejection. She carefully conceals from her co-workers in a food factory the fact she wears such undergarments. One day an attractive male co-worker befriends her. When they get close in her apartment he indeed reacts to her rubber fetish with rejection. But they resume dating and now strive to meet each other's need for an intimate friendship.",19.2088,/bDYExbJa5oUSwBm6obUFogyAtjI.jpg,2010-07-10,Rubbers,False,7.0,1,Drama
False,/AdyJH8kDm8xT8IKTlgpEC15ny4u.jpg,"14, 28, 12",453395,en,Doctor Strange in the Multiverse of Madness,"Doctor Strange, with the help of mystical allies both old and new, traverses the mind-bending and dangerous alternate realities of the Multiverse to confront a mysterious new adversary.",19.1796,/ddJcSKbcp4rKZTmuyWaMhuwcfMz.jpg,2022-05-04,Doctor Strange in the Multiverse of Madness,False,7.225,10214,"Fantasy, Action, Adventure"
False,/cYyNJzwhaj7aC4uTlUctrfaERbf.jpg,"28, 18, 36",1305781,zh,镖人：风起大漠,"Dao Ma, the ""second most wanted fugitive,"" is entrusted by his benefactor, the chief of Mo family clan, to take on a mysterious escort mission-escorting the ""most wanted fugitive"" to Chang'an.",19.1685,/4QZwryGm8l7N5XdEjPchNPl0BV7.jpg,2026-02-17,Blades of the Guardians: Wind Rises in the Desert,False,7.2,35,"Action, Drama, History"
False,/kP8rK9dGS1pr0HrnmXfIi2heWjo.jpg,"18, 28, 12, 36, 10752",1495,en,Kingdom of Heaven,"After his wife dies, a blacksmith named Balian is thrust into royalty, political intrigue and bloody holy wars during the Crusades.",19.152,/rNaBe4TwbMef71sgscqabpGKsxh.jpg,2005-05-03,Kingdom of Heaven,False,7.021,4870,"Drama, Action, Adventure, History, War"
False,/uIpJPDNFoeX0TVml9smPrs9KUVx.jpg,"27, 9648",574475,en,Final Destination Bloodlines,"Plagued by a violent recurring nightmare, college student Stefanie heads home to track down the one person who might be able to break the cycle and save her family from the grisly demise that inevitably awaits them all.",19.1343,/6WxhEvFsauuACfv8HyoVX6mZKFj.jpg,2025-05-14,Final Destination Bloodlines,False,7.051,2772,"Horror, Mystery"
False,/w4bTBXcqXc2TUyS5Fc4h67uWbPn.jpg,18,389,en,12 Angry Men,"The defense and the prosecution have rested and the jury is filing into the jury room to decide if a young Spanish-American is guilty or innocent of murdering his father. What begins as an open and shut case soon becomes a mini-drama of each of the jurors' prejudices and preconceptions about the trial, the accused, and each other.",19.1015,/zhG3vKWyDRaZYoaww1UVAi29T9h.jpg,1957-04-10,12 Angry Men,False,8.56,9903,Drama
False,/eJPPP5MQiwUMo9wxWvsVyZVKTVk.jpg,"14, 53, 18",1469458,ml,സംഭവം അദ്ധ്യായം ഒന്ന്,"After becoming stuck in a time loop in a haunted forest, a man works to save himself and the other trapped souls around him.",19.0845,/tBNSo4T0R8UztkkpjYkzXI4bFAT.jpg,2026-03-06,Sambhavam Adhyayam Onnu,False,6.5,3,"Fantasy, Thriller, Drama"
False,/qPwwAUeO0b2RU1wHPyx8vf5RgF5.jpg,18,3558,en,"Girl, Interrupted","Set in the changing world of the late 1960s, Susanna Kaysen's prescribed ""short rest"" from a psychiatrist she had met only once becomes a strange, unknown journey into Alice's Wonderland, where she struggles with the thin line between normal and crazy. Susanna soon realizes how hard it is to get out once she has been committed, and she ultimately has to choose between the world of people who belong inside or the difficult world of reality outside.",19.0758,/dOBdatHIVppvmRFw2z7bf9VKJr9.jpg,1999-12-21,"Girl, Interrupted",False,7.6,4119,Drama
False,/5BZtN173AXqReBJTxE2ZikBDCl7.jpg,"28, 53, 878",218,en,The Terminator,"In the post-apocalyptic future, reigning tyrannical supercomputers teleport a cyborg assassin known as the ""Terminator"" back to 1984 to kill Sarah Connor, whose unborn son is destined to lead insurgents against 21st century mechanical hegemony. Meanwhile, the human-resistance movement dispatches a lone warrior to safeguard Sarah. Can he stop the virtually indestructible killing machine?",19.0575,/qvktm0BHcnmDpul4Hz01GIazWPr.jpg,1984-10-26,The Terminator,False,7.679,14468,"Action, Thriller, Science Fiction"
False,/xgDj56UWyeWQcxQ44f5A3RTWuSs.jpg,"16, 35, 10751, 14",2062,en,Ratatouille,"Remy, a rat, possesses a palate far more refined than that of his fellow comrades. He dreams of becoming a chef, one who creates rather than scavenges. When fate deposits him in the sewers beneath one of Paris’s most famous restaurants, he finds himself ideally placed to fulfill his dream. Forming an unusual alliance with a hapless young kitchen worker, Remy begins a daring culinary double life.  As Remy pursues his vision, must navigate the suspicions of the calculating Head Chef Skinner, the disapproval of Remy’s own colony, and the foreboding prescence of renowned food critic Anton Ego, who strikes fear in the hearts of chefs all throughout France.",19.0488,/t3vaWRPSf6WjDSamIkKDs1iQWna.jpg,2007-06-28,Ratatouille,False,7.839,18358,"Animation, Comedy, Family, Fantasy"
False,/zdXnJqBaGFVtLoPNuMeKfEYUViZ.jpg,"10749, 18",11036,en,The Notebook,"An epic love story centered around an older man who reads aloud to a woman with Alzheimer's. From a faded notebook, the old man's words bring to life the story about a couple who is separated by World War II, and is then passionately reunited, seven years later, after they have taken different paths.",18.8301,/rNzQyW4f8B8cQeg7Dgj3n6eT5k9.jpg,2004-06-25,The Notebook,False,7.888,12455,"Romance, Drama"
False,/7s7WkAFPBsMTprYMbqbgKoppQsR.jpg,"12, 28, 14",1734,en,The Mummy Returns,"Rick and Evelyn O’Connell, along with their 8-year-old son Alex, discover the key to the legendary Scorpion King’s might: the fabled Bracelet of Anubis. Unfortunately, a newly resurrected Imhotep has designs on the bracelet as well, and isn’t above kidnapping its new bearer, Alex, to gain control of Anubis’s otherworldly army.",18.8246,/kdJsW7hcy1lrj7tdMPycTAQPAiR.jpg,2001-05-04,The Mummy Returns,False,6.397,7603,"Adventure, Action, Fantasy"
False,/hwNtEmmugU5Yd7hpfprNWI0DGIn.jpg,"18, 53, 10752",16869,en,Inglourious Basterds,"In Nazi-occupied France during World War II, a group of Jewish-American soldiers known as ""The Basterds"" are chosen specifically to spread fear throughout the Third Reich by scalping and brutally killing Nazis. The Basterds, lead by Lt. Aldo Raine soon cross paths with a French-Jewish teenage girl who runs a movie theater in Paris which is targeted by the soldiers.",18.8095,/7sfbEnaARXDDhKm0CZ7D7uc2sbo.jpg,2009-08-02,Inglourious Basterds,False,8.217,24019,"Drama, Thriller, War"
False,/9SRfeSuAu0PiuiPsfumR6p4vJpQ.jpg,35,1621,en,Trading Places,A snobbish investor and a wily street con-artist find their positions reversed as part of a bet by two callous millionaires.,18.7461,/8mBuLCOcpWnmYtZc4aqtvDXslv6.jpg,1983-06-07,Trading Places,False,7.231,3622,Comedy
False,/aCHn2TXYJfzPXQKA6r9mKPbMlUB.jpg,"35, 18",37165,en,The Truman Show,"In a picture-perfect seaside town, an insurance salesman begins to realize that his entire existence may be staged and observed by a vast unseen audience as part of a reality TV show.",18.739,/vuza0WqY239yBXOadKlGwJsZJFE.jpg,1998-06-04,The Truman Show,False,8.152,20049,"Comedy, Drama"
