adult,backdrop_path,genre_ids,id,original_language,original_title,overview,popularity,poster_path,release_date,title,video,vote_average,vote_count,genre_names
False,/cT9ZfwoPDk8JbgkessmQgxAWiaM.jpg,"28, 878, 53",1071585,en,M3GAN 2.0,"After the underlying tech for M3GAN is stolen and misused by a powerful defense contractor to create a military-grade weapon known as Amelia, M3GAN's creator Gemma realizes that the only option is to resurrect M3GAN and give her a few upgrades, making her faster, stronger, and more lethal.",18.7571,/oekamLQrwlJjRNmfaBE4llIvkir.jpg,2025-06-25,M3GAN 2.0,False,7.23,1262,"Action, Science Fiction, Thriller"
False,/tuDhEdza074bA497bO9WFEPs6O6.jpg,"12, 10751, 14",411,en,"The Chronicles of Narnia: The Lion, the Witch and the Wardrobe","Siblings Lucy, Edmund, Susan and Peter step through a magical wardrobe and find the land of Narnia. There, they discover a charming, once peaceful kingdom that has been plunged into eternal winter by the evil White Witch, Jadis. Aided by the wise and magnificent lion, Aslan, the children lead Narnia into a spectacular, climactic battle to be free of the Witch's glacial powers forever.",18.7497,/iREd0rNCjYdf5Ar0vfaW32yrkm.jpg,2005-12-07,"The Chronicles of Narnia: The Lion, the Witch and the Wardrobe",False,7.136,11426,"Adventure, Family, Fantasy"
False,/zdXnJqBaGFVtLoPNuMeKfEYUViZ.jpg,"10749, 18",11036,en,The Notebook,"An epic love story centered around an older man who reads aloud to a woman with Alzheimer's. From a faded notebook, the old man's words bring to life the story about a couple who is separated by World War II, and is then passionately reunited, seven years later, after they have taken different paths.",18.7012,/rNzQyW4f8B8cQeg7Dgj3n6eT5k9.jpg,2004-06-25,The Notebook,False,7.888,12452,"Romance, Drama"
False,/aCHn2TXYJfzPXQKA6r9mKPbMlUB.jpg,"35, 18",37165,en,The Truman Show,"In a picture-perfect seaside town, an insurance salesman begins to realize that his entire existence may be staged and observed by a vast unseen audience as part of a reality TV show.",18.607,/vuza0WqY239yBXOadKlGwJsZJFE.jpg,1998-06-04,The Truman Show,False,8.152,20042,"Comedy, Drama"
False,/t6O6XWelu27BD0OmIDCCufZZT6d.jpg,"9648, 80, 35, 10751",1301421,en,The Sheep Detectives,"George is a shepherd who reads detective novels to his beloved sheep every night, assuming they can't possibly understand. But when a mysterious incident disrupts life on the farm, the sheep realize they must become the detectives. As they follow the clues and investigate human suspects, they prove that even sheep can be brilliant crime-solvers.",18.5757,/hTirV44jiLh6NqdiB6jtxPsDIoG.jpg,2026-05-02,The Sheep Detectives,False,0.0,0,"Mystery, Crime, Comedy, Family"
False,/lzMS0CI3FLQYC5EgJoWeIaEt0lm.jpg,"878, 18, 12",286217,en,The Martian,"During a manned mission to Mars, Astronaut Mark Watney is presumed dead after a fierce storm and left behind by his crew. But Watney has survived and finds himself stranded and alone on the hostile planet. With only meager supplies, he must draw upon his ingenuity, wit and spirit to subsist and find a way to signal to Earth that he is alive.",18.5373,/fASz8A0yFE3QB6LgGoOfwvFSseV.jpg,2015-09-30,The Martian,False,7.695,21059,"Science Fiction, Drama, Adventure"
False,/eUERZRVjCTNdgnESlQxyaOJ2d4K.jpg,28,1584215,en,The Internship,"A CIA-trained assassin recruits other graduates from her secret childhood program, The Internship, to violently destroy the organization. The CIA fights back with deadly force.",18.4485,/fYqSOkix4rbDiZW0ACNnvZCpT6X.jpg,2026-01-13,The Internship,False,6.208,65,Action
False,/s7oDV92ltdecJ7BTfGSOgsDi900.jpg,"18, 10749",2288,en,Closer,The relationships of two couples become complicated and deceitful when the man from one couple meets the woman of the other.,18.3591,/fGGaokx4k00S0J603VG53Qlr9jz.jpg,2004-12-03,Closer,False,6.832,3717,"Drama, Romance"
False,/zDIievPXqjfjLogXFqnnopU0OkK.jpg,"10751, 35, 12, 16",412117,en,The Secret Life of Pets 2,"Max the terrier must cope with some major life changes when his owner gets married and has a baby. When the family takes a trip to the countryside, nervous Max has numerous run-ins with canine-intolerant cows, hostile foxes and a scary turkey. Luckily for Max, he soon catches a break when he meets Rooster, a gruff farm dog who tries to cure the lovable pooch of his neuroses.",18.3006,/s9xg4V5EDKiphgIksVJ9gewBM11.jpg,2019-05-24,The Secret Life of Pets 2,False,6.948,3300,"Family, Comedy, Adventure, Animation"
False,/3Sq9c1Lxh75neQ2BC9thaTO74FZ.jpg,99,440249,en,After Porn Ends 2,"After Porn Ends 2 picks up where its predecessor left off and not only turns back the clock to meet the oldest living stars in adult film's history, but goes in depth with some of Its most current retirees and juxtaposes their experiences in a life after porn. Delving deeper into society's ongoing stigmas of race, misogyny, and the reality of decreasing opportunities for these former VHS box cover stars. For some, their careers in adult entertainment is accepted proudly and without regret. In fact, it seems to have proven to be the pathway to their current happiness and inner peace. For others, however, a career in porn has proven to be a conduit to certain despair as they struggle to find a way to bury their past and emerge with a new career or calling.",18.2677,/rfItXrtDGILwsCdmgVxX79phFuI.jpg,2017-03-28,After Porn Ends 2,False,5.3,246,Documentary
False,/vcrgU0KaNj5mKUCIQSUdiQwTE9y.jpg,"12, 14",12444,en,Harry Potter and the Deathly Hallows: Part 1,"Harry, Ron and Hermione walk away from their last year at Hogwarts to find and destroy the remaining Horcruxes, putting an end to Voldemort's bid for immortality. But with Harry's beloved Dumbledore dead and Voldemort's unscrupulous Death Eaters on the loose, the world is more dangerous than ever.",18.2277,/iGoXIpQb7Pot00EEdwpwPajheZ5.jpg,2010-11-17,Harry Potter and the Deathly Hallows: Part 1,False,7.735,20257,"Adventure, Fantasy"
False,/kTrgxhRSj2sun89bDbnGCPBiey6.jpg,"16, 10751, 35",378236,en,The Emoji Movie,"Gene, a multi-expressional emoji, sets out on a journey to become a normal emoji.",18.1912,/60bTx5z9zL1AqCjZ0gmWoRMJ6Bb.jpg,2017-07-23,The Emoji Movie,False,5.4,3297,"Animation, Family, Comedy"
False,/4XM8DUTQb3lhLemJC51Jx4a2EuA.jpg,"28, 80, 53",385687,en,Fast X,"Over many missions and against impossible odds, Dom Toretto and his family have outsmarted, out-nerved and outdriven every foe in their path. Now, they confront the most lethal opponent they've ever faced: A terrifying threat emerging from the shadows of the past who's fueled by blood revenge, and who is determined to shatter this family and destroy everything—and everyone—that Dom loves, forever.",18.1269,/fiVW06jE7z9YnO4trhaMEdclSiC.jpg,2023-05-17,Fast X,False,7.0,6259,"Action, Crime, Thriller"
False,/zPACwR32amTNvzId9qyapCWXYDJ.jpg,"12, 28",85,en,Raiders of the Lost Ark,"When Dr. Indiana Jones – the tweed-suited professor who just happens to be a celebrated archaeologist – is hired by the government to locate the legendary Ark of the Covenant, he finds himself up against the entire Nazi regime.",18.0691,/ceG9VzoRAVGwivFU403Wc3AHRys.jpg,1981-06-12,Raiders of the Lost Ark,False,7.923,13539,"Adventure, Action"
False,/vh7np635kDIcfO6x2Y9ElgLJsuI.jpg,"80, 27, 9648",4232,en,Scream,"A year after the murder of her mother, a teenage girl is terrorized by a masked killer who targets her and her friends by using scary movies as part of a deadly game.",18.0507,/lr9ZIrmuwVmZhpZuTCW8D9g0ZJe.jpg,1996-12-20,Scream,False,7.429,7859,"Crime, Horror, Mystery"
False,/yCatt8lmp3oRFEcOZF8KHhsiASQ.jpg,"28, 10752",1223601,fi,Sisu 2,"Returning to the house where his family was brutally murdered during the war, ""the man who refuses to die"" dismantles it, loads it on a truck, and is determined to rebuild it somewhere safe in their honor. When the commander who killed his family comes back hellbent on finishing the job, a relentless, eye-popping cross-country chase ensues.",18.0422,/jNsttCWZyPtW66MjhUozBzVsRb7.jpg,2025-10-21,Sisu: Road to Revenge,False,7.342,669,"Action, War"
False,/95ckrV6wQgbffurAVmETQ5YKASL.jpg,"10752, 18, 28",228150,en,Fury,"April, 1945. As the Allies make their final push in the European Theatre, a battle-hardened army sergeant named Wardaddy commands a Sherman tank and her five-man crew on a deadly mission behind enemy lines. Outnumbered and outgunned, and with a rookie soldier thrust into their platoon, Wardaddy and his men face overwhelming odds in their heroic attempts to strike at the heart of Nazi Germany.",18.0191,/pfte7wdMobMF4CVHuOxyu6oqeeA.jpg,2014-10-15,Fury,False,7.543,12844,"War, Drama, Action"
False,/en971MEXui9diirXlogOrPKmsEn.jpg,"28, 12, 35",293660,en,Deadpool,"The origin story of former Special Forces operative turned mercenary Wade Wilson, who, after being subjected to a rogue experiment that leaves him with accelerated healing powers, adopts the alter ego Deadpool. Armed with his new abilities and a dark, twisted sense of humor, Deadpool hunts down the man who nearly destroyed his life.",18.0072,/3E53WEZJqP6aM84D8CckXx4pIHw.jpg,2016-02-09,Deadpool,False,7.623,32575,"Action, Adventure, Comedy"
False,/kzeBfhXMRWiykBsqoL3UbfaM0S.jpg,"28, 35, 80",1035259,en,The Naked Gun,"Only one man has the particular set of skills... to lead Police Squad and save the world: Lt. Frank Drebin Jr. Following in his father's footsteps, he must solve a murder case to prevent Police Squad from closure.",18.0025,/rwla9vqzrKVVKVKiOuROTIXGsxj.jpg,2025-07-30,The Naked Gun,False,6.359,1622,"Action, Comedy, Crime"
False,/clFFCapyGpE7KD4Jsu5pUbFBZF4.jpg,"28, 53, 18",359410,en,Road House,"Ex-UFC fighter Dalton takes a job as a bouncer at a Florida Keys roadhouse, only to discover that this paradise is not all it seems.",17.9746,/fDEdtS4P0gJsxHDIt8dG8TR5dx1.jpg,2024-03-08,Road House,False,6.923,2949,"Action, Thriller, Drama"
False,/7nAVXGHHtaNcdsqvDXmY6R9N0fG.jpg,"28, 35",1363123,en,The Family Plan 2,"Now that Dan's assassin days are behind him, all he wants for Christmas is quality time with his kids. But when he learns his daughter has her own plans, he books a family trip to London—putting them all in the crosshairs of an unexpected enemy.",17.9365,/semFxuYx6HcrkZzslgAkBqfJvZk.jpg,2025-11-11,The Family Plan 2,False,6.5,543,"Action, Comedy"
False,/1s1r4OOdnU8VX2inALVTA2q94uY.jpg,"36, 18",1321179,ko,왕과 사는 남자,"In a remote mountain village of 15th-century Joseon, humble headman Heung-do hears a rumor that any village hosting an exiled nobleman will be blessed with abundance and fortune. Hoping to bring prosperity to his impoverished community, he eagerly submits a petition to host one—unaware that his guest is none other than the fallen monarch, deposed boy-king Danjong.",17.9363,/3CnVA1jAA64Q3qNVAW8DekCu19b.jpg,2026-02-04,The King's Warden,False,6.9,10,"History, Drama"
False,/9uakM2woks0JV8HKIc4oatIVS88.jpg,"27, 53",1315303,en,Primate,"Lucy, a college student, along with her friends, spend their vacation at her family's home in Hawaii, which includes her pet chimpanzee, Ben. However, when Ben contracts rabies after being bitten by a rabid animal, the group must fight for their lives in order to avoid the now-violent chimp.",17.9316,/z97hrgI5wbGbZvSVkBfAeBnFKAg.jpg,2026-01-01,Primate,False,6.473,566,"Horror, Thriller"
False,/sNhzcUw5cg4JwICjnHZ5XhTKNrU.jpg,"53, 28, 878",766507,en,Prey,"When danger threatens her camp, the fierce and highly skilled Comanche warrior Naru sets out to protect her people. But the prey she stalks turns out to be a highly evolved alien predator with a technically advanced arsenal.",17.8641,/2FKjLRt7oK1bRRIrxgWmthbBdFh.jpg,2022-08-02,Prey,False,7.661,7625,"Thriller, Action, Science Fiction"
False,/iZHJsUYxhjI6kbooHoQRWXv6F8E.jpg,"18, 53, 80",59,en,A History of Violence,An average family is thrust into the spotlight after the father commits a seemingly self-defense murder at his diner.,17.8453,/3qnO72NHmUgs9JZXAmu4aId9QDl.jpg,2005-09-23,A History of Violence,False,7.164,3678,"Drama, Thriller, Crime"
False,/hSwgaqwaXMLyeDnPhehLPcYfTdp.jpg,27,292238,cn,人皮高跟鞋,"Someone has been skinning dead bodies and using their hide to make shoes. All of a sudden, a shoe factory whose business has been on the low side for some time improves tremendously.",17.8398,/3aAjnQIfN10t6vuYHuflQAMbDYm.jpg,1996-01-06,Horrible High Heels,False,4.2,12,Horror
False,/6zdnsUUdtBzZ9ygp6cRo5LKdzoQ.jpg,18,734286,ja,ミルク　滴る女,"A woman, born in a cowshed, grows up working a dairy farm.  Suffering under the gaze of her male coworkers,  she longs for the attention of the newspaper delivery boy.",17.794,/geo6Wb7kyA0bxJh9r2fBd2AGSjZ.jpg,2010-11-19,MiLK,False,7.8,2,Drama
False,/izkMjmhauFx9DjoBQqM5sM5WAwE.jpg,"28, 53, 878",280,en,Terminator 2: Judgment Day,"Ten years after the events of the original, a reprogrammed T-800 is sent back in time to protect young John Connor from the shape-shifting T-1000. Together with his mother Sarah, he fights to stop Skynet from triggering a nuclear apocalypse.",17.7866,/jFTVD4XoWQTcg7wdyJKa8PEds5q.jpg,1991-07-03,Terminator 2: Judgment Day,False,8.144,14136,"Action, Thriller, Science Fiction"
False,/44immBwzhDVyjn87b3x3l9mlhAD.jpg,"27, 53, 80",934433,en,Scream VI,"Following the latest Ghostface killings, the four survivors leave Woodsboro behind and start a fresh chapter.",17.6655,/wDWwtvkRRlgTiUr6TyLSMX8FCuZ.jpg,2023-03-08,Scream VI,False,6.952,3133,"Horror, Thriller, Crime"
False,/eTlcNXGv32zkVI7ZDHhfeaKHXKQ.jpg,"28, 9648, 878, 53",198663,en,The Maze Runner,"A teenager with no memory of his past finds himself among a group of boys living in a walled enclosure surrounded by a massive, ever-changing maze. As he struggles to adapt to their rules and society, he begins to uncover clues that may lead to escape and the truth behind their confinement.",17.6535,/ode14q7WtDugFDp78fo9lCsmay9.jpg,2014-09-10,The Maze Runner,False,7.188,17999,"Action, Mystery, Science Fiction, Thriller"
False,/mBc6RB7VajfykLqGx0ue7qatXky.jpg,18,1266990,tl,Kulong,"Three friends retreat to a resort to collaborate on a daring screenplay for a contest. Faced with the challenge of writing about passion despite their own dry spells, their journey soon blurs the line between imagination and experience.",17.6419,/AnzrE2WHg3DtZrtmB9AnEbAh17m.jpg,2024-05-24,Kulong,False,6.324,17,Drama
False,/fTrQsdMS2MUw00RnzH0r3JWHhts.jpg,"28, 80, 53",1197306,en,A Working Man,"Levon Cade left behind a decorated military career in the black ops to live a simple life working construction. But when his boss's daughter, who is like family to him, is taken by human traffickers, his search to bring her home uncovers a world of corruption far greater than he ever could have imagined.",17.6343,/6FRFIogh3zFnVWn7Z6zcYnIbRcX.jpg,2025-03-26,A Working Man,False,6.685,1849,"Action, Crime, Thriller"
False,/kP8rK9dGS1pr0HrnmXfIi2heWjo.jpg,"18, 28, 12, 36, 10752",1495,en,Kingdom of Heaven,"After his wife dies, a blacksmith named Balian is thrust into royalty, political intrigue and bloody holy wars during the Crusades.",17.6138,/rNaBe4TwbMef71sgscqabpGKsxh.jpg,2005-05-03,Kingdom of Heaven,False,7.02,4868,"Drama, Action, Adventure, History, War"
False,/eCynaAOgYYiw5yN5lBwz3IxqvaW.jpg,"16, 10751, 12",12,en,Finding Nemo,"Nemo, an adventurous young clownfish, is unexpectedly taken from his Great Barrier Reef home to a dentist's office aquarium. It's up to his worrisome father Marlin and a friendly but forgetful fish Dory to bring Nemo home -- meeting vegetarian sharks, surfer dude turtles, hypnotic jellyfish, hungry seagulls, and more along the way.",17.6067,/eHuGQ10FUzK1mdOY69wF5pGgEf5.jpg,2003-05-30,Finding Nemo,False,7.817,20432,"Animation, Family, Adventure"
False,/3q01ACG0MWm0DekhvkPFCXyPZSu.jpg,"28, 35, 80",573435,en,Bad Boys: Ride or Die,"After their late former Captain is framed, Lowrey and Burnett try to clear his name, only to end up on the run themselves.",17.6006,/oGythE98MYleE6mZlGs5oBGkux1.jpg,2024-06-05,Bad Boys: Ride or Die,False,7.329,3282,"Action, Comedy, Crime"
False,/kG8bBajeSTUxJGmS47WujcraZUk.jpg,"27, 35, 18",1284120,no,Den stygge stesøsteren,"In a fairy-tale kingdom where beauty is a brutal business, Elvira battles to compete with her incredibly beautiful stepsister, and she will go to any length to catch the prince’s eye.",17.6003,/rayAREIKtSinuov10GvrZHyXfXH.jpg,2025-03-07,The Ugly Stepsister,False,7.303,1097,"Horror, Comedy, Drama"
False,/4XPNNt0zfZKBqxxVWaQALd57UHl.jpg,"16, 12, 14, 10751",823219,lv,Straume,"A solitary cat, displaced by a great flood, finds refuge on a boat with various species and must navigate the challenges of adapting to a transformed world together.",17.4562,/zME0Ul0w48MKkYBnFRn40M5qgLh.jpg,2024-08-29,Flow,False,8.089,2747,"Animation, Adventure, Fantasy, Family"
False,/xKsnZDERG1dk95wuZ5q9iks3OL3.jpg,"80, 18, 28",949,en,Heat,Obsessive master thief Neil McCauley leads a top-notch crew on various daring heists throughout Los Angeles while determined detective Vincent Hanna pursues him without rest. Each man recognizes and respects the ability and the dedication of the other even though they are aware their cat-and-mouse game may end in violence.,17.4232,/e09dLw1Ljtccd2P4NsuUvVtS5du.jpg,1995-12-15,Heat,False,7.931,8239,"Crime, Drama, Action"
False,/ecKQlAEG95k62SMGhvX83oEqANK.jpg,"27, 53",138843,en,The Conjuring,"Paranormal investigators Ed and Lorraine Warren work to help a family terrorized by a dark presence in their farmhouse. Forced to confront a powerful entity, the Warrens find themselves caught in the most terrifying case of their lives.",17.4001,/wVYREutTvI2tmxr6ujrHT704wGF.jpg,2013-07-18,The Conjuring,False,7.536,12622,"Horror, Thriller"
False,/mufF1aYvwdpKerhq5R1YrVcbJLY.jpg,"27, 53, 9648",539,en,Psycho,"When larcenous real estate clerk Marion Crane goes on the lam with a wad of cash and hopes of starting a new life, she ends up at the notorious Bates Motel, where manager Norman Bates cares for his housebound mother.",17.3727,/yz4QVqPx3h1hD1DfqqQkCq3rmxW.jpg,1960-06-22,Psycho,False,8.415,10921,"Horror, Thriller, Mystery"
False,/fe6kkxaxn0mCU2gl1vfU44IYWsy.jpg,"18, 36",1317149,en,I Swear,"Diagnosed with Tourette Syndrome at 15, John Davidson navigates his way against the odds through troubled teenage years and into adulthood, finding inspiration in the kindness of others to discover his true purpose in life.",17.3679,/vUwyhNWBKkSwK8ELvEeBRwV724h.jpg,2025-09-22,I Swear,False,8.3,209,"Drama, History"
False,/jCvkDqWWBrgxf9R3DrtJ6GpqXse.jpg,"28, 12, 878",14161,en,2012,"Dr. Adrian Helmsley, part of a worldwide geophysical team investigating the effect on the earth of radiation from unprecedented solar storms, learns that the earth's core is heating up. He warns U.S. President Thomas Wilson that the crust of the earth is becoming unstable and that without proper preparations for saving a fraction of the world's population, the entire race is doomed. Meanwhile, writer Jackson Curtis stumbles on the same information. While the world's leaders race to build ""arks"" to escape the impending cataclysm, Curtis struggles to find a way to save his family. Meanwhile, volcanic eruptions and earthquakes of unprecedented strength wreak havoc around the world.",17.2481,/c2PkTPT5D9zB8SIm5wNlDAANEqM.jpg,2009-10-10,2012,False,5.873,12659,"Action, Adventure, Science Fiction"
False,/AdyJH8kDm8xT8IKTlgpEC15ny4u.jpg,"14, 28, 12",453395,en,Doctor Strange in the Multiverse of Madness,"Doctor Strange, with the help of mystical allies both old and new, traverses the mind-bending and dangerous alternate realities of the Multiverse to confront a mysterious new adversary.",17.1889,/ddJcSKbcp4rKZTmuyWaMhuwcfMz.jpg,2022-05-04,Doctor Strange in the Multiverse of Madness,False,7.225,10211,"Fantasy, Action, Adventure"
False,/xgDj56UWyeWQcxQ44f5A3RTWuSs.jpg,"16, 35, 10751, 14",2062,en,Ratatouille,"Remy, a rat living in Paris, possesses a palate far more refined than that of his fellow comrades. He dreams of becoming a chef, determined to create culinary masterpieces rather than scavenge for scraps. When fate deposits him in the sewers beneath one of Paris’s most famous restaurants, he finds himself ideally placed to fulfill his dream. Forming an unusual alliance with a bumbling young kitchen worker, Remy begins a daring culinary double life. Together, they must outwit the scheming Head Chef Skinner, evade Remy’s disapproving colony, and impress renowned food critic Anton Ego, who strikes fear in the hearts of chefs all throughout France.",17.1889,/t3vaWRPSf6WjDSamIkKDs1iQWna.jpg,2007-06-28,Ratatouille,False,7.839,18354,"Animation, Comedy, Family, Fantasy"
False,/82C04rTiXYZ7c8XZv91Nu53w82Y.jpg,"28, 53",1007734,en,Nobody 2,"Former assassin Hutch Mansell takes his family on a nostalgic vacation to a small-town theme park, only to be pulled back into violence when they clash with a corrupt operator, a crooked sheriff, and a ruthless crime boss.",17.1501,/svXVRoRSu6zzFtCzkRsjZS7Lqpd.jpg,2025-08-13,Nobody 2,False,6.948,1442,"Action, Thriller"
False,/b9diKSmofRcgjbUxDrSPms82yAN.jpg,"18, 10749",9769,en,Lolita,"Humbert Humbert is a middle-aged British novelist who is both appalled by and attracted to the vulgarity of American culture. When he comes to stay at the boarding house run by Charlotte Haze, he soon becomes obsessed with Lolita, the woman's teenaged daughter.",17.1043,/9INcC14WZjCMKGE360VXmklCLdZ.jpg,1997-09-27,Lolita,False,7.107,1950,"Drama, Romance"
False,/d72ROyJqXQtw2OupW0l15eicRAF.jpg,"27, 12, 28",7131,en,Van Helsing,Famed monster slayer Gabriel Van Helsing is dispatched to Transylvania to assist the last of the Valerious bloodline in defeating Count Dracula. Anna Valerious reveals that Dracula has formed an unholy alliance with Dr. Frankenstein's monster and is hell-bent on exacting a centuries-old curse on her family.,17.0981,/gsFun8nATm52aGHeT8ueAel98nE.jpg,2004-05-03,Van Helsing,False,6.398,6562,"Horror, Adventure, Action"
False,/cGbPBHKSFO7hSIjxkb3KOaGdOep.jpg,"14, 12, 10749",967941,en,Wicked: For Good,"As an angry mob rises against the Wicked Witch, Glinda and Elphaba will need to come together one final time. With their singular friendship now the fulcrum of their futures, they will need to truly see each other, with honesty and empathy, if they are to change themselves, and all of Oz, for good.",17.0352,/si9tolnefLSUKaqQEGz1bWArOaL.jpg,2025-11-19,Wicked: For Good,False,6.6,934,"Fantasy, Adventure, Romance"
False,/hwNtEmmugU5Yd7hpfprNWI0DGIn.jpg,"18, 53, 10752",16869,en,Inglourious Basterds,"In Nazi-occupied France during World War II, a group of Jewish-American soldiers known as ""The Basterds"" are chosen specifically to spread fear throughout the Third Reich by scalping and brutally killing Nazis. The Basterds, lead by Lt. Aldo Raine soon cross paths with a French-Jewish teenage girl who runs a movie theater in Paris which is targeted by the soldiers.",17.0184,/7sfbEnaARXDDhKm0CZ7D7uc2sbo.jpg,2009-08-02,Inglourious Basterds,False,8.217,24013,"Drama, Thriller, War"
False,/pjlxrd646cBYznHoPBWTzz6FujX.jpg,"28, 878, 18",39254,en,Real Steel,"Charlie Kenton is a washed-up fighter who retired from the ring when robots took over the sport. After his robot is trashed, he reluctantly teams up with his estranged son to rebuild and train an unlikely contender.",16.9418,/4GIeI5K5YdDUkR3mNQBoScpSFEf.jpg,2011-09-28,Real Steel,False,7.069,9014,"Action, Science Fiction, Drama"
False,/aJn9XeesqsrSLKcHfHP4u5985hn.jpg,"878, 12, 28",283995,en,Guardians of the Galaxy Vol. 2,The Guardians must fight to keep their newfound family together as they unravel the mysteries of Peter Quill's true parentage.,16.9106,/y4MBh0EjBlMuOzv9axM4qJlmhzz.jpg,2017-04-19,Guardians of the Galaxy Vol. 2,False,7.609,22807,"Science Fiction, Adventure, Action"
False,/mlaq0055pIRfBeMqp6KmuDM2KvB.jpg,18,1137861,ta,மாலை நேர மல்லிப்பூ,The movie is about how the global pandemic forces a prostitute to change her medium of work onto a digital platform and how her relationship with her son is affected,16.8421,/5JQPJNIjNVxlHcx9VX5pvKUj3LQ.jpg,2023-06-09,Maalai Nera Malipoo,False,6.5,2,Drama
False,/cQpSKsSjoQYnDmqTlYl0gV3qnif.jpg,"28, 53",67395,en,L.E.T.H.A.L. Ladies: Return to Savage Beach,A stolen computer disk contains the location of a hidden tresaure trove. It's up to the sexy ladies of LETHAL (Legion to Ensure Total Harmony and Law) to find the treasure before the bad guys do.,16.8368,/9z3hdYnDdfWGKD55kdDmshDojeP.jpg,1998-01-27,L.E.T.H.A.L. Ladies: Return to Savage Beach,False,6.0,225,"Action, Thriller"
False,/m3WlBJJRbFPaut1QS0PbOG8Wezy.jpg,"10749, 18",1327862,en,Regretting You,"Morgan Grant and her daughter Clara explore what's left behind after a devastating accident reveals a shocking betrayal and forces them to confront family secrets, redefine love, and rediscover each other.",16.7785,/z4gVnxTaks3anTycwKjDmvQSuWt.jpg,2025-10-22,Regretting You,False,6.968,362,"Romance, Drama"
False,/bGGjyPqtNc8hhGkPo8W8D8t90bW.jpg,"28, 12, 53",539972,en,Kraven the Hunter,"Kraven Kravinoff's complex relationship with his ruthless gangster father, Nikolai, starts him down a path of vengeance with brutal consequences, motivating him to become not only the greatest hunter in the world, but also one of its most feared.",16.6861,/1GvBhRxY6MELDfxFrete6BNhBB5.jpg,2024-12-11,Kraven the Hunter,False,6.43,2286,"Action, Adventure, Thriller"
False,/Ary1sG0AHn4V1DFrwV7g72Fomq0.jpg,"10402, 18, 35",1620551,it,Non abbiam bisogno di parole,"A teenager, the only hearing member of a deaf family, finds her voice and learns to believe in herself through her passion for singing.",16.6224,/4Tf0qTA73XLhBnfP6YgvqtLZBnt.jpg,2026-04-03,Feel My Voice,False,6.5,82,"Music, Drama, Comedy"
