adult,backdrop_path,genre_ids,id,title,original_language,original_title,overview,popularity,poster_path,release_date,softcore,video,vote_average,vote_count,genre_names
False,/zGLHX92Gk96O1DJvLil7ObJTbaL.jpg,"14, 12",338953,Fantastic Beasts: The Secrets of Dumbledore,en,Fantastic Beasts: The Secrets of Dumbledore,"Professor Albus Dumbledore knows the powerful, dark wizard Gellert Grindelwald is moving to seize control of the wizarding world. Unable to stop him alone, he entrusts magizoologist Newt Scamander to lead an intrepid team of wizards and witches. They soon encounter an array of old and new beasts as they clash with Grindelwald's growing legion of followers.",10.5183,/3c5GNLB4yRSLBby0trHoA1DSQxQ.jpg,2022-04-06,False,False,6.628,5053,"Fantasy, Adventure"
False,/sGEqHTylawwS6hwKultk1mKUjdB.jpg,"10749, 35",114,Pretty Woman,en,Pretty Woman,"Vivian is a carefree, streetwise diamond in the rough when she meets sophisticated billionaire Edward in a chance encounter that turns into a week-long business arrangement. But Vivian's energetic spirit challenges Edward's no-nonsense approach to life, and soon they are teaching each other – and falling in love!",10.5173,/hVHUfT801LQATGd26VPzhorIYza.jpg,1990-03-23,False,False,7.447,8929,"Romance, Comedy"
False,/xLMJCCSatxENpHO9rLW9yD8A12C.jpg,"16, 878, 18, 14",18491,Neon Genesis Evangelion: The End of Evangelion,ja,新世紀エヴァンゲリオン劇場版 Air／まごころを、君に,"SEELE orders an all-out attack on NERV, aiming to destroy the Evas before Gendo can advance his own plans for the Human Instrumentality Project. Shinji is pushed to the limits of his sanity as he is forced to decide the fate of humanity.",10.5116,/j6G24dqI4WgUtChhWjfnI4lnmiK.jpg,1997-07-19,False,False,8.258,1832,"Animation, Science Fiction, Drama, Fantasy"
False,/zlsaQEE26TS34ziXAiNIAqa0MLX.jpg,"14, 28, 80",268,Batman,en,Batman,"Having witnessed his parents' brutal murder as a child, millionaire philanthropist Bruce Wayne fights crime in Gotham City disguised as Batman, a costumed hero who strikes fear into the hearts of villains. But when a deformed madman known as 'The Joker' seizes control of Gotham's criminal underworld, Batman must face his most ruthless nemesis ever while protecting both his identity and his love interest, reporter Vicki Vale.",10.511,/cij4dd21v2Rk2YtUQbV5kW69WB2.jpg,1989-06-21,False,False,7.229,8510,"Fantasy, Action, Crime"
False,/6Kn6qW3an3DkPl3MahWemTzrjCt.jpg,"80, 18, 53",11423,Memories of Murder,ko,살인의 추억,"A sadistic serial rapist and murderer of young women terrorizes a small province in 1980s South Korea. To prevent further crimes, three increasingly desperate detectives with conflicting methods race against time to unravel the violent mind of the killer in a futile effort to solve the case.",10.5053,/dsEoTJKM1s5OVDkS2P2JdoTxo4K.jpg,2003-04-25,False,False,8.056,4525,"Crime, Drama, Thriller"
False,/uM5i623wwNfoGD97iwwQWQ7GlZL.jpg,"878, 18",1032892,In the Blink of an Eye,en,In the Blink of an Eye,"Three storylines, spanning thousands of years, intersect and reflect on hope, connection, and the circle of life.",10.4966,/4vWqIdoBavo1htxmxlScDniOS9C.jpg,2026-01-26,False,False,5.4,101,"Science Fiction, Drama"
False,/nubnNXuMArUhiDW1nUevGsG65x9.jpg,"35, 10749",1400336,Focker-In-Law,en,Focker-In-Law,"Henry, son of Greg and Pam Focker, faces family chaos when he decides to marry a strong-willed woman who appears to be his complete mismatch.",10.4952,/gPdzdeehaoaYqxH2rA6yayEDSsS.jpg,2026-11-25,False,False,0.0,0,"Comedy, Romance"
False,/o1jr0UqVjxIZ1JnFzuVLN4ulWey.jpg,"16, 10751, 35, 12",950,Ice Age: The Meltdown,en,Ice Age: The Meltdown,"Diego, Manny and Sid return in this sequel to the hit animated movie Ice Age. This time around, the deep freeze is over, and the ice-covered earth is starting to melt, which will destroy the trio's cherished valley. The impending disaster prompts them to reunite and warn all the other beasts about the desperate situation.",10.4941,/e23bfKyjOiKJ5uOufFgfO7JO5ug.jpg,2006-03-29,False,False,6.716,10292,"Animation, Family, Comedy, Adventure"
False,/fyCKlwarO3Yd6Ikv3EJdvRdp43b.jpg,"16, 10751, 18, 14",1500099,Versa,en,Versa,"A young couple looking to start a family who experience emotions—from grief and loss to ultimate joy—as they embark on an ethereal, abstract, and imaginative cosmic dance of life.",10.4906,/p2zKN6Ic81C1UbLbnak4dZ2wABl.jpg,2025-04-15,False,False,7.774,31,"Animation, Family, Drama, Fantasy"
False,/6cCF0KMUO2QmrVsQFujkQduREXX.jpg,"53, 28, 18, 878",61791,Rise of the Planet of the Apes,en,Rise of the Planet of the Apes,"A highly intelligent chimpanzee named Caesar has been living a peaceful suburban life ever since he was born. But when he gets taken to a cruel primate facility, Caesar decides to revolt against those who have harmed him.",10.4845,/oqA45qMyyo1TtrnVEBKxqmTPhbN.jpg,2011-08-03,False,False,7.341,12680,"Thriller, Action, Drama, Science Fiction"
False,/w8gaeEul1aF4DaMtPhyIw1XOWEk.jpg,"18, 27, 10749",1135847,Mimi Cucu Part 2,hi,Kelas Bintang - Mimi Cucu Part 2,Kelas Bintang is back with this pack of drama called Mimi Cucu Part 2.,10.482,/m0pu6B67XWhQ2uJkBqxVaHmlcVP.jpg,2023-05-06,False,False,0.0,0,"Drama, Horror, Romance"
False,/6c7j7MQCczzNVvcrNEiXbs8Kt2p.jpg,"28, 18, 53",9509,Man on Fire,en,Man on Fire,"Jaded ex-CIA operative John Creasy reluctantly accepts a job as the bodyguard for a 10-year-old girl in Mexico City. They clash at first, but eventually bond, and when she's kidnapped he's consumed by fury and will stop at nothing to save her life.",10.4798,/grCGLCcTHv9TChibzOwzUpykcjB.jpg,2004-04-23,False,False,7.459,5613,"Action, Drama, Thriller"
False,/5fxTB08O7CW1hAcN2MWOKodp1h1.jpg,"18, 35",615777,Babylon,en,Babylon,"A tale of outsized ambition and outrageous excess, tracing the rise and fall of multiple characters in an era of unbridled decadence and depravity during Hollywood's transition from silent films to sound films in the late 1920s.",10.4616,/wjOHjWCUE0YzDiEzKv8AfqHj3ir.jpg,2022-12-22,False,False,7.362,3729,"Drama, Comedy"
False,/MrcSSzWGsXf2IUJpjPPFLlNbjX.jpg,"10751, 35, 12, 16",1280282,Gabby's Dollhouse: The Movie,en,Gabby's Dollhouse: The Movie,"Gabby heads out on a road trip with her Grandma Gigi to the urban wonderland of Cat Francisco. But when Gabby's dollhouse, her most prized possession, ends up in the hands of an eccentric cat lady named Vera, Gabby sets off on an adventure through the real world to get the Gabby Cats back together and save the dollhouse before it's too late.",10.4605,/t6LLguAmu6iZUN8pWhT7Q0IcaQ5.jpg,2025-09-13,False,False,6.8,65,"Family, Comedy, Adventure, Animation"
False,/8AAuJtCzaibYkbE0QVHc8EBsELB.jpg,"14, 28, 12, 16, 10751",82702,How to Train Your Dragon 2,en,How to Train Your Dragon 2,"Five years after uniting the dragons and Vikings of Berk, Hiccup and Toothless soar beyond their homeland, charting the vast unknown. During one of their adventures, the pair discover a secret cave that houses hundreds of wild dragons -- and a mysterious dragon rider with a startling connection to Hiccup. And as the ruthless dragon conqueror Drago Bludvist rises to seize control of both dragons and people alike, Hiccup must step into his role as a true leader and, alongside his friends and Toothless, protect Berk from a devastating war.",10.4409,/d13Uj86LdbDLrfDoHR5aDOFYyJC.jpg,2014-06-05,False,False,7.679,10357,"Fantasy, Action, Adventure, Animation, Family"
False,/rNqfOqFYpSCeSq2YC5pY8F80Yz4.jpg,"27, 9648",4233,Scream 2,en,Scream 2,"Two years after the Woodsboro murders, Sidney Prescott acclimates to college life while someone donning the Ghostface costume begins a new string of killings.",10.4404,/dORlVasiaDkJXTqt9bdH7nFNs6C.jpg,1997-12-12,False,False,6.513,4682,"Horror, Mystery"
False,/wvXxKpFGXvQJRB0nvvfURhRD3C0.jpg,"14, 12, 16, 35, 10751",810,Shrek the Third,en,Shrek the Third,"The King of Far Far Away has died and Shrek and Fiona are to become King & Queen. However, Shrek wants to return to his cozy swamp and live in peace and quiet, so when he finds out there is another heir to the throne, they set off to bring him back to rule the kingdom.",10.436,/n4SexGGQzI26E269tfpa80MZaGV.jpg,2007-05-17,False,False,6.3,9719,"Fantasy, Adventure, Animation, Comedy, Family"
False,/m2QvGozzKz5ux74gKocn4kFTGz1.jpg,"18, 10749",796,Cruel Intentions,en,Cruel Intentions,"Slaking a thirst for dangerous games, Kathryn challenges her stepbrother, Sebastian, to deflower their headmaster's daughter before the summer ends. If he succeeds, the prize is the chance to bed Kathryn. But if he loses, Kathryn will claim his most prized possession.",10.4355,/76cCsRtQ5MJBAqoigojXsLXLJwh.jpg,1999-03-05,False,False,6.798,3535,"Drama, Romance"
False,/m8JTwHFwX7I7JY5fPe4SjqejWag.jpg,"28, 12, 878",640146,Ant-Man and the Wasp: Quantumania,en,Ant-Man and the Wasp: Quantumania,"Super-Hero partners Scott Lang and Hope van Dyne, along with with Hope's parents Janet van Dyne and Hank Pym, and Scott's daughter Cassie Lang, find themselves exploring the Quantum Realm, interacting with strange new creatures and embarking on an adventure that will push them beyond the limits of what they thought possible.",10.4332,/qnqGbB22YJ7dSs4o6M7exTpNxPz.jpg,2023-02-15,False,False,6.229,5760,"Action, Adventure, Science Fiction"
False,/oCFVYPXI4IfhtF3GapU2jkDicDI.jpg,"12, 18",8358,Cast Away,en,Cast Away,"Chuck Noland, a top international manager for FedEx, and Kelly, a Ph.D. student, are in love and heading towards marriage. Then Chuck's plane to Malaysia crashes at sea during a terrible storm. He's the only survivor, and finds himself marooned on a desolate island. With no way to escape, Chuck must find ways to survive in his new home.",10.433,/7lLJgKnAicAcR5UEuo8xhSMj18w.jpg,2000-12-22,False,False,7.662,12190,"Adventure, Drama"
False,/iFaWUETEE2umP1WY0LUAmjSpzm7.jpg,"28, 35, 18, 53",787,Mr. & Mrs. Smith,en,Mr. & Mrs. Smith,"A husband and wife struggle to keep their marriage alive until they realize they are both secretly working as assassins. Now, their respective assignments require them to kill each other.",10.4324,/kjD700RtyhveN3ZbOnSvUSne0Qj.jpg,2005-06-07,False,False,6.691,11144,"Action, Comedy, Drama, Thriller"
False,/g0geLM1zXpLb9mpqKw1ePcA5bTJ.jpg,"18, 53, 27",44214,Black Swan,en,Black Swan,"The story of Nina, a ballerina in a New York City ballet company whose life, like all those in her profession, is completely consumed with dance. She lives with her retired ballerina mother Erica who zealously supports her daughter's professional ambition. When artistic director Thomas Leroy decides to replace prima ballerina Beth MacIntyre for the opening production of their new season, Swan Lake, Nina is his first choice.",10.432,/viWheBd44bouiLCHgNMvahLThqx.jpg,2010-12-03,False,False,7.685,15469,"Drama, Thriller, Horror"
False,/7iEfnj3rfyunky6BzvnlwqfoEF0.jpg,"12, 28, 53, 878",563,Starship Troopers,en,Starship Troopers,"Set in the future, the story follows a young soldier named Johnny Rico and his exploits in the Mobile Infantry. Rico's military career progresses from recruit to non-commissioned officer and finally to officer against the backdrop of an interstellar war between mankind and an arachnoid species known as ""the Bugs.""",10.4289,/cxCmv23O7p3hyHwqoktHYkZcGsY.jpg,1997-11-07,False,False,7.1,5430,"Adventure, Action, Thriller, Science Fiction"
False,/2ndw55F40IkALzWyjCCza3M6nqM.jpg,18,14,American Beauty,en,American Beauty,"Lester Burnham, a depressed suburban father in a mid-life crisis, decides to turn his hectic life around after developing an infatuation with his daughter's attractive friend.",10.4233,/wby9315QzVKdW9BonAefg8jGTTb.jpg,1999-09-15,False,False,8.0,12964,Drama
False,/sU3gFo7Gn67zjtKXIvzJ4omcUbH.jpg,"36, 18, 12",665,Ben-Hur,en,Ben-Hur,"In ancient Judea, a Jewish aristocrat opposing Roman occupation of his homeland reunites with his childhood friend, now a Roman commander — setting in motion a saga of betrayal, adventure, tragedy, revenge, and faith.",10.423,/m4WQ1dBIrEIHZNCoAjdpxwSKWyH.jpg,1959-11-18,False,False,7.884,3110,"History, Drama, Adventure"
False,/IQyEvPTYvrzsa7qstRj6VLQupr.jpg,"9648, 18, 80",392044,Murder on the Orient Express,en,Murder on the Orient Express,Genius Belgian detective Hercule Poirot investigates the murder of an American tycoon aboard the Orient Express train.,10.4205,/7GtdJU6iAg6fjQu3E3zta3bIAQh.jpg,2017-11-03,False,False,6.707,10484,"Mystery, Drama, Crime"
False,/en3GU5uGkKaYmSyetHV4csHHiH3.jpg,"10752, 28, 18",929590,Civil War,en,Civil War,"In the near future, a group of war journalists attempt to survive while reporting the truth as the United States stands on the brink of civil war.",10.413,/sh7Rg8Er3tFcN9BpKIPOMvALgZd.jpg,2024-04-10,False,False,6.855,4254,"War, Action, Drama"
False,/8ujQlfBsLwNDs1lHmGxDMYkUrRT.jpg,"27, 53",1291595,Insidious: Out of the Further,en,Insidious: Out of the Further,"A trio of stalkers infiltrate a quiet suburb and force a new family into the astral plane, where they uncover a terrifying truth: the Further is bleeding into the real world.",10.4114,/4tTrW9dXCByS5wt2pXVWb58zNjz.jpg,2026-08-19,False,False,0.0,0,"Horror, Thriller"
False,/mNQtUJv1F3u0uSKILFrGjIHqkxx.jpg,"37, 18, 12",281957,The Revenant,en,The Revenant,"In the 1820s, a frontiersman, Hugh Glass, sets out on a path of vengeance against those who left him for dead after a bear mauling.",10.4322,/ji3ecJphATlVgWNY0B0RVXZizdf.jpg,2015-12-25,False,False,7.5,19212,"Western, Drama, Adventure"
False,/AdBXP8e6K3FYdDrMx3Wr6WZqCYF.jpg,"12, 14, 35",493529,Dungeons & Dragons: Honor Among Thieves,en,Dungeons & Dragons: Honor Among Thieves,"A charming thief and a band of unlikely adventurers undertake an epic heist to retrieve a lost relic, but things go dangerously awry when they run afoul of the wrong people.",10.8894,/v7UF7ypAqjsFZFdjksjQ7IUpXdn.jpg,2023-03-23,False,False,7.327,4514,"Adventure, Fantasy, Comedy"
False,/qAhedRxRYWZAgZ8O8pHIl6QHdD7.jpg,"28, 12, 35",384018,Fast & Furious Presents: Hobbs & Shaw,en,Fast & Furious Presents: Hobbs & Shaw,"Ever since US Diplomatic Security Service Agent Hobbs and lawless outcast Shaw first faced off, they just have traded smack talk and body blows. But when cyber-genetically enhanced anarchist Brixton's ruthless actions threaten the future of humanity, they join forces to defeat him.",11.1724,/qRyy2UmjC5ur9bDi3kpNNRCc5nc.jpg,2019-07-31,False,False,6.832,7703,"Action, Adventure, Comedy"
False,/xYro90dW4z7es4JG1vo1bmZ0lUN.jpg,"28, 80, 53",1288445,Mutiny,en,Mutiny,"After witnessing his billionaire boss' murder and being framed for the crime, Cole Reed boards a cargo ship on a one-man crusade to avenge his boss' death only to discover an international conspiracy.",9.3862,/aAnTt6KpmbbHbd6xH3FQFlppZjc.jpg,2026-08-19,False,False,0.0,0,"Action, Crime, Thriller"
False,/yOFqBpJ0PEkBdQqalDEaeOiaKbz.jpg,"28, 80, 53",1267319,Mantis,ko,사마귀,"The secret society of contract killers falls into chaos, unleashing a new breed of assassins. With old rules in ruins, who dares claim the shadows?",9.7517,/x6WLRwwddFKattMseWL3m7Geskd.jpg,2025-09-25,False,False,6.331,160,"Action, Crime, Thriller"
False,/5EKplo61HbA5sMGAN0XAvzdo1MX.jpg,"28, 53, 878",752,V for Vendetta,en,V for Vendetta,"In a world in which Great Britain has become a fascist state, a masked vigilante known only as “V” conducts guerrilla warfare against the oppressive British government. When V rescues a young woman from the secret police, he finds in her an ally with whom he can continue his fight to free the people of Britain.",10.2631,/piZOwjyk1g51oPHonc7zaQY3WOv.jpg,2006-02-23,False,False,7.899,15473,"Action, Thriller, Science Fiction"
False,/7g1zO5t0bd27Iqn5ZUDJmksOGPJ.jpg,"18, 9648, 37",273248,The Hateful Eight,en,The Hateful Eight,Bounty hunters seek shelter from a raging blizzard and get caught up in a plot of betrayal and deception.,9.2251,/jIywvdPjia2t3eKYbjVTcwBQlG8.jpg,2015-12-25,False,False,7.756,15190,"Drama, Mystery, Western"
False,/3k2TRmqMjgt7tcwkYwZQdctnty3.jpg,"18, 10752",600,Full Metal Jacket,en,Full Metal Jacket,A pragmatic U.S. Marine observes the dehumanizing effects the U.S.-Vietnam War has on his fellow recruits from their brutal boot camp training to the bloody street fighting in Hue.,10.0977,/kMKyx1k8hWWscYFnPbnxxN4Eqo4.jpg,1987-06-26,False,False,8.119,11367,"Drama, War"
False,/yQy9Y3p5INwkfTuHSnzYnz4MCV3.jpg,"35, 14, 10751",1125257,Freakier Friday,en,Freakier Friday,"Years after Tess and Anna endured an identity crisis, Anna now has a daughter of her own and a soon-to-be stepdaughter. As they navigate the myriad challenges that come when two families merge, Tess and Anna discover lightning might indeed strike twice.",10.4452,/9wV65OmsjLAqBfDnYTkMPutXH8j.jpg,2025-08-06,False,False,6.844,663,"Comedy, Fantasy, Family"
False,/4yWayBvwl9gHXaWrDrAslxjL7mh.jpg,"14, 16, 10751",408,Snow White and the Seven Dwarfs,en,Snow White and the Seven Dwarfs,"A beautiful girl, Snow White, takes refuge in the forest in the house of seven dwarfs to hide from her stepmother, the wicked Queen. The Queen is jealous because she wants to be known as ""the fairest in the land,"" and Snow White's beauty surpasses her own.",10.0679,/3VAHfuNb6Z7UiW12iYKANSPBl8m.jpg,1938-01-14,False,False,7.122,7952,"Fantasy, Animation, Family"
False,/bWF5ImUscXXYia8owpm8coadR4m.jpg,"28, 27, 10752, 878",1257009,Primitive War,en,Primitive War,"During the Vietnam War, a recon unit ventures to an isolated jungle valley to uncover the fate of a missing platoon. They soon find themselves in a fight for their lives against an unexpected enemy — prehistoric dinosaurs.",10.0254,/gtCeJQRQPPpwlLfAvdMAVGaCYXt.jpg,2025-08-21,False,False,6.534,264,"Action, Horror, War, Science Fiction"
False,/l2Lqkfjq1k5pG2gZXD4qSiyrJ0.jpg,"35, 18",318846,The Big Short,en,The Big Short,The men who made millions from a global economic meltdown.,10.3463,/scVEaJEwP8zUix8vgmMoJJ9Nq0w.jpg,2015-12-11,False,False,7.364,9778,"Comedy, Drama"
False,/jhM3wgWUrrOkz9r4xwV5cV5RhI4.jpg,878,17654,District 9,en,District 9,"Thirty years ago, aliens arrive on Earth. Not to conquer or give aid, but to find refuge from their dying planet. Separated from humans in a South African area called District 9, the aliens are managed by Multi-National United, which is unconcerned with the aliens' welfare but will do anything to master their advanced technology. When a company field agent contracts a mysterious virus that begins to alter his DNA, there is only one place he can hide: District 9.",9.6352,/tuGlQkqLxnodDSk6mp5c2wvxUEd.jpg,2009-08-05,False,False,7.5,10253,Science Fiction
False,/lU1fQews2gye23PocVE48CsTmOQ.jpg,"28, 18, 10749, 53",4588,"Lust, Caution",zh,色‧戒,"During World War II, a secret agent must seduce and assassinate an official who works for the Japanese puppet government in Shanghai.",9.8807,/6c1tqfJEBuIyhQC19SLlLQAUAvJ.jpg,2007-09-24,False,False,7.262,792,"Action, Drama, Romance, Thriller"
False,/83ownpZPvBHJD5UVNShzQfa3LaW.jpg,"27, 53, 878",1562,28 Weeks Later,en,28 Weeks Later,"Twenty-eight weeks after the spread of a deadly rage virus, the inhabitants of the British Isles have lost their battle against the onslaught, as the virus has killed everyone there. Six months later, a group of Americans dare to set foot on the Isles, convinced the danger has passed. But it soon becomes all too clear that the scourge continues to live, waiting to pounce on its next victims.",10.2615,/oix0aNv1lvW3nUGspUyvSIBlpbs.jpg,2007-04-26,False,False,6.606,5488,"Horror, Thriller, Science Fiction"
False,/gkebMVTrtVICHCrtzSdedupnSHY.jpg,"27, 28, 16, 18",483685,Tokyo Ghoul: Jack,ja,東京喰種トーキョーグール【JACK】,"Who needs school, who needs baseball, and who needs friends? That's the attitude of high school delinquent, Taishi Fura, who became a loner after falling out with his peers. One day, he witnesses the brutal attack of a ghoul, which left one of his former friends in the hospital and the other dead. Determined to avenge them, Fura decides to pursue the man-eating monster.  His efforts allow him to cross paths with Kishou Arima, a quiet student who also attends his high school. Arima, however, is no ordinary student. Despite his young age, he is a full-fledged investigator of the CCG, a government task force that strives to deal with the ghoul threat. Together, Fura and Arima hunt down the ghoul, known as Lantern, but it soon becomes apparent the monster may be closer than anyone suspects.  In this side story, Tokyo Ghoul: ""Jack"" offers a glimpse into the past of Kishou Arima, well before he ever became the CCG's feared God of Death.",11.1379,/1JjfOrZQAmdsR9bPKlwmL6u0eaG.jpg,2015-09-05,False,False,7.62,96,"Horror, Action, Animation, Drama"
False,/lOXVbF2mBK0xUt8sLInF3TIk5YS.jpg,"28, 878",2048,"I, Robot",en,"I, Robot","In 2035, where robots are commonplace and abide by the three laws of robotics, a technophobic cop investigates an apparent suicide. Suspecting that a robot may be responsible for the death, his investigation leads him to believe that humanity may be in danger.",10.5701,/efwv6F2lGaghjPpBRSINHtoEiZB.jpg,2004-07-15,False,False,7.0,12571,"Action, Science Fiction"
False,/vJbEUMeI2AxBUZKjP6ZVeVNNTLh.jpg,"28, 53, 35",749170,Heads of State,en,Heads of State,"The UK Prime Minister and US President have a public rivalry that risks their countries' alliance. But when they become targets of a powerful enemy, they're forced to rely on each other as they go on a wild, multinational run. Allied with Noel, a brilliant MI6 agent, they must find a way to thwart a conspiracy that threatens the free world.",9.6396,/lVgE5oLzf7ABmzyASEVcjYyHI41.jpg,2025-06-24,False,False,6.818,1011,"Action, Thriller, Comedy"
False,/xFYpUmB01nswPgbzi8EOCT1ZYFu.jpg,"12, 18, 28",980489,Gran Turismo,en,Gran Turismo,The ultimate wish-fulfillment tale of a teenage Gran Turismo player whose gaming skills won him a series of Nissan competitions to become an actual professional racecar driver.,9.6358,/51tqzRtKMMZEYUpSYkrUE7v9ehm.jpg,2023-08-09,False,False,7.705,3336,"Adventure, Drama, Action"
False,/tRdorrIjlybrGsebXOzgF7vRyYy.jpg,"28, 53",1469354,Border Hunters,en,Border Hunters,"After his police officer brother is killed by a drug dealer who flees to the protection of his cartel-connected uncle in Mexico, an American man with a diverse law enforcement/military background goes south of the border to get revenge",9.7494,/6TNFZnJ5CU0uFQxGaO9dbqriiI7.jpg,2025-10-20,False,False,6.133,45,"Action, Thriller"
False,/kJYPag1YrA4PsXIftFdq3QEaanV.jpg,"12, 28, 53, 878",605,The Matrix Revolutions,en,The Matrix Revolutions,The human city of Zion defends itself against the massive invasion of the machines as Neo fights to end the war at another front while also opposing the rogue Agent Smith.,10.2634,/bkkS61w94ZVMNVd8KEyyJl2tnY5.jpg,2003-11-05,False,False,6.749,10726,"Adventure, Action, Thriller, Science Fiction"
False,/vFm4pF0BgaWPj0i2zEiZO6TqEQ0.jpg,"53, 28",260346,Taken 3,en,Taken 3,"Ex-government operative Bryan Mills finds his life is shattered when he's falsely accused of a murder that hits close to home. As he's pursued by a savvy police inspector, Mills employs his particular set of skills to track the real killer and exact his unique brand of justice.",10.2305,/vzvMXMypMq7ieDofKThsxjHj9hn.jpg,2014-12-16,False,False,6.26,6100,"Thriller, Action"
False,/gxSVZCUlDd8upT1G2wdrUdz2hxG.jpg,"28, 80, 35",8961,Bad Boys II,en,Bad Boys II,"Detectives Marcus Burnett and Mike Lowrey of the Miami Narcotics Task Force are tasked with stopping the flow of the drug Ecstasy into Miami. They track the drugs to the whacked-out Cuban drug lord Johnny Tapia, who is also involved in a bloody war with Russian and Haitian mobsters. If that isn't bad enough, there's tension between the two detectives when Marcus discovers that playboy Mike is secretly romancing Marcus’ sister, Syd.",10.228,/yCvB5fG5aEPqa1St7ihY6KEAsHD.jpg,2003-07-18,False,False,6.7,5890,"Action, Crime, Comedy"
False,/n36zycrAqHn2uzx65IeAdnsZcMj.jpg,"35, 18",1159206,Father Mother Sister Brother,en,Father Mother Sister Brother,"Estranged siblings reunite after years apart, forced to confront unresolved tensions and reevaluate their strained relationships with their emotionally distant parents.",10.216,/96O3Ol3f2veMxAxYqsML8rOumB9.jpg,2025-12-01,False,False,6.436,244,"Comedy, Drama"
False,/xNNF4l1OVscJNchJc5xvejHzTDO.jpg,"18, 10749",370663,Below Her Mouth,en,Below Her Mouth,An unexpected affair quickly escalates into a heart-stopping reality for two women whose passionate connection changes their lives forever.,10.2126,/tPhBftWySbanfEialbsUzOuccgN.jpg,2017-02-10,False,False,6.794,1274,"Drama, Romance"
False,/30TgnSvXiL7NQoQ5WWwHqw0FRhA.jpg,"18, 10749",48650,Room in Rome,es,Habitación en Roma,"A hotel room in the center of Rome serves as the setting for Alba and Natasha, two sexy and recently acquainted women, to have a physical adventure that touches their very souls.",10.2051,/w90ItYf9qagQKVEBr1uFxPomAtf.jpg,2010-05-07,False,False,6.403,822,"Drama, Romance"
False,/5jhG1lTgV0MS6tDkBMQSSitttTT.jpg,18,1402,The Pursuit of Happyness,en,The Pursuit of Happyness,A struggling salesman takes custody of his son as he's poised to begin a life-changing professional career.,10.1953,/lBYOKAMcxIvuk9s9hMuecB9dPBV.jpg,2006-12-14,False,False,7.886,10525,Drama
