adult,backdrop_path,genre_ids,id,title,original_language,original_title,overview,popularity,poster_path,release_date,softcore,video,vote_average,vote_count,genre_names
False,/aCHn2TXYJfzPXQKA6r9mKPbMlUB.jpg,"35, 18",37165,The Truman Show,en,The Truman Show,"In a picture-perfect seaside town, an insurance salesman begins to realize that his entire existence may be staged and observed by a vast unseen audience as part of a reality TV show.",17.0271,/vuza0WqY239yBXOadKlGwJsZJFE.jpg,1998-06-04,False,False,8.151,20061,"Comedy, Drama"
False,/gvLG3Fnznkxl4SmYfcK8gUuqxM8.jpg,"28, 12, 878",823464,Godzilla x Kong: The New Empire,en,Godzilla x Kong: The New Empire,"Following their explosive showdown, Godzilla and Kong must reunite against a colossal undiscovered threat hidden within our world, challenging their very existence – and our own.",17.003,/z1p34vh7dEOnLDmyCrlUVLuoDzd.jpg,2024-03-27,False,False,7.046,4603,"Action, Adventure, Science Fiction"
False,/82C04rTiXYZ7c8XZv91Nu53w82Y.jpg,"28, 53, 35",1007734,Nobody 2,en,Nobody 2,"Former assassin Hutch Mansell takes his family on a nostalgic vacation to a small-town theme park, only to be pulled back into violence when they clash with a corrupt operator, a crooked sheriff, and a ruthless crime boss.",16.9895,/svXVRoRSu6zzFtCzkRsjZS7Lqpd.jpg,2025-08-13,False,False,6.944,1461,"Action, Thriller, Comedy"
False,/70AV2Xx5FQYj20labp0EGdbjI6E.jpg,"53, 80, 18",637649,Wrath of Man,en,Wrath of Man,"A cold and mysterious new security guard for a Los Angeles cash truck company surprises his co-workers when he unleashes precision skills during a heist. The crew is left wondering who he is and where he came from. Soon, the marksman's ultimate motive becomes clear as he takes dramatic and irrevocable steps to settle a score.",16.9822,/M7SUK85sKjaStg4TKhlAVyGlz3.jpg,2021-04-22,False,False,7.58,6030,"Thriller, Crime, Drama"
False,/mGznDQ8opBuRd004ChVWhDqjAyW.jpg,"10749, 35, 14",6435,Practical Magic,en,Practical Magic,"Sally and Gillian Owens, born into a magical family, have mostly avoided witchcraft themselves. But when Gillian's vicious boyfriend, Jimmy Angelov, dies unexpectedly, the Owens sisters give themselves a crash course in hard magic. With policeman Gary Hallet growing suspicious, the girls struggle to resurrect Angelov -- and unwittingly inject his corpse with an evil spirit that threatens to end their family line.",16.9465,/AwmToSgf2IL3aHv0QRVsR5KvChv.jpg,1998-10-16,False,False,6.77,1690,"Romance, Comedy, Fantasy"
False,/4XM8DUTQb3lhLemJC51Jx4a2EuA.jpg,"28, 80, 53",385687,Fast X,en,Fast X,"Over many missions and against impossible odds, Dom Toretto and his family have outsmarted, out-nerved and outdriven every foe in their path. Now, they confront the most lethal opponent they've ever faced: A terrifying threat emerging from the shadows of the past who's fueled by blood revenge, and who is determined to shatter this family and destroy everything—and everyone—that Dom loves, forever.",16.9014,/fiVW06jE7z9YnO4trhaMEdclSiC.jpg,2023-05-17,False,False,6.998,6266,"Action, Crime, Thriller"
False,/ohUhHOqW8cM59Ay5UjqplLzJbH3.jpg,"10749, 18",1317672,Love Me Love Me,en,Love Me Love Me,"After her brother's death, June moves to Milan for a fresh start, finding comfort in Will, the perfect honor student at her new international school. But when his troubled best friend James—hiding a dangerous life in clandestine MMA fights—sparks a rivalry that quickly turns into irresistible attraction, June must choose between safety and a love that upends everything she thought she wanted.",16.8492,/jfwHKRHRE2X4NTexdzblaioHH51.jpg,2026-02-12,False,False,5.722,221,"Romance, Drama"
False,/jtMzyOnIly9aciwV3z5TcczVstI.jpg,"27, 53",1276038,A Desert,en,A Desert,"A photographer’s road trip takes a dark turn when he befriends a reckless couple, plunging him into a nightmarish neo-noir spiral of unpredictable horror.",16.8355,/vd194U3uHmxs5rZBV2QU7HNDdEf.jpg,2025-05-02,False,False,6.1,24,"Horror, Thriller"
False,/bCakS265nbi6fYB3bwuzVLAsjsv.jpg,"35, 10749",259694,How to Be Single,en,How to Be Single,"New York City is full of lonely hearts seeking the right match, and what Alice, Robin, Lucy, Meg, Tom and David all have in common is the need to learn how to be single in a world filled with ever-evolving definitions of love.",16.8323,/a4Ce3qHqIyHM3QfGsiVTAu3YADJ.jpg,2016-02-08,False,False,6.3,3342,"Comedy, Romance"
False,/cWczNud8Y8i8ab0Z4bxos4myWYO.jpg,"16, 10751, 12",38757,Tangled,en,Tangled,"Feisty teenager Rapunzel, who has long and magical hair, wants to go and see sky lanterns on her eighteenth birthday, but she's bound to a tower by her overprotective mother. She strikes a deal with Flynn Rider, a charming wanted thief, and the duo set off on an action-packed escapade.",16.8077,/ym7Kst6a4uodryxqbGOxmewF235.jpg,2010-11-24,False,False,7.61,12309,"Animation, Family, Adventure"
False,/zdXnJqBaGFVtLoPNuMeKfEYUViZ.jpg,"10749, 18",11036,The Notebook,en,The Notebook,"An epic love story centered around an older man who reads aloud to a woman with Alzheimer's. From a faded notebook, the old man's words bring to life the story about a couple who is separated by World War II, and is then passionately reunited, seven years later, after they have taken different paths.",16.7539,/rNzQyW4f8B8cQeg7Dgj3n6eT5k9.jpg,2004-06-25,False,False,7.888,12458,"Romance, Drama"
False,/5YZbUmjbMa3ClvSW1Wj3D6XGolb.jpg,"878, 12, 28",447365,Guardians of the Galaxy Vol. 3,en,Guardians of the Galaxy Vol. 3,"Peter Quill, still reeling from the loss of Gamora, must rally his team around him to defend the universe along with protecting one of their own. A mission that, if not completed successfully, could quite possibly lead to the end of the Guardians as we know them.",16.7516,/r2J02Z2OpNTctfOSN1Ydgii51I3.jpg,2023-05-03,False,False,7.923,8195,"Science Fiction, Adventure, Action"
False,/yYvBNN96Ym3wtPxGCFl7F888WwB.jpg,18,207,Dead Poets Society,en,Dead Poets Society,"At an elite, old-fashioned boarding school in New England, a passionate English teacher inspires his students to rebel against convention and seize the potential of every day, courting the disdain of the stern headmaster.",16.697,/erzbMlcNHOdx24AXOcn2ZKA7R1q.jpg,1989-06-02,False,False,8.299,12500,Drama
False,/vh7np635kDIcfO6x2Y9ElgLJsuI.jpg,"80, 27, 9648",4232,Scream,en,Scream,"A year after the murder of her mother, a teenage girl is terrorized by a masked killer who targets her and her friends by using scary movies as part of a deadly game.",16.6847,/lr9ZIrmuwVmZhpZuTCW8D9g0ZJe.jpg,1996-12-20,False,False,7.429,7869,"Crime, Horror, Mystery"
False,/3Vq8otoGevbhcZAKY2devVbPs6L.jpg,"27, 35, 12",1381216,Gator Lake,en,Gator Lake,"In 2003, Lake Jesup became the stage for a real-life horror story, as a monstrous alligator escaped from captivity and began a reign of terror. As the body count rose, a desperate hunt ensued to stop the creature.",16.6619,/pmyZSaHKQZmASqKVqqGfy2agOaR.jpg,2024-05-01,False,False,6.3,44,"Horror, Comedy, Adventure"
False,/3upEZ0ltY7WwOSFVXrtiP34D48p.jpg,"53, 18, 10749",290098,The Handmaiden,ko,아가씨,"1930s Korea, in the period of Japanese occupation, a new girl, Sook-hee, is hired as a handmaiden to a Japanese heiress, Hideko, who lives a secluded life on a large countryside estate with her domineering Uncle Kouzuki. But the maid has a secret. She is a pickpocket recruited by a swindler posing as a Japanese Count to help him seduce the Lady to steal her fortune.",16.5929,/dLlH4aNHdnmf62umnInL8xPlPzw.jpg,2016-06-01,False,False,8.2,4266,"Thriller, Drama, Romance"
False,/Aueidj1cfpZBOW5KbyVCyKMSZE1.jpg,"18, 10749, 36",585032,Sa Bang-ji,ko,사방지,"Sa Bangji was an intersex person who according to historical records lived during Korea’s Joseon Dynasty. Taken in by a kindly benefactor, Sa Bangji lives in a monastery that is one day visited by a young widow, Lee So-sa, who is in mourning following the death of her husband. The pair’s meeting seems predestined, with the erotic attraction between Sa Bangji and Lee So-sa soon evolving into something far more transcendent – and dangerous.  While aspects of the film – its stylised depiction of female actors and sex – identify it as a product of its time, Sa Bangji is undeniably a milestone in screen representations of intersex people, a film that refuses to shy away from the horrendous stigmatization faced by its titular character.",16.5918,/uFsTrW5qzU2l3YE0ataLoUgfsjJ.jpg,1988-10-29,False,False,6.0,4,"Drama, Romance, History"
False,/3q01ACG0MWm0DekhvkPFCXyPZSu.jpg,"28, 35, 80",573435,Bad Boys: Ride or Die,en,Bad Boys: Ride or Die,"After their late former Captain is framed, Lowrey and Burnett try to clear his name, only to end up on the run themselves.",16.5914,/oGythE98MYleE6mZlGs5oBGkux1.jpg,2024-06-05,False,False,7.326,3292,"Action, Comedy, Crime"
False,/s7oDV92ltdecJ7BTfGSOgsDi900.jpg,"18, 10749",2288,Closer,en,Closer,The relationships of two couples become complicated and deceitful when the man from one couple meets the woman of the other.,16.577,/fGGaokx4k00S0J603VG53Qlr9jz.jpg,2004-12-03,False,False,6.833,3718,"Drama, Romance"
False,/95ckrV6wQgbffurAVmETQ5YKASL.jpg,"10752, 18, 28",228150,Fury,en,Fury,"April, 1945. As the Allies make their final push in the European Theatre, a battle-hardened army sergeant named Wardaddy commands a Sherman tank and her five-man crew on a deadly mission behind enemy lines. Outnumbered and outgunned, and with a rookie soldier thrust into their platoon, Wardaddy and his men face overwhelming odds in their heroic attempts to strike at the heart of Nazi Germany.",16.5205,/pfte7wdMobMF4CVHuOxyu6oqeeA.jpg,2014-10-15,False,False,7.543,12854,"War, Drama, Action"
False,/qdthf9WrRDSaIkGVQGhhJ9pz1hn.jpg,"16, 10751, 18, 35, 28",9502,Kung Fu Panda,en,Kung Fu Panda,"Chosen by prophecy but doubted by all, Po is an unlikely Dragon Warrior—a clumsy panda thrust into the world of kung fu as a deadly enemy threatens the Valley of Peace. Under reluctant guidance by Master Shifu and the Furious Five, Po must embrace who he is to unlock the power that no scroll can teach.",16.4471,/wWt4JYXTg5Wr3xBW2phBrMKgp3x.jpg,2008-06-04,False,False,7.319,12547,"Animation, Family, Drama, Comedy, Action"
False,/kTrgxhRSj2sun89bDbnGCPBiey6.jpg,"16, 10751, 35",378236,The Emoji Movie,en,The Emoji Movie,"Gene, a multi-expressional emoji, sets out on a journey to become a normal emoji.",16.4276,/60bTx5z9zL1AqCjZ0gmWoRMJ6Bb.jpg,2017-07-23,False,False,5.391,3303,"Animation, Family, Comedy"
False,/5P6hWD4zxAMntRuRnB4MmPLijNw.jpg,18,22881,The Blind Side,en,The Blind Side,"The story of Michael Oher, a homeless and traumatized boy who became an All American football player and first round NFL draft pick with the help of a caring woman and her family.",16.4235,/bMgq7VBriuBFknXEe9E9pVBYGZq.jpg,2009-11-20,False,False,7.665,6791,Drama
False,/4lj7MZtcIDI2FmZXGkFWh0sNCsq.jpg,"28, 12, 878",1228710,Star Wars: The Mandalorian and Grogu,en,Star Wars: The Mandalorian and Grogu,"The evil Empire has fallen, and Imperial warlords remain scattered throughout the galaxy. As the fledgling New Republic works to protect everything the Rebellion fought for, they have enlisted the help of legendary Mandalorian bounty hunter Din Djarin and his young apprentice Grogu.",16.4184,/m8lEffySgTuKxN3VsMd2gdgx1aw.jpg,2026-05-20,False,False,0.0,0,"Action, Adventure, Science Fiction"
False,/7iUDfakacY1HpajP1DtHrCuDB95.jpg,"16, 35, 10751",863,Toy Story 2,en,Toy Story 2,"Andy heads off to Cowboy Camp, leaving his toys to their own devices. Things shift into high gear when an obsessive toy collector named Al McWhiggen, owner of Al's Toy Barn kidnaps Woody. Andy's toys mount a daring rescue mission, Buzz Lightyear meets his match and Woody has to decide where he and his heart truly belong.",16.3599,/4rbcp3ng8n1MKHjpeqW0L7Fnpzz.jpg,1999-10-30,False,False,7.604,14799,"Animation, Comedy, Family"
False,/ecKQlAEG95k62SMGhvX83oEqANK.jpg,"27, 53",138843,The Conjuring,en,The Conjuring,"Paranormal investigators Ed and Lorraine Warren work to help a family terrorized by a dark presence in their farmhouse. Forced to confront a powerful entity, the Warrens find themselves caught in the most terrifying case of their lives.",16.3069,/wVYREutTvI2tmxr6ujrHT704wGF.jpg,2013-07-18,False,False,7.536,12631,"Horror, Thriller"
False,/5AsIFZ2AJC7JcGpq40aRPuRuaRc.jpg,18,1241752,Rita,tl,Rita,"Rita, who finds herself alone when husband Ariel works abroad. They both find solace and sexual satisfaction in other people. When Ariel comes back, they both act like nothing happened. But will this keep their marriage from falling apart?",16.2917,/pXENxAzOBrTSDJGxDcUnlNTNmWr.jpg,2024-03-22,False,False,6.0,20,Drama
False,/gl0jzn4BupSbL2qMVeqrjKkF9Js.jpg,"12, 14, 16",128,Princess Mononoke,ja,もののけ姫,"Ashitaka, a prince of the disappearing Emishi people, is cursed by a demonized boar god and must journey to the west to find a cure. Along the way, he encounters San, a young human woman fighting to protect the forest, and Lady Eboshi, who is trying to destroy it. Ashitaka must find a way to bring balance to this conflict.",16.2877,/cMYCDADoLKLbB83g4WnJegaZimC.jpg,1997-07-12,False,False,8.324,8911,"Adventure, Fantasy, Animation"
False,/tPaurpIUskVji5vwV0dhy9pq4Vs.jpg,"16, 12, 35, 10751",953,Madagascar,en,Madagascar,Four animal friends get a taste of the wild life when they break out of captivity at the Central Park Zoo and wash ashore on the island of Madagascar.,16.2635,/zMpJY5CJKUufG9OTw0In4eAFqPX.jpg,2005-05-25,False,False,6.922,11660,"Animation, Adventure, Comedy, Family"
False,/qVGpxnjrGlHaSTCqTQI6viBDSfp.jpg,"27, 53, 18",346364,It,en,It,"In a small town in Maine, seven children known as The Losers Club come face to face with life problems, bullies and a monster that takes the shape of a clown called Pennywise.",16.2461,/9E2y5Q7WlCVNEhP5GiVTjhEhx1o.jpg,2017-09-06,False,False,7.239,20234,"Horror, Thriller, Drama"
False,/dBgxEkWe17R0AJDAvAhpeVELQx2.jpg,"28, 18, 10749",744,Top Gun,en,Top Gun,"For Lieutenant Pete 'Maverick' Mitchell and his friend and co-pilot Nick 'Goose' Bradshaw, being accepted into an elite training school for fighter pilots is a dream come true. But a tragedy, as well as personal demons, will threaten Pete's dreams of becoming an ace pilot.",16.2111,/xUuHj3CgmZQ9P2cMaqQs4J0d4Zc.jpg,1986-05-16,False,False,7.06,9464,"Action, Drama, Romance"
False,/cvH1gNIMRITdLzoWv1HNAbRyH3n.jpg,"35, 10749",2105,American Pie,en,American Pie,"At a high-school party, four friends find that losing their collective virginity isn't as easy as they had thought. But they still believe that they need to do so before college. To motivate themselves, they enter a pact to all ""score"" by their senior prom.",16.199,/5P68by2Thn8wHAziyWGEw2O7hco.jpg,1999-07-09,False,False,6.604,8242,"Comedy, Romance"
False,/7QBBvE6tA1kUlo7AKeZZMygdSHp.jpg,27,8689,Cannibal Holocaust,it,Cannibal Holocaust,A New York University professor returns from a rescue mission to the Amazon rainforest with the footage shot by a lost team of documentarians who were making a film about the area's local cannibal tribes.,16.197,/otxZzMh53TsN7yYFqSZ3rwH1yMd.jpg,1980-02-07,False,False,6.268,1840,Horror
False,/xgDj56UWyeWQcxQ44f5A3RTWuSs.jpg,"16, 35, 10751, 14",2062,Ratatouille,en,Ratatouille,"Remy, a rat, possesses a palate far more refined than that of his fellow comrades. He dreams of becoming a chef, one who creates rather than scavenges. When fate deposits him in the sewers beneath one of Paris’s most famous restaurants, he finds himself ideally placed to fulfill his dream. Forming an unusual alliance with a hapless young kitchen worker, Remy begins a daring culinary double life.  As Remy pursues his vision, he must navigate the suspicions of the calculating Head Chef Skinner, the disapproval of Remy’s own colony, and the foreboding presence of renowned food critic Anton Ego, who strikes fear in the hearts of chefs all throughout France.",16.159,/t3vaWRPSf6WjDSamIkKDs1iQWna.jpg,2007-06-28,False,False,7.838,18367,"Animation, Comedy, Family, Fantasy"
False,/4XPNNt0zfZKBqxxVWaQALd57UHl.jpg,"16, 12, 14, 10751",823219,Flow,lv,Straume,"A solitary cat, displaced by a great flood, finds refuge on a boat with various species and must navigate the challenges of adapting to a transformed world together.",16.1561,/zME0Ul0w48MKkYBnFRn40M5qgLh.jpg,2024-08-29,False,False,8.085,2759,"Animation, Adventure, Fantasy, Family"
False,/9UAcMhSCDJ2OCo5QdPpSERjhMA1.jpg,"18, 36",1396,Mirror,ru,Зеркало,"A dying man in his forties recalls his childhood, his mother, the war and personal moments that tell of and juxtapose pivotal moments in Soviet history with daily life.",16.1018,/AttDP5OEsMxtHPPN7Z92p2Ntnmd.jpg,1975-03-07,False,False,7.954,1084,"Drama, History"
False,/kARonxQpuSZdFraTKlCThWOBCtu.jpg,35,38365,Grown Ups,en,Grown Ups,"After their high school basketball coach passes away, five good friends and former teammates reunite for a Fourth of July holiday weekend.",16.0885,/cQGM5k1NtU85n4TUlrOrwijSCcm.jpg,2010-06-24,False,False,6.398,6623,Comedy
False,/hwNtEmmugU5Yd7hpfprNWI0DGIn.jpg,"18, 53, 10752",16869,Inglourious Basterds,en,Inglourious Basterds,"In Nazi-occupied France during World War II, a group of Jewish-American soldiers known as ""The Basterds"" are chosen specifically to spread fear throughout the Third Reich by scalping and brutally killing Nazis. The Basterds, lead by Lt. Aldo Raine soon cross paths with a French-Jewish teenage girl who runs a movie theater in Paris which is targeted by the soldiers.",16.0667,/7sfbEnaARXDDhKm0CZ7D7uc2sbo.jpg,2009-08-02,False,False,8.217,24032,"Drama, Thriller, War"
False,/9ywA15OAiwjSTvg3cBs9B7kOCBF.jpg,"18, 10749",337167,Fifty Shades Freed,en,Fifty Shades Freed,"Believing they have left behind shadowy figures from their past, newlyweds Christian and Ana fully embrace an inextricable connection and shared life of luxury. But just as she steps into her role as Mrs. Grey and he relaxes into an unfamiliar stability, new threats could jeopardize their happy ending before it even begins.",16.0271,/jjPJ4s3DWZZvI4vw8Xfi4Vqa1Q8.jpg,2018-01-17,False,False,6.673,8324,"Drama, Romance"
False,/bGGjyPqtNc8hhGkPo8W8D8t90bW.jpg,"28, 12, 53",539972,Kraven the Hunter,en,Kraven the Hunter,"Kraven Kravinoff's complex relationship with his ruthless gangster father, Nikolai, starts him down a path of vengeance with brutal consequences, motivating him to become not only the greatest hunter in the world, but also one of its most feared.",16.0096,/1GvBhRxY6MELDfxFrete6BNhBB5.jpg,2024-12-11,False,False,6.429,2296,"Action, Adventure, Thriller"
False,/kHJlXiwxcMAf9R934f0ncEBAMXg.jpg,"10749, 18",1252309,Tell Me What You Want,es,Pídeme lo que quieras,"After his father's death, Eric Zimmerman travels to Spain to oversee his company's branches. In Madrid, he falls for Judith and engage in an intense, erotic relationship full of exploration. However, Eric fears his secret may end their affair.",15.8773,/yZXYCiZQPB7Ui6D5206W1zDKv8P.jpg,2024-11-29,False,False,6.1,281,"Romance, Drama"
False,/pjlxrd646cBYznHoPBWTzz6FujX.jpg,"28, 878, 18",39254,Real Steel,en,Real Steel,"Charlie Kenton is a washed-up fighter who retired from the ring when robots took over the sport. After his robot is trashed, he reluctantly teams up with his estranged son to rebuild and train an unlikely contender.",15.9709,/4GIeI5K5YdDUkR3mNQBoScpSFEf.jpg,2011-09-28,False,False,7.069,9026,"Action, Science Fiction, Drama"
False,/tyfO9jHgkhypUFizRVYD0bytPjP.jpg,"10751, 14",447273,Snow White,en,Snow White,"Following the benevolent King's disappearance, the Evil Queen dominated the once fair land with a cruel streak. Princess Snow White flees the castle when the Queen, in her jealousy over Snow White's inner beauty, tries to kill her. Deep into the dark woods, she stumbles upon seven magical dwarves and a young bandit named Jonathan. Together, they strive to survive the Queen's relentless pursuit and aspire to take back the kingdom.",15.9325,/oLxWocqheC8XbXbxqJ3x422j9PW.jpg,2025-03-19,False,False,4.329,1607,"Family, Fantasy"
False,/s7vWRjcfRVMW8tBIxhC3UhKxRoo.jpg,"10749, 53",1097549,Babygirl,en,Babygirl,A high-powered CEO puts her career and family on the line when she begins a torrid affair with her much younger intern.,15.9296,/ilwO6elz3mLV9CToT7C8pjVeKX0.jpg,2024-12-25,False,False,5.7,1172,"Romance, Thriller"
False,/mufF1aYvwdpKerhq5R1YrVcbJLY.jpg,"27, 53, 9648",539,Psycho,en,Psycho,"When larcenous real estate clerk Marion Crane goes on the lam with a wad of cash and hopes of starting a new life, she ends up at the notorious Bates Motel, where manager Norman Bates cares for his housebound mother.",16.3352,/yz4QVqPx3h1hD1DfqqQkCq3rmxW.jpg,1960-06-22,False,False,8.415,10929,"Horror, Thriller, Mystery"
False,/eJPPP5MQiwUMo9wxWvsVyZVKTVk.jpg,"14, 53, 18",1469458,Sambhavam Adhyayam Onnu,ml,സംഭവം അദ്ധ്യായം ഒന്ന്,"After becoming stuck in a time loop in a haunted forest, a man works to save himself and the other trapped souls around him.",14.7847,/tBNSo4T0R8UztkkpjYkzXI4bFAT.jpg,2026-03-06,False,False,6.2,4,"Fantasy, Thriller, Drama"
False,/zDIievPXqjfjLogXFqnnopU0OkK.jpg,"10751, 35, 12, 16",412117,The Secret Life of Pets 2,en,The Secret Life of Pets 2,"Max the terrier must cope with some major life changes when his owner gets married and has a baby. When the family takes a trip to the countryside, nervous Max has numerous run-ins with canine-intolerant cows, hostile foxes and a scary turkey. Luckily for Max, he soon catches a break when he meets Rooster, a gruff farm dog who tries to cure the lovable pooch of his neuroses.",15.8763,/s9xg4V5EDKiphgIksVJ9gewBM11.jpg,2019-05-24,False,False,6.947,3306,"Family, Comedy, Adventure, Animation"
False,/mBc6RB7VajfykLqGx0ue7qatXky.jpg,18,1266990,Kulong,tl,Kulong,"Three friends retreat to a resort to collaborate on a daring screenplay for a contest. Faced with the challenge of writing about passion despite their own dry spells, their journey soon blurs the line between imagination and experience.",15.8045,/AnzrE2WHg3DtZrtmB9AnEbAh17m.jpg,2024-05-24,False,False,6.324,17,Drama
False,,10749,1236814,Swapping Workshop for Middle-aged Couples,ko,중년부부 스와핑 워크샵,"The young deputy Dong-sik and his wife, along with the middle-aged couple manager, went on a trip together as a couple. In fact, Dong-sik became involved in their friendship trip with ambitions for promotion. However, Dong-sik's wife, Eun-joo, takes care of her wives and is full of dissatisfaction because she seems to have become a helper for them instead of a trip. By chance, Dong-sik witnesses the manager's wife, Mal-sook, having an affair with her manager Seong-gil. In order to shut Dong-sik's mouth, Mal-sook starts her secret proposal...",15.8,/1iVFVLcw9VN1P9kSrit8uw0iBUH.jpg,2023-04-21,False,False,9.0,1,Romance
False,/uAfhsySkr1UzQg1zdg3dZQRz9Fd.jpg,"16, 10751, 35",10193,Toy Story 3,en,Toy Story 3,"Woody, Buzz, and the rest of Andy's toys haven't been played with in years. With Andy about to go to college, the gang find themselves accidentally left at a nefarious day care center. The toys must band together to escape and return home to Andy.",14.9668,/AbbXspMOwdvwWZgVN0nabZq03Ec.jpg,2010-06-16,False,False,7.804,15634,"Animation, Family, Comedy"
False,/cF3H9pyUF6dsvqlYUcH0TyBAMTG.jpg,"12, 16, 10751",105864,The Good Dinosaur,en,The Good Dinosaur,An epic journey into the world of dinosaurs where an Apatosaurus named Arlo makes an unlikely human friend.,15.7391,/8RSkxOO80btfKjyiC5ZiTaCHIT8.jpg,2015-11-14,False,False,6.736,5942,"Adventure, Animation, Family"
False,/cT9ZfwoPDk8JbgkessmQgxAWiaM.jpg,"28, 878, 53",1071585,M3GAN 2.0,en,M3GAN 2.0,"After the underlying tech for M3GAN is stolen and misused by a powerful defense contractor to create a military-grade weapon known as Amelia, M3GAN's creator Gemma realizes that the only option is to resurrect M3GAN and give her a few upgrades, making her faster, stronger, and more lethal.",15.7277,/oekamLQrwlJjRNmfaBE4llIvkir.jpg,2025-06-25,False,False,7.209,1276,"Action, Science Fiction, Thriller"
False,/7nAVXGHHtaNcdsqvDXmY6R9N0fG.jpg,"28, 35",1363123,The Family Plan 2,en,The Family Plan 2,"Now that Dan's assassin days are behind him, all he wants for Christmas is quality time with his kids. But when he learns his daughter has her own plans, he books a family trip to London—putting them all in the crosshairs of an unexpected enemy.",15.678,/semFxuYx6HcrkZzslgAkBqfJvZk.jpg,2025-11-11,False,False,6.542,547,"Action, Comedy"
False,/nP3y0TkR6XniFs9J53qQkg4Bnnk.jpg,"18, 35",10625,Mean Girls,en,Mean Girls,"Cady Heron is a hit with The Plastics, the A-list girl clique at her new school, until she makes the mistake of falling for Aaron Samuels, the ex-boyfriend of alpha Plastic Regina George.",15.1941,/fXm3YKXAEjx7d2tIWDg9TfRZtsU.jpg,2004-04-30,False,False,7.223,9391,"Drama, Comedy"
False,/nlPCdZlHtRNcF6C9hzUH4ebmV1w.jpg,"35, 18, 10749",313369,La La Land,en,La La Land,"Mia, an aspiring actress, serves lattes to movie stars in between auditions and Sebastian, a jazz musician, scrapes by playing cocktail party gigs in dingy bars, but as success mounts they are faced with decisions that begin to fray the fragile fabric of their love affair, and the dreams they worked so hard to maintain in each other threaten to rip them apart.",15.6668,/uDO8zWDhfWwoFdKS4fzkUJt0Rf0.jpg,2016-12-01,False,False,7.898,18008,"Comedy, Drama, Romance"
