adult,backdrop_path,genre_ids,id,title,original_language,original_title,overview,popularity,poster_path,release_date,softcore,video,vote_average,vote_count,genre_names
False,/Ae2fAp4SjKVsobi2RTb0Xl8yoY1.jpg,"18, 28, 53",13333,Game of Death,cn,死亡遊戲,A martial arts movie star must fake his death to find the people who are trying to kill him.,11.2134,/c6jgLHaQpdIPH1rC94KkjAqgE7O.jpg,1978-03-23,False,False,6.4,732,"Drama, Action, Thriller"
False,/coru98UcFBzJIU7bxZguxaePgu0.jpg,35,8363,Superbad,en,Superbad,Two co-dependent high school seniors are forced to deal with separation anxiety after their plan to stage a booze-soaked party goes awry.,11.1992,/ek8e8txUyUwd2BNqj6lFEerJfbq.jpg,2007-08-17,False,False,7.264,8087,Comedy
False,/q7ZgPZIqSYm3UlrdCldkYzjGOCI.jpg,"53, 36, 10752",1318413,Pressure,en,Pressure,"In the tense 72 hours before D-Day, and the fate of the free world hanging in the balance, General Dwight D. Eisenhower and Captain James Stagg face an impossible choice—launch the largest and most dangerous seaborne invasion in history or risk losing the war altogether.",11.1892,/9RkDrI8V8QJBjhtyRX7y6Qow3aq.jpg,2026-05-25,False,False,7.8,4,"Thriller, History, War"
False,/3avI4nJ3WNweQFHa2UwRMOO8cbL.jpg,"18, 27, 80",74997,The Human Centipede 2 (Full Sequence),en,The Human Centipede 2 (Full Sequence),"Inspired by the fictional Dr. Heiter, disturbed loner Martin dreams of creating a 12-person centipede and sets out to realize his sick fantasy.",11.1805,/9YEUMnMhIjD5ek4zIqOhLSnTnJS.jpg,2011-10-06,False,False,4.8,1445,"Drama, Horror, Crime"
False,/lV1P1Q5gLDXVG1ZYCxZHStkcQC3.jpg,"878, 12, 53",131631,The Hunger Games: Mockingjay - Part 1,en,The Hunger Games: Mockingjay - Part 1,"After surviving the Quarter Quell, Katniss finds herself in the hidden stronghold of District 13, where the rebellion against the Capitol is gaining momentum. Struggling with the weight of becoming the symbol of resistance, she must navigate fragile alliances while trying to protect those she loves. As propaganda battles rage and Panem moves closer to full-scale war, Katniss is forced to confront the true cost of revolution.",11.1801,/4FAA18ZIja70d1Tu5hr5cj2q1sB.jpg,2014-11-19,False,False,6.818,16729,"Science Fiction, Adventure, Thriller"
False,/iiPBXynI88EgnpunHoUlBCnLpSE.jpg,"9648, 53",2832,Identity,en,Identity,"Complete strangers stranded at a remote desert motel during a raging storm soon find themselves the target of a deranged murderer. As their numbers thin out, the travelers begin to turn on each other, as each tries to figure out who the killer is.",11.1739,/sYgimsiBywqVwJI8H4sETke8m7v.jpg,2003-04-25,False,False,7.184,4356,"Mystery, Thriller"
False,/einbto9qLXFx9QXxEHylaxDbKPx.jpg,"18, 10749, 14",122906,About Time,en,About Time,"The night after another unsatisfactory New Year's party, Tim's father reveals to him that the men in their family have the ability to travel through time. They can't change history, but they can change what happens and has happened in their own lives. Thus begins the start of a lesson in learning to appreciate life itself as it is, as it comes, and most importantly, the people living alongside us.",11.172,/ls6zswrOZVhCXQBh96DlbnLBajM.jpg,2013-09-04,False,False,7.906,9262,"Drama, Romance, Fantasy"
False,/46Os8U0DEPmI0OnvKDxucl6SLVZ.jpg,27,1008042,Talk to Me,en,Talk to Me,"When a group of friends discover how to conjure spirits using an embalmed hand, they become hooked on the new thrill, until one of them goes too far and unleashes terrifying supernatural forces.",11.1699,/kdPMUMJzyYAc4roD52qavX0nLIC.jpg,2023-07-26,False,False,7.141,3739,Horror
False,/ziECpBRIyclmBNaFSWlvCfsKbMD.jpg,"12, 28, 878",1892,Return of the Jedi,en,Return of the Jedi,"Luke Skywalker leads a mission to rescue his friend Han Solo from the clutches of Jabba the Hutt, the Emperor prepares to crush the Rebellion with a more powerful Death Star, and the Rebel fleet mounts a massive attack on the space station. Luke Skywalker confronts Darth Vader in a final climactic duel before the evil Emperor.",11.1682,/jQYlydvHm3kUix1f8prMucrplhm.jpg,1983-05-25,False,False,7.9,16927,"Adventure, Action, Science Fiction"
False,/xavGKawUyXPWAa6JTUkFzaRXMPF.jpg,"28, 12, 53",484641,Anna,en,Anna,Beneath Anna Poliatova's striking beauty lies a secret that will unleash her indelible strength and skill to become one of the world's most feared government assassins.,11.167,/2U0oAVAE0lDRhNmJPPYhDW9kQ8t.jpg,2019-06-19,False,False,6.717,2999,"Action, Adventure, Thriller"
False,/5IwrHiXMeKxOLZnkmMa116xGya4.jpg,"35, 18",878667,Chal Mera Putt 3,pa,ਚਲ ਮੇਰਾ ਪੁੱਟ 3,"Chal Mera Putt 3 revolves around the lives of illegal immigrants in UK, their friendship and their constant struggle of finding a home away from home.",11.1647,/vhlwENeB4bDPl1YeSiPLNfDAJnz.jpg,2021-10-01,False,False,6.0,2,"Comedy, Drama"
False,/h3KN24PrOheHVYs9ypuOIdFBEpX.jpg,"16, 10751, 12",166428,How to Train Your Dragon: The Hidden World,en,How to Train Your Dragon: The Hidden World,"As Hiccup fulfills his dream of creating a peaceful dragon utopia, Toothless’ discovery of an untamed, elusive mate draws the Night Fury away. When danger mounts at home and Hiccup’s reign as village chief is tested, both dragon and rider must make impossible decisions to save their kind.",11.1616,/xvx4Yhf0DVH8G4LzNISpMfFBDy2.jpg,2019-01-03,False,False,7.751,7099,"Animation, Family, Adventure"
False,/44immBwzhDVyjn87b3x3l9mlhAD.jpg,"27, 53, 80",934433,Scream VI,en,Scream VI,"Following the latest Ghostface killings, the four survivors leave Woodsboro behind and start a fresh chapter.",11.1394,/wDWwtvkRRlgTiUr6TyLSMX8FCuZ.jpg,2023-03-08,False,False,6.949,3182,"Horror, Thriller, Crime"
False,/uD267eSiACfWLxp47t3gYymOQRj.jpg,"16, 35, 10751",93456,Despicable Me 2,en,Despicable Me 2,Gru is recruited by the Anti-Villain League to help deal with a powerful new super criminal.,11.134,/5Fh4NdoEnCjCK9wLjdJ9DJNFl2b.jpg,2013-06-26,False,False,6.945,11989,"Animation, Comedy, Family"
False,/6pqJ5v7Q49aUZYtjnKqoJs2PTaf.jpg,10749,1232221,Mother-in-law in Love With Son-in-law 4,ko,사위 사랑은 장모 4,"Joon-yeon and So-hyeon are living together with Joon-yeon's young and pretty mother-in-law for a while after his father-in-law remarries. One day, Joon-yeon is left home alone with his mother-in-law due to So-hyeon and her father-in-law's sudden business trip. The mother-in-law seduces her handsome son-in-law on a hot night. Unable to forget the sex he had with his mother-in-law, Joon-yeon even plans to have a threesome with his wife and his mother-in-law.",11.1295,/o3yMT5okmLA3x9rTe5tCrqke1oI.jpg,2023-12-26,False,False,4.0,1,Romance
False,/2vq5GTJOahE03mNYZGxIynlHcWr.jpg,"18, 28, 36",359724,Ford v Ferrari,en,Ford v Ferrari,"American car designer Carroll Shelby and the British-born driver Ken Miles work together to battle corporate interference, the laws of physics, and their own personal demons to build a revolutionary race car for Ford Motor Company and take on the dominating race cars of Enzo Ferrari at the 24 Hours of Le Mans in France in 1966.",11.1184,/dR1Ju50iudrOh3YgfwkAU1g2HZe.jpg,2019-11-13,False,False,8.007,8969,"Drama, Action, History"
False,/3gI8gS7YIpmEzUehg3cZVQ62phl.jpg,"35, 80, 28",1416391,Toaster,hi,टोस्टर,Murder and chaos erupt when a miser becomes obsessed with a toaster he gave as a wedding gift.,11.0971,/8bsa86WKaQ9plaYN7rd9oGwmyVV.jpg,2026-04-15,False,False,5.72,25,"Comedy, Crime, Action"
False,/s7vWRjcfRVMW8tBIxhC3UhKxRoo.jpg,"10749, 53",1097549,Babygirl,en,Babygirl,A high-powered CEO puts her career and family on the line when she begins a torrid affair with her much younger intern.,11.0859,/ilwO6elz3mLV9CToT7C8pjVeKX0.jpg,2024-12-25,False,False,5.706,1201,"Romance, Thriller"
False,/eUERZRVjCTNdgnESlQxyaOJ2d4K.jpg,28,1584215,The Internship,en,The Internship,"A CIA-trained assassin recruits other graduates from her secret childhood program, The Internship, to violently destroy the organization. The CIA fights back with deadly force.",11.0825,/fYqSOkix4rbDiZW0ACNnvZCpT6X.jpg,2026-01-13,False,False,6.3,73,Action
False,/cT9ZfwoPDk8JbgkessmQgxAWiaM.jpg,"28, 878, 53",1071585,M3GAN 2.0,en,M3GAN 2.0,"After the underlying tech for M3GAN is stolen and misused by a powerful defense contractor to create a military-grade weapon known as Amelia, M3GAN's creator Gemma realizes that the only option is to resurrect M3GAN and give her a few upgrades, making her faster, stronger, and more lethal.",11.0791,/oekamLQrwlJjRNmfaBE4llIvkir.jpg,2025-06-25,False,False,7.2,1324,"Action, Science Fiction, Thriller"
False,/tyj0QztA0PkYo6XauifWjkx7UVi.jpg,"16, 10751, 14, 12",12092,Alice in Wonderland,en,Alice in Wonderland,"On a golden afternoon, wildly curious young Alice tumbles into the burrow and enters the merry, madcap world of Wonderland full of whimsical escapades.",11.0639,/20cvfwfaFqNbe9Fc3VEHJuPRxmn.jpg,1951-08-09,False,False,7.185,6275,"Animation, Family, Fantasy, Adventure"
False,/85PMh0cKywekAJYDnRXfezYAmEc.jpg,"53, 28, 12, 878",44833,Battleship,en,Battleship,"When mankind beams a radio signal into space, a reply comes from ‘Planet G’, in the form of several alien crafts that splash down in the waters off Hawaii. Lieutenant Alex Hopper is a weapons officer assigned to the USS John Paul Jones, part of an international naval coalition which becomes the world's last hope for survival as they engage the hostile alien force of unimaginable strength. While taking on the invaders, Hopper must also try to live up to the potential that his brother, and his fiancée's father—an Admiral—expect of him.",11.0499,/9b0Im7SfedHiajTwzSL9zGyBI7M.jpg,2012-04-11,False,False,5.897,5954,"Thriller, Action, Adventure, Science Fiction"
False,/P82NAcEsLIYgQtrtn36tYsj41m.jpg,"10751, 35, 12, 16",748783,The Garfield Movie,en,The Garfield Movie,"Garfield, the world-famous, Monday-hating, lasagna-loving indoor cat, is about to have a wild outdoor adventure! After an unexpected reunion with his long-lost father – scruffy street cat Vic – Garfield and his canine friend Odie are forced from their perfectly pampered life into joining Vic in a hilarious, high-stakes heist.",11.0486,/xYduFGuch9OwbCOEUiamml18ZoB.jpg,2024-04-30,False,False,6.987,1441,"Family, Comedy, Adventure, Animation"
False,/eTvN54pd83TrSEOz6wbsXEJktCV.jpg,"10752, 28, 53",882569,Guy Ritchie's The Covenant,en,Guy Ritchie's The Covenant,"After an ambush, Afghan interpreter Ahmed goes to Herculean lengths to save US Army Sergeant John Kinley's life. When Kinley learns that Ahmed and his family were not given safe passage to America as promised, he must return to the war zone and repay his debt.",11.0392,/kVG8zFFYrpyYLoHChuEeOGAd6Ru.jpg,2023-04-19,False,False,7.719,3174,"War, Action, Thriller"
False,/6n53UI4mX9QMfe2S0Pgt8mGebY1.jpg,"35, 10749",194,Amélie,fr,Le Fabuleux Destin d'Amélie Poulain,"At a tiny Parisian café, the adorable yet painfully shy Amélie accidentally discovers a gift for helping others. Soon Amelie is spending her days as a matchmaker, guardian angel, and all-around do-gooder. But when she bumps into a handsome stranger, will she find the courage to become the star of her very own love story?",11.0293,/nSxDa3M9aMvGVLoItzWTepQ5h5d.jpg,2001-04-25,False,False,7.92,12391,"Comedy, Romance"
False,/jDz6RYN3nKYtlo7J9IMvGoJit7B.jpg,"18, 12, 28, 36",79,Hero,zh,英雄,"During China's Warring States period, a district prefect arrives at the palace of Qin Shi Huang, claiming to have killed the three assassins who had made an attempt on the king's life three years ago.",11.0271,/vxgZto2Cz7ILHAlmRXt50I2brB2.jpg,2002-12-19,False,False,7.5,2494,"Drama, Adventure, Action, History"
False,/9VM1KI9sVZETl0d00FK7CnBzxiw.jpg,"16, 35, 10751, 14, 12",1497970,Tom and Jerry: Forbidden Compass,zh,猫和老鼠：星盘奇缘,"During a chase inside a museum, Tom and Jerry find an ancient magical compass and end up being transported through time. Lost in a distant era, they will need to work together to find a way back home.",11.0149,/5qttWFjsO62k88civZaDMHiBTvy.jpg,2025-08-02,False,False,6.6,44,"Animation, Comedy, Family, Fantasy, Adventure"
False,/AlW7KZl1HMD1nulwNcp9grQJoRN.jpg,"35, 878",85877,The 33D Invader,cn,蜜桃成熟時33D,"A young woman named Future is sent from the year 2046 to the year 2011 in Hong Kong. Future was sent by the United Nations in order to get pregnant, where she can then extract her genes and repopulate the earth as 99% of males have become infertile in the future due to attacks from Planet Xucker. Two assassins from Xuckler are sent after her to stop her. Future meets three University students: Felix, Dan-san and Sing. The men are obsessed with female students next door: Chin-chin, Chen-chen and Sai-sai. The students agree to help Future find a mate at the university.",11.0124,/bBC1fBHyFBmc6fn4UDedtkOVSaD.jpg,2011-10-06,False,False,5.7,32,"Comedy, Science Fiction"
False,/ioQYjcRnU54ir5ltgyS7k53zw5x.jpg,"18, 10751, 10402, 10749",15121,The Sound of Music,en,The Sound of Music,"In the years before World War II, a tomboyish postulant at an Austrian abbey is hired as a governess in the home of a widowed naval captain with seven children and brings a new love of life and music into the home.",10.9988,/c6CrUZypAsBCaRWX0M3RVRDbhNS.jpg,1965-03-29,False,False,7.7,3629,"Drama, Family, Music, Romance"
False,/wRxLAw4l17LqiFcPLkobriPTZAw.jpg,"28, 53, 80",697843,Extraction 2,en,Extraction 2,"Back from the brink of death, highly skilled commando Tyler Rake takes on another dangerous mission: saving the imprisoned family of a ruthless gangster.",10.9982,/7gKI9hpEMcZUQpNgKrkDzJpbnNS.jpg,2023-06-09,False,False,7.38,2899,"Action, Thriller, Crime"
False,/pgvn1tazqI9mZaRCNQUqNr3umvG.jpg,"12, 878",1233506,The Shrinking Man,fr,L'Homme qui rétrécit,"Paul, is an ordinary man who divides his life between his shipbuilding company, his wife Elise and their daughter Mia. During a sea trip, Paul finds himself confronted with a strange, unexplained meteorological phenomenon. From then on, Paul shrinks inexorably, without science being able to explain why or be of any help to him. When, by accident, he finds himself a prisoner in his own cellar, and while he is only a few centimeters tall, he will have to fight to survive in this banal environment that has become perilous. During this experience, Paul will find himself confronted with himself, with his humanity, and will try to answer the great questions of existence.",10.9758,/5scjQRQq4i0zpbfyvWJX8LFEWjt.jpg,2025-10-22,False,False,6.1,124,"Adventure, Science Fiction"
False,/jgySLjw9ZDKbnGf0VlhlHT7iHSi.jpg,"9648, 53",936245,Hidden Face,ko,히든페이스,"Su-yeon, a cellist in an orchestra led by her fiancé and conductor Sung-jin, disappears one day, leaving behind only a video recording. Sung-jin is devasted over the loss of Su-yeon, but feels a strong attraction to Mi-ju, a cellist who fills in for his fiancée. Then one rainy night, Sung-jin and Mi-ju get swept away by their mutual desires for each other and commit an unforgivable act at Su-yeon's house.",10.9724,/slRaAeEWbU8gM834X10qNhBhVIv.jpg,2024-11-20,False,False,5.1,66,"Mystery, Thriller"
False,/zoVeIgKzGJzpdG6Gwnr7iOYfIMU.jpg,"18, 10749",11216,Cinema Paradiso,it,Nuovo Cinema Paradiso,"A filmmaker recalls his childhood, when he fell in love with the movies at his village's theater and formed a deep friendship with the theater's projectionist.",10.9601,/gCI2AeMV4IHSewhJkzsur5MEp6R.jpg,1988-11-17,False,False,8.426,4824,"Drama, Romance"
False,/iQcCAm8hKWZyUntqrvzyEGtXyJl.jpg,"878, 28, 12",670292,The Creator,en,The Creator,"Amid a future war between the human race and the forces of artificial intelligence, a hardened ex-special forces agent grieving the disappearance of his wife, is recruited to hunt down and kill the Creator, the elusive architect of advanced AI who has developed a mysterious weapon with the power to end the war—and mankind itself.",10.9539,/3dSivDtOuyxLDxPH4v2tcNG1fP7.jpg,2023-09-27,False,False,7.034,3882,"Science Fiction, Action, Adventure"
False,/7jS69IM8bK7ooOWGFmM9G6JcenO.jpg,"18, 10751",770156,Lucy Shimmers and the Prince of Peace,en,Lucy Shimmers and the Prince of Peace,Second chances start when a hardened criminal crosses paths with a precocious little girl who is helped by an angel to change hearts during the holiday season.,10.9505,/yfnJ5qIYx7q33fY4jqv9Pu95RSg.jpg,2020-10-19,False,False,8.38,362,"Drama, Family"
False,/lgBZlJ1LHQel5nneNQMoesmvc7l.jpg,"28, 12, 10752",1271,300,en,300,"A story very loosely based the 480 B.C. Battle of Thermopylae, where the King of Sparta led his army against the advancing Persians.",10.9504,/h7Lcio0c9ohxPhSZg42eTlKIVVY.jpg,2007-03-07,False,False,7.198,14707,"Action, Adventure, War"
False,/iymDDg4upZWgpbSeiE1JCjsSPBs.jpg,"18, 53, 80",64690,Drive,en,Drive,"Driver is a skilled Hollywood stuntman who moonlights as a getaway driver for criminals. Though he projects an icy exterior, lately he's been warming up to a pretty neighbor named Irene and her young son, Benicio. When Irene's husband gets out of jail, he enlists Driver's help in a million-dollar heist. The job goes horribly wrong, and Driver must risk his life to protect Irene and Benicio from the vengeful masterminds behind the robbery.",10.9388,/602vevIURmpDfzbnv5Ubi6wIkQm.jpg,2011-09-15,False,False,7.584,13627,"Drama, Thriller, Crime"
False,/i2GVEvltEu3BXn5crBSxgKuTaca.jpg,"27, 53",614479,Insidious: The Red Door,en,Insidious: The Red Door,"To put their demons to rest once and for all, Josh Lambert and a college-aged Dalton Lambert must go deeper into The Further than ever before, facing their family's dark past and a host of new and more horrifying terrors that lurk behind the red door.",10.9283,/d07phJqCx6z5wILDYqkyraorDPi.jpg,2023-07-05,False,False,6.513,1956,"Horror, Thriller"
False,/qAe5omymsbIvRzl0PySF3NKPdad.jpg,"18, 10749, 80",1443374,All the Good Eyes,zh,森中有林,"The story chronicles four decades in the lives of a family deeply rooted in the soil of Northeast China. Through times of prosperity and hardship, they navigate cycles of love and hatred, fortune and misfortune. Though buffeted by the twists of fate, they never relinquish their steadfast guardianship of one another and the profound commitment to this ancestral land that sustains them.",10.9256,/2lCe3wAq9KpyHwRZo28PeRMZgFm.jpg,2026-04-25,False,False,6.0,1,"Drama, Romance, Crime"
False,/yZP6GyrgzdpjH1AxPHlb8ACLkiA.jpg,"27, 53",49018,Insidious,en,Insidious,"A family discovers that dark spirits have invaded their home after their son inexplicably falls into an endless sleep. When they reach out to a professional for help, they learn things are a lot more personal than they thought.",10.9236,/1egpmVXuXed58TH2UOnX1nATTrf.jpg,2011-03-31,False,False,6.938,7312,"Horror, Thriller"
False,/me67dwJnUBt3O9NqZaBdEQ6i4vM.jpg,"14, 16, 10749, 10751",10882,Sleeping Beauty,en,Sleeping Beauty,"Cursed to die by the evil fairy Maleficent when she was a baby, Princess Aurora is sent into hiding under protection from three good fairies. As she grows up far away, Maleficent becomes increasingly determined to seal the princess's fate.",10.9129,/n3pxoMDDxp10c1smgbDzW4bwlzq.jpg,1959-02-17,False,False,6.945,5477,"Fantasy, Animation, Romance, Family"
False,/bZsATFS6wg6L45ele7Ve4ogGkUT.jpg,"14, 18, 27",60898,Erotic Ghost Story,cn,聊齋艷譚,"After one thousand years, three vixens transform into humans. They seduce a poor young scholar who soon finds himself in a horrifying situation.",10.9029,/fTUCwsxVoLFuodAtlL6aITP1B45.jpg,1990-05-19,False,False,6.2,94,"Fantasy, Drama, Horror"
False,/wWqTMWkEw6HouLd1zPZbZWxtAPr.jpg,"28, 878, 12",399566,Godzilla vs. Kong,en,Godzilla vs. Kong,"In a time when monsters walk the Earth, humanity’s fight for its future sets Godzilla and Kong on a collision course that will see the two most powerful forces of nature on the planet collide in a spectacular battle for the ages.",10.8904,/pgqgaUx1cJb5oZQQ5v0tNARCeBp.jpg,2021-03-24,False,False,7.535,10629,"Action, Science Fiction, Adventure"
False,/6D6M5z4reppUxo2cnBEKI02Csp1.jpg,"28, 80, 53, 37",1601243,Oscar Shaw,en,Oscar Shaw,"After retiring from the police force, a relentless detective haunted by the tragic loss of his closest friend sets out on a perilous quest for vengeance, seeking redemption and fighting to restore justice to the streets he once swore to protect.",10.8872,/tsE3nySukwrfUjouz8vzvKTcXNC.jpg,2026-01-09,False,False,6.6,31,"Action, Crime, Thriller, Western"
False,/rfkIeCaIHhN3K5wjJJqKmfUjYp8.jpg,"18, 36",381284,Hidden Figures,en,Hidden Figures,"The untold story of Katherine G. Johnson, Dorothy Vaughan and Mary Jackson – brilliant African-American women working at NASA and serving as the brains behind one of the greatest operations in history – the launch of astronaut John Glenn into orbit. The visionary trio crossed all gender and race lines to inspire generations to dream big.",10.8795,/9lfz2W2uGjyow3am00rsPJ8iOyq.jpg,2016-12-10,False,False,8.043,10433,"Drama, History"
False,/g0geLM1zXpLb9mpqKw1ePcA5bTJ.jpg,"18, 53, 27",44214,Black Swan,en,Black Swan,"A committed dancer struggles to maintain her sanity after winning the lead role in a production of Tchaikovsky's ""Swan Lake.""",10.8702,/viWheBd44bouiLCHgNMvahLThqx.jpg,2010-12-03,False,False,7.686,15552,"Drama, Thriller, Horror"
False,/2nyaeISu2xIxIgZYNpX4UayY8PN.jpg,"28, 12, 878",141052,Justice League,en,Justice League,"Fuelled by his restored faith in humanity and inspired by Superman's selfless act, Bruce Wayne and Diana Prince assemble a team of metahumans consisting of Barry Allen, Arthur Curry and Victor Stone to face the catastrophic threat of Steppenwolf and the Parademons who are on the hunt for three Mother Boxes on Earth.",10.8476,/eifGNCSDuxJeS1loAXil5bIGgvC.jpg,2017-11-15,False,False,6.074,13667,"Action, Adventure, Science Fiction"
False,/W034dd7w2malON26KWyZm4y37W.jpg,"12, 28, 14",1735,The Mummy: Tomb of the Dragon Emperor,en,The Mummy: Tomb of the Dragon Emperor,"Archaeologist Rick O'Connell travels to China, pitting him against an emperor from the 2,000-year-old Han dynasty who's returned from the dead to pursue a quest for world domination. This time, O'Connell enlists the help of his wife and son to quash the so-called 'Dragon Emperor' and his abuse of supernatural power.",10.8434,/A3acM1lX5PNWQa6r5qeMAJOxbnT.jpg,2008-07-01,False,False,5.517,4808,"Adventure, Action, Fantasy"
False,/6LVSrgm83UYWlrLTCVGmWhFKYO0.jpg,"27, 53, 18",474350,It Chapter Two,en,It Chapter Two,"27 years after overcoming the malevolent supernatural entity Pennywise, the former members of the Losers' Club, who have grown up and moved away from Derry, are brought back together by a devastating phone call.",10.8366,/zfE0R94v1E8cuKAerbskfD3VfUt.jpg,2019-09-04,False,False,6.837,9607,"Horror, Thriller, Drama"
False,/gTIobmaZTeXDMD2LcIvhnL9rsu8.jpg,"35, 27, 14, 28",1022453,The Rajasaab,te,ది రాజాసాబ్,"Seeking his lost grandfather, a young man enters a haunted mansion and awakens a family curse powerful enough to upend both his life and reality.",10.835,/nRy56JePNbXgaZc76gqZkB6FFne.jpg,2026-01-08,False,False,5.2,30,"Comedy, Horror, Fantasy, Action"
False,/bacOuUnRBoAO1NjMfsAGX2EKRrS.jpg,18,1366,Rocky,en,Rocky,"Rocky Balboa is a Philadelphia club fighter who seems to be going nowhere. But when a stroke of fate puts him in the ring with a world heavyweight champion, Rocky knows that it's his one shot at the big time — a once-in-a-lifetime opportunity to go the distance and come out a winner!",10.8332,/hEjK9A9BkNXejFW4tfacVAEHtkn.jpg,1976-12-03,False,False,7.798,8612,Drama
False,/jWq20KNbg5txb28tLxJl0yLYuxp.jpg,35,76493,The Dictator,en,The Dictator,The heroic story of a dictator who risks his life to ensure that democracy would never come to the country he so lovingly oppressed.,10.8171,/n0W7kajF4GFMRk2c0wWwMQqTaDM.jpg,2012-05-15,False,False,6.23,6444,Comedy
False,/xFYpUmB01nswPgbzi8EOCT1ZYFu.jpg,"12, 18, 28",980489,Gran Turismo,en,Gran Turismo,The ultimate wish-fulfillment tale of a teenage Gran Turismo player whose gaming skills won him a series of Nissan competitions to become an actual professional racecar driver.,10.8158,/51tqzRtKMMZEYUpSYkrUE7v9ehm.jpg,2023-08-09,False,False,7.712,3399,"Adventure, Drama, Action"
False,/i2fZIltljrhFPsUK9PN6O6ZE7M4.jpg,"12, 16, 35, 10751, 14",11836,The SpongeBob SquarePants Movie,en,The SpongeBob SquarePants Movie,"There's trouble brewing in Bikini Bottom. Someone has stolen King Neptune's crown, and it looks like Mr. Krab, SpongeBob's boss, is the culprit. Though he's just been passed over for the promotion of his dreams, SpongeBob stands by his boss, and along with his best pal Patrick, sets out on a treacherous mission to Shell City to reclaim the crown and save Mr. Krab's life.",10.8148,/1rvzKV1d18EbDVaEd4VDzK3cgnY.jpg,2004-11-19,False,False,7.086,3195,"Adventure, Animation, Comedy, Family, Fantasy"
False,/4GgiMYynlzp5RmaYNzPHkhW12j7.jpg,"53, 18, 10749",287649,Scarlet Innocence,ko,마담 뺑덕,"A university professor gradually succumbing to blindness is entranced by an obsessive love, in this modern-day adaptation of a classic Korean fairy tale.",10.8031,/ejaHQQKp5J2tD6ubprDMmIRGKnE.jpg,2014-10-02,False,False,6.1,69,"Thriller, Drama, Romance"
False,/mXeINZrLRKbIw51spnruegjmLBS.jpg,27,1499885,The Red Book Ritual: Gates of Hell,en,The Red Book Ritual: Gates of Hell,"Robbie embarks on a dangerous quest to contact his deceased girlfriend through a ritual that summons the dead. He heads to an abandoned house with a group of young people to perform the ""Red Book Ritual."" But during the summoning, supernatural forces awaken. Now they must face ancient horrors to survive.",10.8001,/dOLRsvnjOB6rCx6olyRsMT92PxI.jpg,2025-09-18,False,False,6.29,31,Horror
