adult,backdrop_path,genre_ids,id,original_language,original_title,overview,popularity,poster_path,release_date,title,video,vote_average,vote_count,genre_names
False,/klJMCIblHLFwCuGjKz7tyOpekIC.jpg,"12, 28, 53",36557,en,Casino Royale,"Le Chiffre, a banker to the world's terrorists, is scheduled to participate in a high-stakes poker game in Montenegro, where he intends to use his winnings to establish his financial grip on the terrorist market. M sends Bond—on his maiden mission as a 00 Agent—to attend this game and prevent Le Chiffre from winning. With the help of Vesper Lynd and Felix Leiter, Bond enters the most important poker game in his already dangerous career.",13.2199,/lMrxYKKhd4lqRzwUHAy5gcx9PSO.jpg,2006-11-14,Casino Royale,False,7.57,11596,"Adventure, Action, Thriller"
False,/9il7qNbeYnPMYlutsVYDsj4hRyb.jpg,"18, 28",480530,en,Creed II,"Between personal obligations and training for his next big fight against an opponent with ties to his family's past, Adonis Creed is up against the challenge of his life.",13.2116,/v3QyboWRoA4O9RbcsqH8tJMe8EB.jpg,2018-11-21,Creed II,False,7.027,5750,"Drama, Action"
False,/6TjllWT3cGrPFyqDXurVZ3L8bBi.jpg,"9648, 53, 18",745,en,The Sixth Sense,"Following an unexpected tragedy, child psychologist Malcolm Crowe meets a nine year old boy named Cole Sear, who is hiding a dark secret.",13.1948,/vOyfUXNFSnaTk7Vk5AjpsKTUWsu.jpg,1999-08-06,The Sixth Sense,False,7.95,12751,"Mystery, Thriller, Drama"
False,/sTQNRqLbfCXolrb5CizAW1dj528.jpg,"878, 14, 28",246655,en,X-Men: Apocalypse,"After the re-emergence of the world's first mutant, world-destroyer Apocalypse, the X-Men must unite to defeat his extinction level plan.",13.1561,/2mtQwJKVKQrZgTz49Dizb25eOQQ.jpg,2016-05-18,X-Men: Apocalypse,False,6.522,13686,"Science Fiction, Fantasy, Action"
False,/2QMgoiDlTmrO9FngZft8GgZ2SbX.jpg,"10751, 16, 12, 35",270946,en,Penguins of Madagascar,"Skipper, Kowalski, Rico and Private join forces with undercover organization The North Wind to stop the villainous Dr. Octavius Brine from destroying the world as we know it.",13.1364,/dXbpNrPDZDMEbujFoOxmMNQVMHa.jpg,2014-11-22,Penguins of Madagascar,False,6.53,4437,"Family, Animation, Adventure, Comedy"
False,/vOV4Qy3g791OTzEndiSGoJwuI2M.jpg,"53, 28, 12, 18, 14",1401778,en,Turbulence,"Young married couple Zach and Emmy decide to take a hot air balloon trip across the Italian Dolomites to rekindle their relationship. When they and pilot Harry are joined by a third passenger, Julia, events unfold in ways they could never imagine five thousand meters in the air.",13.1336,/jRuiKL4S9UpLma2ZlM47xIu2gbe.jpg,2025-11-26,Turbulence,False,6.584,107,"Thriller, Action, Adventure, Drama, Fantasy"
False,/7S0bXv3BqCuPfImKRf5kkmBVYZR.jpg,"28, 12, 14",572802,en,Aquaman and the Lost Kingdom,"Black Manta seeks revenge on Aquaman for his father's death. Wielding the Black Trident's power, he becomes a formidable foe. To defend Atlantis, Arthur (Aquaman) forges an alliance with his imprisoned brother. They must protect the kingdom.",13.1225,/7lTnXOy0iNtBAdRP3TZvaKJ77F6.jpg,2023-12-20,Aquaman and the Lost Kingdom,False,6.526,3442,"Action, Adventure, Fantasy"
False,/w4X3j3ECvmEJMLabhbLB94iGcMV.jpg,"10749, 18",308624,ko,옹녀뎐,"Ong-nye had a world of men wrapped around her finger, until, one day, a horrific injury leaves her handicapped, and she retreats to the mountains. But one man may break her loneliness.",13.1175,/rtl4hW2KJHInieeCiGgrDJmMG7s.jpg,2014-08-21,The Story of Ong-nyeo,False,5.0,5,"Romance, Drama"
False,/k6tdiMTO39RQj3dhfspuzprfoe0.jpg,"80, 28, 53",941109,en,Play Dirty,"Expert thief Parker gets a shot at a major heist, but to pull it off he and his team must outsmart a South American dictator, the New York mob, and the world's richest man.",13.0934,/ovZ0zq0NwRghtWI1oLaM0lWuoEw.jpg,2025-09-30,Play Dirty,False,6.6,601,"Crime, Action, Thriller"
False,/8VXpLIfTQr1ieqzySB9NnCkxuW5.jpg,"10749, 35",293172,it,La svergognata,"In this movie a writer comes to stay at an island resort and gets involved with a teenage lolita  who is there with her parents and rather malicious best friend. She teases the older man mercilessly--going to a hotel and dancing with him naked and then suddenly getting dressed and running off to a party with a young American guy. But it's not so much because she is malicious, but because she is really an insecure virgin. Finally, he gives up on her after his beautiful wife (Barbara Bouchet) shows up. But the younger woman becomes jealous and is not going to give up so easily. . .",13.0911,/7SfuAJik0PcLXlBPaAsE7rpKuSz.jpg,1974-08-17,La svergognata,False,3.2,4,"Romance, Comedy"
False,/hGGC9gKo7CFE3fW07RA587e5kol.jpg,"16, 35, 10751, 12",14160,en,Up,"Carl Fredricksen spent his entire life dreaming of exploring the globe and experiencing life to its fullest. But at age 78, life seems to have passed him by, until a twist of fate (and a persistent 8-year old Wilderness Explorer named Russell) gives him a new lease on life.",13.0905,/mFvoEwSfLqbcWwFsDjQebn9bzFe.jpg,2009-05-28,Up,False,7.959,21542,"Animation, Comedy, Family, Adventure"
False,/hNsYUryiwxcdeTMkaBcPF3iEg0p.jpg,"878, 28",335983,en,Venom,"Investigative journalist Eddie Brock attempts a comeback following a scandal, but accidentally becomes the host of Venom, a violent, super powerful alien symbiote. Soon, he must rely on his newfound powers to protect the world from a shadowy organization looking for a symbiote of their own.",13.042,/2uNW4WbgBXL25BAbXGLnLqX71Sw.jpg,2018-09-28,Venom,False,6.825,17136,"Science Fiction, Action"
False,/sS2UzdPLKw2TylH66kjHBESjStr.jpg,10749,1233728,ko,7일간의 스와핑,"Cheon-seok and Mi-seon remarried. Mi-seon goes on a trip with her friends and asks her daughter-in-law to take care of her father-in-law for a week. Her father-in-law and her daughter-in-law came to live together for 7 days. Her daughter-in-law, who tasted her father-in-law's crispy pork belly, falls in love with her father-in-law...",13.0295,/9DNis2hoyLImQnGIZoianI7iohe.jpg,2023-05-23,Seven-day Swapping,False,0.0,0,Romance
False,/aTLq0TMKdsmIy1ZyFM1LfPs326d.jpg,"18, 878, 53",6479,en,I Am Legend,"Robert Neville is a scientist who was unable to stop the spread of the terrible virus that was incurable and man-made. Immune, Neville is now the last human survivor in what is left of New York City and perhaps the world. For three years, Neville has faithfully sent out daily radio messages, desperate to find any other survivors who might be out there. But he is not alone.",13.0262,/iPDkaSdKk2jRLTM65UOEoKtsIZ8.jpg,2007-12-12,I Am Legend,False,7.2,16719,"Drama, Science Fiction, Thriller"
False,/4BS8tgBNWg2jPiDlBwM2iJe1xB7.jpg,"16, 10751, 12, 35",49013,en,Cars 2,Star race car Lightning McQueen and his pal Mater head overseas to compete in the World Grand Prix race. But the road to the championship becomes rocky as Mater gets caught up in an intriguing adventure of his own: international espionage.,12.9599,/okIz1HyxeVOMzYwwHUjH2pHi74I.jpg,2011-06-11,Cars 2,False,6.176,8423,"Animation, Family, Adventure, Comedy"
False,/vVpEOvdxVBP2aV166j5Xlvb5Cdc.jpg,"28, 53, 80",458156,en,John Wick: Chapter 3 - Parabellum,"Super-assassin John Wick returns with a $14 million price tag on his head and an army of bounty-hunting killers on his trail. After killing a member of the shadowy international assassin’s guild, the High Table, John Wick is excommunicado, but the world’s most ruthless hit men and women await his every turn.",12.9531,/ziEuG1essDuWuC5lpWUaw1uXY2O.jpg,2019-05-15,John Wick: Chapter 3 - Parabellum,False,7.438,11632,"Action, Thriller, Crime"
False,/yvPbncYhMu9FfTjDhq0N5lgnVkO.jpg,"35, 10749, 18",4951,en,10 Things I Hate About You,"On the first day at his new school, Cameron instantly falls for Bianca, the gorgeous girl of his dreams. The only problem is that Bianca is forbidden to date until her ill-tempered, completely un-dateable older sister Kat goes out, too. In an attempt to solve his problem, Cameron singles out the only guy who could possibly be a match for Kat: a mysterious bad boy with a nasty reputation of his own.",12.9119,/ujERk3aKABXU3NDXOAxEQYTHe9A.jpg,1999-03-30,10 Things I Hate About You,False,7.59,8841,"Comedy, Romance, Drama"
False,/g1OvTd1eF346vmx8qsJnjaiooZ6.jpg,"12, 14, 10751",630,en,The Wizard of Oz,"Young Dorothy finds herself in a magical world where she makes friends with a lion, a scarecrow and a tin man as they make their way along the yellow brick road to talk with the Wizard and ask for the things they miss most in their lives. The Wicked Witch of the West is the only thing that could stop them.",12.91,/uCC3j4pV9eOZwzDUWp2ilbcTf1f.jpg,1939-08-15,The Wizard of Oz,False,7.585,6072,"Adventure, Fantasy, Family"
False,/3zvZ699gMW2RhWc0GisIukzq0Ls.jpg,"14, 12, 28",284052,en,Doctor Strange,"After his career is destroyed, a brilliant but arrogant surgeon gets a new lease on life when a sorcerer takes him under her wing and trains him to defend the world against evil.",12.9082,/xf8PbyQcR5ucXErmZNzdKR0s8ya.jpg,2016-10-25,Doctor Strange,False,7.418,23311,"Fantasy, Adventure, Action"
False,/xj1Sv1xm4Y0ydBueGuf10Y9qM0O.jpg,18,489,en,Good Will Hunting,"Will Hunting is a headstrong, working-class genius who is failing the lessons of life. After one too many run-ins with the law, Will's last chance is a psychology professor, who might be the only man who can reach him.",12.8858,/z2FnLKpFi1HPO7BEJxdkv6hpJSU.jpg,1997-12-05,Good Will Hunting,False,8.159,13716,Drama
False,/xuLA0pii2IMJW2puT7EvJtgpg0H.jpg,"28, 12, 10751, 35",675353,en,Sonic the Hedgehog 2,"After settling in Green Hills, Sonic is eager to prove he has what it takes to be a true hero. His test comes when Dr. Robotnik returns, this time with a new partner, Knuckles, in search for an emerald that has the power to destroy civilizations. Sonic teams up with his own sidekick, Tails, and together they embark on a globe-trotting journey to find the emerald before it falls into the wrong hands.",12.8666,/6DrHO1jr3qVrViUO6s6kFiAGM7.jpg,2022-03-30,Sonic the Hedgehog 2,False,7.434,5821,"Action, Adventure, Family, Comedy"
False,/pYgj8e2Y6RufnSyOA6OnzmxFXxZ.jpg,"27, 18, 9648",530385,en,Midsommar,"Several friends travel to Sweden to study as anthropologists a summer festival that is held every ninety years in the remote hometown of one of them. What begins as a dream vacation in a place where the sun never sets, gradually turns into a dark nightmare as the mysterious inhabitants invite them to participate in their disturbing festive activities.",12.8567,/7LEI8ulZzO5gy9Ww2NVCrKmHeDZ.jpg,2019-07-03,Midsommar,False,7.152,7984,"Horror, Drama, Mystery"
False,/c6H7Z4u73ir3cIoCteuhJh7UCAR.jpg,"878, 28, 12",524434,en,Eternals,"The Eternals are a team of ancient aliens who have been living on Earth in secret for thousands of years. When an unexpected tragedy forces them out of the shadows, they are forced to reunite against mankind’s most ancient enemy, the Deviants.",12.8065,/lFByFSLV5WDJEv3KabbdAF959F2.jpg,2021-11-03,Eternals,False,6.8,9057,"Science Fiction, Action, Adventure"
False,/8zhviPFJx25k8PbUOUL5sLOy9XE.jpg,"80, 18, 53",242,en,The Godfather Part III,"In the midst of trying to legitimize his business dealings in 1979 New York and Italy, aging mafia don, Michael Corleone seeks forgiveness for his sins while taking a young protege under his wing.",12.801,/lm3pQ2QoQ16pextRsmnUbG2onES.jpg,1990-12-25,The Godfather Part III,False,7.419,6808,"Crime, Drama, Thriller"
False,/ok4ot3YbfDYZcINXf91JUfq3maB.jpg,"27, 9648, 80",176,en,Saw,"Two men wake up to find themselves shackled in a grimy, abandoned bathroom. As they struggle to comprehend their predicament, they discover a disturbing tape left behind by the sadistic mastermind known as Jigsaw. With a chilling voice and cryptic instructions, Jigsaw informs them that they must partake in a gruesome game in order to secure their freedom.",12.7976,/rLNSOudrayDBo1uqXjrhxcjODIC.jpg,2004-10-01,Saw,False,7.42,9975,"Horror, Mystery, Crime"
False,/wHdpSwLr0wUKRyG1CGzGjPSkyrK.jpg,"35, 10749, 18",1611398,es,Un hombre por semana,A divorced woman reconstructs her life and opens herself to love. Her search for dating apps takes her through fun and unpredictable moments to discover self-love.,12.7966,/rHwOvosfDFRsjBihdh9dIHnMgbO.jpg,2026-01-08,Un hombre por semana,False,7.306,49,"Comedy, Romance, Drama"
False,/bNiiUCQUD7ij5Ybh2GoWSZwqAb1.jpg,"14, 12, 28, 10751, 10749",102651,en,Maleficent,"A beautiful, pure-hearted young woman, Maleficent has an idyllic life growing up in a peaceable forest kingdom, until one day when an invading army threatens the harmony of the land. She rises to be the land's fiercest protector, but she ultimately suffers a ruthless betrayal – an act that begins to turn her heart into stone. Bent on revenge, Maleficent faces an epic battle with the invading King's successor and, as a result, places a curse upon his newborn infant Aurora. As the child grows, Maleficent realizes that Aurora holds the key to peace in the kingdom – and to Maleficent's true happiness as well.",12.7965,/bDG3yei6AJlEAK3A5wN7RwFXQ7V.jpg,2014-05-28,Maleficent,False,7.087,13655,"Fantasy, Adventure, Action, Family, Romance"
False,/IQyEvPTYvrzsa7qstRj6VLQupr.jpg,"9648, 18, 80",392044,en,Murder on the Orient Express,Genius Belgian detective Hercule Poirot investigates the murder of an American tycoon aboard the Orient Express train.,12.7882,/7GtdJU6iAg6fjQu3E3zta3bIAQh.jpg,2017-11-03,Murder on the Orient Express,False,6.707,10481,"Mystery, Drama, Crime"
False,/gLXibzLQ4qegvjdqDC0f8yTij2P.jpg,"9648, 53, 28",1310568,en,Murder at the Embassy,"1934. Private detective Miranda Green investigates a murder perpetrated in the British Embassy in Cairo, where a top secret document was stolen, risking to jeopardize both Buckingham Palace and the peace of the world. All those present in this closed place are suspected: the American photographer, the English student, the American actress, the Egyptian security guard, the ambassador interpreter, the Egyptian gardener and - why not? — the Ambassador himself. But who would have expected that a small group of Nazis would be behind a plot, risking to jeopardize both Buckingham Palace and the peace of the world?",12.7842,/3DBmBItPdy0A2ol59jgHhS54Lua.jpg,2025-11-14,Murder at the Embassy,False,5.9,41,"Mystery, Thriller, Action"
False,/qe4Tp0hURXqiih5AV1kHimXIt3u.jpg,"28, 80",414419,en,Kill Bill: The Whole Bloody Affair,"Quentin Tarantino's complete cut combining Kill Bill: Vol. 1 and Vol. 2 follows The Bride, a former assassin who awakens from a four-year coma after being shot by her mentor and lover, Bill. She embarks on a vengeful quest to eliminate Bill and the Deadly Viper Assassination Squad who betrayed her.",12.7768,/nSOJfWJCdVFZQwXQA7RXn7FIIiY.jpg,2011-03-27,Kill Bill: The Whole Bloody Affair,False,8.055,1216,"Action, Crime"
False,/xYro90dW4z7es4JG1vo1bmZ0lUN.jpg,"28, 80, 53",1288445,en,Mutiny,"After witnessing his billionaire boss' murder and being framed for the crime, Cole Reed boards a cargo ship on a one-man crusade to avenge his boss' death only to discover an international conspiracy.",12.7749,/fUNcKaKoZvqF1fibkoWB7MwFhhd.jpg,2026-08-19,Mutiny,False,0.0,0,"Action, Crime, Thriller"
False,/yZP6GyrgzdpjH1AxPHlb8ACLkiA.jpg,"27, 53",49018,en,Insidious,"A family discovers that dark spirits have invaded their home after their son inexplicably falls into an endless sleep. When they reach out to a professional for help, they learn things are a lot more personal than they thought.",12.7688,/1egpmVXuXed58TH2UOnX1nATTrf.jpg,2011-03-31,Insidious,False,6.94,7261,"Horror, Thriller"
False,/qAzYK4YPSWDc7aa4R43LcwRIAyb.jpg,"28, 12, 878",299537,en,Captain Marvel,"The story follows Carol Danvers as she becomes one of the universe’s most powerful heroes when Earth is caught in the middle of a galactic war between two alien races. Set in the 1990s, Captain Marvel is an all-new adventure from a previously unseen period in the history of the Marvel Cinematic Universe.",12.7677,/AtsgWhDnHTq68L0lLsUrCnM7TjG.jpg,2019-03-06,Captain Marvel,False,6.784,16646,"Action, Adventure, Science Fiction"
False,/yJyZRrXaYUjhOrJGga8awbw4Rud.jpg,"12, 14, 10749, 10751",420817,en,Aladdin,A kindhearted street urchin named Aladdin embarks on a magical adventure after finding a lamp that releases a wisecracking genie while a power-hungry Grand Vizier vies for the same lamp that has the power to make their deepest wishes come true.,12.7625,/ykUEbfpkf8d0w49pHh0AD2KrT52.jpg,2019-05-22,Aladdin,False,7.085,10565,"Adventure, Fantasy, Romance, Family"
False,/i9oyhCYxIYH2082J0Rc3a3jQjRB.jpg,"27, 53",91586,en,Insidious: Chapter 2,The haunted Lambert family seeks to uncover the mysterious childhood secret that has left them dangerously connected to the spirit world.,12.7437,/w5JjiB3O1CLDXbTJe1QpU5RHmlU.jpg,2013-09-12,Insidious: Chapter 2,False,6.68,4530,"Horror, Thriller"
False,/5lAMQMWpXMsirvtLLvW7cJgEPkU.jpg,"16, 18, 10749",378064,ja,映画 聲の形,"Shouya Ishida starts bullying the new girl in class, Shouko Nishimiya, because she is deaf. But as the teasing continues, the rest of the class starts to turn on Shouya for his lack of compassion. When they leave elementary school, Shouko and Shouya do not speak to each other again... until an older, wiser Shouya, tormented by his past behaviour, decides he must see Shouko once more. He wants to atone for his sins, but is it already too late...?",12.7398,/tuFaWiqX0TXoWu7DGNcmX3UW7sT.jpg,2016-09-17,A Silent Voice: The Movie,False,8.387,4437,"Animation, Drama, Romance"
False,/r5dG1V4P4y84x6ETQkQ5BnZ0iXh.jpg,35,140638,en,"Pussycat, Pussycat, I Love You",An American playwright living in Rome consults a quack psychiatrist to combat his fears of balding and save his failing marriage.,12.738,/5NG3iF6mli8QMJYNsbzWxzW04t4.jpg,1970-03-25,"Pussycat, Pussycat, I Love You",False,4.4,22,Comedy
False,/jPu8yiadqgzwFPGKJmGo637ASVP.jpg,"878, 28, 12",1724,en,The Incredible Hulk,"Scientist Bruce Banner scours the planet for an antidote to the unbridled force of rage within him: the Hulk. But when the military masterminds who dream of exploiting his powers force him back to civilization, he finds himself coming face to face with a new, deadly foe.",12.716,/gKzYx79y0AQTL4UAk1cBQJ3nvrm.jpg,2008-06-12,The Incredible Hulk,False,6.2,12597,"Science Fiction, Action, Adventure"
False,/7Wev9JMo6R5XAfz2KDvXb7oPMmy.jpg,"9648, 53",77,en,Memento,"Leonard Shelby is tracking down the man who raped and murdered his wife. The difficulty of locating his wife's killer, however, is compounded by the fact that he suffers from a rare, untreatable form of short-term memory loss. Although he can recall details of life before his accident, Leonard cannot remember what happened fifteen minutes ago, where he's going, or why.",12.7079,/fKTPH2WvH8nHTXeBYBVhawtRqtR.jpg,2000-10-11,Memento,False,8.177,16102,"Mystery, Thriller"
False,/218MafWtM9XpPRuNdh0uhrNezi5.jpg,"878, 12, 18",982843,ko,대홍수,"When a raging flood traps a researcher and her young son, a call to a crucial mission puts their escape — and the future of humanity — on the line.",12.6876,/1tUOZQDgZaGqZtrB21MieiXARL2.jpg,2025-09-18,The Great Flood,False,5.995,663,"Science Fiction, Adventure, Drama"
False,/fwf4L3r2ZU9ptOB9nOo5nuVLo1i.jpg,"10749, 18",398818,en,Call Me by Your Name,"In the summer of 1983, a 17-year-old Elio spends his days in his family's villa in Italy. One day Oliver, a graduate student, arrives to assist Elio's father, a professor of Greco-Roman culture. Soon, Elio and Oliver discover a summer that will alter their lives forever.",12.6557,/mZ4gBdfkhP9tvLH1DO4m4HYtiyi.jpg,2017-10-01,Call Me by Your Name,False,8.093,12690,"Romance, Drama"
False,/uNA0OVk09Hbwflye3eBoOiGIKGc.jpg,"35, 18, 28",1336770,ml,വാഴ II,"Four friends – Hashir, Alan, Ajin and Vinayak – are considered losers and troublemakers by parents, family and the school management. They face immense social pressure as they reach adulthood, embarking them on an emotional journey of self discovery and acceptance, where they finally learn to take up their responsibilities and find success",12.6313,/1yLZ7kExd0UGGbaZW4LxmYD4OIf.jpg,2026-04-02,Vaazha II,False,6.0,1,"Comedy, Drama, Action"
False,/6WqqEjiycNvDLjbEClM1zCwIbDD.jpg,"27, 53, 878",1100988,en,28 Years Later,"Twenty-eight years after the Rage virus outbreak, a heavily-defended island survives connected to the mainland by a single causeway. When one of the group leaves the island into the dark heart of the mainland, he discovers secrets, wonders, and horrors that have mutated not only the infected but other survivors as well.",12.6032,/n5FygjEppOvac6yEaowi26nTyw3.jpg,2025-06-18,28 Years Later,False,6.603,2423,"Horror, Thriller, Science Fiction"
False,/1XmbgjIpqpdnSBaEzN0YaaaZObd.jpg,35,1008953,en,Incoming,Their first week of high school. The biggest party of the year. Mistakes will be made as four teenage boys navigate a night of mayhem and debauchery.,12.5981,/k2ySukuAiAarLns0yttKS3jg85Y.jpg,2024-08-22,Incoming,False,6.2,348,Comedy
False,/gSasp6UPB6Ha4rjM8z0g7yknnC3.jpg,10749,698700,ko,어린 처제,The story of an explicit relationship between a man and his sister-in-law.,12.5939,/sn0VRzQDW3bVCmB7gunksaRvHJf.jpg,2018-05-17,Younger Sister-in-law,False,5.0,1,Romance
False,/wbDkvShcrveXNFsgyujY4kdurVa.jpg,"35, 10749",957119,en,Sidelined: The QB and Me,"Dallas, a burdened but headstrong dancer, is determined to get into the best dance school in the country—her late mother’s alma mater. However, that dream is suddenly derailed when the cheeky yet secretly grieving football star, Drayton, crashes into her life with a unique story of his own. Will the two of them be able to grow into their dreams together, or will their dreams be sidelined?",12.5932,/mSL6truNrWP1Bn9ng1rN0SkMI4f.jpg,2025-02-06,Sidelined: The QB and Me,False,6.189,209,"Comedy, Romance"
False,/5En0fmDagt3Pk8d7P3uTwfeQceg.jpg,"18, 35, 36",490132,en,Green Book,"Tony Lip, a bouncer in 1962, is hired to drive pianist Don Shirley on a tour through the Deep South in the days when African Americans, forced to find alternate accommodations and services due to segregation laws below the Mason-Dixon Line, relied on a guide called The Negro Motorist Green Book.",12.5807,/7BsvSuDQuoqhWmU2fL7W2GOcZHU.jpg,2018-11-16,Green Book,False,8.223,12759,"Drama, Comedy, History"
False,/wZS4xSfPtk1NPQnx9zsT5R2WhCu.jpg,"10751, 35, 12, 16, 878, 14, 28",438148,en,Minions: The Rise of Gru,"A fanboy of a supervillain supergroup known as the Vicious 6, Gru hatches a plan to become evil enough to join them, with the backup of his followers, the Minions.",12.5765,/wKiOkZTN9lUUUNZLmtnwubZYONg.jpg,2022-06-29,Minions: The Rise of Gru,False,7.27,3988,"Family, Comedy, Adventure, Animation, Science Fiction, Fantasy, Action"
False,/P82NAcEsLIYgQtrtn36tYsj41m.jpg,"10751, 35, 12, 16",748783,en,The Garfield Movie,"Garfield, the world-famous, Monday-hating, lasagna-loving indoor cat, is about to have a wild outdoor adventure! After an unexpected reunion with his long-lost father – scruffy street cat Vic – Garfield and his canine friend Odie are forced from their perfectly pampered life into joining Vic in a hilarious, high-stakes heist.",12.5697,/xYduFGuch9OwbCOEUiamml18ZoB.jpg,2024-04-30,The Garfield Movie,False,6.998,1419,"Family, Comedy, Adventure, Animation"
False,/8srpvfRNT9qenQZACPTXDZYXitL.jpg,"80, 18, 9648, 53",12201,en,Edge of Darkness,"As a seasoned homicide detective, Thomas Craven has seen the bleakest side of humanity. But nothing prepares him for the toughest investigation of his life: the search for his only daughter Emma's killer. Now, he is on a personal mission to uncover the disturbing secrets surrounding her murder, including corporate corruption, government collusion and Emma's own mysterious life.",12.5691,/pvHjp1vEFmp5FquSCPQ2O95tIZJ.jpg,2010-01-28,Edge of Darkness,False,6.415,1702,"Crime, Drama, Mystery, Thriller"
False,/twiVn9oFXOVR0uoYgawyEBlnFu8.jpg,"12, 18, 14",1368337,en,The Odyssey,"Odysseus, the legendary Greek king of Ithaca, embarks on a long and perilous journey home following the Trojan War, chronicling his encounters with mythical beings such as the Cyclops Polyphemus, the Sirens, and the witch-goddess Circe, while attempting to reunite with his wife, Penelope.",12.5665,/pe5cCoX5iIb5IWKPsbPkCwjLFHt.jpg,2026-07-15,The Odyssey,False,0.0,0,"Adventure, Drama, Fantasy"
False,/cJvUJEEQ86LSjl4gFLkYpdCJC96.jpg,"10752, 28",1241436,en,Warfare,"A platoon of Navy SEALs embarks on a dangerous mission in Ramadi, Iraq, with the chaos and brotherhood of war retold through their memories of the event.",12.5642,/l39TlELomwysfsr37vrvCV6rmaQ.jpg,2025-04-09,Warfare,False,7.078,1395,"War, Action"
False,/gwLukBMtEv2pRxqQcWpkVhWt90j.jpg,"35, 18, 10751, 14",45588,en,Angels in the Outfield,The short-tempered manager of the Pittsburgh Pirates mends his ways in return for a little divine assistance.,12.5581,/72vL5Z7v0Mq0AfFiU1iL6tMHTID.jpg,1951-10-19,Angels in the Outfield,False,6.8,26,"Comedy, Drama, Family, Fantasy"
False,/9pkZesKMnblFfKxEhQx45YQ2kIe.jpg,"27, 53",381288,en,Split,"Though Kevin has evidenced 23 personalities to his trusted psychiatrist, Dr. Fletcher, there remains one still submerged who is set to materialize and dominate all the others. Compelled to abduct three teenage girls led by the willful, observant Casey, Kevin reaches a war for survival among all of those contained within him — as well as everyone around him — as the walls between his compartments shatter apart.",12.5505,/lli31lYTFpvxVBeFHWoe5PMfW5s.jpg,2017-01-19,Split,False,7.341,18242,"Horror, Thriller"
