adult,backdrop_path,genre_ids,id,original_language,original_title,overview,popularity,poster_path,release_date,title,video,vote_average,vote_count,genre_names
False,/ifUfE79O1raUwbaQRIB7XnFz5ZC.jpg,"27, 9648",646385,en,Scream,"Twenty-five years after a streak of brutal murders shocked the quiet town of Woodsboro, a new killer has donned the Ghostface mask and begins targeting a group of teenagers to resurrect secrets from the town’s deadly past.",17.5005,/1m3W6cpgwuIyjtg5nSnPx7yFkXW.jpg,2022-01-12,Scream,False,6.7,3761,"Horror, Mystery"
False,/aan0KdhVgJfAwUJ3n2HDFOWcxZ2.jpg,35,252838,en,The Wedding Ringer,"Doug Harris is a loveable but socially awkward groom-to-be with a problem: he has no best man.  With less than two weeks to go until he marries the girl of his dreams, Doug is referred to Jimmy Callahan, owner and CEO of Best Man, Inc., a company that provides flattering best men for socially challenged guys in need.  What ensues is a hilarious wedding charade as they try to pull off the big con, and an unexpected budding bromance between Doug and his fake best man Jimmy.",17.4581,/ciR2suRkfJen9lQvfz22lgCj7g7.jpg,2015-01-16,The Wedding Ringer,False,6.464,1672,Comedy
False,/6pNEWzBnKKHfDYRwzhV3JJQkpG6.jpg,"18, 10749",1470086,tl,Ligaw,"A sultry woman who charms the hearts of men in a remote province. Dolores, a devoted wife to her paraplegic husband, falls for a young mountaineer. What begins as a reckless escape turns into an affair drenched in passion and secrecy.",17.4216,/yc8V3KEnhvPrzXpdYTXdTvjpOb5.jpg,2025-05-09,Ligaw,False,6.667,6,"Drama, Romance"
False,/v1wZkPjY7Lnp5yAEwTZjSBmZC9o.jpg,"12, 14",30584,en,Sword of the Valiant: The Legend of Sir Gawain and the Green Knight,"Gawain was a squire in King Arthur's court when the Green Knight burst in and offered to play a game with a brave knight. Gawain journeys across the land, learning about life, saving damsels, and solving the Green Knight's riddle.",17.3939,/mqcmaLS8yECWb1skKJnmO9vGIj4.jpg,1984-08-17,Sword of the Valiant: The Legend of Sir Gawain and the Green Knight,False,5.161,56,"Adventure, Fantasy"
False,/b3U9kPQA6qo3H6t91LobKQlTZYP.jpg,"99, 10402",49310,en,The Beatles: The Making of Sgt. Pepper,"This was an official documentary shown on television featuring George Martin taking us through the album tracks and Paul, George and Ringo giving us their memories of the sessions. The Making Of Sgt. Pepper was transmitted in the UK on ITV on 14th June 1992 and featured separate interviews with Paul (filmed on 9th April 1992), George (12th April) and Ringo (19th April). The show also features George Martin playing some unreleased Sgt. Pepper's recordings directly off the original studio 4-track master tapes.",17.3753,/wwhqUcEfgoy4087hKiGFSP0cBti.jpg,1992-06-14,The Beatles: The Making of Sgt. Pepper,False,7.2,6,"Documentary, Music"
False,/8568C7FeSsjmqLGuObSB0oB6kOU.jpg,"27, 53",23823,en,Wrong Turn 3: Left for Dead,"A group of people find themselves trapped in the backwoods of West Virginia, fighting for their lives against a group of vicious and horribly disfigured inbred cannibals.",17.3452,/84s4LMWuGbm4xPWW5PSbHyQhh33.jpg,2009-10-08,Wrong Turn 3: Left for Dead,False,5.694,1252,"Horror, Thriller"
False,/wqgZSvgoctaadgwUdPYVsksivxn.jpg,"35, 18, 10749",20334,en,The Shop Around the Corner,"Two employees at a gift shop can barely stand one another, without realising that they are falling in love through the post as each other's anonymous pen pal.",17.3146,/dZ1aEzGYRiqJwPfjS6VL7wUkHmF.jpg,1940-01-12,The Shop Around the Corner,False,8.075,818,"Comedy, Drama, Romance"
False,/2eW8VlLXjUq4OKk8SYf5KTr91Kv.jpg,35,4258,en,Scary Movie 5,"Home with their newly-formed family, happy parents Dan and Jody are haunted by sinister, paranormal activities. Determined to expel the insidious force, they install security cameras and discover their family is being stalked by an evil dead demon.",17.2989,/vBqLLxE6GaAPhO6v9EFvFbLZ7Ap.jpg,2013-04-11,Scary Movie 5,False,4.8,2979,Comedy
False,/eNI7PtK6DEYgZmHWP9gQNuff8pv.jpg,"878, 28, 12",624860,en,The Matrix Resurrections,"Plagued by strange memories, Neo's life takes an unexpected turn when he finds himself back inside the Matrix.",17.2651,/8c4a8kE7PizaGQQnditMmI1xbRp.jpg,2021-12-16,The Matrix Resurrections,False,6.343,6338,"Science Fiction, Action, Adventure"
False,/fK8aA2X9EANs9Bfc5fZ6q9Gj7la.jpg,"18, 10751",1278101,zh,小小的我,"Liu Chunhe, suffering from cerebral palsy, bravely breaks through the shackles of body and mind to realize the dream stage for his grandmother, while trying to find the coordinates of his own life. After experiencing a summer transformation, he finally embarked on a new journey.",17.2593,/rLj287mA1tp4hZmd69umb1rOZu8.jpg,2024-12-27,Big World,False,8.123,61,"Drama, Family"
False,/jRJrQ72VLyEnVsvwfep8Xjlvu8c.jpg,"80, 18, 28",101,fr,Léon,"Léon, the top hit man in New York, has earned a rep as an effective ""cleaner"". But when his next-door neighbors are wiped out by a loose-cannon DEA agent, he becomes the unwilling custodian of 12-year-old Mathilda. Before long, Mathilda's thoughts turn to revenge, and she considers following in Léon's footsteps.",17.2477,/bxB2q91nKYp8JNzqE7t7TWBVupB.jpg,1994-09-14,Léon: The Professional,False,8.295,15864,"Crime, Drama, Action"
False,/uTQ6UAAdLdZwcmXmchIZJB7Jg64.jpg,"28, 35, 80, 53",390043,en,The Hitman's Bodyguard,"The world’s top bodyguard gets a new client, a hitman who must testify at the International Court of Justice. They must put their differences aside and work together to make it to the trial on time.",17.19,/5CGjlz2vyBhW5xHW4eNOZIdgzYq.jpg,2017-08-16,The Hitman's Bodyguard,False,6.892,6573,"Action, Comedy, Crime, Thriller"
False,/6TjllWT3cGrPFyqDXurVZ3L8bBi.jpg,"9648, 53, 18",745,en,The Sixth Sense,"Following an unexpected tragedy, child psychologist Malcolm Crowe meets a nine year old boy named Cole Sear, who is hiding a dark secret.",17.1494,/vOyfUXNFSnaTk7Vk5AjpsKTUWsu.jpg,1999-08-06,The Sixth Sense,False,7.948,12643,"Mystery, Thriller, Drama"
False,/6GF9uJs7AnbcJvyfoZyjZv063Oo.jpg,"10751, 16, 18, 12",8587,en,The Lion King,"Young lion prince Simba, eager to one day become king of the Pride Lands, grows up under the watchful eye of his father Mufasa; all the while his villainous uncle Scar conspires to take the throne for himself. Amid betrayal and tragedy, Simba must confront his past and find his rightful place in the Circle of Life.",17.0944,/sKCr78MXSLixwmZ8DyJLrpMsd15.jpg,1994-06-15,The Lion King,False,8.252,19461,"Family, Animation, Drama, Adventure"
False,/1SpoDvFVEkKsSK89AQDqZLtWxNH.jpg,27,27400,es,Los Ritos Sexuales del Diablo,"A young woman travels with her partner to England on the unexpected death of her brother. Staying with her sister-in-law, she finds her companion soon drawn into a satanic cult based in the house whose rites seem to centre somewhat on large-scale sexual congress.",17.0105,/7bxsUfuQ42OxpjAjtWs7u9gc1Wf.jpg,1982-04-03,Black Candles,False,6.183,142,Horror
False,/tuDhEdza074bA497bO9WFEPs6O6.jpg,"12, 10751, 14",411,en,"The Chronicles of Narnia: The Lion, the Witch and the Wardrobe","Siblings Lucy, Edmund, Susan and Peter step through a magical wardrobe and find the land of Narnia. There, they discover a charming, once peaceful kingdom that has been plunged into eternal winter by the evil White Witch, Jadis. Aided by the wise and magnificent lion, Aslan, the children lead Narnia into a spectacular, climactic battle to be free of the Witch's glacial powers forever.",16.9806,/iREd0rNCjYdf5Ar0vfaW32yrkm.jpg,2005-12-07,"The Chronicles of Narnia: The Lion, the Witch and the Wardrobe",False,7.135,11369,"Adventure, Family, Fantasy"
False,,"18, 10749, 10402",1643729,pa,Ishqa'n De Lekhe,"Starring the sensational Gurnam Bhullar alongside the stunning Isha Malviya, this Punjabi cinema is crafted for every soul that has ever loved deeply. Directed by the talented Manvir Brar, Ishqa'n De Lekhe is set to redefine Punjabi romance on the big screen.",16.9577,/g3EpAFlNGqkYxkw8cHOANzi8u1.jpg,2026-03-06,Ishqa'n De Lekhe,False,0.0,0,"Drama, Romance, Music"
False,/elWuOHGHjseM0TnW3gU604rxLXV.jpg,"27, 9648",95008,en,The House That Vanished,"A young model, Valerie, and her petty thief boyfriend witness a murder in a backwoods manor. Valerie escapes, but soon finds herself being stalked by the killer.",16.9562,/34LrQxQMDUboPHwEuy2lTL6R8BQ.jpg,1973-12-07,The House That Vanished,False,4.9,18,"Horror, Mystery"
False,/wzC2p07FfCsOTLo2aUeGBUQhsHX.jpg,"28, 878, 53",10061,en,Escape from L.A.,Into the 9.6-quaked Los Angeles of 2013 comes Snake Plissken. His job: wade through L.A.'s ruined landmarks to retrieve a doomsday device.,16.9131,/3L9lL2eUsmLNNfENPwNOc82Hzpw.jpg,1996-08-09,Escape from L.A.,False,5.9,1569,"Action, Science Fiction, Thriller"
False,/c4sKPgyJj19GBCAvUjpPRiiA45.jpg,"35, 53",276839,en,Home Sweet Hell,"Don Champagne seems to have it all, but when his wife, Mona, learns of his affair with a pretty new salesgirl, she will stop at nothing to maintain their storybook life.",16.8567,/a0S1ou77hJ8RAxGkpyZGbfUr2SG.jpg,2015-03-13,Home Sweet Hell,False,5.422,494,"Comedy, Thriller"
False,/2w4xG178RpB4MDAIfTkqAuSJzec.jpg,"12, 28, 878",11,en,Star Wars,Princess Leia is captured and held hostage by the evil Imperial forces in their effort to take over the galactic Empire. Venturesome Luke Skywalker and dashing captain Han Solo team together with the loveable robot duo R2-D2 and C-3PO to rescue the beautiful princess and restore peace and justice in the Empire.,16.8493,/6FfCtAuVAW8XJjZ7eWeLibRLWTw.jpg,1977-05-25,Star Wars,False,8.201,22037,"Adventure, Action, Science Fiction"
False,/3V4kLQg0kSqPLctI5ziYWabAZYF.jpg,"28, 878, 12",912649,en,Venom: The Last Dance,"Eddie and Venom are on the run. Hunted by both of their worlds and with the net closing in, the duo are forced into a devastating decision that will bring the curtains down on Venom and Eddie's last dance.",16.8478,/1RaSkWakWBxxYOWRrqmwo2my5zg.jpg,2024-10-22,Venom: The Last Dance,False,6.665,4049,"Action, Science Fiction, Adventure"
False,/e39gR8o0Z6voMud728VjATP6gaI.jpg,"35, 18",1053024,it,La lunga corsa,"As the son of two inmates Hyacinth was always more at home in prison than in the outside world, until he took part in a foot race that promised to change his life.",16.83,/bs4t919wSEakghynTgxZwYBgpjw.jpg,2023-08-24,Jailbird,False,5.5,12,"Comedy, Drama"
False,/geQgwdQBNYOVoUKK2oBB0ILilIa.jpg,"878, 53",475961,en,Curvature,"Helen tries to cope with the recent death of her husband, a scientist who killed himself right when he was on the verge of successfully completing the invention of a time machine. One day, she receives a phone call, and a voice suspiciously resembling her own voice warns her that she’s in danger. Is it possible Helen has time travelled? And what could have led her to do something like that?",16.8138,/wQ1CwqwGCNZHAkMC0HyEoWYJwzI.jpg,2017-10-08,Curvature,False,4.938,80,"Science Fiction, Thriller"
False,/mbnJQMGJcXEp26Lfzjz34Cikvuc.jpg,99,448982,en,King Cohen: The Wild World of Filmmaker Larry Cohen,"A feature-length documentary focusing on the acclaimed work and eclectic career of maverick filmmaker Larry Cohen, writer-director of ""Black Caesar,"" ""It's Alive,"" ""God Told Me To,"" ""Q,"" ""The Stuff,"" and many more.",16.7687,/7wMNzJcbidOX84YZMtS6ToqRE72.jpg,2018-07-07,King Cohen: The Wild World of Filmmaker Larry Cohen,False,6.381,21,Documentary
False,/hofnlIyF6bePkgQOpcuRWLvzf15.jpg,"16, 10751, 14",14836,en,Coraline,"Wandering her rambling old house in her boring new town, 11-year-old Coraline discovers a hidden door to a strangely idealized version of her life. In order to stay in the fantasy, she must make a frighteningly real sacrifice.",16.7166,/4jeFXQYytChdZYE9JYO7Un87IlW.jpg,2009-02-05,Coraline,False,7.9,8818,"Animation, Family, Fantasy"
False,/ukPu5xYOBAnh5H46uK4aQOirW2b.jpg,"10751, 35, 12, 16, 878",1022787,en,Elio,"Elio, a space fanatic with an active imagination, finds himself on a cosmic misadventure where he must form new bonds with eccentric alien lifeforms, navigate a crisis of intergalactic proportions and somehow discover who he is truly meant to be.",16.6998,/7z8jDiTZZco9moIKpTUImFtTy7o.jpg,2025-06-18,Elio,False,6.9,890,"Family, Comedy, Adventure, Animation, Science Fiction"
False,/cKvDv2LpwVEqbdXWoQl4XgGN6le.jpg,"28, 878, 12",1726,en,Iron Man,"After being held captive in an Afghan cave, billionaire engineer Tony Stark creates a unique weaponized suit of armor to fight evil.",16.6994,/78lPtwv72eTNqFW9COBYI0dWDJa.jpg,2008-04-30,Iron Man,False,7.656,27846,"Action, Science Fiction, Adventure"
False,/o3i6AfTcWAuNvzAUV3q5lOmi6Gx.jpg,"16, 10751, 12, 18, 35",150540,en,Inside Out,"When 11-year-old Riley moves to a new city, her Emotions team up to help her through the transition. Joy, Fear, Anger, Disgust and Sadness work together, but when Joy and Sadness get lost, they must journey through unfamiliar places to get back home.",16.6249,/2H1TmgdfNtsKlU9jKdeNyYL5y8T.jpg,2015-06-17,Inside Out,False,7.91,23240,"Animation, Family, Adventure, Drama, Comedy"
False,/u5NWHVhZ6HWc1fXnqn82cMar5St.jpg,18,1241983,en,Train Dreams,A logger leads a life of quiet grace as he experiences love and loss during an era of monumental change in early 20th-century America.,16.5731,/wfzYOVdafdbD1d3SxNqiBtV2Yhx.jpg,2025-11-05,Train Dreams,False,7.333,819,Drama
False,/5uiaW1yJPhGPdCXqGIkC5zeRfDg.jpg,"9648, 53, 18",10866,en,Joy Ride,"Three young people on a road trip from Colorado to New Jersey talk to a trucker on their CB radio, then must escape when he turns out to be a psychotic killer.",16.5551,/1LVGjf1QWgkNNPQssZtuT1GYKoP.jpg,2001-10-05,Joy Ride,False,6.529,1314,"Mystery, Thriller, Drama"
False,/jBwq9uIOSncXGfRxAq63tuDnfBv.jpg,"27, 9648, 53",27439,it,La bestia uccide a sangue freddo,A masked killer stalks an institution for mentally disturbed rich women.,16.5531,/lgl10TDsWLY0rEDVTSHxWus2I35.jpg,1971-08-02,Slaughter Hotel,False,4.783,76,"Horror, Mystery, Thriller"
False,/ze6Mx4QE5mQVXRYmG2flncqqle4.jpg,"12, 14",767,en,Harry Potter and the Half-Blood Prince,"As Lord Voldemort tightens his grip on both the Muggle and wizarding worlds, Hogwarts is no longer a safe haven. Harry suspects perils may even lie within the castle, but Dumbledore is more intent upon preparing him for the final battle fast approaching. Together they work to find the key to unlock Voldemorts defenses and to this end, Dumbledore recruits his old friend and colleague Horace Slughorn, whom he believes holds crucial information. Even as the decisive showdown looms, romance blossoms for Harry, Ron, Hermione and their classmates. Love is in the air, but danger lies ahead and Hogwarts may never be the same again.",16.5417,/z7uo9zmQdQwU5ZJHFpv2Upl30i1.jpg,2009-07-15,Harry Potter and the Half-Blood Prince,False,7.681,20564,"Adventure, Fantasy"
False,/tcBX2dtkNozZ0uDLVaxXrE6rqyN.jpg,27,1038392,en,The Conjuring: Last Rites,Paranormal investigators Ed and Lorraine Warren take on one last terrifying case involving mysterious entities they must confront.,16.5361,/byWgphT74ClOVa8EOGzYDkl8DVL.jpg,2025-09-03,The Conjuring: Last Rites,False,6.9,1688,Horror
False,/oiFE33B46FBLv72vRnJlgVA5zKU.jpg,9648,50637,en,Alias Boston Blackie,"It is the Christmas Holidays and reformed thief, Boston Blackie goes to Castle Theater to pick up players who will perform for prisoners that are still in prison. He takes a girl with him who has a brother already in prison. She has visited the prison twice in the month, so is not suppose to visit again. However when the group is completed the girl is included as well as Inspector Farrady. One of the clowns in the show is kidnapped and replaced by a con who wants to get even with two ex-partners. Boston Blackie figures out that a con has replaced one of his clowns but is unable to stop him. Blackie's clothes are stolen and a murder is committed. Of course, the Inspector immediately suspects Blackie of being involved. Now it is Blackie's job to find the killer, exonerate himself and help the girl free her brother.",16.5253,/3E2eV6QzBerr0sn6cpNAaRv3eRb.jpg,1942-04-02,Alias Boston Blackie,False,5.458,12,Mystery
False,/vuUDwAi9UgLyNN9xZLtKTaLQWnl.jpg,"35, 80, 53",639988,ko,어쩔수가없다,"After being laid off and humiliated by a ruthless job market, a veteran paper mill manager descends into violence in a desperate bid to reclaim his dignity.",16.5248,/sBpxTGLzKnvPSVtL5yQYpSxvKEb.jpg,2025-09-24,No Other Choice,False,7.556,806,"Comedy, Crime, Thriller"
False,/weAYfu6FfrNxEDJ3xH1XpgQcqUv.jpg,"14, 18, 10749",8966,en,Twilight,"When Bella Swan moves to a small town in the Pacific Northwest, she falls in love with Edward Cullen, a mysterious classmate who reveals himself to be a 108-year-old vampire. Despite Edward's repeated cautions, Bella can't stay away from him, a fatal move that endangers her own life.",16.5028,/3Gkb6jm6962ADUPaCBqzz9CTbn9.jpg,2008-11-20,Twilight,False,6.28,14258,"Fantasy, Drama, Romance"
False,/hlfu6g0h0D65SjkVhQBU20zePTl.jpg,"28, 12, 14, 16",1357633,ja,俺だけレベルアップな件 -ReAwakening-,"Over a decade after 'gates' connecting worlds appeared, awakening 'hunters' with superpowers, weakest hunter Sung Jinwoo encounters a double dungeon and accepts a mysterious quest, becoming the only one able to level up, changing his fate. A catch-up recap of the first season coupled with an exclusive sneak peek of the first two episodes of the highly anticipated second season in one momentous theatrical fan experience.",16.4965,/dblIFen0bNZAq8icJXHwrjfymDW.jpg,2024-11-26,Solo Leveling -ReAwakening-,False,7.09,261,"Action, Adventure, Fantasy, Animation"
False,/2nwhxEyefcIFKwOrSigiamoIzu2.jpg,"28, 53, 18",1119878,en,Ice Road: Vengeance,"Big rig ice road driver Mike McCann travels to Nepal to scatter his late brother’s ashes on Mt. Everest. While on a packed tour bus traversing the deadly 12,000 ft. terrain of the infamous Road to the Sky, McCann and his mountain guide encounter a group of mercenaries and must fight to save themselves, the busload of innocent travelers, and the local villagers’ homeland.",16.4639,/cQN9rZj06rXMVkk76UF1DfBAico.jpg,2025-06-27,Ice Road: Vengeance,False,6.2,589,"Action, Thriller, Drama"
False,/yCg9mQpR3nVmX9ku3ObCAIISb5g.jpg,"10749, 18",1495694,en,Beauty from Pain,"After a devastating heartbreak, an aspiring musician escapes to Australia. She agrees to a no-strings romance with a billionaire winemaker, but when she falls in love she must choose to walk away or risk her heart on a man afraid to love.",16.4467,/mJtBKvHQaFzgp0N6JFskSvjbTar.jpg,2025-12-18,Beauty from Pain,False,7.269,13,"Romance, Drama"
False,/7iUDfakacY1HpajP1DtHrCuDB95.jpg,"16, 35, 10751",863,en,Toy Story 2,"Andy heads off to Cowboy Camp, leaving his toys to their own devices. Things shift into high gear when an obsessive toy collector named Al McWhiggen, owner of Al's Toy Barn kidnaps Woody. Andy's toys mount a daring rescue mission, Buzz Lightyear meets his match and Woody has to decide where he and his heart truly belong.",16.4235,/4rbcp3ng8n1MKHjpeqW0L7Fnpzz.jpg,1999-10-30,Toy Story 2,False,7.604,14718,"Animation, Comedy, Family"
False,/eQsellX1IeGaIjv1w4JBzoOrvmf.jpg,"35, 18, 10752",354287,en,War Machine,A rock star general bent on winning the “impossible” war in Afghanistan takes us inside the complex machinery of modern war. Inspired by the true story of General Stanley McChrystal.,16.3921,/bU2Q2rCH5VFrJNKSyx6wSmQZFsX.jpg,2017-05-26,War Machine,False,5.616,1216,"Comedy, Drama, War"
False,/vbk5CfaAHOjQPSAcYm6AoRRz2Af.jpg,"12, 14",673,en,Harry Potter and the Prisoner of Azkaban,"Year three at Hogwarts means new fun and challenges as Harry learns the delicate art of approaching a Hippogriff, transforming shape-shifting Boggarts into hilarity and even turning back time. But the term also brings danger: soul-sucking Dementors hover over the school, an ally of the accursed He-Who-Cannot-Be-Named lurks within the castle walls, and fearsome wizard Sirius Black escapes Azkaban. And Harry will confront them all.",16.379,/aWxwnYoe8p2d2fcxOqtvAtJ72Rw.jpg,2004-05-31,Harry Potter and the Prisoner of Azkaban,False,8.008,22915,"Adventure, Fantasy"
False,/wbDkvShcrveXNFsgyujY4kdurVa.jpg,"35, 10749",957119,en,Sidelined: The QB and Me,"Dallas, a burdened but headstrong dancer, is determined to get into the best dance school in the country—her late mother’s alma mater. However, that dream is suddenly derailed when the cheeky yet secretly grieving football star, Drayton, crashes into her life with a unique story of his own. Will the two of them be able to grow into their dreams together, or will their dreams be sidelined?",16.3636,/mSL6truNrWP1Bn9ng1rN0SkMI4f.jpg,2025-02-06,Sidelined: The QB and Me,False,6.085,195,"Comedy, Romance"
False,/cWczNud8Y8i8ab0Z4bxos4myWYO.jpg,"16, 10751, 12",38757,en,Tangled,"Feisty teenager Rapunzel, who has long and magical hair, wants to go and see sky lanterns on her eighteenth birthday, but she's bound to a tower by her overprotective mother. She strikes a deal with Flynn Rider, a charming wanted thief, and the duo set off on an action-packed escapade.",16.3393,/ym7Kst6a4uodryxqbGOxmewF235.jpg,2010-11-24,Tangled,False,7.61,12237,"Animation, Family, Adventure"
False,/gpJr8wRED8BpBVaxM0eODQEBNwC.jpg,"878, 28, 35",650524,cn,尋秦記,"In the Qin Dynasty, time-traveller Hong Siu-lung has lived in seclusion with his family for twenty years. Yet every step he takes remains under the watchful eye of his former disciple, now the Qin Emperor. On the brink of ultimate power after conquering the six warring states, the emperor is suddenly ambushed by a mysterious team wielding advanced weapons clearly originating from Hong’s time. Drawn together by fate again, Hong and Qin Emperor are forced to confront the long-buried conflict between them, because the future now depends on how they settle their past.",16.3265,/h3OUaPfCaFmzwB2eMHik50RsXlP.jpg,2025-12-31,Back to the Past,False,5.957,23,"Science Fiction, Action, Comedy"
False,/rj58WQ9ImI0mYDptXdM7euX1Wjt.jpg,"16, 10751, 12, 14",109445,en,Frozen,"Young princess Anna of Arendelle dreams about finding true love at her sister Elsa’s coronation. Fate takes her on a dangerous journey in an attempt to end the eternal winter that has fallen over the kingdom. She's accompanied by ice delivery man Kristoff, his reindeer Sven, and snowman Olaf. On an adventure where she will find out what friendship, courage, family, and true love really means.",16.2787,/kgwjIb2JDHRhNk13lmSxiClFjVk.jpg,2013-11-20,Frozen,False,7.249,17411,"Animation, Family, Adventure, Fantasy"
False,/3pKIcv6KhUE35jsKnv3MylQ3OT2.jpg,"80, 28, 878",198184,en,Chappie,"Every child comes into the world full of promise, and none more so than Chappie: he is gifted, special, a prodigy. Like any child, Chappie will come under the influence of his surroundings—some good, some bad—and he will rely on his heart and soul to find his way in the world and become his own man. But there's one thing that makes Chappie different from any one else: he is a robot.",16.2531,/uuDUpzlMFomdSfNWlpEPS9nVZWV.jpg,2015-03-04,Chappie,False,6.787,8360,"Crime, Action, Science Fiction"
False,/snohB6SbZB9SRW1qdPIPJuvHrBD.jpg,14,92645,en,Grimm's Snow White,"When the King is killed by ferocious reptile beasts, his Queen takes control of the kingdom. She tries to kill her beautiful stepdaughter SNOW, but she escapes into the enchanted forest...",16.2337,/6QTA9ekUmBqRqRsZV8QWMaB89Zj.jpg,2012-03-13,Grimm's Snow White,False,5.536,69,Fantasy
False,/iTqw8QXIdMcPa20vmBCDpbdIReG.jpg,"53, 18, 10749",1236197,es,Juegos de Seducción,"Sebastián, a charismatic con artist who seduces women to steal their money, puts his retirement plans on hold after the sudden appearance of Carolina, an enigmatic woman who will expose him to the greatest danger of his career.",16.2327,/uOQCP7RB97H2r8QELb4jaunWzNb.jpg,2025-07-18,Follow,False,7.778,36,"Thriller, Drama, Romance"
False,/8zLS8p1tRyWFLRFfmgQq0j5WE6z.jpg,"12, 28, 14",564,en,The Mummy,Dashing legionnaire Rick O'Connell stumbles upon the hidden ruins of Hamunaptra while in the midst of a battle to claim the area in 1920s Egypt. It has been over three thousand years since former High Priest Imhotep suffered a fate worse than death as a punishment for a forbidden love—along with a curse that guarantees eternal doom upon the world if he is ever awoken.,16.2288,/yhIsVvcUm7QxzLfT6HW2wLf5ajY.jpg,1999-04-16,The Mummy,False,6.962,9811,"Adventure, Action, Fantasy"
False,/kWYfW2Re0rUDE6IHhy4CRuKWeFr.jpg,"12, 14, 28",121,en,The Lord of the Rings: The Two Towers,"Frodo Baggins and the other members of the Fellowship continue on their sacred quest to destroy the One Ring--but on separate paths. Their destinies lie at two towers--Orthanc Tower in Isengard, where the corrupt wizard Saruman awaits, and Sauron's fortress at Barad-dur, deep within the dark lands of Mordor. Frodo and Sam are trekking to Mordor to destroy the One Ring of Power while Gimli, Legolas and Aragorn search for the orc-captured Merry and Pippin. All along, nefarious wizard Saruman awaits the Fellowship members at the Orthanc Tower in Isengard.",16.2158,/5VTN0pR8gcqV3EPUHHfMGnJYN9L.jpg,2002-12-18,The Lord of the Rings: The Two Towers,False,8.413,23549,"Adventure, Fantasy, Action"
False,/44immBwzhDVyjn87b3x3l9mlhAD.jpg,"27, 53, 80",934433,en,Scream VI,"Following the latest Ghostface killings, the four survivors leave Woodsboro behind and start a fresh chapter.",16.2131,/wDWwtvkRRlgTiUr6TyLSMX8FCuZ.jpg,2023-03-08,Scream VI,False,7.0,3083,"Horror, Thriller, Crime"
False,/wWfazEPvQCUrSOnaLOClATQAWD4.jpg,"18, 27",25319,en,The Masque of the Red Death,"A European prince terrorizes the local peasantry while using his castle as a refuge against the ""Red Death"" plague that stalks the land.",16.211,/sSYceyGZrWskWDsn3MHtipJ1wFM.jpg,1964-06-24,The Masque of the Red Death,False,6.585,354,"Drama, Horror"
