adult,backdrop_path,genre_ids,id,title,original_language,original_title,overview,popularity,poster_path,release_date,softcore,video,vote_average,vote_count,genre_names
False,/uMBByiSDpgFwWVegAtwwnuzvogJ.jpg,"14, 18, 10749",297,Meet Joe Black,en,Meet Joe Black,"Bill Parrish has it all - success, wealth and power. Days before his 65th birthday, he receives a visit from a mysterious stranger, Joe Black, who soon reveals himself as Death. In exchange for extra time, Bill agrees to serve as Joe's earthly guide. But will he regret his choice when Joe unexpectedly falls in love with Bill's beautiful daughter Susan?",12.5253,/fDPAjvfPMomkKF7cMRmL5Anak61.jpg,1998-11-12,False,False,7.358,5701,"Fantasy, Drama, Romance"
False,/vyrCniZsrXZAW08eECKIp1BMLPh.jpg,"35, 18, 10749",50646,"Crazy, Stupid, Love.",en,"Crazy, Stupid, Love.","Cal Weaver is living the American dream. He has a good job, a beautiful house, great children and a beautiful wife, named Emily. Cal's seemingly perfect life unravels, however, when he learns that Emily has been unfaithful and wants a divorce. Over 40 and suddenly single, Cal is adrift in the fickle world of dating. Enter, Jacob Palmer, a self-styled player who takes Cal under his wing and teaches him how to be a hit with the ladies.",12.5198,/p4RafgAPk558muOjnBMHhMArjS2.jpg,2011-07-29,False,False,7.271,9217,"Comedy, Drama, Romance"
False,/jOzrELAzFxtMx2I4uDGHOotdfsS.jpg,"12, 28, 878",181812,Star Wars: The Rise of Skywalker,en,Star Wars: The Rise of Skywalker,"The surviving Resistance faces the First Order once again as the journey of Rey, Finn and Poe Dameron continues. With the power and knowledge of generations behind them, the final battle begins.",12.5162,/db32LaOibwEliAmSL2jjDF6oDdj.jpg,2019-12-18,False,False,6.273,10758,"Adventure, Action, Science Fiction"
False,/fYnEbgoNCxW9kL0IgOgtJb9JTBU.jpg,"27, 14",426063,Nosferatu,en,Nosferatu,"A gothic tale of obsession between a haunted young woman and the terrifying vampire infatuated with her, causing untold horror in its wake.",12.5031,/5qGIxdEO841C0tdY8vOdLoRVrr0.jpg,2024-12-25,False,False,6.707,3591,"Horror, Fantasy"
False,/sTQNRqLbfCXolrb5CizAW1dj528.jpg,"878, 14, 28",246655,X-Men: Apocalypse,en,X-Men: Apocalypse,"After the re-emergence of the world's first mutant, world-destroyer Apocalypse, the X-Men must unite to defeat his extinction level plan.",12.4944,/2mtQwJKVKQrZgTz49Dizb25eOQQ.jpg,2016-05-18,False,False,6.521,13699,"Science Fiction, Fantasy, Action"
False,/7Wev9JMo6R5XAfz2KDvXb7oPMmy.jpg,"9648, 53",77,Memento,en,Memento,"Leonard Shelby is tracking down the man who raped and murdered his wife. The difficulty of locating his wife's killer, however, is compounded by the fact that he suffers from a rare, untreatable form of short-term memory loss. Although he can recall details of life before his accident, Leonard cannot remember what happened fifteen minutes ago, where he's going, or why.",12.4928,/fKTPH2WvH8nHTXeBYBVhawtRqtR.jpg,2000-10-11,False,False,8.177,16115,"Mystery, Thriller"
False,/3P52oz9HPQWxcwHOwxtyrVV1LKi.jpg,"28, 35, 12",383498,Deadpool 2,en,Deadpool 2,Wisecracking mercenary Deadpool battles the evil and powerful Cable and other bad guys to save a boy's life.,12.4782,/to0spRl1CMDvyUbOnbb4fTk3VAd.jpg,2018-05-15,False,False,7.49,19117,"Action, Comedy, Adventure"
False,/jwt159hXWA9Q5xpBo8hWb3zwLi7.jpg,"80, 53",500,Reservoir Dogs,en,Reservoir Dogs,"A botched robbery indicates a police informant, and the pressure mounts in the aftermath at a warehouse. Crime begets violence as the survivors -- veteran Mr. White, newcomer Mr. Orange, psychopathic parolee Mr. Blonde, bickering weasel Mr. Pink and Nice Guy Eddie -- unravel.",12.4474,/xi8Iu6qyTfyZVDVy60raIOYJJmk.jpg,1992-09-02,False,False,8.115,15363,"Crime, Thriller"
False,/qbbx3NDw6FrtQSrKdxn9n72xJzO.jpg,"53, 80, 18",1630433,The Red Line,th,เส้นตาย สายลวง,"Three women fall prey to a ruthless phone scam. To settle the score, they'll take on the criminal network that stole their money — and their dignity.",12.4451,/q3ROA6OqVA9rWSsC2DzdkPQvxWW.jpg,2026-03-22,False,False,6.885,52,"Thriller, Crime, Drama"
False,/sKvQUSyqsFq8e1ts6oo3Xp3dPH2.jpg,"16, 12, 35, 14, 10751",585511,Luck,en,Luck,"Suddenly finding herself in the never-before-seen Land of Luck, the unluckiest person in the world must unite with the magical creatures there to turn her luck around.",12.4351,/1HOYvwGFioUFL58UVvDRG6beEDm.jpg,2022-08-05,False,False,7.726,1933,"Animation, Adventure, Comedy, Fantasy, Family"
False,/liiPM38H376CDqxJ7VeQjan5YUy.jpg,"16, 35, 12, 10751",57800,Ice Age: Continental Drift,en,Ice Age: Continental Drift,"Manny, Diego, and Sid embark upon another adventure after their continent is set adrift. Using an iceberg as a ship, they encounter sea creatures and battle pirates as they explore a new world.",12.4316,/dfp1BZF7FxbBUyzHvMOI9t8NWDD.jpg,2012-06-27,False,False,6.383,8062,"Animation, Comedy, Adventure, Family"
False,/gLXibzLQ4qegvjdqDC0f8yTij2P.jpg,"9648, 53, 28",1310568,Murder at the Embassy,en,Murder at the Embassy,"1934. Private detective Miranda Green investigates a murder perpetrated in the British Embassy in Cairo, where a top secret document was stolen, risking to jeopardize both Buckingham Palace and the peace of the world. All those present in this closed place are suspected: the American photographer, the English student, the American actress, the Egyptian security guard, the ambassador interpreter, the Egyptian gardener and - why not? — the Ambassador himself. But who would have expected that a small group of Nazis would be behind a plot, risking to jeopardize both Buckingham Palace and the peace of the world?",12.4095,/3DBmBItPdy0A2ol59jgHhS54Lua.jpg,2025-11-14,False,False,5.965,43,"Mystery, Thriller, Action"
False,/gCIB3DdK00DyfwosVGf7pnFFdK3.jpg,"28, 12, 53",399402,Hunter Killer,en,Hunter Killer,"Captain Glass of the USS Arkansas discovers that a coup d'état is taking place in Russia, so he and his crew join an elite group working on the ground to prevent a war.",12.4042,/ng7ukqGaSHOuJZ4GwLJP6AH9ixc.jpg,2018-10-19,False,False,6.9,2381,"Action, Adventure, Thriller"
False,/hUJKuKdF7aBgsCYQdDou3SJOC8t.jpg,"18, 10749",1357449,Ídolos,es,Ídolos,"A fiery young motorcycle racer throws away his shot at the junior championship in a reckless crash, only to receive a surprise offer from a top Moto2 team that gives him a chance at redemption. But to claim it, he must train under his estranged father, a disgraced former world champion haunted by a tragic past. As the father and son battle personal demons, media scrutiny, and a ruthless racing circuit, their fractured bond is pushed to the limit by ambition, love, and the unforgiving speed of the sport. With a wildcard entry into MotoGP on the line, they must confront the wreckage of their relationship to seize a future—on and off the track.",12.3915,/j2gYxk9EQXh2hz1jNZQOe9WOUXU.jpg,2026-01-23,False,False,6.95,20,"Drama, Romance"
False,/tCsYQTkQx7vknDmTw666K1XxAdx.jpg,"28, 18, 53, 80",348893,Boyka: Undisputed IV,en,Boyka: Undisputed IV,"In the fourth installment of the fighting franchise, Boyka is shooting for the big leagues when an accidental death in the ring makes him question everything he stands for. When he finds out the wife of the man he accidentally killed is in trouble, Boyka offers to fight in a series of impossible battles to free her from a life of servitude.",12.3885,/7QGdIJWWTkPhVjpQ0zA6z69khod.jpg,2016-08-01,False,False,7.176,1440,"Action, Drama, Thriller, Crime"
False,/wz1eLrNxK77xAY7JYi4iYrtiMEd.jpg,"99, 10402",78192,Michael Jackson: The Life of an Icon,en,Michael Jackson: The Life of an Icon,"See Michael Jackson, one of the most recognizable and popular entertainers of all time, like never before in the feature-length tribute Michael Jackson: The Life of an Icon. Known to millions of fans worldwide for his record-breaking albums, groundbreaking music videos, mesmerizing dance moves and humanitarian efforts, his true story has never really been told...until now. This unprecedented look into the King of Pop's fascinating life includes all-new interviews with his mother Katherine Jackson as well as siblings Tito and Rebbie Jackson, family, friends and music legends such as Smokey Robinson, Dionne Warwick and many more.",12.3802,/tOCYV9JCXXFtb7YehKXJBMKI4aD.jpg,2011-11-02,False,False,7.9,142,"Documentary, Music"
False,/3czpqXzFy5UcNuD1AubecRLWkwD.jpg,"28, 12, 878",127585,X-Men: Days of Future Past,en,X-Men: Days of Future Past,The ultimate X-Men ensemble fights a war for the survival of the species across two time periods as they join forces with their younger selves in an epic battle that must change the past – to save our future.,12.3591,/tYfijzolzgoMOtegh1Y7j2Enorg.jpg,2014-05-15,False,False,7.529,16170,"Action, Adventure, Science Fiction"
False,/aC6wW62V6b0csr5iUnbOjYAqfhg.jpg,"18, 53, 9648",345,Eyes Wide Shut,en,Eyes Wide Shut,"After Dr. Bill Harford's wife, Alice, admits to having sexual fantasies about a man she met, Bill becomes obsessed with having a sexual encounter. He discovers an underground sexual group and attends one of their meetings -- and quickly discovers that he is in over his head.",12.3503,/knEIz1eNGl5MQDbrEAVWA7iRqF9.jpg,1999-07-16,False,False,7.487,6969,"Drama, Thriller, Mystery"
False,/fqv8v6AycXKsivp1T5yKtLbGXce.jpg,"878, 12, 28",653346,Kingdom of the Planet of the Apes,en,Kingdom of the Planet of the Apes,"Several generations following Caesar's reign, apes – now the dominant species – live harmoniously while humans have been reduced to living in the shadows. As a new tyrannical ape leader builds his empire, one young ape undertakes a harrowing journey that will cause him to question all he's known about the past and to make choices that will define a future for apes and humans alike.",12.3489,/gKkl37BQuKTanygYQG1pyYgLVgf.jpg,2024-05-08,False,False,7.055,4204,"Science Fiction, Adventure, Action"
False,/ok4ot3YbfDYZcINXf91JUfq3maB.jpg,"27, 9648, 80",176,Saw,en,Saw,"Two men wake up to find themselves shackled in a grimy, abandoned bathroom. As they struggle to comprehend their predicament, they discover a disturbing tape left behind by the sadistic mastermind known as Jigsaw. With a chilling voice and cryptic instructions, Jigsaw informs them that they must partake in a gruesome game in order to secure their freedom.",12.3328,/rLNSOudrayDBo1uqXjrhxcjODIC.jpg,2004-10-01,False,False,7.42,9986,"Horror, Mystery, Crime"
False,/hXsy4XCCHrUk81XoRhcooyWejao.jpg,"35, 80",115,The Big Lebowski,en,The Big Lebowski,"Jeffrey 'The Dude' Lebowski, a Los Angeles slacker who only wants to bowl and drink White Russians, is mistaken for another Jeffrey Lebowski, a wheelchair-bound millionaire, and finds himself dragged into a strange series of events involving nihilists, adult film producers, ferrets, errant toes, and large sums of money.",12.3318,/3bv6WAp6BSxxYvB5ozKFUYuRA8C.jpg,1998-03-06,False,False,7.84,12095,"Comedy, Crime"
False,/aD7FXrm2GErTmzrIFBntPyhAqS9.jpg,"53, 28",1087891,The Amateur,en,The Amateur,"After his life is turned upside down when his wife is killed in a London terrorist attack, a brilliant but introverted CIA decoder takes matters into his own hands when his supervisors refuse to take action.",12.329,/SNEoUInCa5fAgwuEBMIMBGvkkh.jpg,2025-04-09,False,False,6.951,1560,"Thriller, Action"
False,/4NxVLxuoQDPz889TG1njH4L7cYB.jpg,"12, 16, 35, 10751, 14",11688,The Emperor's New Groove,en,The Emperor's New Groove,"When the self‑absorbed Emperor Kuzco is accidentally transformed into a llama, he must rely on a humble villager to survive the jungle and reclaim his throne.",12.3247,/wwbgkXQBEKtnyIJapk6gUgWkVw8.jpg,2000-12-15,False,False,7.6,7245,"Adventure, Animation, Comedy, Family, Fantasy"
False,/W034dd7w2malON26KWyZm4y37W.jpg,"12, 28, 14",1735,The Mummy: Tomb of the Dragon Emperor,en,The Mummy: Tomb of the Dragon Emperor,"Archaeologist Rick O'Connell travels to China, pitting him against an emperor from the 2,000-year-old Han dynasty who's returned from the dead to pursue a quest for world domination. This time, O'Connell enlists the help of his wife and son to quash the so-called 'Dragon Emperor' and his abuse of supernatural power.",12.3109,/A3acM1lX5PNWQa6r5qeMAJOxbnT.jpg,2008-07-01,False,False,5.515,4778,"Adventure, Action, Fantasy"
False,/69EFgWWPFWbRNHmQgYdSnyJ94Ge.jpg,"28, 12, 878",49521,Man of Steel,en,Man of Steel,"A young boy learns that he has extraordinary powers and is not of this earth. As a young man, he journeys to discover where he came from and what he was sent here to do. But the hero in him must emerge if he is to save the world from annihilation and become the symbol of hope for all mankind.",12.3061,/cB46TSg3kGjq2eVy5kVUhlpUa1H.jpg,2013-06-12,False,False,6.642,16096,"Action, Adventure, Science Fiction"
False,/8Mq428bLVcBixhsKP4dAyEL1Ycu.jpg,"35, 80, 9648, 53",5236,Kiss Kiss Bang Bang,en,Kiss Kiss Bang Bang,A petty thief posing as an actor is brought to Los Angeles for an unlikely audition and finds himself in the middle of a murder investigation along with his high school dream girl and a detective who's been training him for his upcoming role...,12.2714,/aWfjIkpENFX6Uw82pET7EQ6jnrd.jpg,2005-09-14,False,False,7.16,2984,"Comedy, Crime, Mystery, Thriller"
False,/yJyZRrXaYUjhOrJGga8awbw4Rud.jpg,"12, 14, 10749, 10751",420817,Aladdin,en,Aladdin,A kindhearted street urchin named Aladdin embarks on a magical adventure after finding a lamp that releases a wisecracking genie while a power-hungry Grand Vizier vies for the same lamp that has the power to make their deepest wishes come true.,12.2634,/ykUEbfpkf8d0w49pHh0AD2KrT52.jpg,2019-05-22,False,False,7.085,10571,"Adventure, Fantasy, Romance, Family"
False,/fbxZeJEcyf76oEQIGmotlclwmiH.jpg,"16, 10751, 12, 878",15512,Monsters vs Aliens,en,Monsters vs Aliens,"When Susan Murphy is unwittingly clobbered by a meteor full of outer space gunk on her wedding day, she mysteriously grows to 49-feet-11-inches. The military jumps into action and captures Susan, secreting her away to a covert government compound. She is renamed Ginormica and placed in confinement with a ragtag group of Monsters...",12.2543,/hpHarddVj34j53T7NsoUGdKj4mP.jpg,2009-03-19,False,False,6.243,4929,"Animation, Family, Adventure, Science Fiction"
False,/rcEDPOOOUTLFxLLQJggfLffbofe.jpg,"16, 28, 14",810693,Jujutsu Kaisen 0,ja,劇場版 呪術廻戦 0,"Yuta Okkotsu is a nervous high school student who is suffering from a serious problem—his childhood friend Rika has turned into a curse and won't leave him alone. Since Rika is no ordinary curse, his plight is noticed by Satoru Gojo, a teacher at Jujutsu High, a school where fledgling exorcists learn how to combat curses. Gojo convinces Yuta to enroll, but can he learn enough in time to confront the curse that haunts him?",12.2424,/23oJaeBh0FDk2mQ2P240PU9Xxfh.jpg,2021-12-24,False,False,8.107,1708,"Animation, Action, Fantasy"
False,/1jdPUUSy37Wzw3xuc8otI86X2gv.jpg,"16, 14, 10402, 878",1575337,Cosmic Princess Kaguya!,ja,超かぐや姫！,"Iroha's life gets knocked off its orbit when Kaguya, a carefree runaway from the Moon, moves in and convinces her to perform in a virtual world together.",12.2252,/9I9cM38gecZcwJ0C6r0cwfvtPJP.jpg,2026-01-22,False,False,8.407,70,"Animation, Fantasy, Music, Science Fiction"
False,/9FrpAtF87VKblKkDEiIZzYgO40K.jpg,"28, 35, 80",2109,Rush Hour,en,Rush Hour,"When Hong Kong Inspector Lee is summoned to Los Angeles to investigate a kidnapping, the FBI doesn't want any outside help and assigns cocky LAPD Detective James Carter to distract Lee from the case. Not content to watch the action from the sidelines, Lee and Carter form an unlikely partnership and investigate the case themselves.",12.2245,/3WsLE6FtxEPRa6U9sbY1ckrn39s.jpg,1998-09-18,False,False,7.063,5595,"Action, Comedy, Crime"
False,/aGmkdYMadabH1rNpKVWtmT7rCGh.jpg,"35, 10751, 10749",11247,A Cinderella Story,en,A Cinderella Story,"Routinely exploited by her wicked stepmother, the downtrodden Samantha Montgomery is excited about the prospect of meeting her Internet beau at the school's Halloween dance.",12.2113,/ukwP7gDPWxj1R1dW5iN3mnxkL3D.jpg,2004-07-16,False,False,6.6,3360,"Comedy, Family, Romance"
False,/lAs4Y5a8Pi86xDwuv8cx2prOVI2.jpg,"12, 10751, 14, 10749",447277,The Little Mermaid,en,The Little Mermaid,"The youngest of King Triton’s daughters, and the most defiant, Ariel longs to find out more about the world beyond the sea, and while visiting the surface, falls for the dashing Prince Eric. With mermaids forbidden to interact with humans, Ariel makes a deal with the evil sea witch, Ursula, which gives her a chance to experience life on land, but ultimately places her life – and her father’s crown – in jeopardy.",12.2,/ym1dxyOk4jFcSl4Q2zmRrA5BEEN.jpg,2023-05-18,False,False,6.3,3284,"Adventure, Family, Fantasy, Romance"
False,/uzzTystB8lL0mRDII5Sfs5HxgkI.jpg,"35, 12, 14, 16, 10751",10192,Shrek Forever After,en,Shrek Forever After,"A midlife-crisis burdened Shrek, longing for the days when he felt like a real ogre, makes a pact with magic deal-maker Rumpelstiltskin. But when he's duped and sent to a twisted version of Far Far Away—where Rumpelstiltskin is king, ogres are hunted, and he and Fiona have never met—he sets out to restore his world and reclaim his true love.",12.1895,/6HrfPZtKcGmX2tUWW3cnciZTaSD.jpg,2010-05-20,False,False,6.393,7897,"Comedy, Adventure, Fantasy, Animation, Family"
False,/wZS4xSfPtk1NPQnx9zsT5R2WhCu.jpg,"10751, 35, 12, 16, 878, 14, 28",438148,Minions: The Rise of Gru,en,Minions: The Rise of Gru,"A fanboy of a supervillain supergroup known as the Vicious 6, Gru hatches a plan to become evil enough to join them, with the backup of his followers, the Minions.",12.1719,/wKiOkZTN9lUUUNZLmtnwubZYONg.jpg,2022-06-29,False,False,7.269,3990,"Family, Comedy, Adventure, Animation, Science Fiction, Fantasy, Action"
False,/i1yf91svRHX45l9BXL8rVFzLoPH.jpg,"27, 53, 12",578,Jaws,en,Jaws,"When the seaside community of Amity finds itself under attack by a dangerous great white shark, the town's chief of police, a young marine biologist, and a grizzled shark hunter embark on a desperate quest to kill the beast before it strikes again.",12.1605,/tjbLSFwi0I3phZwh8zoHWNfbsEp.jpg,1975-06-20,False,False,7.681,11454,"Horror, Thriller, Adventure"
False,/6qHI1IYj7QlLSCwHRzkL62X175s.jpg,18,73,American History X,en,American History X,"Derek Vineyard is paroled after serving 3 years in prison for killing two African-American men. Through his brother, Danny Vineyard's narration, we learn that before going to prison, Derek was a skinhead and the leader of a violent white supremacist gang that committed acts of racial crime throughout L.A. and his actions greatly influenced Danny. Reformed and fresh out of prison, Derek severs contact with the gang and becomes determined to keep Danny from going down the same violent path as he did.",12.1605,/x2drgoXYZ8484lqyDj7L1CEVR4T.jpg,1998-07-01,False,False,8.327,12487,Drama
False,/7NKfxJrQn053UJeLftlx4m4NTzo.jpg,"27, 28",36647,Blade,en,Blade,"The Daywalker known as ""Blade"" - a half-vampire, half-mortal man - becomes the protector of humanity against an underground army of vampires.",12.1558,/oWT70TvbsmQaqyphCZpsnQR7R32.jpg,1998-08-21,False,False,6.827,6640,"Horror, Action"
False,/4fLZUr1e65hKPPVw0R3PmKFKxj1.jpg,"16, 10751, 10749, 14, 35",976573,Elemental,en,Elemental,"In a city where fire, water, land and air residents live together, a fiery young woman and a go-with-the-flow guy will discover something elemental: how much they have in common.",12.1437,/4Y1WNkd88JXmGfhtWR7dmDAo1T2.jpg,2023-06-14,False,False,7.577,5247,"Animation, Family, Romance, Fantasy, Comedy"
False,/aJFwk1clMal1prxAvKAgHxKPAf.jpg,"27, 53, 878",170,28 Days Later,en,28 Days Later,"Twenty-eight days after a killer virus was accidentally unleashed from a British research facility, a small group of London survivors are caught in a desperate struggle to protect themselves from the infected. Carried by animals and humans, the virus turns those it infects into homicidal maniacs -- and it's absolutely impossible to contain.",12.14,/sQckQRt17VaWbo39GIu0TMOiszq.jpg,2002-10-31,False,False,7.242,8399,"Horror, Thriller, Science Fiction"
False,/iymDDg4upZWgpbSeiE1JCjsSPBs.jpg,"18, 53, 80",64690,Drive,en,Drive,"Driver is a skilled Hollywood stuntman who moonlights as a getaway driver for criminals. Though he projects an icy exterior, lately he's been warming up to a pretty neighbor named Irene and her young son, Benicio. When Irene's husband gets out of jail, he enlists Driver's help in a million-dollar heist. The job goes horribly wrong, and Driver must risk his life to protect Irene and Benicio from the vengeful masterminds behind the robbery.",12.0931,/602vevIURmpDfzbnv5Ubi6wIkQm.jpg,2011-09-15,False,False,7.584,13527,"Drama, Thriller, Crime"
False,/eHaazLxM5LRMh0ySkVy7SK6wUWt.jpg,"12, 28, 878",101299,The Hunger Games: Catching Fire,en,The Hunger Games: Catching Fire,"After surviving the Hunger Games, Katniss and Peeta struggle with the consequences of their victory as unrest spreads across Panem. Forced back into the spotlight, they become symbols of hope and resistance while the Capitol prepares a new and deadly challenge that will change the future of the nation forever.",12.0725,/vrQHDXjVmbYzadOXQ0UaObunoy2.jpg,2013-11-15,False,False,7.426,18349,"Adventure, Action, Science Fiction"
False,/aJCtkxLLzkk1pECehVjKHA2lBgw.jpg,"12, 28, 878",1891,The Empire Strikes Back,en,The Empire Strikes Back,"The epic saga continues as Luke Skywalker, in hopes of defeating the evil Galactic Empire, learns the ways of the Jedi from aging master Yoda. But Darth Vader is more determined than ever to capture Luke. Meanwhile, rebel leader Princess Leia, cocky Han Solo, Chewbacca, and droids C-3PO and R2-D2 are thrown into various stages of capture, betrayal and despair.",12.069,/nNAeTmF4CtdSgMDplXTDPOpYzsX.jpg,1980-05-20,False,False,8.392,18291,"Adventure, Action, Science Fiction"
False,/dbojPWKZaqK3vNXT7ynRMigar7L.jpg,18,740300,Hedon,de,Hedon,"On the hunt for an emotional spark, Fynn sets out to lose himself in various sexual encounters of the night. As day is dawning he stumbles across young Tom, but by this point he wonders if he is still in control of his bodily impulses.",12.0584,/wm3o2zyf5inp0017JVVKRJUwxip.jpg,2019-04-09,False,False,1.0,2,Drama
False,/stmYfCUGd8Iy6kAMBr6AmWqx8Bq.jpg,"28, 878, 35, 10751",454626,Sonic the Hedgehog,en,Sonic the Hedgehog,"Powered with incredible speed, Sonic The Hedgehog embraces his new home on Earth. That is, until Sonic sparks the attention of super-uncool evil genius Dr. Robotnik. Now it’s super-villain vs. super-sonic in an all-out race across the globe to stop Robotnik from using Sonic’s unique power for world domination.",12.049,/aQvJ5WPzZgYVDrxLX4R6cLJCEaQ.jpg,2020-02-12,False,False,7.285,10345,"Action, Science Fiction, Comedy, Family"
False,/AdBXP8e6K3FYdDrMx3Wr6WZqCYF.jpg,"12, 14, 35",493529,Dungeons & Dragons: Honor Among Thieves,en,Dungeons & Dragons: Honor Among Thieves,"A charming thief and a band of unlikely adventurers undertake an epic heist to retrieve a lost relic, but things go dangerously awry when they run afoul of the wrong people.",12.0437,/v7UF7ypAqjsFZFdjksjQ7IUpXdn.jpg,2023-03-23,False,False,7.328,4520,"Adventure, Fantasy, Comedy"
False,/n8BYpslKnXDScx4WTWejLel3qZ1.jpg,35,4248,Scary Movie 2,en,Scary Movie 2,"While the original parodied slasher flicks like Scream, Keenen Ivory Wayans's sequel to Scary Movie takes comedic aim at haunted house movies. A group of students visit a mansion called ""Hell House,"" and murderous high jinks ensue.",12.0416,/7Eb1JWK0Cb0rbfsYjwfc9g0PbQH.jpg,2001-07-04,False,False,5.813,5106,Comedy
False,/yF1eOkaYvwiORauRCPWznV9xVvi.jpg,"28, 878, 12",298618,The Flash,en,The Flash,"When his attempt to save his family inadvertently alters the future, Barry Allen becomes trapped in a reality in which General Zod has returned and there are no Super Heroes to turn to. In order to save the world that he is in and return to the future that he knows, Barry's only hope is to race for his life. But will making the ultimate sacrifice be enough to reset the universe?",12.039,/rktDFPbfHfUbArZ6OOOKsXcv0Bm.jpg,2023-06-13,False,False,6.616,4937,"Action, Science Fiction, Adventure"
False,,"53, 10749, 9648",1466120,Dead Again,ko,데드 어게인,"Min-hyeok and Hae-ji, Seon-woong and Mi-mi, who came on a couple's trip to Vietnam, are very excited. Min-hyeok also enjoys a thrilling secret meeting with his wife Hae-ji as well as Mi-mi, who has been in a long-term relationship, and has a satisfying time.  However, Min-hyeok suddenly feels intense pain and stops breathing, and when he opens his eyes thinking he is going to die, it is his first day in Vietnam. Min-hyeok, who is confused about everything, finds out that there is a reason for the vacation that ends in death...",12.0385,/iqSmb9ugb8xK6avZ3Wglxue39N8.jpg,2025-05-08,False,False,7.2,4,"Thriller, Romance, Mystery"
False,/pBdQ4iorzRV2G38mdS6rzrmUfMA.jpg,"28, 10752, 53",840326,Sisu,fi,Sisu,"When an ex-soldier who discovers gold in the Lapland wilderness tries to take the loot into the city, German soldiers led by a brutal SS officer battle him.",12.0282,/ygO9lowFMXWymATCrhoQXd6gCEh.jpg,2022-09-09,False,False,7.412,2788,"Action, War, Thriller"
False,/s3FiHTdpQVpqIqdBxLLiy40wGut.jpg,"16, 28, 12, 35, 10751",140300,Kung Fu Panda 3,en,Kung Fu Panda 3,"While Po and his father are visiting a secret panda village, an evil spirit threatens all of China, forcing Po to form a ragtag army to fight back.",12.0279,/oajNi4Su39WAByHI6EONu8G8HYn.jpg,2016-01-23,False,False,6.921,6540,"Animation, Action, Adventure, Comedy, Family"
