adult,backdrop_path,genre_ids,id,title,original_language,original_title,overview,popularity,poster_path,release_date,softcore,video,vote_average,vote_count,genre_names
False,,18,484503,The Black Pearl,zh,黑珍珠,"Women are beaten, raped, tortured and killed in brutal prison.",15.3505,/yRlYkjecV3lJf51jIJI9ECzofVQ.jpg,1982-01-01,False,False,0.0,0,Drama
False,/iYqSQaWDttQIQzsxg9xHyg0bttG.jpg,"27, 878",945961,Alien: Romulus,en,Alien: Romulus,"While scavenging the deep ends of a derelict space station, a group of young space colonizers come face to face with the most terrifying life form in the universe.",15.3353,/2uSWRTtCG336nuBiG8jOTEUKSy8.jpg,2024-08-13,False,False,7.164,4551,"Horror, Science Fiction"
False,/9XhZhoSnFJ3AjpfzdIiZVHLQIS4.jpg,"28, 35, 80, 14",9470,Kung Fu Hustle,cn,功夫,"It's the 1940s, and the notorious Axe Gang terrorizes Shanghai. Small-time criminals Sing and Bone hope to join, but they only manage to make lots of very dangerous enemies. Fortunately for them, kung fu masters and hidden strength can be found in unlikely places. Now they just have to take on the entire Axe Gang.",15.3025,/exbyTbrvRUDKN2mcNEuVor4VFQW.jpg,2004-02-10,False,False,7.499,3187,"Action, Comedy, Crime, Fantasy"
False,/mFCS5OuhPYT79KXu5jl7RqznPR1.jpg,27,259693,The Conjuring 2,en,The Conjuring 2,Lorraine and Ed Warren travel to north London to help a single mother raising four children alone in a house plagued by malicious spirits.,15.2583,/zEqyD0SBt6HL7W9JQoWwtd5Do1T.jpg,2016-06-08,False,False,7.293,9177,Horror
False,/hBwDYiOPwXHuwiYGP82ekFNSeBr.jpg,"12, 14, 10749",50619,The Twilight Saga: Breaking Dawn - Part 1,en,The Twilight Saga: Breaking Dawn - Part 1,Bella Swan and Edward Cullen's honeymoon phase is abruptly disrupted by betrayals and unforeseen tragedies that endanger their world.,15.2423,/qs8LsHKYlVRmJbFUiSUhhRAygwj.jpg,2011-11-16,False,False,6.189,9264,"Adventure, Fantasy, Romance"
False,/sGE6N1vJjxZLkOJEXdIOqTslxuL.jpg,99,1087040,Money Shot: The Pornhub Story,en,Money Shot: The Pornhub Story,"Featuring interviews with performers, activists and past employees, this documentary offers a deep dive into the successes and scandals of Pornhub.",15.2356,/kpTqWqLYcf1uErnx5VXLah4EWJZ.jpg,2023-03-15,False,False,5.762,357,Documentary
False,/cFcXilLbI7yjPIYB58AZiOyUnoh.jpg,"28, 12, 80",47971,xXx: Return of Xander Cage,en,xXx: Return of Xander Cage,"Xander Cage is left for dead after an incident, though he secretly returns to action for a new, tough assignment with his handler Augustus Gibbons.",15.208,/hba8zREJpP1AYhaXgb2oJLQeO0K.jpg,2017-01-13,False,False,6.133,9224,"Action, Adventure, Crime"
False,/cDJ61O1STtbWNBwefuqVrRe3d7l.jpg,"12, 14, 28",10195,Thor,en,Thor,"Against his father Odin's will, The Mighty Thor - a powerful but arrogant warrior god - recklessly reignites an ancient war. Thor is cast down to Earth and forced to live among humans as punishment. Once here, Thor learns what it takes to be a true hero when the most dangerous villain of his world sends the darkest forces of Asgard to invade Earth.",15.1914,/prSfAi1xGrhLQNxVSUFh61xQ4Qy.jpg,2011-04-21,False,False,6.8,22339,"Adventure, Fantasy, Action"
False,/aTLq0TMKdsmIy1ZyFM1LfPs326d.jpg,"18, 878, 53",6479,I Am Legend,en,I Am Legend,"Robert Neville is a scientist who was unable to stop the spread of the terrible virus that was incurable and man-made. Immune, Neville is now the last human survivor in what is left of New York City and perhaps the world. For three years, Neville has faithfully sent out daily radio messages, desperate to find any other survivors who might be out there. But he is not alone.",15.1883,/iPDkaSdKk2jRLTM65UOEoKtsIZ8.jpg,2007-12-12,False,False,7.215,16837,"Drama, Science Fiction, Thriller"
False,/mOtKQlXdL5J4lwqcSFlkZmgmFeZ.jpg,"16, 35, 10751, 37, 12",44896,Rango,en,Rango,"When Rango, a lost family pet, accidentally winds up in the gritty, gun-slinging Western town of Dirt, the theater-loving lizard suddenly finds himself the newly appointed sheriff. Welcomed as the last hope the town has been waiting for, Rango is forced to play his new role to the hilt and uncover the truth behind a looming water crisis—before his act catches up with him.",15.1865,/A5MP1guV8pbruieG0tnpPIbaJtt.jpg,2011-03-02,False,False,6.899,7103,"Animation, Comedy, Family, Western, Adventure"
False,/pe3cTrUeAHHLycZVEmFjT9kEV7a.jpg,28,646315,The Legendary Lighter,ko,전설의 라이타,A man who used to be called Lighter cleans up his act from his days as a gangster and struggles to start over.,15.1852,/h5fCwKCnKAKxdX6onTnrU6MeYe8.jpg,2019-10-29,False,False,5.8,5,Action
False,/9PRKAdrDvAdCfg3EcApLTfzGsEt.jpg,"878, 35, 12",696506,Mickey 17,en,Mickey 17,"Unlikely hero Mickey Barnes finds himself in the extraordinary circumstance of working for an employer who demands the ultimate commitment to the job… to die, for a living.",15.1779,/edKpE9B5qN3e559OuMCLZdW1iBZ.jpg,2025-02-28,False,False,6.838,3567,"Science Fiction, Comedy, Adventure"
False,/i0lipAm0VHFA3EH0CPV0s5LJMIE.jpg,"878, 9648, 28",1058424,Hope,ko,호프,"In the remote South Korean village of Hope Harbor, police chief Bum-seok and officer Sung-ae are called to investigate a mysterious creature wreaking havoc on the community. But all is not as it seems, and perceptions can be misleading. What begins as ignorance plants the seed of disaster, escalating through human conflict into a tragedy of cosmic proportions.",15.1723,/1n37BJchWHLiSYQkuFxe5KjB951.jpg,2026-11-04,False,False,0.0,0,"Science Fiction, Mystery, Action"
False,/3TeGmKJfkik1D1rIoqGb1aR4k9c.jpg,"12, 28, 878",1893,Star Wars: Episode I - The Phantom Menace,en,Star Wars: Episode I - The Phantom Menace,"Anakin Skywalker, a young slave strong with the Force, is discovered on Tatooine. Meanwhile, the evil Sith have returned, enacting their plot for revenge against the Jedi.",15.1492,/6wkfovpn7Eq8dYNKaG5PY3q2oq6.jpg,1999-05-19,False,False,6.577,15833,"Adventure, Action, Science Fiction"
False,/qVGpxnjrGlHaSTCqTQI6viBDSfp.jpg,"27, 53, 18",346364,It,en,It,"In a small town in Maine, seven children known as The Losers Club come face to face with life problems, bullies and a monster that takes the shape of a clown called Pennywise.",15.1265,/9E2y5Q7WlCVNEhP5GiVTjhEhx1o.jpg,2017-09-06,False,False,7.241,20317,"Horror, Thriller, Drama"
False,,18,1123640,Manji Mai 3: I will let you go Paradise Jodo,ja,卍舞Ⅲ いかせてあげる、極楽浄土,"The female ninja butterfly was the daughter of a large store five years ago. The butterfly is in love with the Ronin Kurokawa Gennoshin, and one night he abandons everything and leaves the house to be with him, but he…",15.091,/mvyxrQtti8b8fn5ZoAc36VcwArt.jpg,1996-05-18,False,False,0.0,0,Drama
False,/qvcOovScPoRalRxDy50rYSYFree.jpg,"35, 10749",10591,The Girl Next Door,en,The Girl Next Door,"Exceptionally ambitious high schooler Matthew has aspirations for a career in politics when he falls in love with his gorgeous 19-year-old neighbor, Danielle. But Matthew's bright future is jeopardized when he finds Danielle was once a porn star. As Danielle's past catches up with her, Matthew's love for her forces him to re-evaluate his goals.",15.0825,/5mVyFHSY2rSsNgD4NfEwV82HigU.jpg,2004-04-09,False,False,6.744,4013,"Comedy, Romance"
False,/o8dPH0ZSIyyViP6rjRX1djwCUwI.jpg,"9648, 53, 27",419430,Get Out,en,Get Out,"Chris and his girlfriend Rose go upstate to visit her parents for the weekend. At first, Chris reads the family's overly accommodating behavior as nervous attempts to deal with their daughter's interracial relationship, but as the weekend progresses, a series of increasingly disturbing discoveries lead him to a truth that he never could have imagined.",15.0583,/mE24wUCfjK8AoBBjaMjho7Rczr7.jpg,2017-02-24,False,False,7.622,18880,"Mystery, Thriller, Horror"
False,/gklkxY0veMajdCiGe6ggsh07VG2.jpg,"10751, 35, 12, 16",940551,Migration,en,Migration,"After a migrating duck family alights on their pond with thrilling tales of far-flung places, the Mallard family embarks on a family road trip, from New England, to New York City, to tropical Jamaica.",15.0569,/ldfCF9RhR40mppkzmftxapaHeTo.jpg,2023-12-06,False,False,7.4,2244,"Family, Comedy, Adventure, Animation"
False,/d5C5Wsx4fnMRA0tj9BK1kTPcgQe.jpg,"27, 53",1315303,Primate,en,Primate,"College student Lucy and her friends spend their vacation at her family's home in Hawaii, which includes her pet chimpanzee, Ben. However, when Ben contracts rabies after being bitten by a rabid animal, the group must fight for their lives in order to avoid the now-violent chimp.",15.0467,/rKleYiEj4pFqxedTRWfujLooi84.jpg,2026-01-01,False,False,6.5,647,"Horror, Thriller"
False,/5TO9LeUAdilHgq50veWqBpDejaU.jpg,35,58008,Night Nurse,it,L'infermiera di notte,"A dentist invites a elderly patient to stay at his home to recover, unaware that he is a jewel thief. He plans to steal a valuable diamond but then runs into a beautiful nurse who, aside from constantly stripping nude, has plans of her own.",15.0467,/tzhBAhN35YjobVG3Ubm3ERnzhBL.jpg,1979-02-07,False,False,5.2,53,Comedy
False,/x9td0NQha0t44K2qgcMipLOGjVi.jpg,"28, 53, 12",370172,No Time to Die,en,No Time to Die,"Bond has left active service and is enjoying a tranquil life in Jamaica. His peace is short-lived when his old friend Felix Leiter from the CIA turns up asking for help. The mission to rescue a kidnapped scientist turns out to be far more treacherous than expected, leading Bond onto the trail of a mysterious villain armed with dangerous new technology.",15.0284,/iUgygt3fscRoKWCV1d0C7FbM9TP.jpg,2021-09-29,False,False,7.3,7111,"Action, Thriller, Adventure"
False,/8BTsTfln4jlQrLXUBquXJ0ASQy9.jpg,"12, 28, 878",140607,Star Wars: The Force Awakens,en,Star Wars: The Force Awakens,"Thirty years after defeating the Galactic Empire, Han Solo and his allies face a new threat from the evil Kylo Ren and his army of Stormtroopers.",15.0231,/wqnLdwVXoBjKibFRR5U3y0aDUhs.jpg,2015-12-15,False,False,7.2,20538,"Adventure, Action, Science Fiction"
False,/iryef4LKiPQkvhNJS1EtLlay3br.jpg,"28, 9648, 53, 878",615173,The Witch: Part 2. The Other One,ko,마녀 2,"A girl wakes up in a huge secret laboratory, then accidentally meets another girl who is trying to protect her house from a gang. The mystery girl overthrows the gang with her unexpected powers, and laboratory staff set out to find her.",15.0204,/9YTuscJXmr9Iua62amCgGSU8PDW.jpg,2022-06-15,False,False,7.397,448,"Action, Mystery, Thriller, Science Fiction"
False,/puqQGxK9HYITUKhCdREg3XOLlZd.jpg,"27, 878, 35",696393,Cold Storage,en,Cold Storage,"When a mutating, highly contagious fungus escapes a sealed facility, two employees – joined by a grizzled bioterror operative – must survive the wildest night shift ever to save humanity from extinction.",14.9862,/3HA2iiq982e01EKXJvPFyfMADVM.jpg,2026-01-22,False,False,6.82,483,"Horror, Science Fiction, Comedy"
False,/gJbTXKNTL6O7r7PzF6ZRkJGBlPp.jpg,"27, 9648, 53",493922,Hereditary,en,Hereditary,"Following the death of the Leigh family matriarch, Annie and her children uncover disturbing secrets about their heritage. Their daily lives are not only impacted, but they also become entangled in a chilling fate from which they cannot escape, driving them to the brink of madness.",14.9614,/hjlZSXM86wJrfCv5VKfR5DI2VeU.jpg,2018-06-07,False,False,7.294,8588,"Horror, Mystery, Thriller"
False,/e5lxpaVyazQX723A3svR17WxckP.jpg,18,519465,Queen of Hearts,da,Dronningen,"Anne, a brilliant and dedicated advocacy lawyer specialising in society’s most vulnerable, children and young adults, lives what appears to be the picture-perfect life with her doctor-husband, Peter, and their twin daughters. When her estranged teenage stepson, Gustav, moves in with them, Anne’s escalating desire leads her down a dangerous rabbit hole which, once exposed, unleashes a sequence of events destined to destroy her world.",14.9564,/dfFVDIgovEfQZn53VRKLV2JQnRJ.jpg,2019-03-27,False,False,6.915,377,Drama
False,/69EFgWWPFWbRNHmQgYdSnyJ94Ge.jpg,"28, 12, 878",49521,Man of Steel,en,Man of Steel,"A young boy learns that he has extraordinary powers and is not of this earth. As a young man, he journeys to discover where he came from and what he was sent here to do. But the hero in him must emerge if he is to save the world from annihilation and become the symbol of hope for all mankind.",14.9539,/cB46TSg3kGjq2eVy5kVUhlpUa1H.jpg,2013-06-12,False,False,6.649,16194,"Action, Adventure, Science Fiction"
False,/x6zvXGaI67NJehFHorTRSxEasMe.jpg,18,1688163,Hayok,tl,Hayok,"A feisty thriller about a fiercely independent woman who becomes the obsession of a contractor desperate to possess her. But when betrayal turns violent, she strikes back with a revenge that destroys his pride and control.",14.943,/i4FFY9mskUpJLnLXQwZSTn3f1Ek.jpg,2026-05-15,False,False,7.0,1,Drama
False,/1buxBsiQM1zQvEEM8FyJH6lZgHa.jpg,"27, 35, 10749",1177445,Cannibal Mukbang,en,Cannibal Mukbang,"Shy and looking for love, Mark quickly becomes smitten with the outgoing and mysterious Ash. But as his feelings for her intensify, so does his unexpected submersion into Ash's biggest love: the wild world of mukbanging. And with it, lots of bloodshed.",14.9418,/f30neqyKxshsD9T5bCGenqVSkjf.jpg,2025-09-25,False,False,4.455,11,"Horror, Comedy, Romance"
False,/aI78JFBTG8M44HtytLdM73M5yRo.jpg,18,1380126,Pin/Ya,tl,Pin/Ya,"A strong childhood bond between two girls grows into something more. Learning to play with fire as they explore their bodies, Pin and Aya soon learn that their feelings for each other are beyond friendship. With their friendship at stake, will they take a chance at love?",14.9022,/jGKreGg9s4ruL25UFt7budrGJfy.jpg,2024-12-06,False,False,5.7,9,Drama
False,/jW21PoKwqs79wk6bfiYezox63mK.jpg,"878, 28, 12",18,The Fifth Element,fr,Le Cinquième Élément,"In 2257, a taxi driver is unintentionally given the task of saving a young girl who is part of the key that will ensure the survival of humanity.",14.8824,/fPtlCO1yQtnoLHOwKtWz7db6RGU.jpg,1997-05-02,False,False,7.579,11734,"Science Fiction, Action, Adventure"
False,/wxr4Z6E83h14CogsZOzDm1vuDX3.jpg,"878, 28, 12",91314,Transformers: Age of Extinction,en,Transformers: Age of Extinction,"As humanity picks up the pieces after the battle of Chicago, a shadowy group reveals itself in an attempt to control the direction of history…while an ancient, powerful new menace sets Earth in its crosshairs. With help from Cade Yeager, Optimus Prime and the Autobots rise to meet their most fearsome challenge yet.",14.867,/jyzrfx2WaeY60kYZpPYepSjGz4S.jpg,2014-06-25,False,False,5.964,8746,"Science Fiction, Action, Adventure"
False,/vgGcmZWWjxYanOrPxxIoijZqCtQ.jpg,"35, 53",467905,How to Make a Killing,en,How to Make a Killing,"Disowned at birth by his obscenely wealthy family, blue-collar Becket Redfellow will stop at nothing to reclaim his inheritance, no matter how many relatives stand in his way.",14.7996,/vxMeKC7o5Gi8IHMi6lUgsdprTqv.jpg,2026-02-16,False,False,7.1,409,"Comedy, Thriller"
False,/e9UvRjJAqn2hLXDfMHU1LFMEKGv.jpg,27,1430077,Hokum,en,Hokum,"When novelist Ohm Bauman retreats to a remote inn to scatter his parents' ashes, he is consumed by tales of a witch haunting the honeymoon suite. Disturbing visions and a shocking disappearance forces him to confront dark corners of his past.",14.7806,/jKPWwsbAM6HKURPYQ1eG8DmKMKn.jpg,2026-04-29,False,False,6.9,60,Horror
False,/5a7lMDn3nAj2ByO0X1fg6BhUphR.jpg,"12, 28, 878",333339,Ready Player One,en,Ready Player One,"When the creator of a popular video game system dies, a virtual contest is created to compete for his fortune.",14.7607,/pU1ULUq8D3iRxl1fdX2lZIzdHuI.jpg,2018-03-28,False,False,7.587,16923,"Adventure, Action, Science Fiction"
False,/dfU9xyEEyLxvZ5unTn05Whm9Lce.jpg,"28, 14",9312,Mortal Kombat,en,Mortal Kombat,"For nine generations an evil sorcerer has been victorious in hand-to-hand battle against his mortal enemies. If he wins a tenth Mortal Kombat tournament, desolation and evil will reign over the multiverse forever. To save Earth, three warriors must overcome seemingly insurmountable odds, their own inner demons, and superhuman foes.",14.7545,/fcK7tzSSXMYiMN8E9KlZJL1BYyp.jpg,1995-08-18,False,False,5.9,2547,"Action, Fantasy"
False,/wbDkvShcrveXNFsgyujY4kdurVa.jpg,"35, 10749",957119,Sidelined: The QB and Me,en,Sidelined: The QB and Me,"Dallas, a burdened but headstrong dancer, is determined to get into the best dance school in the country—her late mother’s alma mater. However, that dream is suddenly derailed when the cheeky yet secretly grieving football star, Drayton, crashes into her life with a unique story of his own. Will the two of them be able to grow into their dreams together, or will their dreams be sidelined?",14.7263,/mSL6truNrWP1Bn9ng1rN0SkMI4f.jpg,2025-02-06,False,False,6.21,229,"Comedy, Romance"
False,/3q01ACG0MWm0DekhvkPFCXyPZSu.jpg,"28, 35, 80",573435,Bad Boys: Ride or Die,en,Bad Boys: Ride or Die,"After their late former Captain is framed, Lowrey and Burnett try to clear his name, only to end up on the run themselves.",14.7027,/oGythE98MYleE6mZlGs5oBGkux1.jpg,2024-06-05,False,False,7.3,3331,"Action, Comedy, Crime"
False,/fiRDzpcJe7qz3yIR43hdXIE3NHv.jpg,"53, 9648, 35",812583,Wake Up Dead Man: A Knives Out Mystery,en,Wake Up Dead Man: A Knives Out Mystery,"When young priest Jud Duplenticy is sent to assist charismatic firebrand Monsignor Jefferson Wicks, it’s clear that all is not well in the pews. After a sudden and seemingly impossible murder rocks the town, the lack of an obvious suspect prompts local police chief Geraldine Scott to join forces with renowned detective Benoit Blanc to unravel a mystery that defies all logic.",14.6911,/qCOGGi8JBVEZMc3DVby8rUivyXz.jpg,2025-11-26,False,False,7.2,2486,"Thriller, Mystery, Comedy"
False,/xcjJ5khg2yzOa282mza39Lbrm7j.jpg,"27, 18",9552,The Exorcist,en,The Exorcist,"When a mysterious entity possesses a young girl, her mother seeks the help of two Catholic priests to save her life.",14.6763,/5x0CeVHJI8tcDx8tUUwYHQSNILq.jpg,1973-12-26,False,False,7.743,8638,"Horror, Drama"
False,/4HWAQu28e2yaWrtupFPGFkdNU7V.jpg,"35, 80, 9648",546554,Knives Out,en,Knives Out,"When renowned crime novelist Harlan Thrombey is found dead at his estate just after his 85th birthday, the inquisitive and debonair Detective Benoit Blanc is mysteriously enlisted to investigate. From Harlan's dysfunctional family to his devoted staff, Blanc sifts through a web of red herrings and self-serving lies to uncover the truth behind Harlan's untimely death.",14.6746,/pThyQovXQrw2m0s9x82twj48Jq4.jpg,2019-11-27,False,False,7.841,14019,"Comedy, Crime, Mystery"
False,/8FWLJHuWB72UXBmiMtxwTvQVumN.jpg,"10751, 35, 80, 12, 16",1175942,The Bad Guys 2,en,The Bad Guys 2,"The now-reformed Bad Guys are trying (very, very hard) to be good, but instead find themselves hijacked into a high-stakes, globe-trotting heist, masterminded by a new team of criminals they never saw coming: The Bad Girls.",14.6617,/26oSPnq0ct59l07QOXZKyzsiRtN.jpg,2025-07-24,False,False,7.655,780,"Family, Comedy, Crime, Adventure, Animation"
False,/tCsYQTkQx7vknDmTw666K1XxAdx.jpg,"28, 18, 53, 80",348893,Boyka: Undisputed IV,en,Boyka: Undisputed IV,"In the fourth installment of the fighting franchise, Boyka is shooting for the big leagues when an accidental death in the ring makes him question everything he stands for. When he finds out the wife of the man he accidentally killed is in trouble, Boyka offers to fight in a series of impossible battles to free her from a life of servitude.",14.6528,/7QGdIJWWTkPhVjpQ0zA6z69khod.jpg,2016-08-01,False,False,7.186,1456,"Action, Drama, Thriller, Crime"
False,/2Mq10FWFbxoYgsZysWlw7T9wSNe.jpg,"10749, 18",61979,Three Steps Above Heaven,es,Tres metros sobre el cielo,"Babi, a sheltered upper-class girl, and Hache, a reckless rebel obsessed with illegal motorcycle races, fall into a forbidden love that pulls them deeper into passion and risk.",14.6485,/xeWyY2s13dRlKOLk4E3TkXgM4sS.jpg,2010-12-03,False,False,7.724,3226,"Romance, Drama"
False,/r9leYNa8nTRCceZrZhP1DXkgKVb.jpg,"27, 9648, 878",1091,The Thing,en,The Thing,A research team in Antarctica is hunted by a shape-shifting alien that assumes the appearance of its victims.,14.6429,/tzGY49kseSE9QAKk47uuDGwnSCu.jpg,1982-06-25,False,False,8.072,7931,"Horror, Mystery, Science Fiction"
False,/9FrpAtF87VKblKkDEiIZzYgO40K.jpg,"28, 35, 80",2109,Rush Hour,en,Rush Hour,"When Hong Kong Inspector Lee is summoned to Los Angeles to investigate a kidnapping, the FBI doesn't want any outside help and assigns cocky LAPD Detective James Carter to distract Lee from the case. Not content to watch the action from the sidelines, Lee and Carter form an unlikely partnership and investigate the case themselves.",14.6214,/we7wOLVFgxhzLzUt0qNe50xdIQZ.jpg,1998-09-18,False,False,7.073,5653,"Action, Comedy, Crime"
False,/qA6MHDGDY0LyutjLUgFJRbPXLpW.jpg,"27, 878, 53",1084199,Companion,en,Companion,"During a weekend getaway at a secluded lakeside estate, a group of friends finds themselves entangled in a web of secrets, deception, and advanced technology. As tensions rise and loyalties are tested, they uncover unsettling truths about themselves and the world around them.",14.5877,/oCoTgC3UyWGfyQ9thE10ulWR7bn.jpg,2025-01-22,False,False,7.0,2299,"Horror, Science Fiction, Thriller"
False,/82C04rTiXYZ7c8XZv91Nu53w82Y.jpg,"28, 53, 35",1007734,Nobody 2,en,Nobody 2,"Former assassin Hutch Mansell takes his family on a nostalgic vacation to a small-town theme park, only to be pulled back into violence when they clash with a corrupt operator, a crooked sheriff, and a ruthless crime boss.",14.5774,/svXVRoRSu6zzFtCzkRsjZS7Lqpd.jpg,2025-08-13,False,False,6.9,1572,"Action, Thriller, Comedy"
False,/jlGmlFOcfo8n5tURmhC7YVd4Iyy.jpg,"28, 35, 12",436969,The Suicide Squad,en,The Suicide Squad,"Supervillains Harley Quinn, Bloodsport, Peacemaker and a collection of nutty cons at Belle Reve prison join the super-secret, super-shady Task Force X as they are dropped off at the remote, enemy-infused island of Corto Maltese.",13.9376,/q61qEyssk2ku3okWICKArlAdhBn.jpg,2021-07-28,False,False,7.5,9577,"Action, Comedy, Adventure"
False,/bdI6U1mT0kCdTJ6TWtiFxQ42GSn.jpg,"80, 18, 53",242582,Nightcrawler,en,Nightcrawler,"When Lou Bloom, desperate for work, muscles into the world of L.A. crime journalism, he blurs the line between observer and participant to become the star of his own story. Aiding him in his effort is Nina, a TV-news veteran.",14.2136,/j9HrX8f7GbZQm1BrBiR40uFQZSb.jpg,2014-10-23,False,False,7.709,11722,"Crime, Drama, Thriller"
False,/3P52oz9HPQWxcwHOwxtyrVV1LKi.jpg,"28, 35, 12",383498,Deadpool 2,en,Deadpool 2,Wisecracking mercenary Deadpool battles the evil and powerful Cable and other bad guys to save a boy's life.,14.558,/to0spRl1CMDvyUbOnbb4fTk3VAd.jpg,2018-05-15,False,False,7.491,19218,"Action, Comedy, Adventure"
False,/yF1eOkaYvwiORauRCPWznV9xVvi.jpg,"28, 878, 12",298618,The Flash,en,The Flash,"When his attempt to save his family inadvertently alters the future, Barry Allen becomes trapped in a reality in which General Zod has returned and there are no Super Heroes to turn to. In order to save the world that he is in and return to the future that he knows, Barry's only hope is to race for his life. But will making the ultimate sacrifice be enough to reset the universe?",13.9771,/rktDFPbfHfUbArZ6OOOKsXcv0Bm.jpg,2023-06-13,False,False,6.616,4990,"Action, Science Fiction, Adventure"
False,/vbkW4KerpshPZnP84w9qwSfYrhu.jpg,"27, 53",1198984,We Bury the Dead,en,We Bury the Dead,"After a catastrophic military disaster, the dead don't just rise - they hunt. Ava searches for her missing husband, but what she finds is far more terrifying.",14.4606,/xZqo0yPARmyF8TACVNyaOACkYWG.jpg,2026-01-01,False,False,6.013,233,"Horror, Thriller"
False,/iXXPaQPfQowpQ5UvhsHLj9BgFhe.jpg,"27, 878",126889,Alien: Covenant,en,Alien: Covenant,"The crew of the colony ship Covenant, bound for a remote planet on the far side of the galaxy, discovers what they think is an uncharted paradise but is actually a dark, dangerous world.",14.4436,/zecMELPbU5YMQpC81Z8ImaaXuf9.jpg,2017-05-09,False,False,6.176,9413,"Horror, Science Fiction"
False,/ukPu5xYOBAnh5H46uK4aQOirW2b.jpg,"12, 16, 35, 10751, 878",1022787,Elio,en,Elio,"Elio, a space fanatic with an active imagination, finds himself on a cosmic misadventure where he must form new bonds with eccentric alien lifeforms, navigate a crisis of intergalactic proportions and somehow discover who he is truly meant to be.",14.1904,/7z8jDiTZZco9moIKpTUImFtTy7o.jpg,2025-06-18,False,False,6.9,994,"Adventure, Animation, Comedy, Family, Science Fiction"
False,/r17jFHAemzcWPPtoO0UxjIX0xas.jpg,"28, 53, 80",324552,John Wick: Chapter 2,en,John Wick: Chapter 2,"John Wick is forced out of retirement by a former associate looking to seize control of a shadowy international assassins’ guild. Bound by a blood oath to aid him, Wick travels to Rome and does battle against some of the world’s most dangerous killers.",13.7739,/hXWBc0ioZP3cN4zCu6SN3YHXZVO.jpg,2017-02-08,False,False,7.338,14247,"Action, Thriller, Crime"
False,/z4mSIudSz9ddv7kmZ7QFN0ALUz9.jpg,27,8689,Cannibal Holocaust,it,Cannibal Holocaust,A New York University professor returns from a rescue mission to the Amazon rainforest with the footage shot by a lost team of documentarians who were making a film about the area's local cannibal tribes.,13.1187,/otxZzMh53TsN7yYFqSZ3rwH1yMd.jpg,1980-02-07,False,False,6.266,1866,Horror
False,/rVqY0Bo4Npf6EIONUROxjYAJfmD.jpg,"12, 14, 10749, 10751",420817,Aladdin,en,Aladdin,A kindhearted street urchin named Aladdin embarks on a magical adventure after finding a lamp that releases a wisecracking genie while a power-hungry Grand Vizier vies for the same lamp that has the power to make their deepest wishes come true.,14.3676,/ykUEbfpkf8d0w49pHh0AD2KrT52.jpg,2019-05-22,False,False,7.085,10607,"Adventure, Fantasy, Romance, Family"
