adult,backdrop_path,genre_ids,id,title,original_language,original_title,overview,popularity,poster_path,release_date,softcore,video,vote_average,vote_count,genre_names
False,/7py8kUCYaOdFn1TfVS87BDBySOz.jpg,"35, 12, 878",550988,Free Guy,en,Free Guy,"A bank teller discovers he is actually a background player in an open-world video game, and decides to become the hero of his own story. Now, in a world where there are no limits, he is determined to be the guy who saves his world his way before it's too late.",11.179,/dxraF0qPr1OEgJk17ltQTO84kQF.jpg,2021-08-11,False,False,7.452,9715,"Comedy, Adventure, Science Fiction"
False,/5n417Ff5GXOGCOKj3ZLMRAxEP0o.jpg,"18, 9648",249397,Nymphomaniac: Vol. II,en,Nymphomaniac: Vol. II,The continuation of Joe's sexually dictated life delves into the darker aspects of her adult life and what led to her being in Seligman's care.,13.324,/iLUNqgNKuWn667kXCKztSxYbT3k.jpg,2013-12-25,False,False,6.707,3120,"Drama, Mystery"
False,/uvitbjFU4JqvMwIkMWHp69bmUzG.jpg,"18, 80",598,City of God,pt,Cidade de Deus,"In the poverty-stricken favelas of Rio de Janeiro in the 1970s, two young men choose different paths. Rocket is a budding photographer who documents the increasing drug-related violence of his neighborhood, while José “Zé” Pequeno is an ambitious drug dealer diving into a dangerous life of crime.",13.2466,/k7eYdWvhYQyRQoU2TB2A2Xu2TfD.jpg,2002-08-30,False,False,8.429,8114,"Drama, Crime"
False,/iymDDg4upZWgpbSeiE1JCjsSPBs.jpg,"18, 53, 80",64690,Drive,en,Drive,"Driver is a skilled Hollywood stuntman who moonlights as a getaway driver for criminals. Though he projects an icy exterior, lately he's been warming up to a pretty neighbor named Irene and her young son, Benicio. When Irene's husband gets out of jail, he enlists Driver's help in a million-dollar heist. The job goes horribly wrong, and Driver must risk his life to protect Irene and Benicio from the vengeful masterminds behind the robbery.",12.6388,/602vevIURmpDfzbnv5Ubi6wIkQm.jpg,2011-09-15,False,False,7.6,13525,"Drama, Thriller, Crime"
False,/69PZORl7TmqzvG8yrloqfHgjhZV.jpg,"18, 10749",493125,An Affair - Two Sisters,ko,정사-두자매,Two beautiful sisters run a cabin in the mountains that is well-known to men as a place of affection. An unknown man near the cabin watches them closely.,13.2232,/hd53bYFpoWjojG08xLQBO8cP50h.jpg,2017-09-21,False,False,4.7,3,"Drama, Romance"
False,/n1ItmvzsDV5yLgDodSCLZpFlsP6.jpg,"18, 53, 80",146233,Prisoners,en,Prisoners,"Keller Dover is facing every parent’s worst nightmare. His six-year-old daughter, Anna, is missing, together with her young friend, Joy, and as minutes turn to hours, panic sets in. The only lead is a dilapidated RV that had earlier been parked on their street.",12.0488,/jsS3a3ep2KyBVmmiwaz3LvK49b1.jpg,2013-09-19,False,False,8.103,12946,"Drama, Thriller, Crime"
False,/qvcOovScPoRalRxDy50rYSYFree.jpg,"35, 10749",10591,The Girl Next Door,en,The Girl Next Door,"Exceptionally ambitious high schooler Matthew has aspirations for a career in politics when he falls in love with his gorgeous 19-year-old neighbor, Danielle. But Matthew's bright future is jeopardized when he finds Danielle was once a porn star. As Danielle's past catches up with her, Matthew's love for her forces him to re-evaluate his goals.",14.6333,/5mVyFHSY2rSsNgD4NfEwV82HigU.jpg,2004-04-09,False,False,6.734,3966,"Comedy, Romance"
False,/jsoz1HlxczSuTx0mDl2h0lxy36l.jpg,"14, 28, 35",616037,Thor: Love and Thunder,en,Thor: Love and Thunder,"After his retirement is interrupted by Gorr the God Butcher, a galactic killer who seeks the extinction of the gods, Thor Odinson enlists the help of King Valkyrie, Korg, and ex-girlfriend Jane Foster, who now wields Mjolnir as the Mighty Thor. Together they embark upon a harrowing cosmic adventure to uncover the mystery of the God Butcher’s vengeance and stop him before it’s too late.",13.3801,/pIkRyD18kl4FhoCNQuWxWu5cBLM.jpg,2022-07-06,False,False,6.371,8494,"Fantasy, Action, Comedy"
False,/6aNKD81RHR1DqUUa8kOZ1TBY1Lp.jpg,"35, 18",637,Life Is Beautiful,it,La vita è bella,A touching story of an Italian book seller of Jewish ancestry who lives in his own little fairy tale. His creative and happy life would come to an abrupt halt when his entire family is deported to a concentration camp during World War II. While locked up he tries to convince his son that the whole thing is just a game.,12.4359,/mfnkSeeVOBVheuyn2lo4tfmOPQb.jpg,1997-12-20,False,False,8.439,13914,"Comedy, Drama"
False,/jPu8yiadqgzwFPGKJmGo637ASVP.jpg,"878, 28, 12",1724,The Incredible Hulk,en,The Incredible Hulk,"Scientist Bruce Banner scours the planet for an antidote to the unbridled force of rage within him: the Hulk. But when the military masterminds who dream of exploiting his powers force him back to civilization, he finds himself coming face to face with a new, deadly foe.",12.149,/gKzYx79y0AQTL4UAk1cBQJ3nvrm.jpg,2008-06-12,False,False,6.2,12608,"Science Fiction, Action, Adventure"
False,/xuLA0pii2IMJW2puT7EvJtgpg0H.jpg,"28, 12, 10751, 35",675353,Sonic the Hedgehog 2,en,Sonic the Hedgehog 2,"After settling in Green Hills, Sonic is eager to prove he has what it takes to be a true hero. His test comes when Dr. Robotnik returns, this time with a new partner, Knuckles, in search for an emerald that has the power to destroy civilizations. Sonic teams up with his own sidekick, Tails, and together they embark on a globe-trotting journey to find the emerald before it falls into the wrong hands.",12.5592,/6DrHO1jr3qVrViUO6s6kFiAGM7.jpg,2022-03-30,False,False,7.433,5829,"Action, Adventure, Family, Comedy"
False,/sGE6N1vJjxZLkOJEXdIOqTslxuL.jpg,99,1087040,Money Shot: The Pornhub Story,en,Money Shot: The Pornhub Story,"Featuring interviews with performers, activists and past employees, this documentary offers a deep dive into the successes and scandals of Pornhub.",15.7505,/kpTqWqLYcf1uErnx5VXLah4EWJZ.jpg,2023-03-15,False,False,5.794,349,Documentary
False,/hy0Hx9fMPk2fmw26Li60z1S2giU.jpg,"18, 80, 53",629,The Usual Suspects,en,The Usual Suspects,"Held in an L.A. interrogation room, Verbal Kint attempts to convince the feds that a mythic crime lord, Keyser Soze, not only exists, but was also responsible for drawing him and his four partners into a multi-million dollar heist that ended with an explosion in San Pedro harbor – leaving few survivors. Verbal lures his interrogators with an incredible story of the crime lord's almost supernatural prowess.",12.498,/99X2SgyFunJFXGAYnDv3sb9pnUD.jpg,1995-07-19,False,False,8.17,11319,"Drama, Crime, Thriller"
False,/13Nz8EchKRdCgJcKdEoJAnpiVn2.jpg,"28, 12, 14",791373,Zack Snyder's Justice League,en,Zack Snyder's Justice League,"Determined to ensure Superman's ultimate sacrifice was not in vain, Bruce Wayne aligns forces with Diana Prince with plans to recruit a team of metahumans to protect the world from an approaching threat of catastrophic proportions.",13.6689,/tnAuB8q5vv7Ax9UAEje5Xi4BXik.jpg,2021-03-18,False,False,8.09,10737,"Action, Adventure, Fantasy"
False,/oIJjO1CvEdTMFNkWfHaV0RB584G.jpg,"28, 80, 53",628847,Trap House,en,Trap House,"An undercover DEA agent and his partner embark on a game of cat and mouse with an audacious, and surprising group of thieves – their own rebellious teenagers, who have begun robbing from a dangerous cartel, using their parents' tactics and top-secret intel to do it.",14.0142,/6tpAPeuuqbVnYWWPoOLEDLSBU7a.jpg,2025-11-14,False,False,6.5,253,"Action, Crime, Thriller"
False,/6WRrGYalXXveItfpnipYdayFkQB.jpg,"18, 53, 80",1422,The Departed,en,The Departed,"To take down South Boston's Irish Mafia, the police send in one of their own to infiltrate the underworld, not realizing the syndicate has done likewise. While an undercover cop curries favor with the mob kingpin, a career criminal rises through the police ranks. But both sides soon discover there's a mole among them.",12.6262,/nT97ifVT2J1yMQmeq20Qblg61T.jpg,2006-10-04,False,False,8.16,16077,"Drama, Thriller, Crime"
False,/fYnEbgoNCxW9kL0IgOgtJb9JTBU.jpg,"27, 14",426063,Nosferatu,en,Nosferatu,"A gothic tale of obsession between a haunted young woman and the terrifying vampire infatuated with her, causing untold horror in its wake.",12.5807,/5qGIxdEO841C0tdY8vOdLoRVrr0.jpg,2024-12-25,False,False,6.706,3587,"Horror, Fantasy"
False,/xOCcp04PVGHuR3gBKzquBm9DMyP.jpg,9648,232078,Triple Crossed,en,Triple Crossed,"With a tour in Afghanistan behind him, war-torn Chris Jensen struggles to assimilate back to life in California. Drifting and living out of his car, he soon discovers that few are willing to deal with the remnants of a damaged career military man. Chris is self medicating; desperate to silence the echoes from the front lines. When an opportunity finally presents itself, he makes the hard decision to employ his most coveted talents honed in special ops. A job is a job and Chris knows civilian life can be just as cut-throat as time on active duty. But just how close does he have to get to Andrew Warner to secure the kill?",9.1031,/doK75PABYpMHqiiHFoOJsC0pAn0.jpg,2013-11-12,False,False,4.1,30,Mystery
False,/7S0bXv3BqCuPfImKRf5kkmBVYZR.jpg,"28, 12, 14",572802,Aquaman and the Lost Kingdom,en,Aquaman and the Lost Kingdom,"Black Manta seeks revenge on Aquaman for his father's death. Wielding the Black Trident's power, he becomes a formidable foe. To defend Atlantis, Arthur (Aquaman) forges an alliance with his imprisoned brother. They must protect the kingdom.",12.5306,/7lTnXOy0iNtBAdRP3TZvaKJ77F6.jpg,2023-12-20,False,False,6.526,3446,"Action, Adventure, Fantasy"
False,/iR79ciqhtaZ9BE7YFA1HpCHQgX4.jpg,"27, 9648, 10402",1100782,Smile 2,en,Smile 2,"About to embark on a new world tour, global pop sensation Skye Riley begins experiencing increasingly terrifying and inexplicable events. Overwhelmed by the escalating horrors and the pressures of fame, Skye is forced to face her dark past to regain control of her life before it spirals out of control.",12.8571,/ht8Uv9QPv9y7K0RvUyJIaXOZTfd.jpg,2024-10-16,False,False,6.591,2092,"Horror, Mystery, Music"
False,/4fLZUr1e65hKPPVw0R3PmKFKxj1.jpg,"16, 10751, 10749, 14, 35",976573,Elemental,en,Elemental,"In a city where fire, water, land and air residents live together, a fiery young woman and a go-with-the-flow guy will discover something elemental: how much they have in common.",12.8831,/4Y1WNkd88JXmGfhtWR7dmDAo1T2.jpg,2023-06-14,False,False,7.576,5245,"Animation, Family, Romance, Fantasy, Comedy"
False,/3nqxXZ7QixMeWoQD10cw6FZf277.jpg,"12, 35, 10751, 14",118,Charlie and the Chocolate Factory,en,Charlie and the Chocolate Factory,"A young boy wins a tour through the most magnificent chocolate factory in the world, led by the world's most unusual candy maker.",12.9315,/iKP6wg3c6COUe8gYutoGG7qcPnO.jpg,2005-07-13,False,False,7.038,16043,"Adventure, Comedy, Family, Fantasy"
False,/rQaHA74pevnGsxcKGaoZVGWe9TC.jpg,"16, 10751, 18, 10402, 14",508442,Soul,en,Soul,"Joe Gardner is a middle school teacher with a love for jazz music. After a successful audition at the Half Note Club, he suddenly gets into an accident that separates his soul from his body and is transported to the You Seminar, a center in which souls develop and gain passions before being transported to a newborn child. Joe must enlist help from the other souls-in-training, like 22, a soul who has spent eons in the You Seminar, in order to get back to Earth.",12.4932,/6jmppcaubzLF8wkXM36ganVISCo.jpg,2020-12-25,False,False,8.093,11331,"Animation, Family, Drama, Music, Fantasy"
False,/aC6wW62V6b0csr5iUnbOjYAqfhg.jpg,"18, 53, 9648",345,Eyes Wide Shut,en,Eyes Wide Shut,"After Dr. Bill Harford's wife, Alice, admits to having sexual fantasies about a man she met, Bill becomes obsessed with having a sexual encounter. He discovers an underground sexual group and attends one of their meetings -- and quickly discovers that he is in over his head.",12.6134,/knEIz1eNGl5MQDbrEAVWA7iRqF9.jpg,1999-07-16,False,False,7.487,6967,"Drama, Thriller, Mystery"
False,/yF1eOkaYvwiORauRCPWznV9xVvi.jpg,"28, 878, 12",298618,The Flash,en,The Flash,"When his attempt to save his family inadvertently alters the future, Barry Allen becomes trapped in a reality in which General Zod has returned and there are no Super Heroes to turn to. In order to save the world that he is in and return to the future that he knows, Barry's only hope is to race for his life. But will making the ultimate sacrifice be enough to reset the universe?",11.765,/rktDFPbfHfUbArZ6OOOKsXcv0Bm.jpg,2023-06-13,False,False,6.616,4935,"Action, Science Fiction, Adventure"
False,/q7vmCCmyiHnuKGMzHZlr0fD44b9.jpg,"10749, 14, 10751, 18",150689,Cinderella,en,Cinderella,"When her father unexpectedly passes away, young Ella finds herself at the mercy of her cruel stepmother and her daughters. Never one to give up hope, Ella's fortunes begin to change after meeting a dashing stranger in the woods.",14.5679,/j91LJmcWo16CArFOoapsz84bwxb.jpg,2015-03-06,False,False,6.823,7363,"Romance, Fantasy, Family, Drama"
False,/vVpEOvdxVBP2aV166j5Xlvb5Cdc.jpg,"28, 53, 80",458156,John Wick: Chapter 3 - Parabellum,en,John Wick: Chapter 3 - Parabellum,"Super-assassin John Wick returns with a $14 million price tag on his head and an army of bounty-hunting killers on his trail. After killing a member of the shadowy international assassin’s guild, the High Table, John Wick is excommunicado, but the world’s most ruthless hit men and women await his every turn.",12.9832,/ziEuG1essDuWuC5lpWUaw1uXY2O.jpg,2019-05-15,False,False,7.437,11640,"Action, Thriller, Crime"
False,/xj1Sv1xm4Y0ydBueGuf10Y9qM0O.jpg,18,489,Good Will Hunting,en,Good Will Hunting,"Will Hunting is a headstrong, working-class genius who is failing the lessons of life. After one too many run-ins with the law, Will's last chance is a psychology professor, who might be the only man who can reach him.",12.8811,/z2FnLKpFi1HPO7BEJxdkv6hpJSU.jpg,1997-12-05,False,False,8.16,13724,Drama
False,/mPfy2cQto2GoahuLeknwcrUcE8M.jpg,"53, 12, 28",80785,Amazon Jail,pt,Curral de Mulheres,"Young women in the Amazon are kidnapped by a ring of devil-worshipers, who plan to sell them as sex slaves. Some of the women escape, but are pursued into the jungle by their captors. The women must band together to turn the tables on their kidnappers.",14.9743,/ob0TfLdSvNvRCPM09a9E4iAbugX.jpg,1982-01-01,False,False,4.1,24,"Thriller, Adventure, Action"
False,/1TUg5pO1VZ4B0Q1amk3OlXvlpXV.jpg,"12, 18, 10751, 16",420818,The Lion King,en,The Lion King,"Simba idolizes his father, King Mufasa, and takes to heart his own royal destiny. But not everyone in the kingdom celebrates the new cub's arrival. Scar, Mufasa's brother—and former heir to the throne—has plans of his own. The battle for Pride Rock is ravaged with betrayal, tragedy and drama, ultimately resulting in Simba's exile. With help from a curious pair of newfound friends, Simba will have to figure out how to grow up and take back what is rightfully his.",13.8239,/dzBtMocZuJbjLOXvrl4zGYigDzh.jpg,2019-07-12,False,False,7.098,10706,"Adventure, Drama, Family, Animation"
False,/70Rm9ItxKuEKN8iu6rNjfwAYUCJ.jpg,"27, 53",760104,X,en,X,"In 1979, a group of young filmmakers set out to make an adult film in rural Texas, but when their reclusive, elderly hosts catch them in the act, the cast find themselves fighting for their lives.",11.5985,/lopZSVtXzhFY603E9OqF7O1YKsh.jpg,2022-03-17,False,False,6.718,3909,"Horror, Thriller"
False,/xEY0MV2jSQBz9iOJfCFvLTiPGMA.jpg,"53, 80",75656,Now You See Me,en,Now You See Me,An FBI agent and an Interpol detective track a team of illusionists who pull off bank heists during their performances and reward their audiences with the money.,13.3323,/tWsNYbrqy1p1w6K9zRk0mSchztT.jpg,2013-05-29,False,False,7.332,16683,"Thriller, Crime"
False,/1fpwEe2GvNjAq2MN2xxdifNZLBT.jpg,"27, 53",280092,Insidious: Chapter 3,en,Insidious: Chapter 3,"A twisted new tale of terror begins for a teenage girl and her family, and revealing more mysteries of the otherworldly realm, 'The Further'.",13.0153,/iDdGfdNvY1EX0uDdA4Ru77fwMfc.jpg,2015-05-28,False,False,6.282,3584,"Horror, Thriller"
False,/hwPnxzIgQFfXl5zP0Yh8bViCMzf.jpg,"14, 12, 28",57158,The Hobbit: The Desolation of Smaug,en,The Hobbit: The Desolation of Smaug,"The Dwarves, Bilbo and Gandalf have successfully escaped the Misty Mountains, and Bilbo has gained the One Ring. They all continue their journey to get their gold back from the Dragon, Smaug.",13.0782,/xQYiXsheRCDBA39DOrmaw1aSpbk.jpg,2013-12-11,False,False,7.577,14107,"Fantasy, Adventure, Action"
False,/tbbyUOh6Jd45hDun3kLyZkCttkI.jpg,"10749, 18",64641,Monika,it,La ragazzina,"Monika is young, beautiful and a virgin. She is only 16 years old, and, beside getting the attention of all her classmates, she also attracts older men. She has a relationship with a boy, Leo, but she doesn't know that he uses to pimp the girls he seduces to rich businessmen. One of Leo's client befriends Monika and becomes so obsessed that he pays Leo to get her. But Monika turns her attention to her art professor, unknowing that he too has his secrets.",12.4402,/y8Byo8Mwd1a9JwISWLYR0zVxA5.jpg,1974-02-28,False,False,4.5,19,"Romance, Drama"
False,/nG5zmbVeYlcDhckrPAe06fArywn.jpg,"10749, 878, 18",152601,Her,en,Her,"In the not so distant future, Theodore, a lonely writer, purchases a newly developed operating system designed to meet the user's every need. To Theodore's surprise, a romantic relationship develops between him and his operating system. This unconventional love story blends science fiction and romance in a sweet tale that explores the nature of love and the ways that technology isolates and connects us all.",12.7967,/eCOtqtfvn7mxGl6nfmq4b1exJRc.jpg,2013-12-18,False,False,7.84,15218,"Romance, Science Fiction, Drama"
False,/eENEf62tMXbhyVvdcXlnQz2wcuT.jpg,"878, 28, 12",580489,Venom: Let There Be Carnage,en,Venom: Let There Be Carnage,"After finding a host body in investigative reporter Eddie Brock, the alien symbiote must face a new enemy, Carnage, the alter ego of serial killer Cletus Kasady.",12.8596,/pzKsRuKLFmYrW5Q0q8E8G78Tcgo.jpg,2021-09-30,False,False,6.746,11110,"Science Fiction, Action, Adventure"
False,/bAFnjhweXxHUWjmFzMTuX12Ud3b.jpg,53,1199193,Pose,en,Pose,"Isolated in a grand country manor, a reclusive artist spends a passionate and paranoid weekend with his ex-lover, an obsessive fan, and a potential muse. Hoping to spark a new wave of artistic brilliance over the course of a few tumultuous days, filled with chaos and revelation not all of them will make it out alive.",12.8219,/qhyyyWrHUbl6QG4udAJj17CBa5.jpg,2026-02-25,False,False,6.29,31,Thriller
False,/iGBbWXmAIgpiWg9Mx2D2gLzbg4n.jpg,18,269955,Obsessed,ko,인간중독,"A secret, passionate affair happens in the summer of 1969 between Colonel Jin Pyeong, trapped in a loveless marriage with Soo Jin, and Jong Ga Heun, the Chinese-Korean wife of Captain Kyung Woo Jin.",12.8139,/fetCtoAvZShCk1nqAWZFuKZschR.jpg,2014-05-14,False,False,6.6,79,Drama
False,/oVa4o0C5Fa7G36qHY48n3KHGBDX.jpg,"27, 9648, 878",1091,The Thing,en,The Thing,A research team in Antarctica is hunted by a shape-shifting alien that assumes the appearance of its victims.,12.8089,/tzGY49kseSE9QAKk47uuDGwnSCu.jpg,1982-06-25,False,False,8.069,7842,"Horror, Mystery, Science Fiction"
False,/lAs4Y5a8Pi86xDwuv8cx2prOVI2.jpg,"12, 10751, 14, 10749",447277,The Little Mermaid,en,The Little Mermaid,"The youngest of King Triton’s daughters, and the most defiant, Ariel longs to find out more about the world beyond the sea, and while visiting the surface, falls for the dashing Prince Eric. With mermaids forbidden to interact with humans, Ariel makes a deal with the evil sea witch, Ursula, which gives her a chance to experience life on land, but ultimately places her life – and her father’s crown – in jeopardy.",12.799,/ym1dxyOk4jFcSl4Q2zmRrA5BEEN.jpg,2023-05-18,False,False,6.274,3284,"Adventure, Family, Fantasy, Romance"
False,/ok4ot3YbfDYZcINXf91JUfq3maB.jpg,"27, 9648, 80",176,Saw,en,Saw,"Two men wake up to find themselves shackled in a grimy, abandoned bathroom. As they struggle to comprehend their predicament, they discover a disturbing tape left behind by the sadistic mastermind known as Jigsaw. With a chilling voice and cryptic instructions, Jigsaw informs them that they must partake in a gruesome game in order to secure their freedom.",12.7986,/rLNSOudrayDBo1uqXjrhxcjODIC.jpg,2004-10-01,False,False,7.4,9983,"Horror, Mystery, Crime"
False,/wHdpSwLr0wUKRyG1CGzGjPSkyrK.jpg,"35, 10749, 18",1611398,Un hombre por semana,es,Un hombre por semana,A divorced woman reconstructs her life and opens herself to love. Her search for dating apps takes her through fun and unpredictable moments to discover self-love.,12.7978,/rHwOvosfDFRsjBihdh9dIHnMgbO.jpg,2026-01-08,False,False,7.346,52,"Comedy, Romance, Drama"
False,/egVj5Y9f79xPnyAQJmeDR0Uwow3.jpg,"53, 18, 10749",2251,Unfaithful,en,Unfaithful,A New York suburban couple's marriage goes dangerously awry when the wife indulges in an adulterous fling.,12.7966,/bjiHEhuiwhIygzjczbTPAA07cGc.jpg,2002-05-10,False,False,6.682,1695,"Thriller, Drama, Romance"
False,/tg4IgDUIP2FPAMHZIMo9UQSKoBS.jpg,"80, 28, 53",55846,Blitz,en,Blitz,A tough cop is dispatched to take down a serial killer who has been targeting police officers.,12.7896,/qjqmhhc7uLub22mhu4V6DjOBwXM.jpg,2011-05-20,False,False,6.18,1791,"Crime, Action, Thriller"
False,/pYgj8e2Y6RufnSyOA6OnzmxFXxZ.jpg,"27, 18, 9648",530385,Midsommar,en,Midsommar,"Several friends travel to Sweden to study as anthropologists a summer festival that is held every ninety years in the remote hometown of one of them. What begins as a dream vacation in a place where the sun never sets, gradually turns into a dark nightmare as the mysterious inhabitants invite them to participate in their disturbing festive activities.",12.7784,/7LEI8ulZzO5gy9Ww2NVCrKmHeDZ.jpg,2019-07-03,False,False,7.151,7990,"Horror, Drama, Mystery"
False,/cFcXilLbI7yjPIYB58AZiOyUnoh.jpg,"28, 12, 80",47971,xXx: Return of Xander Cage,en,xXx: Return of Xander Cage,"Xander Cage is left for dead after an incident, though he secretly returns to action for a new, tough assignment with his handler Augustus Gibbons.",12.7674,/hba8zREJpP1AYhaXgb2oJLQeO0K.jpg,2017-01-13,False,False,6.132,9202,"Action, Adventure, Crime"
False,/sKvQUSyqsFq8e1ts6oo3Xp3dPH2.jpg,"16, 12, 35, 14, 10751",585511,Luck,en,Luck,"Suddenly finding herself in the never-before-seen Land of Luck, the unluckiest person in the world must unite with the magical creatures there to turn her luck around.",12.749,/1HOYvwGFioUFL58UVvDRG6beEDm.jpg,2022-08-05,False,False,7.7,1931,"Animation, Adventure, Comedy, Fantasy, Family"
False,/uU1Mt4JWhDvl4vKb3AfxNsorkoM.jpg,"10751, 14, 10749",321612,Beauty and the Beast,en,Beauty and the Beast,A live-action adaptation of Disney's version of the classic tale of a cursed prince and a beautiful young woman who helps him break the spell.,12.7431,/hKegSKIDep2ewJWPUQD7u0KqFIp.jpg,2017-03-16,False,False,6.968,15964,"Family, Fantasy, Romance"
False,/o9puyKpayQoX8ikIaYtf2PfKv3.jpg,"28, 12, 35, 878",607,Men in Black,en,Men in Black,"After a police chase with an otherworldly being, a New York City cop is recruited as an agent in a top-secret organization established to monitor and police alien activity on Earth: the Men in Black. Agent K and new recruit Agent J find themselves in the middle of a deadly plot by an intergalactic terrorist who has arrived on Earth to assassinate two ambassadors from opposing galaxies.",12.7386,/uLOmOF5IzWoyrgIF5MfUnh5pa1X.jpg,1997-07-02,False,False,7.219,14740,"Action, Adventure, Comedy, Science Fiction"
False,/4ZZiOP4Imzv6ULF9QczvfQ1VdEO.jpg,"16, 28, 18, 878",1406657,Scarlet,ja,果てしなきスカーレット,"After failing to avenge her father's murder, Princess Scarlet, wakes up in the ""Land of the Dead."" In this world filled with madness, if she does not achieve her revenge against her nemesis and reach the ""No End Place,"" she will become ""Void"" and cease to exist. Can Scarlet find a way to live at the end of her endless journey?",12.6999,/2O2tOyS4kvO9GtFPHpWmbXvfRQv.jpg,2025-11-21,False,False,7.2,77,"Animation, Action, Drama, Science Fiction"
False,/qvyOfwTC3qdbzkqdXWSSEMHtjBZ.jpg,"18, 35, 10749",1064213,Anora,en,Anora,"A young sex worker from Brooklyn gets her chance at a Cinderella story when she meets and impulsively marries the son of an oligarch. Once the news reaches Russia, her fairytale is threatened as his parents set out to get the marriage annulled.",12.6912,/oN0o3owobFjePDc5vMdLRAd0jkd.jpg,2024-10-14,False,False,7.063,3089,"Drama, Comedy, Romance"
False,/3IFRjBDwtk0DlIsDfJ2zEzLjUBi.jpg,"10751, 16, 35, 12",82690,Wreck-It Ralph,en,Wreck-It Ralph,"Wreck-It Ralph is the 9-foot-tall, 643-pound villain of an arcade video game named Fix-It Felix Jr., in which the game's titular hero fixes buildings that Ralph destroys. Wanting to prove he can be a good guy and not just a villain, Ralph escapes his game and lands in Hero's Duty, a first-person shooter where he helps the game's hero battle against alien invaders. He later enters Sugar Rush, a kart racing game set on tracks made of candies, cookies and other sweets. There, Ralph meets Vanellope von Schweetz who has learned that her game is faced with a dire threat that could affect the entire arcade, and one that Ralph may have inadvertently started.",12.6873,/zWoIgZ7mgmPkaZjG0102BSKFIqQ.jpg,2012-11-01,False,False,7.355,13010,"Family, Animation, Comedy, Adventure"
False,/uIk2g2bRkNwNywKZIhC5oIU94Kh.jpg,"35, 10751, 14",787699,Wonka,en,Wonka,"Willy Wonka – chock-full of ideas and determined to change the world one delectable bite at a time – is proof that the best things in life begin with a dream, and if you’re lucky enough to meet Willy Wonka, anything is possible.",12.6777,/qhb1qOilapbapxWQn9jtRCMwXJF.jpg,2023-12-06,False,False,7.039,4344,"Comedy, Family, Fantasy"
