adult,backdrop_path,genre_ids,id,title,original_language,original_title,overview,popularity,poster_path,release_date,softcore,video,vote_average,vote_count,genre_names
False,/t35dVtLN4H12XXtipJfIDEy2h7Y.jpg,"18, 36",3291,"Good Night, and Good Luck.",en,"Good Night, and Good Luck.",The story of journalist Edward R. Murrow's stand against Senator Joseph McCarthy's anti-communist witch-hunts in the early 1950s.,10.2613,/w4QSEno2xxHqMtSr3mPUhJpO3F2.jpg,2005-09-16,False,False,7.071,1096,"Drama, History"
False,/k2ZdjMXmqnw4RJeh8cwxCvcznJZ.jpg,18,50014,The Help,en,The Help,"Aibileen Clark is a middle-aged African-American maid who has spent her life raising white children and has recently lost her only son; Minny Jackson is an African-American maid who has often offended her employers despite her family's struggles with money and her desperate need for jobs; and Eugenia ""Skeeter"" Phelan is a young white woman who has recently moved back home after graduating college to find out her childhood maid has mysteriously disappeared. These three stories intertwine to explain how life in Jackson, Mississippi revolves around ""the help""; yet they are always kept at a certain distance because of racial lines.",10.2529,/3kmfoWWEc9Vtyuaf9v5VipRgdjx.jpg,2011-08-09,False,False,8.197,8959,Drama
False,/sGEqHTylawwS6hwKultk1mKUjdB.jpg,"10749, 35",114,Pretty Woman,en,Pretty Woman,"Vivian is a carefree, streetwise diamond in the rough when she meets sophisticated billionaire Edward in a chance encounter that turns into a week-long business arrangement. But Vivian's energetic spirit challenges Edward's no-nonsense approach to life, and soon they are teaching each other – and falling in love!",10.239,/hVHUfT801LQATGd26VPzhorIYza.jpg,1990-03-23,False,False,7.447,8931,"Romance, Comedy"
False,/5gWhwqXKVXXtzFgxEmnQ7kAh0si.jpg,18,358083,The Paradise Suite,nl,The Paradise Suite,"The lives of six people, who seem to have nothing more in common than their faraway homelands, become inextricably linked in Amsterdam, the city they have chosen as their new home.",10.2272,/ZfRRNNfDdfeTYj8QD4EzIOCSi9.jpg,2015-10-29,False,False,6.4,28,Drama
False,/hfdds27YL5nTAhiOtjfNNxD3bJe.jpg,"16, 10751, 35, 12",80321,Madagascar 3: Europe's Most Wanted,en,Madagascar 3: Europe's Most Wanted,"Animal pals Alex, Marty, Melman, and Gloria are still trying to make it back to New York's Central Park Zoo. They are forced to take a detour to Europe to find the penguins and chimps who broke the bank at a Monte Carlo casino. When French animal-control officer Capitaine Chantel DuBois picks up their scent, Alex and company are forced to hide out in a traveling circus.",10.2261,/ekraj4ksvIKeuvQVEevEJkuybZd.jpg,2012-06-06,False,False,6.63,6524,"Animation, Family, Comedy, Adventure"
False,/sM42bpH73dmf3kJrE8xr4kztYqR.jpg,"878, 9648, 27",70981,Prometheus,en,Prometheus,"A team of explorers discover a clue to the origins of mankind on Earth, leading them on a journey to the darkest corners of the universe. There, they must fight a terrifying battle to save the future of the human race.",10.2225,/qsYQflQhOuhDpQ0W2aOcwqgDAeI.jpg,2012-05-30,False,False,6.594,13179,"Science Fiction, Mystery, Horror"
False,/r19pit61EI91tnOv7U4SxHhRPlN.jpg,"18, 36",1341137,A Great Awakening,en,A Great Awakening,One of the most defining moments in American history is the story of an unlikely friendship between the Reverend George Whitefield and Benjamin Franklin.,10.2158,/rd7BsFaHO7JaYlz3WHUvqHjgm60.jpg,2026-04-03,False,False,8.0,3,"Drama, History"
False,/4vSBj7BYsyuKCx96EJzGyp20WfY.jpg,"35, 27",593643,The Menu,en,The Menu,"A young couple travels to a remote island to eat at an exclusive restaurant where the chef has prepared a lavish menu, with some shocking surprises.",10.2052,/fPtUgMcLIboqlTlPrq0bQpKK8eq.jpg,2022-11-17,False,False,7.171,6091,"Comedy, Horror"
False,/5EKplo61HbA5sMGAN0XAvzdo1MX.jpg,"28, 53, 878",752,V for Vendetta,en,V for Vendetta,"In a world in which Great Britain has become a fascist state, a masked vigilante known only as “V” conducts guerrilla warfare against the oppressive British government. When V rescues a young woman from the secret police, he finds in her an ally with whom he can continue his fight to free the people of Britain.",10.2001,/piZOwjyk1g51oPHonc7zaQY3WOv.jpg,2006-02-23,False,False,7.899,15475,"Action, Thriller, Science Fiction"
False,/c5EmNhLQsTTKAyUHULnKYQjlloz.jpg,"27, 9648",41446,Scream 4,en,Scream 4,"Fifteen years after the original Woodsboro murders, Sidney Prescott returns home to promote her new book about surviving trauma, only for a new Ghostface killer to emerge, targeting a new group of teens.",10.1917,/g0YcSd5QpgGXOjg9tl0if0soOkE.jpg,2011-04-13,False,False,6.479,4138,"Horror, Mystery"
False,/5QEOy0QEpad9QsXeMxuGHPXMale.jpg,"28, 12, 14",76338,Thor: The Dark World,en,Thor: The Dark World,"Thor fights to restore order across the cosmos… but an ancient race led by the vengeful Malekith returns to plunge the universe back into darkness. Faced with an enemy that even Odin and Asgard cannot withstand, Thor must embark on his most perilous and personal journey yet, one that will reunite him with Jane Foster and force him to sacrifice everything to save us all.",10.1903,/wp6OxE4poJ4G7c0U2ZIXasTSMR7.jpg,2013-10-30,False,False,6.51,18243,"Action, Adventure, Fantasy"
False,/fuacZLpnohQtLD0AhtCErcPVL98.jpg,"10749, 35, 18",1259102,Eternity,en,Eternity,"In an afterlife where souls have one week to decide where to spend eternity, Joan is faced with the impossible choice between the man she spent her life with and her first love, who died young and has waited decades for her to arrive.",10.1902,/o8pg20G67BGmQvRkXwstNre062J.jpg,2025-11-26,False,False,6.997,608,"Romance, Comedy, Drama"
False,/jDvxsBemt2Iyslg7qn2WMzgxz23.jpg,"28, 53, 27, 9648",1375646,Colony,ko,군체,"Professor Se-jeong is thrust into a bloody nightmare when a rapidly mutating virus is released during a biotech conference causing authorities to seal the facility. Trapped inside with no escape, Se-jeong along with a small group of survivors must fight to stay alive while the infected undergo horrific transformations.",10.1785,/zc5vqIeqV0ShsbBQPqvhQ0LZpnn.jpg,2026-05-21,False,False,0.0,0,"Action, Thriller, Horror, Mystery"
False,/v23fWgJUEt8EMmvn19btIacxP8E.jpg,"10749, 14, 16",3933,Corpse Bride,en,Corpse Bride,"In a 19th-century European village, a young man about to be married is whisked away to the underworld and wed to a mysterious corpse bride, while his real bride waits bereft in the land of the living.",10.1782,/isb2Qow76GpqYmsSyfdMfsYAjts.jpg,2005-09-12,False,False,7.585,10112,"Romance, Fantasy, Animation"
False,/5jnoAA74Qwb5w6B9FMvnc20n6Ie.jpg,"28, 12",353081,Mission: Impossible - Fallout,en,Mission: Impossible - Fallout,"When an IMF mission ends badly, the world is faced with dire consequences. As Ethan Hunt takes it upon himself to fulfill his original briefing, the CIA begin to question his loyalty and his motives. The IMF team find themselves in a race against time, hunted by assassins while trying to prevent a global catastrophe.",10.1729,/AkJQpZp9WoNdj7pLYSj1L0RcMMN.jpg,2018-07-25,False,False,7.447,9074,"Action, Adventure"
False,/9IDJpHROaC0S1ZlIxrvzOcOX5yC.jpg,"10751, 35, 80, 16, 28",629542,The Bad Guys,en,The Bad Guys,"When the Bad Guys, a crew of criminal animals, are finally caught after years of heists and being the world’s most-wanted villains, Mr. Wolf brokers a deal to save them all from prison.",10.1709,/7qop80YfuO0BwJa1uXk1DXUUEwv.jpg,2022-03-17,False,False,7.527,2521,"Family, Comedy, Crime, Animation, Action"
False,/yBDvgpyynDsbMyK21FoQu1c2wYR.jpg,"9648, 80, 53",870028,The Accountant²,en,The Accountant²,"When an old acquaintance is murdered, Wolff is compelled to solve the case. Realizing more extreme measures are necessary, Wolff recruits his estranged and highly lethal brother, Brax, to help. In partnership with Marybeth Medina, they uncover a deadly conspiracy, becoming targets of a ruthless network of killers who will stop at nothing to keep their secrets buried.",10.17,/lUvfTcOZiK0sdcX0WNLPbMyKjGm.jpg,2025-04-23,False,False,7.062,1704,"Mystery, Crime, Thriller"
False,/8yPSYhooj8nyBbmV3GVdLDwuE7e.jpg,"18, 10749",1079091,It Ends with Us,en,It Ends with Us,"When a woman's first love suddenly reenters her life, her relationship with a charming, but abusive neurosurgeon is upended, and she realizes she must learn to rely on her own strength to make an impossible choice for her future.",10.167,/AjV6jFJ2YFIluYo4GQf13AA1tqu.jpg,2024-08-07,False,False,6.94,1895,"Drama, Romance"
False,/mXLVA0YL6tcXi6SJSuAh9ONXFj5.jpg,"878, 12, 10751, 14",601,E.T. the Extra-Terrestrial,en,E.T. the Extra-Terrestrial,"An alien is left behind on Earth and saved by the 10-year-old Elliott who decides to keep him hidden in his home. While a task force hunts for the extra-terrestrial, Elliott, his brother, and his little sister Gertie form an emotional bond with their new friend, and try to help him find his way home.",10.1642,/an0nD6uq6byfxXCfk6lQBzdL2J1.jpg,1982-06-11,False,False,7.513,11936,"Science Fiction, Adventure, Family, Fantasy"
False,/zoVeIgKzGJzpdG6Gwnr7iOYfIMU.jpg,"18, 10749",11216,Cinema Paradiso,it,Nuovo Cinema Paradiso,"A filmmaker recalls his childhood, when he fell in love with the movies at his village's theater and formed a deep friendship with the theater's projectionist.",10.1637,/gCI2AeMV4IHSewhJkzsur5MEp6R.jpg,1988-11-17,False,False,8.425,4793,"Drama, Romance"
False,/gAuUsA4orQIifYEHTueAjbOaKug.jpg,"16, 10751, 12",37135,Tarzan,en,Tarzan,"Tarzan was a small orphan who was raised by an ape named Kala since he was a child. He believed that this was his family, but on an expedition Jane Porter is rescued by Tarzan. He then finds out that he's human. Now Tarzan must make the decision as to which family he should belong to...",10.1613,/bTvHlcqiOjGa3lFtbrTLTM3zasY.jpg,1999-06-17,False,False,7.396,7281,"Animation, Family, Adventure"
False,/MrcSSzWGsXf2IUJpjPPFLlNbjX.jpg,"10751, 35, 12, 16",1280282,Gabby's Dollhouse: The Movie,en,Gabby's Dollhouse: The Movie,"Gabby heads out on a road trip with her Grandma Gigi to the urban wonderland of Cat Francisco. But when Gabby's dollhouse, her most prized possession, ends up in the hands of an eccentric cat lady named Vera, Gabby sets off on an adventure through the real world to get the Gabby Cats back together and save the dollhouse before it's too late.",10.1522,/t6LLguAmu6iZUN8pWhT7Q0IcaQ5.jpg,2025-09-13,False,False,6.8,65,"Family, Comedy, Adventure, Animation"
False,/qe4Tp0hURXqiih5AV1kHimXIt3u.jpg,"28, 80",414419,Kill Bill: The Whole Bloody Affair,en,Kill Bill: The Whole Bloody Affair,"A former assassin, known simply as The Bride, wakes from a coma four years after her jealous ex-lover Bill attempts to murder her on her wedding day. Fueled by an insatiable desire for revenge, she vows to get even with every person who contributed to the loss of her unborn child, her entire wedding party, and four years of her life. After devising a hit list, The Bride sets off on her quest, enduring unspeakable injury and unscrupulous enemies.",10.1418,/nSOJfWJCdVFZQwXQA7RXn7FIIiY.jpg,2011-03-27,False,False,8.1,1220,"Action, Crime"
False,/jzzpCJWkVZZwAxzzLmtYN0MBWFd.jpg,"27, 9648",986097,HIM,en,HIM,"After suffering a potentially career-ending brain trauma, Cameron Cade receives a lifeline when his hero, legendary eight-time Championship quarterback and cultural megastar Isaiah White, offers to train Cam at Isaiah's isolated compound that he shares with his celebrity influencer wife. But as Cam's training accelerates, Isaiah's charisma begins to curdle into something darker.",10.1417,/qPJzcYR2f1O1uynYBCVPPJuOiAH.jpg,2025-09-18,False,False,5.662,354,"Horror, Mystery"
False,/3zCPI4JFc54xvLaJ71oI2KoP3az.jpg,"80, 9648, 53",1949,Zodiac,en,Zodiac,"Over the course of a decade, editors of the San Francisco Chronicle entice themselves in the murders of the Zodiac Killer. However, as time runs its course, interest in the case dwindles in the eyes of the professionals. The Killer stops interacting with the public. However, believing he has the answers, an amateur cartoonist from the initial sightings races against time to prevent what he believes is another murder.",10.1354,/6YmeO4pB7XTh8P8F960O1uA14JO.jpg,2007-03-02,False,False,7.529,11473,"Crime, Mystery, Thriller"
False,/eBSdeXfqDXFRUVDompUsXh23ljx.jpg,18,950891,The Sales Girl,mn,Худалдагч Охин,"Saruul, a science student, is asked by an injured classmate Namuunaa to work part-time as a substitute in an adult goods store for a month. Katya, the Russian owner, a former ballet dancer who lives an elegant life on her own, realizes that Saruul, who comes daily to deliver the proceeds, has been suppressing herself against her parents' expectations, and tries to release her secret desires and sexual curiosity. Saruul, who lives with her family with little change in her life except for the evenings when she paints her favorite pictures, is exposed to a new world through her interaction with Katya, who has a wealth of life experience, but one incident leads to a growing distrust...",10.1334,/nKPPKN4QWXv4DdmCy6LdUl6xZTI.jpg,2023-11-15,False,False,0.0,0,Drama
False,/8AAuJtCzaibYkbE0QVHc8EBsELB.jpg,"14, 28, 12, 16, 10751",82702,How to Train Your Dragon 2,en,How to Train Your Dragon 2,"Five years after uniting the dragons and Vikings of Berk, Hiccup and Toothless soar beyond their homeland, charting the vast unknown. During one of their adventures, the pair discover a secret cave that houses hundreds of wild dragons -- and a mysterious dragon rider with a startling connection to Hiccup. And as the ruthless dragon conqueror Drago Bludvist rises to seize control of both dragons and people alike, Hiccup must step into his role as a true leader and, alongside his friends and Toothless, protect Berk from a devastating war.",10.131,/d13Uj86LdbDLrfDoHR5aDOFYyJC.jpg,2014-06-05,False,False,7.679,10360,"Fantasy, Action, Adventure, Animation, Family"
False,/4V1yIoAKPMRQwGBaSses8Bp2nsi.jpg,"28, 878",137113,Edge of Tomorrow,en,Edge of Tomorrow,"Major Bill Cage is an officer who has never seen a day of combat when he is unceremoniously demoted and dropped into combat. Cage is killed within minutes, managing to take an alpha alien down with him. He awakens back at the beginning of the same day and is forced to fight and die again... and again - as physical contact with the alien has thrown him into a time loop.",10.1288,/nBM9MMa2WCwvMG4IJ3eiGUdbPe6.jpg,2014-05-27,False,False,7.637,14946,"Action, Science Fiction"
False,/fwrqW8Lp5VQuppFrODd4iJ8LySE.jpg,"28, 12",335787,Uncharted,en,Uncharted,"A young street-smart, Nathan Drake and his wisecracking partner Victor “Sully” Sullivan embark on a dangerous pursuit of “the greatest treasure never found” while also tracking clues that may lead to Nathan’s long-lost brother.",10.1283,/rJHC1RUORuUhtfNb4Npclx0xnOf.jpg,2022-02-10,False,False,6.867,6721,"Action, Adventure"
False,/oG9dcGSSu13fjFp1Uly15ZXjRKV.jpg,"16, 10751, 14, 12, 35, 10749",11970,Hercules,en,Hercules,"Bestowed with superhuman strength, a young mortal named Hercules sets out to prove himself a hero in the eyes of his father, the great god Zeus. Along with his friends Pegasus, a flying horse, and Phil, a personal trainer, Hercules is tricked by the hilarious, hotheaded villain Hades, who's plotting to take over Mount Olympus!",10.1279,/dK9rNoC97tgX3xXg5zdxFisdfcp.jpg,1997-06-13,False,False,7.491,7878,"Animation, Family, Fantasy, Adventure, Comedy, Romance"
False,/8IGO8rF5asa7tnO0aEtx3e5R4Z5.jpg,"35, 10749",11631,Mamma Mia!,en,Mamma Mia!,A spirited young bride-to-be living with her single mother on a small Greek island secretly invites three of her mother's ex-boyfriends in hope of finding her biological father to walk her down the aisle.,10.1228,/zdUA4FNHbXPadzVOJiU0Rgn6cHR.jpg,2008-07-03,False,False,6.973,6955,"Comedy, Romance"
False,/8YNNyQiPZlF9qv5EGOUK20mnXVk.jpg,"28, 878, 53",262500,Insurgent,en,Insurgent,Beatrice Prior must confront her inner demons and continue her fight against a powerful alliance which threatens to tear her society apart.,10.1226,/dP5Fb6YRfzmCQtRbHOr2kO7tJW9.jpg,2015-03-18,False,False,6.36,10391,"Action, Science Fiction, Thriller"
False,/en3GU5uGkKaYmSyetHV4csHHiH3.jpg,"10752, 28, 18",929590,Civil War,en,Civil War,"In the near future, a group of war journalists attempt to survive while reporting the truth as the United States stands on the brink of civil war.",10.1134,/sh7Rg8Er3tFcN9BpKIPOMvALgZd.jpg,2024-04-10,False,False,6.856,4261,"War, Action, Drama"
False,/y42MEf1rvoLEWYEyNuOADxQ6MQ7.jpg,"18, 80",4982,American Gangster,en,American Gangster,"Loosely based on the criminal career of Frank Lucas, a gangster from La Grange, North Carolina, who smuggled heroin into the United States on American service planes returning from the Vietnam War, before being detained by a task force led by Newark Detective Richie Roberts.",10.1013,/sX9idXDqRUxE5ffww3n3RV5gL55.jpg,2007-11-02,False,False,7.589,5981,"Drama, Crime"
False,/9UAKA6ceZi6TgQwTAAMt7DWwYPI.jpg,18,7345,There Will Be Blood,en,There Will Be Blood,"Ruthless silver miner, turned oil prospector, Daniel Plainview, moves to oil-rich California. Using his son to project a trustworthy, family-man image, Plainview cons local landowners into selling him their valuable properties for a pittance. However, local preacher Eli Sunday suspects Plainview's motives and intentions, starting a slow-burning feud that threatens both their lives.",10.0975,/fa0RDkAlCec0STeMNAhPaF89q6U.jpg,2007-12-26,False,False,8.077,7367,Drama
False,/o1l6OCqA3pYDZHIc5L1s7CEzCMv.jpg,"28, 35, 878",608,Men in Black II,en,Men in Black II,"Kay and Jay reunite to provide our best, last and only line of defense against a sinister seductress who levels the toughest challenge yet to the MIB's untarnished mission statement – protecting Earth from the scum of the universe. It's been four years since the alien-seeking agents averted an intergalactic disaster of epic proportions. Now it's a race against the clock as Jay must convince Kay – who not only has absolutely no memory of his time spent with the MIB, but is also the only living person left with the expertise to save the galaxy – to reunite with the MIB before the earth submits to ultimate destruction.",10.0732,/enA22EPyzc2WQ1VVyY7zxresQQr.jpg,2002-07-03,False,False,6.383,10591,"Action, Comedy, Science Fiction"
False,/bInicBgSHfQiWLbnRT5jxw9Grvm.jpg,"12, 53, 878",74,War of the Worlds,en,War of the Worlds,"Ray Ferrier is a divorced dockworker and less-than-perfect father. Soon after his ex-wife and her new husband drop off his teenage son and young daughter for a rare weekend visit, a strange and powerful lightning storm touches down.",10.0661,/6Biy7R9LfumYshur3YKhpj56MpB.jpg,2005-06-28,False,False,6.535,9102,"Adventure, Thriller, Science Fiction"
False,/iFaWUETEE2umP1WY0LUAmjSpzm7.jpg,"28, 35, 18, 53",787,Mr. & Mrs. Smith,en,Mr. & Mrs. Smith,"A husband and wife struggle to keep their marriage alive until they realize they are both secretly working as assassins. Now, their respective assignments require them to kill each other.",10.0558,/kjD700RtyhveN3ZbOnSvUSne0Qj.jpg,2005-06-07,False,False,6.691,11147,"Action, Comedy, Drama, Thriller"
False,/iwvP8XVpYVmJ3xfF9xdBi5uAOWl.jpg,"80, 18, 53, 28",75780,Jack Reacher,en,Jack Reacher,"One morning in an ordinary town, five people are shot dead in a seemingly random attack. All evidence points to a single suspect: an ex-military sniper who is quickly brought into custody. The interrogation yields one written note: 'Get Jack Reacher!'. Reacher, an enigmatic ex-Army investigator, believes the authorities have the right man but agrees to help the sniper's defense attorney. However, the more Reacher delves into the case, the less clear-cut it appears. So begins an extraordinary chase for the truth, pitting Jack Reacher against an unexpected enemy, with a skill for violence and a secret to keep.",10.053,/uQBbjrLVsUibWxNDGA4Czzo8lwz.jpg,2012-12-20,False,False,6.66,7578,"Crime, Drama, Thriller, Action"
False,/woos7rldBAKG99HmcbNZNpMjwNk.jpg,"10749, 878, 35",1209511,Love Insurance Kompany,ta,லவ் இன்சூரன்ஸ் கம்பெனி,"In 2040, an app premised on ensuring romance for all is used widely by the population. When the voice behind the app's AI realizes its misconception to true love, he embarks on a quest to prove that love does not come from a screen.",10.045,/dHEuGKZBkEx4RcaVV8rYahORNPA.jpg,2026-04-10,False,False,5.5,3,"Romance, Science Fiction, Comedy"
False,/fyCKlwarO3Yd6Ikv3EJdvRdp43b.jpg,"16, 10751, 18, 14",1500099,Versa,en,Versa,"A young couple looking to start a family who experience emotions—from grief and loss to ultimate joy—as they embark on an ethereal, abstract, and imaginative cosmic dance of life.",10.0322,/p2zKN6Ic81C1UbLbnak4dZ2wABl.jpg,2025-04-15,False,False,7.774,31,"Animation, Family, Drama, Fantasy"
False,/qzUIOTk0E3F1zjvYjcBRTKUTgf9.jpg,"80, 35, 28, 12",207703,Kingsman: The Secret Service,en,Kingsman: The Secret Service,The story of a super-secret spy organization that recruits an unrefined but promising street kid into the agency's ultra-competitive training program just as a global threat emerges from a twisted tech genius.,10.0217,/r6q9wZK5a2K51KFj4LWVID6Ja1r.jpg,2015-01-24,False,False,7.619,17736,"Crime, Comedy, Action, Adventure"
False,/yOFqBpJ0PEkBdQqalDEaeOiaKbz.jpg,"28, 80, 53",1267319,Mantis,ko,사마귀,"The secret society of contract killers falls into chaos, unleashing a new breed of assassins. With old rules in ruins, who dares claim the shadows?",10.0152,/x6WLRwwddFKattMseWL3m7Geskd.jpg,2025-09-25,False,False,6.331,160,"Action, Crime, Thriller"
False,/kJaRWmy1BGq3pHyE94LOTteiHer.jpg,"28, 18, 9648, 53",2501,The Bourne Identity,en,The Bourne Identity,"Wounded to the brink of death and suffering from amnesia, Jason Bourne is rescued at sea by a fisherman. With nothing to go on but a Swiss bank account number, he starts to reconstruct his life, but finds that many people he encounters want him dead. However, Bourne realizes that he has the combat and mental skills of a world-class spy—but who does he work for?",10.0132,/aP8swke3gmowbkfZ6lmNidu0y9p.jpg,2002-06-14,False,False,7.474,10014,"Action, Drama, Mystery, Thriller"
False,/9FeYBZDvNTh4ZmweekJvwyIxIiL.jpg,35,8467,Dumb and Dumber,en,Dumb and Dumber,"Lloyd and Harry are two men whose stupidity is really indescribable. When Mary, a beautiful woman, loses an important suitcase with money before she leaves for Aspen, the two friends (who have found the suitcase) decide to return it to her. After some ""adventures"" they finally get to Aspen where, using the lost money they live it up and fight for Mary's heart.",10.0112,/4LdpBXiCyGKkR8FGHgjKlphrfUc.jpg,1994-12-16,False,False,6.651,6669,Comedy
False,/dfkE2LppPbJ1qUzi3tdND5iuMFp.jpg,"35, 80",10607,Don't Be a Menace to South Central While Drinking Your Juice in the Hood,en,Don't Be a Menace to South Central While Drinking Your Juice in the Hood,"When Ashtray moves to South Central L.A. to live with his father (who appears to be the same age he is) and grandmother (who likes to talk tough and smoke reefer), he falls in with his gang-banging cousin Loc Dog, who along with the requisite pistols and Uzi carries a thermo-nuclear warhead for self-defense. Will Ashtray be able to keep living the straight life?",10.0016,/HZQBF7JDd2e9p4rPSbSHuWHaCC.jpg,1996-01-12,False,False,7.019,1486,"Comedy, Crime"
False,/kFI1oF6KVnLEbUT7yLIbKXeyvu.jpg,"28, 12, 878",602,Independence Day,en,Independence Day,"Strange phenomena surface around the globe. The skies ignite. Terror races through the world's major cities. As these extraordinary events unfold, it becomes increasingly clear that a force of incredible magnitude has arrived. Its mission: total annihilation over the Fourth of July weekend. The last hope to stop the destruction is an unlikely group of people united by fate and unimaginable circumstances.",10.0007,/p0BPQGSPoSa8Ml0DAf2mB2kCU0R.jpg,1996-06-25,False,False,6.9,10342,"Action, Adventure, Science Fiction"
False,/sra8XnL96OyLHENcglmZJg6HA8z.jpg,"12, 28, 53",954,Mission: Impossible,en,Mission: Impossible,"When Ethan Hunt, the leader of a crack espionage team whose perilous operation has gone awry with no explanation, discovers that a mole has penetrated the CIA, he's surprised to learn that he's the prime suspect. To clear his name, Hunt now must ferret out the real double agent and, in the process, even the score.",9.9944,/l5uxY5m5OInWpcExIpKG6AR3rgL.jpg,1996-05-22,False,False,7.024,9909,"Adventure, Action, Thriller"
False,/2l9yXhNtLC5SHa81m3MtLfpoXTr.jpg,"99, 10770, 14",259910,Marvel Studios: Assembling a Universe,en,Marvel Studios: Assembling a Universe,"A look at the story behind Marvel Studios and the Marvel Cinematic Universe, featuring interviews and behind-the-scenes footage from all of the Marvel films, the Marvel One-Shots and ""Marvel's Agents of S.H.I.E.L.D.""!",9.988,/41Ke02UzYoPsiTc3YbomPGiQKMl.jpg,2014-03-18,False,False,6.925,167,"Documentary, TV Movie, Fantasy"
False,/6LVSrgm83UYWlrLTCVGmWhFKYO0.jpg,"27, 53, 18",474350,It Chapter Two,en,It Chapter Two,"27 years after overcoming the malevolent supernatural entity Pennywise, the former members of the Losers' Club, who have grown up and moved away from Derry, are brought back together by a devastating phone call.",9.9862,/zfE0R94v1E8cuKAerbskfD3VfUt.jpg,2019-09-04,False,False,6.837,9550,"Horror, Thriller, Drama"
False,/i4ZougHEyBAboDpi6jsaTUDTjUl.jpg,"14, 53, 28, 12, 27",282035,The Mummy,en,The Mummy,"Though safely entombed in a crypt deep beneath the unforgiving desert, an ancient queen whose destiny was unjustly taken from her is awakened in our current day, bringing with her malevolence grown over millennia, and terrors that defy human comprehension.",9.983,/zxkY8byBnCsXodEYpK8tmwEGXBI.jpg,2017-06-06,False,False,5.517,7600,"Fantasy, Thriller, Action, Adventure, Horror"
