adult,backdrop_path,genre_ids,id,original_language,original_title,overview,popularity,poster_path,release_date,title,video,vote_average,vote_count,genre_names
False,/8jeDyvFQKgss36FbGAmGQVzPXlH.jpg,"53, 28, 35",1151334,en,Eenie Meanie,A former teenage getaway driver gets dragged back into her unsavory past when a former employer offers her a chance to save the life of her chronically unreliable ex-boyfriend.,13.1692,/12Va3oO3oYUdOd75zM57Nx1976a.jpg,2025-08-21,Eenie Meanie,False,6.304,293,"Thriller, Action, Comedy"
False,/4MCKNAc6AbWjEsM2h9Xc29owo4z.jpg,"28, 80, 53",866398,en,The Beekeeper,One man's campaign for vengeance takes on national stakes after he is revealed to be a former operative of a powerful and clandestine organization known as Beekeepers.,13.1568,/A7EByudX0eOzlkQ2FIbogzyazm2.jpg,2024-01-08,The Beekeeper,False,7.248,4062,"Action, Crime, Thriller"
False,/q9ff80fha6CtuABJtkQvx7woJFc.jpg,"28, 53",1613798,es,Venganza,"The brutal murder of the wife of “Toro,” a military hero in the special forces, turns him into a man with a single purpose: revenge. After a stroke of fate makes him a millionaire, Carlos transforms his fortune into an arsenal and, together with his closest soldiers, sets out to hunt down those responsible.",13.1506,/ggJGx8fwwy21gEIXYusIlHcUn8z.jpg,2026-02-26,Venganza,False,8.0,2,"Action, Thriller"
False,/n3VpgjdOB1DkHSUe1DbFzV8ncpJ.jpg,"14, 28, 53, 878",8698,en,The League of Extraordinary Gentlemen,"To prevent a world war from breaking out, famous characters from Victorian literature band together to do battle against a cunning villain.",13.1499,/kdAuVFP63XXxnb983ry2pLCKd9S.jpg,2003-07-11,The League of Extraordinary Gentlemen,False,5.975,4289,"Fantasy, Action, Thriller, Science Fiction"
False,,"35, 10749, 18",194043,en,The Politician's Love Story,"A haughty politician, on seeing a satirical cartoon in a newspaper, rushes to the paper's offices to shoot the cartoonist. On discovering the cartoonist is a pretty woman, he falls instantly in love and wastes no time in trying to woo her.",13.1158,/1H1eJP0ZCTO0C2VHvkBubxHOST5.jpg,1909-02-21,The Politician's Love Story,False,4.3,3,"Comedy, Romance, Drama"
False,/3upCfjjXjg1MrYMUoVceaHPcRCQ.jpg,99,1640697,en,Diabolical: The Epstein Files,It's the scandal that has shocked Americans and rocked the Trump administration. A legal and political saga that has shattered fundamental beliefs that all are equal in the eyes of the law. What do the Epstein Files reveal?,13.1122,/wFXoZsIqEZPpJgdDlJdFFzWplhk.jpg,2026-03-02,Diabolical: The Epstein Files,False,0.0,0,Documentary
False,/aJn9XeesqsrSLKcHfHP4u5985hn.jpg,"878, 12, 28",283995,en,Guardians of the Galaxy Vol. 2,The Guardians must fight to keep their newfound family together as they unravel the mysteries of Peter Quill's true parentage.,13.1122,/y4MBh0EjBlMuOzv9axM4qJlmhzz.jpg,2017-04-19,Guardians of the Galaxy Vol. 2,False,7.609,22715,"Science Fiction, Adventure, Action"
False,/xM0MAjNltCiLZnlwZTbkQdDXsAI.jpg,"27, 18",870110,en,Shot in the Dark,"Two years ago, William Langston made a mistake that would affect the course of his life. Now, with a killer loose in his home town and his circle of friends falling away one at a time, William faces his greatest fears as well as his own mortality.",13.0988,/lR0kW9ljONCIf2LJXb3rsCsdfxW.jpg,2021-10-10,Shot in the Dark,False,4.4,10,"Horror, Drama"
False,/1DTIRhw4cpLJlHlrPPbKzq6amHc.jpg,"28, 18, 36",1185528,zh,射雕英雄传：侠之大者,"Under Genghis Khan, the Mongolian army pushes west to destroy the Jin Dynasty, setting its sights on the Song Dynasty next. Amid internal conflicts among martial arts schools, Guo Jing unites the Central Plains' warriors to defend Xiangyang, embodying courage and loyalty in the fight for the nation.",13.0871,/fUCFEGFlMIFet9ja72JDAeG1he8.jpg,2025-01-29,Legends of the Condor Heroes: The Gallants,False,6.9,82,"Action, Drama, History"
False,/85k0kaoRgGmF6ACq0M61AFxhjLN.jpg,"35, 80",12153,en,White Chicks,"Two FBI agent brothers, Marcus and Kevin Copeland, accidentally foil a drug bust. To avoid being fired they accept a mission escorting a pair of socialites to the Hamptons--but when the girls are disfigured in a car accident, they refuse to go. Left without options, Marcus and Kevin decide to pose as the sisters, transforming themselves from black men into rich white women.",13.0583,/aHTUpo45qy9QYIOnVITGGqLoVcA.jpg,2004-06-23,White Chicks,False,6.9,4425,"Comedy, Crime"
False,/i1yf91svRHX45l9BXL8rVFzLoPH.jpg,"27, 53, 12",578,en,Jaws,"When the seaside community of Amity finds itself under attack by a dangerous great white shark, the town's chief of police, a young marine biologist, and a grizzled shark hunter embark on a desperate quest to kill the beast before it strikes again.",13.0355,/tjbLSFwi0I3phZwh8zoHWNfbsEp.jpg,1975-06-20,Jaws,False,7.679,11364,"Horror, Thriller, Adventure"
False,/2XSeKDmIa2KxaiJy4J9e8FrIZhk.jpg,"10751, 35, 16, 878, 80",20352,en,Despicable Me,"Gru is a supervillain determined to prove he’s the greatest by stealing the Moon. To pull off his plan, he adopts three orphaned girls—Margo, Edith, and Agnes—intending to use them as part of his scheme. However, as Gru bonds with the girls, his cold, villainous exterior begins to melt.",13.0307,/b1BT309QWjtFUlJPLmXmrcHOWEL.jpg,2010-07-08,Despicable Me,False,7.256,15894,"Family, Comedy, Animation, Science Fiction, Crime"
False,/zdXnJqBaGFVtLoPNuMeKfEYUViZ.jpg,"10749, 18",11036,en,The Notebook,"An epic love story centered around an older man who reads aloud to a woman with Alzheimer's. From a faded notebook, the old man's words bring to life the story about a couple who is separated by World War II, and is then passionately reunited, seven years later, after they have taken different paths.",13.0291,/rNzQyW4f8B8cQeg7Dgj3n6eT5k9.jpg,2004-06-25,The Notebook,False,7.888,12380,"Romance, Drama"
False,/cEsnLkTCJ4jh9Oym7nPAPGnOMm3.jpg,"18, 53, 80",379,en,Miller's Crossing,"Set in 1929, a political boss and his advisor have a parting of the ways when they both fall for the same woman.",13.0185,/i83gYdglRCjCRLSsmCk5nRWRmDM.jpg,1990-09-21,Miller's Crossing,False,7.45,1813,"Drama, Thriller, Crime"
False,/jCvkDqWWBrgxf9R3DrtJ6GpqXse.jpg,"28, 12, 878",14161,en,2012,"Dr. Adrian Helmsley, part of a worldwide geophysical team investigating the effect on the earth of radiation from unprecedented solar storms, learns that the earth's core is heating up. He warns U.S. President Thomas Wilson that the crust of the earth is becoming unstable and that without proper preparations for saving a fraction of the world's population, the entire race is doomed. Meanwhile, writer Jackson Curtis stumbles on the same information. While the world's leaders race to build ""arks"" to escape the impending cataclysm, Curtis struggles to find a way to save his family. Meanwhile, volcanic eruptions and earthquakes of unprecedented strength wreak havoc around the world.",13.0158,/c2PkTPT5D9zB8SIm5wNlDAANEqM.jpg,2009-10-10,2012,False,5.869,12587,"Action, Adventure, Science Fiction"
False,/wru4lC7aK4BYJzxAOoDI0vlfXL7.jpg,"18, 10749",10644,en,The Unbearable Lightness of Being,"Successful surgeon Tomas leaves Prague for an operation, meets a young photographer named Tereza, and brings her back with him. Tereza is surprised to learn that Tomas is already having an affair with the bohemian Sabina, but when the Soviet invasion occurs, all three flee to Switzerland. Sabina begins an affair, Tom continues womanizing, and Tereza, disgusted, returns to Czechoslovakia. Realizing his mistake, Tomas decides to chase after her.",13.0152,/g1kPEwATsCI8DnGx6ViAhUVKQSI.jpg,1988-02-05,The Unbearable Lightness of Being,False,6.9,506,"Drama, Romance"
False,/mFDQ8f2lPHorGwtuE0fjnUIbKLF.jpg,35,62029,it,Bingo Bongo,"The ape-man, found somewhere in the jungles of Congo, transferred to Milan and named Bingo Bongo. The only one who believes in the human qualities of him is Laura, a woman anthropologist , so their affection for each other even grows to love.",13.0009,/5ve4VuCwi7Xas5s50ynEB7uFjM2.jpg,1982-12-23,Bingo Bongo,False,5.735,170,Comedy
False,/4fLZUr1e65hKPPVw0R3PmKFKxj1.jpg,"10751, 14, 35, 10749, 16",976573,en,Elemental,"In a city where fire, water, land and air residents live together, a fiery young woman and a go-with-the-flow guy will discover something elemental: how much they have in common.",12.992,/4Y1WNkd88JXmGfhtWR7dmDAo1T2.jpg,2023-06-14,Elemental,False,7.58,5186,"Family, Fantasy, Comedy, Romance, Animation"
False,/yJyZRrXaYUjhOrJGga8awbw4Rud.jpg,"12, 14, 10749, 10751",420817,en,Aladdin,A kindhearted street urchin named Aladdin embarks on a magical adventure after finding a lamp that releases a wisecracking genie while a power-hungry Grand Vizier vies for the same lamp that has the power to make their deepest wishes come true.,12.9903,/ykUEbfpkf8d0w49pHh0AD2KrT52.jpg,2019-05-22,Aladdin,False,7.087,10523,"Adventure, Fantasy, Romance, Family"
False,/mufF1aYvwdpKerhq5R1YrVcbJLY.jpg,"27, 53, 9648",539,en,Psycho,"When larcenous real estate clerk Marion Crane goes on the lam with a wad of cash and hopes of starting a new life, she ends up at the notorious Bates Motel, where manager Norman Bates cares for his housebound mother.",12.9802,/yz4QVqPx3h1hD1DfqqQkCq3rmxW.jpg,1960-06-22,Psycho,False,8.415,10859,"Horror, Thriller, Mystery"
False,/5XIRL45dcc44GKkcKTzRXsRuxaR.jpg,99,1014779,en,The Figo Affair: The Transfer That Changed Football,This documentary spotlights one of the most contentious deals in football history and the extraordinary player at the center of the storm: Luís Figo.,12.9461,/cmUmwFRrgQguSPPut2SYzwNEQEY.jpg,2022-08-25,The Figo Affair: The Transfer That Changed Football,False,6.953,107,Documentary
False,/aQCCpAIdWAp6wyFgjMry4okwrZo.jpg,"27, 53",138843,en,The Conjuring,"Paranormal investigators Ed and Lorraine Warren work to help a family terrorized by a dark presence in their farmhouse. Forced to confront a powerful entity, the Warrens find themselves caught in the most terrifying case of their lives.",12.9428,/wVYREutTvI2tmxr6ujrHT704wGF.jpg,2013-07-18,The Conjuring,False,7.537,12549,"Horror, Thriller"
False,/qFvCT6nKMGGDBHaKw0XV1061VWH.jpg,"53, 27",17692,en,Jaws 3-D,A giant thirty-five-foot shark becomes trapped in a SeaWorld theme park and it's up to the sons of police chief Brody to rescue everyone.,12.9422,/kqDXj53F9paqVGJLGfHtz7giJ3s.jpg,1983-07-22,Jaws 3-D,False,4.473,1396,"Thriller, Horror"
False,/8P7DLHSqtuGX5hzWfRHXnU5Pov0.jpg,"27, 9648",1480387,en,undertone,The host of a popular paranormal podcast becomes haunted by terrifying recordings mysteriously sent her way.,12.9333,/1wREWUEHzjDWSreNFbFLDO7YEaM.jpg,2026-03-12,undertone,False,4.6,5,"Horror, Mystery"
False,/1lKwXYaZ9hxro6cIuuaOkqdaAdS.jpg,35,1195988,en,Matt Rife: Natural Selection,"From his problem with protection crystals to his beef with social media trolls, comedian Matt Rife holds nothing back in this rollicking stand-up special.",12.9332,/hnSCLaB4phSI2B4I3ErUlQ1IGLN.jpg,2023-11-15,Matt Rife: Natural Selection,False,6.1,40,Comedy
False,/9XhZhoSnFJ3AjpfzdIiZVHLQIS4.jpg,"28, 35, 80, 14",9470,cn,功夫,"It's the 1940s, and the notorious Axe Gang terrorizes Shanghai. Small-time criminals Sing and Bone hope to join, but they only manage to make lots of very dangerous enemies. Fortunately for them, kung fu masters and hidden strength can be found in unlikely places. Now they just have to take on the entire Axe Gang.",12.9314,/exbyTbrvRUDKN2mcNEuVor4VFQW.jpg,2004-02-10,Kung Fu Hustle,False,7.483,3100,"Action, Comedy, Crime, Fantasy"
False,/1m1c5gIWWkb1FEC9lzsoXHhhs7b.jpg,"28, 18, 36, 10752",197,en,Braveheart,"Enraged at the slaughter of Murron, his new bride and childhood love, Scottish warrior William Wallace slays a platoon of the local English lord's soldiers. This leads the village to revolt and, eventually, the entire country to rise up against English rule.",12.9304,/or1gBugydmjToAEq7OZY0owwFk.jpg,1995-05-24,Braveheart,False,7.941,10931,"Action, Drama, History, War"
False,/ei4bXNp4hBrfUEvWkp7usnQeGQP.jpg,"28, 14, 27",72331,en,Abraham Lincoln: Vampire Hunter,"President Lincoln's mother is killed by a supernatural creature, which fuels his passion to crush vampires and their slave-owning helpers.",12.9294,/qv8deK0ZmutAuEpejruQKApIy6r.jpg,2012-06-20,Abraham Lincoln: Vampire Hunter,False,5.763,3514,"Action, Fantasy, Horror"
False,/gl0jzn4BupSbL2qMVeqrjKkF9Js.jpg,"12, 14, 16",128,ja,もののけ姫,"Ashitaka, a prince of the disappearing Emishi people, is cursed by a demonized boar god and must journey to the west to find a cure. Along the way, he encounters San, a young human woman fighting to protect the forest, and Lady Eboshi, who is trying to destroy it. Ashitaka must find a way to bring balance to this conflict.",12.9278,/cMYCDADoLKLbB83g4WnJegaZimC.jpg,1997-07-12,Princess Mononoke,False,8.324,8829,"Adventure, Fantasy, Animation"
False,/k24eZq5I3jyz4htPkZCRpnUmBzE.jpg,"18, 10749",1156593,es,Culpa tuya,The love between Noah and Nick seems unwavering despite their parents' attempts to separate them. But his job and her entry into college open up their lives to new relationships that will shake the foundations of both their relationship and the Leister family itself.,12.9266,/1sQA7lfcF9yUyoLYC0e6Zo3jmxE.jpg,2024-12-26,Your Fault,False,7.1,1522,"Drama, Romance"
False,/z0ALFPZjhaAQjXThyMO9b3dIrz4.jpg,"27, 53",11503,en,The Serpent and the Rainbow,"A Harvard anthropologist is sent to Haiti to retrieve a strange powder that is said to have the power to bring human beings back from the dead. In his quest to find the miracle drug, the cynical scientist enters the rarely seen netherworld of walking zombies, blood rites and ancient curses. Based on the true life experiences of Wade Davis and filmed on location in Haiti, it's a frightening excursion into black magic and the supernatural.",12.9218,/ezgaj43WaSmyQa24NLG7vPK9hb5.jpg,1988-02-05,The Serpent and the Rainbow,False,6.395,540,"Horror, Thriller"
False,/deUWVEgNh2IGjShyymZhaYP40ye.jpg,"28, 12, 53",1356039,es,Contraataque,"When a hostage rescue mission creates a new enemy, Capt. Guerrero and his elite soldiers must face an ambush by a criminal group.",12.911,/38I76hGcFY6xB47pjm7pZwkfuAF.jpg,2025-02-27,Counterattack,False,8.258,794,"Action, Adventure, Thriller"
False,/uorMP2U1F0AfogYMz4lYu2EbgYo.jpg,"28, 12, 53, 878",524047,en,Greenland,"John Garrity, his estranged wife and their young son embark on a perilous journey to find sanctuary as a planet-killing comet hurtles toward Earth. Amid terrifying accounts of cities getting levelled, the Garritys experience the best and worst in humanity. As the countdown to the global apocalypse approaches zero, their incredible trek culminates in a desperate and last-minute flight to a possible safe haven.",12.8979,/bNo2mcvSwIvnx8K6y1euAc1TLVq.jpg,2020-07-29,Greenland,False,7.127,5127,"Action, Adventure, Thriller, Science Fiction"
False,/zPACwR32amTNvzId9qyapCWXYDJ.jpg,"12, 28",85,en,Raiders of the Lost Ark,"When Dr. Indiana Jones – the tweed-suited professor who just happens to be a celebrated archaeologist – is hired by the government to locate the legendary Ark of the Covenant, he finds himself up against the entire Nazi regime.",12.8969,/ceG9VzoRAVGwivFU403Wc3AHRys.jpg,1981-06-12,Raiders of the Lost Ark,False,7.922,13446,"Adventure, Action"
False,/9VqvhI7mBuqAHit2aWVVaYZ0JCL.jpg,"80, 18, 53",523077,en,Running with the Devil,A leader of a drug cartel sends his two toughest henchmen to investigate why a shipment was botched.,12.8939,/qJ2H94PpXxZgiGGUNkyLSKZzm8u.jpg,2019-08-29,Running with the Devil,False,5.414,342,"Crime, Drama, Thriller"
False,,"35, 27",1614492,hu,A halál négy kapuja,"A graveyard rendezvous that isn’t just about love, but about fulfilling a promise – and facing its consequences.  A family weekend that digs up buried secrets – secrets that perhaps should have stayed underground forever.  A legendary VHS tape, worth killing for – or maybe someone already has.  And a childhood tale that proves, years later: sometimes the scariest things are the ones we believed were true as kids.  From Horrorszkóp and Cruel World Team comes four dark and unsettling stories in this chilling horror anthology.  Each one steeped in the shadow of death, human weakness, and the grim truth that the ending is never what you expect.  Four stories. Four secrets. Four inevitable ends.",12.8814,/dLw6aWlLr0cDWpqQjOjnFIOeHEX.jpg,2026-02-03,The Four Gates of Death,False,3.0,1,"Comedy, Horror"
False,/5pXhfTMklUEKVtDt6EIUKcEqtSx.jpg,"27, 35, 878",33475,en,Bud Abbott and Lou Costello Meet the Invisible Man,"As novice detectives, Bud and Lou come face to face with the Invisible Man.",12.8705,/sGFnr4dCUm1Ro1bZHR5TXHOolXb.jpg,1951-03-14,Bud Abbott and Lou Costello Meet the Invisible Man,False,6.3,114,"Horror, Comedy, Science Fiction"
False,/eBvO13N6NrVZHHKJzW1yqK4YgnL.jpg,"18, 10402",1247601,en,The Beatles: John,"One of four biopics, focusing on individual members of The Beatles, this one telling the story of the group from the perspective of John Lennon.",12.859,/lx8XZ4HvfEZd82M2YuJUy6qNSUR.jpg,2028-04-05,The Beatles: John,False,0.0,0,"Drama, Music"
False,/9IIBboV7MCT0bTxzXHmWK1Hq558.jpg,"18, 80, 28",272,en,Batman Begins,"Driven by tragedy, billionaire Bruce Wayne dedicates his life to uncovering and defeating the corruption that plagues his home, Gotham City.  Unable to work within the system, he instead creates a new identity, a symbol of fear for the criminal underworld - The Batman.",12.8564,/sPX89Td70IDDjVr85jdSBb4rWGr.jpg,2005-06-10,Batman Begins,False,7.721,22339,"Drama, Crime, Action"
False,/vr6n6ZFUZvedvIlhfYcbCWcaKyW.jpg,"12, 14, 28",58,en,Pirates of the Caribbean: Dead Man's Chest,"Jack's got a blood debt to pay: he owes his soul to the legendary Davy Jones, ghastly Ruler of the Ocean Depths.  But ever-crafty Jack isn't about to go down without a fight.",12.8463,/uXEqmloGyP7UXAiphJUu2v2pcuE.jpg,2006-07-06,Pirates of the Caribbean: Dead Man's Chest,False,7.374,16950,"Adventure, Fantasy, Action"
False,/fIuuYkIjF9Q7W26YbIeKX5OWwiL.jpg,18,1600028,es,La celda de los milagros,"After being falsely accused of a terrible crime, Hector, a man with a neurological disability, goes to a secret prison. His goodness conquers the prisoners, who plan to prove their innocence.",12.8437,/heC13pt4SV7y3HF5lWNzf0u729j.jpg,2025-12-25,A Father's Miracle,False,7.943,62,Drama
False,/hY2sAMW4E27B8ms7Jv2nfsSSEoo.jpg,"10770, 35, 10749",881853,en,The Enchanted Christmas Cake,"Gwen recently lose her grandmother and she is struggling to run their bakery and regain the Christmas spirit, and figure out her grandmother's magical recipe for the town's legendary Enchanted Christmas Cake.",12.8384,/rKaJoJlrrxn1lTVoukWtysjyIjn.jpg,2021-12-15,The Enchanted Christmas Cake,False,5.815,46,"TV Movie, Comedy, Romance"
False,/tbx3tN8d97n4VjgpN3Gon0azGRh.jpg,"14, 18",455974,de,Blue My Mind,"15-year-old Mia faces an overwhelming transformation which puts her entire existence into question. Her body is changing radically, and despite desperate attempts to halt the process, Mia is soon forced to accept that nature is far more powerful than she is.",12.8358,/dzONa8dMkPw5c0fxDVzxP2QnmaI.jpg,2017-10-02,Blue My Mind,False,6.7,237,"Fantasy, Drama"
False,/zBMXbCIeRRflY4BjiKOrfF1phTH.jpg,"28, 80, 53",1592032,zh,怒袭,"A former special forces soldier infiltrates northern Myanmar to rescue his missing daughter, fighting against scam gangs and organ traffickers in a final showdown with the crime boss.",12.8357,/4mTK8drt1EWo1AzqBrV4mJA04Wh.jpg,2026-02-12,Furious Attack,False,5.5,2,"Action, Crime, Thriller"
False,/3kps0wiGFMRVkSXxbebbAUeWrN3.jpg,"16, 10751, 28, 12, 14",1147411,fr,"Miraculous World : Tokyo, Stellar Force","Kagami drags Marinette to Tokyo to help the Stellars defeat a new supervillain, but Marinette soon realizes her friend has another, untold reason for this trip to Japan.",12.8321,/vFaopnGXRXxRf4z2Z3IgA1QtOyV.jpg,2025-12-07,"Miraculous World: Tokyo, Stellar Force",False,8.3,23,"Animation, Family, Action, Adventure, Fantasy"
False,/c91AMgRHxp632DkNpeU1xbMrEST.jpg,"53, 10770",91790,en,Nowhere to Land,A pilot must safely land a 747 on which deadly nerve gas has been planted.,12.8111,/wY9hdfbZmvjcqDxbpJaVTOYtqj3.jpg,2010-10-21,Nowhere to Land,False,5.6,15,"Thriller, TV Movie"
False,/mPfN4ExlmlHaxFapAD4EO1nXh3m.jpg,"18, 80",481880,en,Trial by Fire,"The tragic and controversial story of Cameron Todd Willingham, who was executed in Texas for killing his three children after scientific evidence and expert testimony that bolstered his claims of innocence were suppressed.",12.8063,/Aeon31iP17ys9FesAK3bLycXI6v.jpg,2019-05-17,Trial by Fire,False,7.011,262,"Drama, Crime"
False,/q3vACaClas2wNzWgGCkkQgNiifg.jpg,"27, 35",40760,en,Sorority House Massacre,"Upon joining a sorority, Beth is plagued by nightmares of a knife-wielding killer, when her past comes back to haunt her.",12.801,/oU2i9iabbzBbDdKxv1PqQjoqSbw.jpg,1986-10-01,Sorority House Massacre,False,4.721,120,"Horror, Comedy"
False,/eTlcNXGv32zkVI7ZDHhfeaKHXKQ.jpg,"28, 9648, 878, 53",198663,en,The Maze Runner,"A teenager with no memory of his past finds himself among a group of boys living in a walled enclosure surrounded by a massive, ever-changing maze. As he struggles to adapt to their rules and society, he begins to uncover clues that may lead to escape and the truth behind their confinement.",12.7962,/ode14q7WtDugFDp78fo9lCsmay9.jpg,2014-09-10,The Maze Runner,False,7.2,17925,"Action, Mystery, Science Fiction, Thriller"
False,/1Onam6oWyFAUCcoxtdWkACtEiNr.jpg,"18, 10749",4348,en,Pride & Prejudice,"A story of love and life among the landed English gentry during the Georgian era. Mr. Bennet is a gentleman living in Hertfordshire with his overbearing wife and five daughters, but if he dies their house will be inherited by a distant cousin whom they have never met, so the family's future happiness and security is dependent on the daughters making good marriages.",12.7929,/o8UhmEbWPHmTUxP0lMuCoqNkbB3.jpg,2005-09-16,Pride & Prejudice,False,8.049,8646,"Drama, Romance"
False,/zQDFHYNVVVp9OAYSixYAG1SyX1l.jpg,"35, 18, 10749",19404,hi,दिलवाले दुल्हनिया ले जायेंगे,"Raj is a rich, carefree, happy-go-lucky second generation NRI. Simran is the daughter of Chaudhary Baldev Singh, who in spite of being an NRI is very strict about adherence to Indian values. Simran has left for India to be married to her childhood fiancé. Raj leaves for India with a mission at his hands, to claim his lady love under the noses of her whole family. Thus begins a saga.",12.7861,/2CAL2433ZeIihfX1Hb2139CX0pW.jpg,1995-10-20,Dilwale Dulhania Le Jayenge,False,8.517,4565,"Comedy, Drama, Romance"
False,/iwvP8XVpYVmJ3xfF9xdBi5uAOWl.jpg,"80, 18, 53, 28",75780,en,Jack Reacher,"One morning in an ordinary town, five people are shot dead in a seemingly random attack. All evidence points to a single suspect: an ex-military sniper who is quickly brought into custody. The interrogation yields one written note: 'Get Jack Reacher!'. Reacher, an enigmatic ex-Army investigator, believes the authorities have the right man but agrees to help the sniper's defense attorney. However, the more Reacher delves into the case, the less clear-cut it appears. So begins an extraordinary chase for the truth, pitting Jack Reacher against an unexpected enemy, with a skill for violence and a secret to keep.",12.775,/uQBbjrLVsUibWxNDGA4Czzo8lwz.jpg,2012-12-20,Jack Reacher,False,6.655,7527,"Crime, Drama, Thriller, Action"
False,/AqLcLsGGTzAjm3pCCq0CZCQrp6m.jpg,"12, 14",12444,en,Harry Potter and the Deathly Hallows: Part 1,"Harry, Ron and Hermione walk away from their last year at Hogwarts to find and destroy the remaining Horcruxes, putting an end to Voldemort's bid for immortality. But with Harry's beloved Dumbledore dead and Voldemort's unscrupulous Death Eaters on the loose, the world is more dangerous than ever.",12.7698,/iGoXIpQb7Pot00EEdwpwPajheZ5.jpg,2010-11-17,Harry Potter and the Deathly Hallows: Part 1,False,7.735,20171,"Adventure, Fantasy"
False,/olz73f1yVWu5JlLDi8lI98Yekvl.jpg,"99, 18, 36",1439660,en,Fukushima: A Nuclear Nightmare,The definitive account of Japan’s struggle as it faced a nuclear catastrophe while still reeling from the devastation of an earthquake and tsunami.,12.7658,/nL2f1g1cMPUsPmFWB71qHqjyVFd.jpg,2026-02-20,Fukushima: A Nuclear Nightmare,False,6.4,10,"Documentary, Drama, History"
False,/jNH4qJLh2HuL75OzKZeJY3Blcxa.jpg,"35, 18",40007,fr,De la guerre,"After a freak accident changes his perspective on life, a Parisian filmmaker meets a stranger who brings him to a commune that's populated by free-spirited women.",12.7634,/bFN8mdLklHEcnzSoarkA9oR5Ivg.jpg,2008-10-01,On War,False,4.9,26,"Comedy, Drama"
False,/xs4XBvTe71gP2nt1sEHXV5jIUxA.jpg,"37, 28, 18, 80",67051,en,The Desperate Trail,"Amiable con man Jack Cooper is on a westbound stagecoach, headed for the next batch of suckers who will mistake him for an easy mark. Fiery Sarah O'Rourke rides the same coach, handcuffed to lawman Bill Speakes and headed for the hangman. In a few hours, all should reach their destinations. But the trail they travel takes an unexpected turn: Cooper and O'Rourke are soon off the stage and running for their lives. The law ends and the chase begins in a very alive tale of wanted-dead-or-alive fugitives (Linda Fiorentino and Craig Sheffer) pursued by a marshal (Sam Elliott) who's a law unto himself.",12.7535,/1wH2QZv3aTBOmM7DMhpu1qK0pNp.jpg,1994-10-21,The Desperate Trail,False,4.609,23,"Western, Action, Drama, Crime"
